selling_proposition,price,discount,goods_title,rank_title,rank_sub,color_count
4900,10.29,0.11,"Plus Size Women Seamless Wire-Free Sports Yoga Sleep Thin Bra, Prevent Drooping, Push-Up, Solid Color, Autumn And Winter",,,
,7.79,0.14,"3pcs/Pack Plus Size High Waist Tummy Control Seamless Ice Silk Triangular Panties For Women, Comfortable Fit, Shaping And Lifting, Thin Design For Summer",1,in Plus Size Panties,4
5100,5.69,0,5pack Solid Simple Brief,,,20
2700,4.79,0.06,Women Seamless Wireless Bandeau Bra (One Piece),,,8
1400,4.65,0.38,Plus Racer Back Nightdress,,,7
,2.19,0,1pc Women's Sexy High Waist Lace Abdomen Control Panties,1,in Women's Blue Underwear,7
,4.26,0.49,Plus Size Sexy Lace Patchwork Cami Nightdress,10,in Burgundy Plus Size Nightgowns & Sleepshirts,5
1400,4.61,0.19,5pack Plain Simple Panty,,,20
1700,1.7,0.15,Alice Dark Fashionable Pink Face Pattern Jacquard Mid-Calf Socks,,,14
,10.69,0,Plus Size Women's Piping Trim Single Breasted Short Sleeve Top And Shorts Casual Pajama Set,8,in White Plus Size Pajama Sets,9
,3.81,0.09,2 Pairs Of Plus Size Women Simple Solid Color Lingerie Accessory (Nipple Cover),7,in Plus Size Lingerie Accessories,10
1100,17.52,0.41,Plus 3pcs Waffle Knit Cami Top & 3pcs Shorts PJ Set,,,
,1.3,0,"4pcs Flower Shaped Bra Strap Clips, Anti-slip Invisible Bra Straps Buckle For Women's Undergarment",2,in White Women Lingerie Accessories,6
1500,5.58,0.08,Seamless Leopard Print Strapless Bra (One Piece),,,4
,3.75,0.47,Plus Size Printed Cami PJ Set,4,in Blue Plus Size Pajama Sets,
,5.19,0.21,"Women's Seamless Front Closure Lightweight Sports Bra, With Beauty Back Design, Push-Up And Side Support. Non-Wired And Simple Style.",5,in Seamless Bras,
1400,3.49,0.05,"High-Waist Tummy Control Panties For Women, Butt Lifter And Postpartum Body Shaper, Sports",,,
,4.37,0.54,"Ladies"" Plus Size Heart Print Cami Top And Shorts Pajama Set",4,in Hot Pink Plus Size Pajama Sets,9
,9.49,0.14,Contrast Binding Button Front Satin PJ Set,2,in Baby Pink Women Pajama Sets,12
,9.49,0,Contrast Binding Button Front Satin PJ Set,4,in Women's satin sleepwear sets,12
700,7.79,0,Heart Print Tee & Shorts Pajama Set,,,9
2700,9.99,0,Contrast Piping Blouse & Bow Front Shorts PJ Set,,,
,9.74,0.23,"SHEIN Women's Brocade Floral Print Pajama Set With Lapel, Top And Shorts",6,in Hot Pink Women Pajama Sets,7
1300,4.38,0.28,Heart Print Lettuce Trim Bow Front Cami Top & Shorts PJ Set,,,8
700,11.33,0.1,"SHEIN Women's Jacquard Collar Short Sleeve Shirt & Shorts Pajama Set, Suitable For Summer",,,7
1300,15.69,0.27,3pcs Waffle Knit Belted Lounge Set,,,4
1900,4.38,0.28,Heart Print Lettuce Trim Bow Front PJ Set,,,8
,7.99,0.06,Plaid Print Tie Front PJ Set,1,in Plaid Sleepwear,4
3200,21.26,0.02,Women's Lace Trimmed Camisole And Shorts Pajama Set,,,7
,6.19,0,Satin Cami Top & Shorts PJ Set,2,in Burgundy Women Pajama Sets,13
,9.3,0.11,2pc Simple Striped Loose Knit Long Sleeve Top & Side Split Shorts Casual Homewear Set For Home Use,1,in Pink Women Lounge Sets,6
1400,5.52,0.38,Contrast Lace Button Front Crop Cami Top & Shorts PJ Set,,,10
400,5.52,0.38,Contrast Lace Button Front Cami Top & Shorts PJ Set,,,10
2800,11.49,0.12,Solid Tee & Knot Front Shorts Lounge Set,,,4
,9.39,0,"2pcs Satin Pajama Set, Women Short Sleeve Notched Collar Top And Bowknot Shorts Sleepwear Home Clothes",5,in Black Women Pajama Sets,4
1600,11.49,0,Striped Button Front Satin Night Set,,,13
1700,5.52,0.38,Contrast Lace Button Front Crop Cami Top & Shorts PJ Set,,,10
300,11.69,0,"SHEIN Solid Color Short Sleeve & Shorts (Imitation Silk) Homewear Set, 2pcs",,,12
900,10.79,0,Shein LuxeNights Floral Print Satin Lapel Pajama Set,,,
2300,5.27,0.26,Ruffle Hem Satin PJ Set,,,9
,2.49,0,1pc Lace Triangle Panties For Women Lingerie,7,in Women's Lace Underwear,5
900,5.29,0.13,"Women's Lace Padded Bralette And Triangle Panties Lingerie Set, Longline",,,6
,9.49,0.1,Contrast Binding Satin PJ Set,1,in Baby Blue Women Pajama Sets,11
2000,12.29,0,Color Block Pajama Set With Trim,,,22
,3.42,0.07,"Lace Crotchless Sexy Lingerie Bodysuit, Stretchy, Alluring, Personalized",3,in Women Sexy Lingerie & Costumes,4
,7.99,0,Pink Lace Trimmed Bow Decorated Side Slit Cami Slip Dress,3,in Pink Women Nightgowns & Sleepshirts,14
,3.89,0.07,2pcs Women Lace Adjustable Strap Bra & Panty,7,in Blue Women Sexy Lingerie Sets,5
1200,16.54,0.23,3pcs Waffle Knit Belted Lounge Set,,,4
,6.29,0.07,Letter Graphic Contrast Binding Lingerie Set Sports,2,in Women Bra & Panty Sets,6
,9.79,0,Drop Shoulder Contrast Trim Belted Satin Sleep Robe,1,in White Women Robes,9
6000,10.09,0.07,"Classic Daily Wear Body Shaper Butt Lifter Panty Smoothing Brief, Sports",,,
100,8.99,0.05,Heart Print Satin Cami Top & Pants PJ Set,,,8
1000,5.81,0.41,Drop Shoulder Contrast Trim Belted Satin Sleep Robe,,,9
600,13.19,0.07,SHEIN Plus Mouth Print Tee & Biker Shorts PJ Set,,,5
1700,7.09,0,Slogan Graphic Drop Shoulder Nightdress,,,8
4000,9.1,0.01,Women's Seamless Panties (boxer Briefs) Set Of 4,,,12
1700,1.99,0,Wide Waistband Lace Panty,,,7
,20.39,0,Woman's Plush Robe With Belt And Heart Embroidery,3,in Pink Women Robes,
,9.09,0.07,Plus Size Lace Trim Ruched Bow Detail Wireless Lingerie Set,3,in Plus Size Bra & Panty Sets,
2700,3.49,0.08,1pack Solid Self Adhesive Bra,,,5
,3.69,0.16,"Plus Size Lace Underwear, Fashionable Daily Wear, Heart-Shaped Rhinestone Embellishment",1,in Red Plus Size Panties,
,11.59,0,Plus Contrast Binding Satin Pajama Set,1,in Plus-Size Women's Black Sleepwear,8
500,9.09,0.07,Plus Size Women's Letter Printed T-Shirt Sleep Dress,,,
2600,12.69,0,12pcs Women's Solid Color Triangle Panties,,,
1200,13.99,0,SHEIN Contrast Binding Satin Night Set,,,12
200,11.29,0.07,Plus Casual Lettuce Trim Racerback Tank Top & Shorts PJ Set,,,
5000,6.69,0.07,"Super Push-Up Bra, Small-Cup Bra Gives The Effect Of A Big Chest",,,5
400,5.99,0.2,Satin Cami Top & Shorts PJ Set,,,13
900,6.49,0.14,Women's Plus Size 3pcs Bowknot Lingerie Set,,,
,9.65,0.37,Heart Print Contrast Piping PJ Set,7,in Beige Women Pajama Sets,4
,23.69,0.07,SHEIN Maternity 5pack Solid Ruched Nursing Bra For Mother,1,in Maternity Lingerie,9
800,6.08,0.22,Plus Size Love Print Casual Loose Fit Spaghetti Strap Home Dress,,,6
,6.83,0.1,Plus Rainbow & Unicorn Print Drop Shoulder Nightdress,6,in Baby Pink Plus Size Nightgowns & Sleepshirts,
3400,6.1,0,1 Pc High Waist Trainer Body Shaper Tummy Slimming Sheath Woman Flat Belly Control Panties Hip Butt Lifter Briefs Panty Shapewear,,,
200,15.49,0,Manfinity Underwear&Sleepwear Basics Men Contrast Piping Loungewear Set,,,5
,3.04,0.43,Elephant & Heart & Letter Print Cami Sleep Dress,1,in Blue Women Nightgowns & Sleepshirts,
,19.79,0.07,4pack Floral Lace Criss Cross Lingerie Set,6,in Women Bra & Panty Sets,4
,5.49,0.21,Solid Wireless Bra,7,in Dusty Pink Women Bras & Bralettes,
,3.89,0.22,Crisscross Back Satin Cami Night Dress,8,in Sexy women's sleepwear,7
,10.29,0.11,"Plus Size Women's Seamless Wireless Sports Yoga Sleep Thin Bra, Anti-Sagging & Push Up",3,in Plus Size Push-Up Bras,
,11.89,0,Plus Flamingo Print Contrast Piping Satin PJ Set,6,in Plus-Size Women's Satin Sleepwear,
700,4.79,0.08,Fashion Backless Brassiere Sexy Womem Beauty Back Wire Free Bralette Soft Bras For Women Sexy Underwear Push Up Bras Top Female Padded Lingerie,,,
1200,1.68,0.16,"1pair Women Ruffle Trim Casual Crew Socks, For Lolita",,,
1900,7.09,0,Ruffle Hem Satin PJ Set,,,9
100,9.19,0,Lace Trim Split Thigh Satin Cami Night Dress,,,6
1000,5.07,0.42,Solid Lettuce Trim Cami Lounge Dress,,,
50,4.29,0.07,Men Ultra-Thin Ice Silk T-Back Thong,,,5
1800,6.26,0.09,SHEIN Women's Solid Color Front Closure Bandeau Bra,,,
,16.99,0.07,Shein LuxeNights Plus Floral Print Satin Cami Dress & Belted Robe,6,in Plus Size Robes & Robe Sets,
80,15.39,0,Frida Kahlo X SHEIN Floral & Figure Printed Shawl Collar Wrap Knot Top And Shorts Women's Pajama Set,,,
,6.39,0,Plus Size Women's Heart Pattern Printed Sleeveless Sleepwear Dress,7,in Plus Size Nightgowns & Sleepshirts,
10000,5.69,0,5pack Plain Simple Solid Panty,,,20
1000,14.49,0.07,Batman X ROMWE Plus Size Cartoon Print Contrast Trim Pajama Set,,,
2800,5.61,0.43,Letter Graphic Tee & Pants PJ Set,,,
,4.25,0.47,Plus Size Sexy & Comfortable Lace Patchwork Side Slit Cami Dress,5,in Plus-Size Women's Sexy Sleepwear,5
,4.39,0.08,"A Piece Of Sexy Butt-Lifting Underwear, Thickened Fake Buttocks And Hip Pads, Seamless Women's Summer Body-Shaping Buttocks Pants, Beautiful Buttocks, Peach Buttocks Pants, Sports",4,in Beige Women Shapewear Bottoms,
,8.3,0.14,"6 Pairs Random Men's Multicolored Mid-Calf Socks, Funny Fun Crazy Novelty Cool Socks For Daily Life, Gift For Men",2,in Whimsical socks,
1900,3.06,0.45,Bear & Letter Printed Sleeveless Nightgown For Summer,,,7
700,6.22,0.48,3-Pack Women's Bra Tops Removable Pads Wireless Bras Solid Color Tank Tops Lace Bras Breathable Tops Sports Bras,,,
300,13.79,0,"SHEIN Women Solid Color Triangle Panties With Bow Decoration, 12pcs/Pack",,,
,3.49,0.05,"High-Waisted Abdominal Control Panties For Women, Hip Up Postpartum Shapewear, Sports",2,in Underwear & Sleepwear,
,3.49,0.08,Floral Lace Bralette Lingerie,5,in Women's Bralettes,9
4800,6.92,0.1,SHEIN 5pcs Color Block Trimmed Triangle Panties Sports,,,4
400,27.23,0.02,"3pcs Summer Piping Contrast Color Collar Pocket Heart Embroidered Short-Sleeved Button-Up Top And Bow Shorts, Women Pajamas And Home Service Set",,,
,2.49,0,Women's Pure Color Lace Triangle Underwear Lingerie,2,in Black Women Briefs,5
900,4.19,0.6,Cartoon Cute Ladies' Pajama Set,,,
,6.39,0,Plus Size Sleeveless Text Pattern Casual Home Dress,2,in Burgundy Plus Size Nightgowns & Sleepshirts,6
900,10.89,0,Plus Solid Tee & Letter Graphic Pants PJ Set,,,
,2.79,0.07,"Seamless Waist Trainer Trimmer Belt, Breathable Tummy Control Compression Wrap Cincher, Women's Underwear & Shapewear 1pc, Sports",1,in Plus Size Waist Trainers,
,1.36,0.47,Plus Solid Strapless Bralette,9,in White Plus Size Bras & Bralettes,6
,5.49,0.14,Floral Lace Criss Cross Lace Up Backless Teddy Bodysuit,1,in Hot Pink Women Sexy Bodysuits,13
1200,8.47,0.37,Striped Button Front Satin Night Set,,,13
500,12.09,0.07,Plus Size Cat Print Short-Sleeve T-Shirt And Polka Dot Printed Shorts Pajamas Set For Spring/Summer,,,4
2100,5.92,0.22,4pack Scallop Trim Panty Sets,,,
,9.19,0.07,SHEIN Leisure-E Solid Cami Lounge Dress,1,in White Women Lounge Dresses,5
300,4.96,0.3,Plus Flamingo & Letter Graphic Nightdress,,,4
200,7.45,0.37,Plus Size Butterfly Printed Pajama Set,,,
,3.99,0.07,Women's Comfortable Front Closure Bra Push-Up Padded Bra,10,in Women's Strapless Bras,
3000,11.79,0.14,"5pcs/set Women's Plus Size Breathable High Waist Triangle Shape Panties, Slimming And Comfortable",,,
,6.39,0.07,"1pc Women Body Shaping Underwear High Elastic Anti-Curling Tummy Control Panties, Plus Size, Sports",7,in Plus Size Corsets & Shapewear,
10000,6.49,0.24,"Women's Bodycon Shapewear Bodysuit With Tightening Straps & Full Chest ,Buttock Lift, Sports",,,
,6.39,0.11,SHEIN Plus Size Adjustable Solid Color Bra & Wireless Bra,2,in White Plus Size Bras & Bralettes,
300,7.59,0,Plus Size Women's Popsicle Cup Print Cami Top And Shorts Pajama Set,,,
1000,15.59,0,Women's Fuzzy Trim Satin Loungewear Set,,,7
1400,7.59,0,Solid Top And Tie Waist Floral Print Shorts PJ Set,,,
700,2.19,0,1pc Women's Sexy High Waist Lace Tummy Control Panties,,,7
700,5,0.5,Allover Floral Print PJ Set,,,
2100,8.89,0,Contrast Lace Tie Front Cami PJ Set,,,8
,9.9,0.16,Plus Letter & Palm Tree Print Tee & Shorts PJ Set,8,in Plus-Size Women's Casual Sleepwear,
,6.33,0.12,SHEIN Plus Size Adjustable Solid Color Bra & Wireless Bra,6,in Plus Size Bras & Bralettes,
100,15.39,0.07,"GARFIELD X SHEIN Plus Size Casual Cartoon & Letter Printed Oversized Short Sleeve T-Shirt And Shorts Pajama Set, Summer",,,
,3.39,0.08,Women's Sexy Lace Bralette And Panties Set With Flat Angle Design,6,in Black Women Bra & Panty Sets,
1100,14.19,0,Allover Print Contrast Trim Pajama Set,,,
3600,5.86,0.2,"3pairs Women's Multicolor Fashionable Pile Socks, Suitable For Daily Use",,,
10,12.69,0,"Women's Cute Bear Printed Short Sleeve Cardigan And Shorts Casual Two-Piece Set, Loungewear",,,
,3.1,0.14,1pair 80D Plus Size Black Snag Tights For Women,9,in Black Women Tights,6
2300,5.29,0,Galaxy Print Lettuce Trim Slip Nightdress,,,
900,32.09,0,Plus Size Women's Short Sleeve Top And Shorts Sleepwear Set,,,5
6200,10.69,0,Shein Underwear&Sleepwear Basics 7pack Seamless Zebra Striped Panty,,,
9800,3.59,0.08,Contrast Mesh Triangle Bralette,,,4
,3.06,0.45,Bear & Letter Printed Sleeveless Nightgown For Summer,4,in Pink Nightgowns,7
2700,3.49,0.08,Floral Lace Bralette Lingerie,,,9
1600,9.69,0.08,Plus Size Moon Printed Tank Top And Shorts Pajama Set,,,
1400,9.09,0.07,3pack Solid Rib Bralette Set,,,6
3700,5.59,0.07,Solid Seamless Bralette,,,
4100,5.09,0,"3pcs/pack Breathable & Comfortable Lace Women's Panties, Seamless Triangle Underwear",,,
2500,8.39,0.08,2pcs Solid Color Bra With Steel Ring,,,11
,6.79,0.07,Embroidery Mesh Bra & Panty Set Lingerie Set,4,in Women's Floral Bras,13
,4.69,0.08,Letter Graphic Contrast Binding Bra & Panty Set Lingerie Set Sports,1,in Royal Blue Women Bra & Panty Sets,11
800,5.75,0.32,4pcs Solid Scallop Edge Boyshorts,,,
800,9.99,0.15,5pcs/Pack Plus Size Women's Ultra Soft & Comfortable Printed Triangle Underwear,,,
80,5.77,0.67,Women Solid Color Ribbed Pits And Buttoned Top With Long Pants Home Wear Set,,,
2100,26.79,0.07,6pcs Tie Waist Lounge Set,,,
1900,1.55,0.22,Solid Contrast Mesh Brief,,,
1800,4.99,0.04,3pcs Women's Back Lace Seamless Simple And Comfortable Triangle Panties,,,
1000,2.51,0.13,Lace High Waist Tummy Control Boyshorts Boxer Briefs For Women Soft Shorts Panties Shapewear Underwear,,,
1800,7.69,0,Eyelash Lace Satin Cami PJ Set,,,6
300,4.96,0.56,Plus Size Flamingo Print Short Sleeve Top And Shorts Casual Homewear Set,,,
2100,5.89,0,Plus Size Star & Moon Print Satin Nightgown,,,
,2.91,0.17,5 Pairs Women's All-Season All-Match Black And White Short Socks,4,in Women Invisible Socks,
10,3.99,0.09,"1pc Solid Color Sexy Wire-Free And Detachable Padded Women's Lightweight Bralette, Comfortable And Breathable Athletic Camisole Top With Beauty Back Design",,,
10,3.8,0.68,Plus Size Casual Short Sleeve Sleep Dress With Bear Print For Summer,,,
5700,12.06,0.05,Lace Trim Cami Top & Pants PJ Set,,,11
300,7.09,0,Cartoon Animal Print Short Sleeve Nightgown,,,4
400,5.82,0.35,Women Fashionable Heart Printed Bow Knot Short Sleeve And Long Pants Pajama Set,,,4
,10.29,0,"Women's Summer Sleepwear Set With Contrast Piping And Small Floral Print, Including Button Down Short Sleeve Top And Shorts With Bow, Suitable For Home Wear",5,in Heart Print Sleepwear,
,3.69,0,Plain No Show Shortie,7,in Black Women Boyshorts,12
,10.79,0,ROMWE Grunge Punk Casual Homewear Set With Contrast Color Raglan Short Sleeve Star Printed Top And Plaid Shorts,9,in Plaid Sleepwear,
,2.3,0.15,1pair White Lace Flower Pattern Mid-calf Socks With Lovely Hollow Out & Mesh Design For School Party,8,in White Women Crew Socks,
800,10.56,0.1,Cat Graphic Tee & Heart Print Shorts & Pants PJ Set,,,
300,6.45,0.1,Butterfly & Letter Graphic Tee & Shorts PJ Set,,,
,5.58,0.08,"Wireless Strapless Bra For Prom Dress, Wedding Dress",2,in White Women Bras & Bralettes,4
600,7.44,0.23,Plus Heart Print PJ Set,,,5
700,7.89,0.27,Pure Desire Plus Contrast Lace Mesh Slips With Thong,,,
,2.7,0.13,Heart Pattern Faux Pearl Bow Decor Fishnet Over The Knee Socks,4,in Women Over the Knee Socks,
2900,9.69,0.08,2pcs Solid Underwire Bra,,,
,13.79,0,Women's Solid Color Triangle Panties,6,in Women Panties,4
500,5.49,0.08,Heart Print Lettuce Trim Slip Dress,,,
300,7.99,0.06,Floral Lace Lingerie Set,,,
800,2.59,0.07,"3 Pairs Lace Flower Decor Bra Straps, Adjustable  Versatile Anti-slip Shoulder Strap For Women's Lingerie And Bra Accessories",,,
1600,4.09,0.09,"Seamless Sports Bra Shock-absorbent & Push Up Vest For Running Yoga Gym & Workout, Back Beauty Ultra Thin Bra Without Steel Ring To Hide Sagging",,,
100,6.49,0.11,"Plus Size Women's Wireless Bandeau Bra, One Piece",,,
,5.92,0.45,Plus Contrast Lace Cami Nightdress,4,in Hot Pink Plus Size Nightgowns & Sleepshirts,
,5.99,0.1,"Summer Strapless Anti-Slip Anti-Walking Shoulder-Free Plus Size Underwear, Lovely & Romantic Lace Wrapped Chest, One-Piece",8,in Plus-Size Lace Bras,
,8.81,0.16,SHEIN Plus Letter Trim Rib-knit Crop Tank Top & Shorts PJ Set,3,in Burgundy Plus Size Pajama Sets,4
3700,14.91,0.12,3pcs/Set Solid Color Vest & Shorts Home Wear Set,,,5
,3.22,0.46,SHEIN Plus Size Strapless Lace Patchwork Bra & Wireless Bra,7,in Plus-Size Lace Bras,
60,11.59,0,Frida Kahlo X SHEIN Women Summer Flowers Pajama Top & Shorts & Pants PJ Set Sets,,,
10,6.09,0.1,"Women's Plus Size Simple Bralette, Wireless Strapless Bandeau Bra, Casual 1pc",,,
200,8.09,0,Plus Size Black Cute Printed Short Sleeve Sleep Dress,,,
1700,8.35,0.26,Striped Button Front Satin Night Set,,,13
500,8.39,0,Heart Print Butterfly Embroidery Contrast Lace Bow Front Mesh Night Dress,,,
500,3.56,0.39,Floral Print Satin Cami Top & Shorts PJ Set,,,6
,3.89,0.07,2 Pairs Big Size Women Oval-Shaped Intimate Apparel Accessory Nipple Covers,9,in Plus Size Lingerie Accessories,10
200,2.79,0,"Women's High Waist Triangle Panties, Shaping, Tummy Control, Skin-Friendly And Comfortable Sports",,,
,8.79,0.06,Wave Trim Cami Night Dress,5,in Women Lounge Dresses,14
1300,7.46,0.21,7pcs/Pack Women Sweet Printed Casual Comfortable Triangle Panties Sports,,,
,5.34,0.12,"Plus Size Front Closure Wireless Bandeau Bra, 1pc",8,in Plus Size Bras & Bralettes,
1000,13.59,0.07,5pcs Solid Wireless Bralette,,,5
10,2.7,0.5,"Seamless Soft Support Women's Lightweight Bra, Great For Large Breasts, Push-Up And Side Support, Anti-Sagging And Adjustable, Summer",,,
2100,5.69,0.12,"Simple Solid Color Thin No Steel Ring Comfortable Full Coverage Seamless Bra With Gathering Effect, Side Slimming And Anti-Sagging Function",,,
400,2,0.13,Letter Graphic Crew Socks,,,
800,4.49,0.1,Solid Bandeau Bra,,,8
600,9.69,0.1,Plus 5pack Solid Bandeau Bra,,,
400,5.19,0,Letter & Cartoon Graphic Cami PJ Set With Eye Cover,,,
50,8.99,0.05,Plus Lace Trim Asymmetrical Hem Satin Cami Nightdress,,,
400,7.55,0.16,Plus Eyelash Lace Panel High Split Satin Slips,,,
200,17.79,0,Men Belted Robe & Pants,,,
1300,11.79,0,Floral Print Batwing Sleeve PJ Set,,,
600,5.51,0.45,Women's Heart Butterfly Pattern Printed Short Sleeve Top And Long Pants Pajama Set,,,6
900,11.79,0,Lapel Collar Binding Trim Pajama Set,,,
,2.6,0.13,One Pair Of White Over-The-Knee Leg Warmers,9,in White Women Leg Warmers,
600,9.99,0.05,Plus Heart Print Lettuce Trim Bow Front PJ Set,,,
3100,13.55,0.08,3pcs Solid Underwire Bra,,,
,6.89,0.08,"Men's Chest Compression Shapewear Shirt Slimming Abs Abdomen Body Shaper Undershirt, Sports",1,in White Men Shapewear Tops,
2500,16.09,0,12pcs Ribbed Knit Triangle Panties,,,
1700,5.89,0,Women's Watermelon Print Camisole Tank Top And Shorts Pajama Set,,,
1900,6.19,0.11,Plus Size Steel-Free Butterfly Decorated Bra,,,
300,6.49,0.07,SHEIN Women White Contrast Lace Underwire Strapless Bra,,,
200,6.3,0.14,"Comfortable Diabetic Ankle Socks 5 Pairs Men\ Mid-Calf Socks - Gentle Skin Care, Elastic Fit, Breathable, No Tight Fit, Seamless Toe, Keeping You Comfortable All Day",,,9
600,12.55,0.5,3pcs Waffle Knit Pajama Set,,,
400,2.79,0,"High-Waist Ice Silk Seamless Women's Briefs, Comfortable Slimming Underwear With Triangle Cut And Butt Lifting Effect, Thin For Summer",,,5
,13.49,0.08,Solid Belted Lounge Robe,1,in Women Lounge Robes,5
,6.69,0,7pack Plain Simple Thong,10,in Women Thongs,6
,19.79,0.07,4sets Lace Wireless Bra And Panty Set Lingerie Set,4,in Lace  Bras,4
,8.22,0.55,Men Solid Color Casual Daily Home Wear Top (4-Piece Set),6,in Men Loungewear Tops,12
,5.09,0.07,Sexy Women Lingerie Low Back Backless Bras Underwear Deep V Low Cute Push Up Bra Intimates Female Breathable Bralette Padded Student Bras Suitable For Girls Small Breasts,4,in Dusty Pink Women Bras & Bralettes,6
2400,10.39,0,Shein LuxeNights Leopard Print Contrast Piping Satin PJ Set,,,
1500,9.9,0.22,Textured Fake Button Contrast Lace Tie Front PJ Set,,,11
2300,15.59,0,Solid Cami Satin 3 Top & 3 Shorts PJ Set,,,4
10000,13.79,0,12pack Solid Simple Brief,,,4
1300,9.69,0,Women's Plus Size Plaid Pocket T-Shirt Pajamas And Plaid Pajama Pants Set,,,
5100,4.69,0.16,Floral Lace Bralette With Floral Shorts,,,5
300,4.69,0.08,Classic Sexy Floral Lace Crisscross Backless Teddy Bodysuit,,,
1000,5.59,0.08,Ladies' Solid Transparent Shoulder Strap Bra With Underwire,,,6
,3.83,0.46,Plus Size Leopard Print Nightgown,4,in Plus Size Nightgowns & Sleepshirts,4
,5.77,0.44,Cartoon Bear Printed Long Sleeve Pants Pajamas Set,10,in Baby Blue Women Pajama Sets,
600,3.09,0,3pcs Lace Flower Pattern Sexy Thongs,,,
,3.8,0.41,Women's Summer Letter & Cartoon Animal Printed Short Sleeve Shorts Romper Pajamas,1,in Pink Women Rompers,4
700,8.34,0.22,"6pcs/Set Ice Silk Triangle Panties For Women, Antimicrobial, Seamless, High Waist, Comfortable, Breathable",,,
100,2.22,0.35,ROMWE Kawaii 1pair Colorful Women's Over The Knee Socks,,,
300,4.19,0.11,Plus Size Strapless Push-Up Bra With Thin Padded Cups,,,
,9.56,0.34,Bow Front Lettuce Trim Lounge Set,6,in Pink Women Lounge Sets,
,2.26,0.39,Classic Sexy Plus Floral Lace Panty,7,in Black Plus Size Sexy Lingerie,
20,5.88,0.58,Men's Patchwork Pocket Short Sleeve Top And Plaid Pants Homewear Set,,,
400,11.39,0.07,Plus Size Floral Printed Pajama Set,,,
,11.19,0,12pack Solid Simple Thong,4,in Women Thongs,7
1300,13.95,0.22,3pcs Floral Print Belted Robe Set,,,
200,6.89,0,Women's Cherry Print Camisole Top With Shorts Pajama Set,,,6
600,2.51,0.13,Women Breathable Mesh Ice Silk Seamless Leak-Proof Absorbent High-Waisted Tummy Control Comfortable Physiological Underwear,,,4
700,5.49,0.21,Classic Sexy Floral Lace Scallop Trim Crotchless Teddy Bodysuit,,,12
300,4.52,0.22,Bear Printed T-Shirt Dress For Sleepwear,,,
800,5.79,0,Ladies' Solid Color Pajama Set,,,4
900,5.46,0.25,5pack Contrast Binding Brief,,,
1400,18.69,0,ROMWE Kawaii Vintage Style Bow Knotknot & Floral Printed Short Sleeve Top And Shorts Women's Pajama Set,,,4
90,7.69,0.07,Plus Size Summer Casual Star Printed Tie Dye Curved Hem Tank Dress,,,
400,6.59,0.15,Women's Sexy Lace Longline Bras And Panties Set,,,
90,1.38,0.58,Women's Sparkly Spaghetti Straps Casual Bralette With Patchwork Design,,,
40,12.09,0.18,"2pcs Women's Elegant And Graceful Plant Leaf & Floral Patterned Silk Pajama Set, Including Long Tie-Waist Robe And Spaghetti Strap Nightgown. Loose-Fit, Wide Collar, Short Slip Dress, Comfortable, , And Homewear In Random Print. Suitable For Home Use.",,,
,2.89,0,Breathable Mesh Ice Silk Seamless Menstrual Period Leakproof High Waist Tummy Control Comfortable Shapewear Safety Pants,1,in Black Women Safety Shorts,4
2700,4.87,0.48,Letter Graphic Tee & Plaid Print Pants PJ Set,,,6
200,11.19,0,GARFIELD X SHEIN Summer Cartoon & Letter Print Drop-Shoulder Loose Top And Shorts Pajama Set,,,
100,16.79,0.07,Shein LuxeNights Plus Floral Print Satin Cami Nightdress & Belted Robe,,,
300,12.99,0,Men's Solid Color Short-Sleeved Top & Plaid Pants Homewear Set,,,
,4.65,0.1,Solid Wireless Bra,6,in Seamless Bras,5
1400,13.79,0,3pcs/set Plus Size Vest-style Sleep Dress,,,
200,10.19,0.07,Plus Lace Trim Romper Bodysuit,,,
500,15.09,0.07,DAZY Letter Print Loose Fit Top And Shorts Homewear Set,,,4
300,4.79,0.06,"1pc Women's Push-Up Bra, Invisible With Lifting And Side Support, Anti-Sagging And Back-Smoothing, Top Style",,,
,3.29,0.08,"10pcs Extra Large Plus Size Inner Anti-Friction Leg Sleeves, Unisex Elastic Thigh Protector To Prevent Chafing Walking, Anti-Chafing Sticker For Thigh, Four Seasons Available",5,in Plus Size Lingerie Accessories,
700,10.25,0.1,3pcs/Set Bear Pattern Top And Checker Shorts & Pants Home Outfit,,,
,6.19,0.07,"One Shoulder Strapless Push-Up Bra With Anti-Slip And Anti-Fall Design, Romantic And Sexy Lace With Underwire, For Small Breasts Enhancement, Sold As A 1pc",5,in Elegant Bras,
60,4.69,0.11,SHEIN DesireSculpt Front-Closure Plus Size Wireless Bra (1pc),,,
9600,21.69,0,21pcs Seamless Triangle Panties With Scalloped Edge,,,
400,10.19,0,(4pcs/Pack) Seamless High Waist Square Pants Ice Silk Safety Shorts Women Underpants Anti-Lightening Body Shaper,,,
,4.52,0.22,Cherry Print Button Front Sleep Romper,5,in Black Women Rompers,10
4000,5.19,0.22,"Women's Lightweight Sports Bra, Push Up & Back Support, No Underwire, Front Buckle, Simple Style & Seamless",,,
200,2.59,0,Soft Ice Silk Underwear Lightweight Satin Sexy Panties Lacy Panties Bow Lingerie Ruffle Panties for Women Smooth Briefs,,,
50,13.99,0.07,"Plus Size Women's Pajama Set, Short Sleeve Top & Seven-Quarter Pants, Black Polka Dot, Home Wear",,,4
,2.34,0.29,1PC Sexy Lingerie Plus Size Full Body Stocking  Cut Out Hollow Out Bodystocking Without Underwear Valentine's Day,1,in Plus Size Sexy Lingerie,
500,8.81,0.22,Ladies' Long Sleeve Pajama Set With Letter Pattern,,,8
6600,8.61,0.02,5pack Solid Simple Solid Panty,,,
,8.54,0.05,Plus Strawberry Print Tee & Shorts PJ Set,6,in Women Plus Sleep & Lounge,5
,13.59,0.33,Classic Sexy Embroidered Mesh Trim Satin Babydoll Slips With Belted Robe,4,in Blue Women Sexy Lingerie Dresses,
3700,16.99,0.07,Women's Solid Color Homewear Set With Small Bow Decoration,,,
,5.86,0.11,Plus Leopard Print Nightdress,8,in Hot Pink Plus Size Nightgowns & Sleepshirts,
,12.76,0.11,Plus Size Color-Blocked Short-Sleeve Shirt And Shorts Pajama Set With Lapel Collar,4,in Black Plus Size Pajama Sets,9
3200,4.58,0.1,Shein Underwear&Sleepwear Basics 3pcs Letter Tape Waist Panty,,,4
400,12.09,0,SHEIN X Care Bears Embroidery Cartoon Pattern Ruffle Hem PJ Set,,,
,5.11,0.13,"Ladies' Waterproof Thickened Silicone Breast Petals For Small Breast Lift Up & Push In, Special For Wedding Photography",4,in Women's Wedding Lingerie Accessories,
1000,4.29,0.07,1pc Wireless Bra For Women,,,
1600,11.29,0,Lapel Collar Contrast Binding Satin Blouse & Shorts PJ Set,,,13
200,10.39,0,Christmas Plaid Print Piping Trim Patched Pocket PJ Set,,,
