selling_proposition,price,discount,goods_title,,rank_sub,color_count
,3.8,0.05,pair Classic Lens Sunglasses For Outdoor Elegant Sunglasses Beach Sun Glasses,7,in Women Sunglasses,null
3300,3.6,0.2,pcs set Fashionable Stainless Steel Nose Ring Stainless Steel For Women   Men No Piercing Needed Septum Body Jewelry,,,null
600,3.5,0.05,Vintage Oval Sunglasses For Women Men Small Metal Frame Sunglasses Ladies Sunglasses,,,null
4000,2.1,0,Geo Pendant Layered Necklace,,,null
700,1.7,0.06,pc Fashionable Sweet Style Ribbon Bowknot   Heart Shaped Mobile Phone Chain Pendant Bag Keychain Charm Mother s Day Gift,,,null
3800,2,0,pair Fashionable Cubic Zirconia Decor C shaped Multi layer Stud Earrings  Suitable For Daily Wear,,,null
,1.8,0.1,pcs Women s Simple Sparkling Beaded Handmade Waist Chain For Summer,4,in Women Waist Chains,null
80,2.7,0.07,Chain Pattern Bandana Fashionable Elegant Square Scarf Ideal For Going Out   Dressing Up Your Look Bandana Hair Band Head Band Ideal For Dressing Up Your Look,,,null
10,0.85,0.5,Pcs Glass Bell Flower Beads Cap Transparent Wind Chime Beads   mm Glass Beads Jellyfish Beads For Wind Chimes Handmade Jewelry For Bracelets  Necklaces  Earrings  Handicrafts  Wind Chimes  Ornaments Or Other Jewelry Crafts  Embrace Symbolic Power With Our Glass Wind Chime Flower Beads  The Wind Is Blowing Gently  And These Beads Are A Blessing From Afar  They Symbolize Blessings And Tender Love  And Are Perfect For Expressing Affection To Your Loved Ones,,,null
1300,3.2,0.09,Oval Frame Fashion Glasses Vintage Shades Beach Accessories,,,null
1100,1.7,0,Single Row Cubic Zirconia Women s Ring,,,null
,1.51,0.48,Street  pc Ladies  Jacquard Knit Hat With Soul Pattern Suitable For Daily Wear,3,in Women Beanie Hat,null
200,1.3,0.07,Street House Design Keychain,,,null
3900,2.6,0,pcs Minimalist Bangle,,,null
600,2.2,0,pc Vintage Silver Winged Dragon Ring  Powerful Symbol   Adjustable Open Ring For Jewelry Accessory Gift,,,null
3300,2.5,0,pcs Metallic Texture Pearl Bead   Disc Pendant Necklace Set  Random Quantity Of Discs,,,null
400,1.9,0.05,pc Creative Mini Woven Bag Zipper Purse  Small Bag Card Bag Key Bag Suitable As A Gift To A Friend,,,null
4100,5.7,0.08,pc Fuzzy Trim Cowboy Hat Cowgirl Hat For Women Party,,,null
1600,1.8,0,pc Vintage Minimalist Tree Vine branch   Leaf Design Women s Ring  For Wedding  Party  Festival  Casual And Daily Wear,,,null
900,5,0,pcs Stainless Steel Gold  Silver Stylish Simple Bracelet Set  Suitable For Daily Decoration Or Gift Giving,,,null
100,1.6,0,Faux Pearl Decor Stud Earrings,,,null
,2,0,Fruit Detail Acrylic Earrings,,,null
3300,2.57,0.01,Minimalist Cuff Bangle,,,null
400,4.9,0,pcs Set Fashionable Elegant Simple Delicate Ring Set In Heart  Butterfly  Flower  Leaf  Droplet  Geometric  Pearl Like   Wide Metallic Styles For Holidays  Parties  Dating   Daily Wear  Without Box,,,null
200,4.22,0.34,pairs Elf Ears For Cosplay  Anime Party  Costume  Halloween  Vampire  Fairy  Goblin,,,null
80,2.48,0.2,pcs Ocean Beach Seashell   Conch Pendant DIY Jewelry Making Accessories For Bracelet  Necklace  Earring  Phone Chain,,,null
2400,3.9,0.07,Geometric Frame Black Sunglasses For Daily Life Sunglasses Beach Sun Glasses,,,null
300,4.9,0,pc Customized Name Necklace   Personalized Name Jewelry   Minimalist Handwritten English Name Alphabet Necklace   Gift For Mom,,,null
,1.86,0.02,pcs set Shell   Starfish Charm Necklace,2,in Women Necklace Sets,null
700,0.97,0.35,pc Wrapped Design Hair Tie Casual,,,null
300,1.6,0,pcs Men Beaded Bracelet,,,null
600,1.4,0,Rhinestone   Star Decor Earrings,,,null
1600,2.8,0.1,pcs  cm Square Claw Hair Clips   Hair Claw Set Casual,,,null
800,1.33,0.22,Superb White Flower Earrings For Women  Long Tassel Design With High Sense Of Style  Popular And Chic Ear Accessories That Bring Sweetness,,,null
,0.75,0.46,Graduation Hat Charm Necklace,,,null
3400,1.8,0.05,pc Checkerboard Pattern Hair Clip For Women  Suitable For Daily Wear  Party  Going Out Casual,,,null
10,1.6,0.06,pc  Fashion Letter Geometric Zinc Alloy Brooch  Horror Ghost TV Ghost Film Funny Metal Brooch  Versatile Clothing Accessories Medal Badge,,,null
100,0.69,0.51,DAZY Textured Cuff Hoop Earrings,,,null
9100,1.5,0,pair Fashionable   Elegant Faux Pearl Drop Earrings In Simple Teardrop Design  Perfect For Parties And As A Versatile Gift For Women,,,null
100,1.3,0,pcs set Ball Decor Navel Belly Ring For Women And Men  Punk Piercing  A Fashionable Body Jewelry Gift For Any Occasion,,,null
200,0.87,0.52,Street  pc Doctor Nurse Themed Keychain With Thermometer And Stethoscope Design  Creative Alloy   Glass Pendant  Ideal Gift For Medical Students And Friends,,,null
1800,1.8,0,pc Gold colored European style Double layer Beaded Titanium Steel Chain Necklace For Women  Daily Wear,,,null
,1.17,0.27,Floral Print Hair Band Boho,8,in Boho Hair Bands,null
4300,2,0.05,pair European And American Minimalist Twist Two Layer Press Pattern Clip on Earrings,,,null
400,6.2,0,pc Women Luxurious Flower Full Rhinestone Bracelet Compatible With Apple Watch Band Apple Watch Strap Band Apple Watch Band Apple Watch Strap Strap Strap                     mm  Compatible With Apple Watch Band Apple Watch Strap Band Apple Watch Band Apple Watch Strap Strap Ultra Se                   And Other Smartwatch Accessories Apple Watch Band Apple Watch Strap Band Apple Watch Band Apple Watch Strap Strap Strap,,,null
,1.3,0,Rectangle Charm Y Lariat Necklace,8,in Women Long Necklaces,null
900,0.87,0.46,pcs Set Fashionable Simple Heart Pendant Necklace   Earrings Set For Women  Vacation Party Dating Casual Wear  Gold Or Silver Color Optional,,,null
800,2.7,0.07,pc Women s Y k Retro Oval Frame Wraparound Sunglasses Uv    Protection For Daily Wear Shades Beach Accessories,,,null
3300,4.95,0.01,pc Jewelry Organizer Hanging Holder For  Necklaces Rings Earrings Display Stand,,,null
300,1.6,0.06,pc Wide Brimmed Solid Color Shiny Faux Silk Y k Headband For Summer,,,null
1100,0.96,0.36,pcs Sunflower Stud Earrings,,,null
700,3.5,0,European And American New Fashion Touchdown Sport Cap  Game Day  Millet Letter Creative Handmade Earrings,,,null
2100,5.5,0.07,pcs Minimalist Round Buckle Belt,,,null
1400,2.9,0.09,Elegant  pc Women Minimalist Skinny Belt,,,null
600,3.3,0.06,pc Women Letter Embroidered Baseball Cap,,,null
100,1.8,0.5,pcs Plaid   Floral Print Scarf Hair Tie Boho,,,null
10000,1.8,0.05,pair Vintage Red Heart Shaped Zinc Alloy Hoop Earrings With Gold Tone For Thanksgiving Accessories,,,null
1500,1.7,0,Cubic Zirconia Decor Stud Earrings,,,null
2200,2.9,0.06,pc Women Symmetrical Buckle Elastic Casual Stretch Belt For Dress Decoration,,,null
,7.5,0.5,pack Contrast Binding Uniform Costume Set   Mask,,,null
,8.1,0.07,pc Women s   cm White Boneless Lolita Soft Gauze Petticoat Skirt  With High Elasticity,1,in Petticoats,null
900,1.6,0,A Simple Light Luxury Elegant   K Gold Plated Exquisite Small Cross Pendant Collarbone Chain Necklace,,,null
40,2.1,0,Fashionable and Popular Men Minimalist Pendant Necklace Stainless Steel Punk Hip Pop Style for Jewelry Gift and for a Stylish Look,,,null
,7.3,0,Luxurious Diamond Encrusted Ladies  Square Steel Strap Watch With Simple Design  Gift Box And Adjusting Tool Included Holiday,10,in Women Quartz Watches,null
70,1.7,0.11,pcs Couple Geometric Charm Keychain,,,null
3000,4.1,0,pc Fresh European   American Style Fashionable Sexy Literary   Retro   Elegant   Cute Bracelet  Multicolor Circular Wide Polyresin Texture Ombre Semi Transparent Exaggerated Geometric  d Bohemian Acrylic Wristband  Hand Accessory,,,null
,4.8,0.5,pc Elegant And Simple S    Sterling Silver Pearl Geometric Ingot Necklace  Women s Light Luxury Collarbone Chain  Girl s Birthday Gift  Holiday Summer Outfit,,,null
900,2.1,0,pc Fashionable White Cubic Zirconia Cross Pendant Necklace For Men Daily Decoration For Valentine s Day Gift,,,null
10000,2.3,0,Pcs Of Spider   Cat Pendant Fashion All Match Magnetic Attractive Pendant Beaded Elastic Adjustable Couple Bracelets,,,null
2600,4.3,0,pairs Rhinestone Decor Earrings,,,null
1900,0.96,0.31,pc Vintage Turtle Ring With Teardrop Shaped Rhinestone In Bohemian Style  Perfect For Daily Wear,,,null
,1.4,0,pc Men s Simple Gold plated Relief Face Alloy Ring,4,in Men Single Ring,null
,5.1,0,pc Men Gold Stainless Steel Strap Glamorous Rhinestone Decor Square Dial Quartz Watch  For Party Holiday,5,in Men Quartz Watches,null
3900,2.2,0,pair Unique Design Minimalist   Elegant Cat Eye Stone C Shaped Ear Cuff,,,null
2000,2.8,0,pcs Lock   Key Charm Chain Necklace,,,null
1200,0.8,0.38,pcs Women s Fashionable Multicolor Sparkling Rhinestone Circle Hoop Earrings With Glittering Crystals  Elegant   Sexy Style  Suitable For Parties Daily Wear,,,null
4400,1.5,0,Rhinestone Decor Geometric Drop Earrings,,,null
8500,1.6,0,pairs Set Seastar   Seashell Design Earrings Set  Ocean Style  Suitable For Women  Festival   Party Wearing,,,null
1200,3.48,0.26,Men Wolf   Letter Graphic Trucker Hat Street,,,null
1100,0.96,0.26,pc Minimalist Stainless Steel Necklace Suitable For Both Men And Women,,,null
,12.8,0.07,pc Unisex Solid Color Unique Shiny Rhinestone Tassel Hat  Schwester Bachelorette Cap  New Vintage Novelty KJ Gift Hat Wide Brimmed Hat  Spring Summer Bright Colors  BR Colorful  Vibrant  Classy Aesthetic  BR Fashionable And Elegant  Suitable For Western Themed Events  Parties  Engagement Parties  Cosplay  Graduation Ceremonies  Masquerades  Festivals  Weddings  Birthday Celebrations  Music Festivals,1,in Fedora Hat,null
,2.8,0,pcs set Black Embossed Design Ring,1,in Men Ring Sets,null
,0.43,0.71,pc  take It Easy  Embroidered Iron On Patch  Vintage Patch  Hippie Patch For Jacket  Backpack  Jeans  Hat And Clothes,5,in Fittings DIY & Tools,null
2000,2.1,0,pcs Set Fashionable Faux Pearl   Heart Decor Ring For Women For Daily Decoration,,,null
10000,2.16,0.06,pcs Heart   Star Pattern Cuff Bangle,,,null
,1.33,0.17,pc Women Flower Decor Fashion Alligator Hair Clip For Hair Decoration Boho,2,in Boho Hair Clips,null
4900,2.2,0,Personality Europe And America Style Elastic Rope Hand String  Ins Unpopular Handmade Beads Copper Plated Gold Bracelet For Women,,,null
4200,1.5,0,pair Elegant Water Drop Shaped Pearl Stud Earrings  Simple  Vintage Design,,,null
100,1.6,0.06,pcs Poker Card Embroidered Fabric Patch Badge DIY Clothing Pants Hat Bag Shoe Decoration Iron On Patch,,,null
3000,1.7,0,Cubic Zirconia Decor Cuff Ring,,,null
3500,2.1,0,pcs Exaggerated Personality Circle C Shaped Spiral Hollow Cylinder Line Large Silver Ear Clips  Fashionable Earrings Suitable For Women s Daily Parties  Banquets And Weddings,,,null
100,1.5,0.06,DAZY  pcs Minimalist Solid Scrunchie Casual,,,null
100,2.6,0,pcs Graphic Print Gift Bag  Modern Bow Decor Paper Gift Wrapping Bag For For Party  Holiday,,,null
1400,3.9,0,pc Fashion Business Men s Three Sub Dial Scale Number Quartz Watch Set With Stainless Steel Strap,,,null
1900,3.8,0.07,pairs Tortoiseshell Cat Eye Sunglasses Travel Accessories Boho Shades Beach Accessories,,,null
2800,3.2,0.5,pcs set Women s Jeans dresses Decorative Chain Belt With Circular Buckle  Black   White Color  Suitable For Daily Wear,,,null
800,1.86,0.34,pc Sports Style Wooden Ball Beaded Keychain Bracelet With Key Ring  Perfect Gift For Parents  Teachers  And Friends,,,null
2100,2.5,0.04,Gold Sliver Ankle Bracelets For Women   K Gold Anklets For Women Waterproof  Link Heart Beads Herringbone Rhinestone Anklets Set Layered Anklet Bracelets For Women Gold Jewelry Gift,,,null
3800,2.9,0.06,pc Paisley Print Bandana Women Scarves Women Big Square Scarf Bandana Hair Band Head Band Ideal For Dressing Up Your Look,,,null
,1.9,0.05,pcs Beaded Waist Chain Gold Body Chain   Belly Chain Belt Adjustable Women s   Girl s Beachwear Waist Jewelry Sexy,5,in Women Waist Chains,null
,3.2,0.09,pc Women Tree Pattern Fashion Scarf For Daily Life For Women Bandana Hair Band Head Band Ideal For Dressing Up Your Look,8,in Women Scarves & Scarf Accessories,null
3700,2.6,0.07,pc Women s Golden Square Buckle Multicolor Pu Belt  Versatile And Suitable For Daily Wear,,,null
10,1.4,0,Hot Sale Simple   Shiny Sun Moon Blue Gemstone Stacking Couple Rings  European And American Style,,,null
1300,3.2,0,Vintage European And American Style Unpopular Multi Coloured Natural Shell Handmade Woven Beaded Layered Bracelet For Women In Spring And Summer,,,null
3300,1.36,0.2,Evil Eye Decor Cuff Ring,,,null
1200,1.7,0,Rhinestone Star Decor Drop Earrings,,,null
400,3.1,0.06,Unisex Square Full Frame Uv Protection Beach Sunglasses  Fashionable Accessory For Daily Wear Shades Beach Accessories,,,null
2400,3.3,0.06,pair Leopard Tinted Lens Boho Classic Trendy Fashion Glasses UV Protection Vintage Sunglasses Beach Sun Glasses,,,null
2200,0.82,0.41,pc Hip hop Style Elegant Colorful Copper Inlaid Simple Multilayer Clip Earring For Men And Women Daily Wear,,,null
200,1.9,0,pcs Set Simple Design Bangle Set,,,null
300,5.2,0,pcs Mixed Style Cartoon Zinc Alloy Brooch Set  Dolphin  Dog  Butterfly  Bee  Etc   With Oil For Random Shipping,,,null
1000,2.6,0.07,pc Foldable Solid Color Reversible Sun Hat For Men  Suitable For Daily Wear Casual,,,null
,8.3,0.07,Boho Women s Elastic Waist Belt With Metal Buckle And Leopard Print  Casual Sports Style  Fashionable Accessory For Daily Use And Special Occasions  Christmas  Weddings And Parties,8,in Boho Women Belts & Belts Accessories,null
2500,2,0,Pomegranate Seed Necklace,,,null
2000,2.4,0,pcs Uncommon Design Retro   Fashion Resin Decorated Ring  Suitable For Women  Ideal For Taking Photos  Daily Wearing Or As A Gift,,,null
600,2.5,0,pcs set Men Star   Bird Decor Ring  For Jewelry Gift And Party,,,null
5500,1.76,0.2,pairs Rhinestone Decor Hoop Earrings,,,null
1400,1.76,0.27,pc Boho Zinc Alloy Rhinestone   Bead Decor Hollow Out Oval Charm Necklace For Women For Daily Decoration,,,null
1600,3.9,0.07,pc Big Claw Clip With Fun   Cute Curly Cat And Goldfish Bowl Pattern,,,null
,1.6,0.06,pc Double Side Y K Beanie Spider Web Letter Jacquard Candy Color Hip Hop Knit Hat Warm Skull Cap Elastic Couple Beanies Ski Hats For Women Men Knitted Beanie Hats  Letter Embroidery Warm Winter Caps  Hip Hop Punk Knit Hats  Unisex,,,null
200,2.6,0,Men Triple Dial Quartz Watch,,,null
400,3,0.06,Single layer Short Faux Pearl White Wedding Bridal Veil  Simple Style,,,null
2800,1.98,0.1,pc Round Plate Peach Blossom Imprint Pendant Necklace Non Fading,,,null
3000,1.9,0,Pc Vintage Punk Style Black Red Beads Bracelet With Cross   Feather Pendant For Women Men,,,null
200,2.4,0.08,pc Leopard Print Retro Double Beam Sunglasses  Uv Protection,,,null
3400,3.5,0.08,pair Geometric Frame Sunglasses For Outdoor Elegant Sunglasses Beach Sun Glasses,,,null
900,0.96,0.26,pc Women s Gold   k Plated Flat Snake Chain Stainless Steel Bracelet  Party Gifts,,,null
1700,5.3,0,pcs Set Fashionable Simple Heart  Rhinestone  Butterfly  Fish Tail  Shell   Multi Element Metal Anklet Set  Suitable For Layering  Women Beach Wear  Party  Dating  Gift  Everyday Outfit,,,null
,4,0.07,pc Classic   Vintage Small Frame Fashion Eyeglasses For Outdoor Travel Boho Shades Beach Accessories,3,in Women Glasses & Eyewear Accessories,null
10000,2.4,0,Women s  pcs Creative Fashionable Vintage Turquoise Sparkle Tassel Multi layer Beaded Necklace Set,,,null
5700,1.2,0,pc Simple Circle   Flat Opening Design Personalized Fashionable Luxurious Bracelet For Women,,,null
100,2.2,0,pcs Water drop Gemstone Decor Jewelry Set,,,null
1000,2.8,0,Vintage Boho Style Coin Tassel Pendant Chain Bracelet Minimalist Hand Chain Jewelry With Lobster Buckle,,,null
,5.8,0.06,Street MLB New York Yankees Baseball Team Fashion NY  D Embroidery Hard Top Adjustable Hat For Outdoor Sports   Sun Protection  Suitable For Men And Women Year Round Outfit  Holiday Gift  Valentine Day Gift,9,in Women Baseball Cap,null
100,2.46,0.37,pc Antique Steampunk Bronze Hollow Gear Movement Quartz Pocket Watch Pendant Gift With Chain Pocket,,,null
8900,2.8,0,pc Fashionable Rhinestone Inlaid Stainless Steel Bangle For Women  Simple Style   Versatile Jewelry Accessory,,,null
600,1.76,0.2,Fashionable and Popular Men Minimalist Chain Bracelet Stainless Steel Punk Hip Pop Style for Jewelry Gift and for a Stylish Look,,,null
40,2.6,0.13,pc Simple Leopard Print Bowknot Bag Charm Keychain Pendant Bow Keychain,,,null
2500,2.2,0,Minimalist Solid Bangle,,,null
,1.6,0.06,Shiny Rhinestone Five Pointed Star Tassel Clothes Patch  Iron On Applique With Glue Backing  Diy Apparel Accessory,4,in Textile DIY & Tools,null
1900,2.9,0,pcs C Shaped Faux Pearl Earring Set,,,null
2200,0.59,0.61,pair Cute Cartoon American Independence Day Five Pointed Star   Western Cowboy Hat Dangle Earrings For Women  Best Friend  Girlfriend  Sister Gifts,,,null
200,1.9,0,pcs Sacks   pcs Bridal Band For Bridesmaids Linen Bag Breathable Bamboo Charcoal Bag Jewelry Dust Proof Package Gift  Hangover Recovery Kit  Hangover Relief Kit Burlap Bag   Emergency Packaging Bag For Wedding Bachelor  Bachelorette Party Supplies Bags And Bracelets Need To Be Purchased Separately,,,null
1800,2.2,0,pair Fashionable Black And White Checkerboard Earrings Suitable For Women s Daily Wear,,,null
200,2,0.05,pcs Simple Solid Hair Tie Casual,,,null
700,2.3,0,pcs Flower   Butterfly Decor Ring,,,null
,2.48,0.2,Vintage Square Frame Eyeglasses Big Glasses Clear Glasses Accessories,6,in Vintage Sunglasses,null
700,3,0,Pair Elegant Cubic Zirconia Hoop Earrings For Women For Wedding Anniversary Engagement Party Jewelry Valentine s Day Gift,,,null
1200,2,0,Minimalist Chain Necklace,,,null
,2.4,0.08,Boho  pcs Women s Body Chains  Elastic Beaded Waist Chain Set With Rice Beads For Summer Beach,5,in Boho Women Pants Chain,null
,0.75,0.71,pcs Pack Reusable Smooth Surface Solid Color Gift Bags  Medium   Large Sizes    Ideal For Gift Wrapping  Birthday And Party Favors,9,in Gift Wrapping Boxes,null
60,4.8,0.28,Piece Rose Red Women s Fascinators  Feathers Tea Party Hat  Veil Headband With Hair Clip,,,null
3900,1.52,0.2,pc Women s Simple   Delicate Fashionable Open Bangle With Metal Decoration,,,null
1900,3.1,0.06,pc Scroll Print Scarf Women Bandana Fashion Head Scarf Bandana Hair Band Head Band Ideal For Dressing Up Your Look,,,null
2900,1.36,0.2,Double Flower Earrings  pair,,,null
1100,1.1,0,One Clock Watch Fashionable Simple Niche Design Ring For Women Alloy Jewelry Daily Commute Wear,,,null
2200,2.9,0.06,pc Women Symmetrical Buckle Elastic Casual Stretch Belt For Dress Decoration,,,null
,7.5,0.5,pack Contrast Binding Uniform Costume Set   Mask,,,null
,8.1,0.07,pc Women s   cm White Boneless Lolita Soft Gauze Petticoat Skirt  With High Elasticity,1,in Petticoats,null
900,1.6,0,A Simple Light Luxury Elegant   K Gold Plated Exquisite Small Cross Pendant Collarbone Chain Necklace,,,null
40,2.1,0,Fashionable and Popular Men Minimalist Pendant Necklace Stainless Steel Punk Hip Pop Style for Jewelry Gift and for a Stylish Look,,,null
,7.3,0,Luxurious Diamond Encrusted Ladies  Square Steel Strap Watch With Simple Design  Gift Box And Adjusting Tool Included Holiday,10,in Women Quartz Watches,null
70,1.7,0.11,pcs Couple Geometric Charm Keychain,,,null
3000,4.1,0,pc Fresh European   American Style Fashionable Sexy Literary   Retro   Elegant   Cute Bracelet  Multicolor Circular Wide Polyresin Texture Ombre Semi Transparent Exaggerated Geometric  d Bohemian Acrylic Wristband  Hand Accessory,,,null
,4.8,0.5,pc Elegant And Simple S    Sterling Silver Pearl Geometric Ingot Necklace  Women s Light Luxury Collarbone Chain  Girl s Birthday Gift  Holiday Summer Outfit,,,null
900,2.1,0,pc Fashionable White Cubic Zirconia Cross Pendant Necklace For Men Daily Decoration For Valentine s Day Gift,,,null
2500,2.2,0,Minimalist Solid Bangle,,,null
1900,2.9,0,pcs C Shaped Faux Pearl Earring Set,,,null
2200,0.59,0.61,pair Cute Cartoon American Independence Day Five Pointed Star   Western Cowboy Hat Dangle Earrings For Women  Best Friend  Girlfriend  Sister Gifts,,,null
200,2,0.05,pcs Simple Solid Hair Tie Casual,,,null
700,2.3,0,pcs Flower   Butterfly Decor Ring,,,null
1200,2,0,Minimalist Chain Necklace,,,null
3900,1.52,0.2,pc Women s Simple   Delicate Fashionable Open Bangle With Metal Decoration,,,null
1900,3.1,0.06,pc Scroll Print Scarf Women Bandana Fashion Head Scarf Bandana Hair Band Head Band Ideal For Dressing Up Your Look,,,null
2900,1.36,0.2,Double Flower Earrings  pair,,,null
,3.9,0.07,Pair Women Rhinestone Decor Ombre Lens Fashion Glasses For Travel Accessories Sunglasses Beach Sun Glasses,6,in Women Sunglasses,null
40,1.3,0,Fashionable and Popular Men Geometric Pendant Necklace Stainless Steel for Jewelry Gift and for a Stylish Look,,,null
,3.7,0.08,Pcs Letter Shoe Charms for Clogs  Alphabet Gibits Charms with  I Heart  and Hashtag Symbols for Sandals Decorations  Letter Shoe Charms Pack for Boys Girls Women Men Gift Party Favors White Pink,4,in Fittings DIY & Tools,null
700,6,0,pcs Various Styles Beginner Polymer Clay Beads Bracelet Making Kit With     Colors  Including Rondelle Polymer Clay Spacer Beads  Black Lava Beads  Various Pendants  And Elastic Cords  Ideal For Diy Craft Birthday Party Gifts,,,null
,2.5,0.07,pcs  Official Authorised Authentic Products New Cartoon Cute Hair Clips  Perfect Gift For Family  Friends And Classmates,6,in Pink Women Hair Accessories,null
100,1.5,0,pcs Plastic Gift Bags With Handle  Reusable Transparent PVC Gift Wrap Tote Bag For Retail Boutique Wedding Birthday Party Favor  Shopping Bag  Party Bag  Party Gift Bag  Craft Tote Bag  Party Favors,,,null
300,4.7,0.06,Elegant Hair Clips Women Wedding Bridal Hat Fascinator Ladies Dress Up Headband Lace Feather Mesh Flower Hairpin Decor,,,null
,1.3,0,pc Creative Red Carton Box Shaped Brooch With The Words  Don T Hate Me Because I M A Little Cooler   Suitable For Men And Women To Wear In Daily Life,1,in Men Brooches,null
,2.4,0,pc Retro Bohemian Style Necklace  Black   White   Coffee Color Beaded Coconut Shell Pendant Necklace  Ideal For Men  Daily Wear Jewelry,5,in Men Beaded Necklaces,null
1300,0.93,0.48,pair Silver color Simple Irregular Geometric Alloy Ear Hook Earrings Suitable For Women s Daily Wear,,,null
200,6.3,0.11,Pc Key Ring Tails Chain Keychain Keyring Gift Cute Simulation Fox Tail Keychain Pendant Key Chain Bags Charm Keys Holder Valentine s Day Holiday Gifts Random Color  Therian Plush Keychain,,,null
400,6.3,0.07,pc Leaf Decor Straw Hat Solid Color Bohemian For Outdoor And Traveling For Vacation Boho,,,null
1500,2.2,0,pc Fashionable Niche Design Rice Shaped Beads   Sun  Stars  Moon Shaped Pendant Women Necklace,,,null
1800,2.9,0.06,pc Owl Y k Style Large Frame Blue Light Blocking Women s Eyeglasses Party Decoration Glasses For Ladies  Christmas Dance Party And Photography Clear Glasses Accessories,,,null
300,4.2,0,Bachelorette Party Favor Hangover Kit Bags     X       Drawstring For Wedding Welcome Holiday Survival Recovery Bridesmaid Gifts,,,null
10,9.2,0.08,Tea Party Fascinator Kentucky Feather Hat Women s Fascinator Derby Straw Pillbox Hat For Cocktail Wedding,,,null
5500,1.8,0,pcs Set European And American Style Multi Piece Ear Clip Set  Copper Material Women s Jewelry Simple Hoop Earrings For Women Four Seasons Casual Wear,,,null
200,1.5,0.06,DAZY Flower Decor Hair Claw Elegant Perfect Gift For Friends For Daily Use,,,null
900,1.32,0.22,pcs New Bohemian Style Geometric  d Paint Crafted Statement Earrings With Long Tassels   Multicolor Candy Colors For Party  Style,,,null
100,4.1,0.07,American Vintage Style Sporty Girl Flag   Letter Embroidery Distressed Washed Out Baseball Cap With Pre Curved Visor,,,null
30,1.5,0,pc Rhinestone Star Decor Ring Copper Jewelry,,,null
700,1.8,0,Wide Cuff Bangle,,,null
1400,1.8,0,Women s Pearl Necklace With Elegant Beach Style Natural Shell And Lucky Starfish Pendant,,,null
,1.84,0.2,Happiness Collections Gold Thank You Tags     Perfect For  Wedding Favors  Baby Shower  Bridal Shower  Birthday Or Special Event     Pcs,9,in Gift Wrap Tags,null
2100,1.2,0.2,pc A Half Face Ring  Retro Sculpture And Fashion Ring  Suitable For Commemorative Gifts  Holidays Gifts For Friends,,,null
100,1.4,0.13,Chain Print Bandana Stylish Vintage Turban For Casual Weekend Wear   Decoration Bandana Hair Band Head Band Ideal For Dressing Up Your Look,,,null
3900,2.2,0.08,pc Metallic Sunglasses For Men   Women  Classic Vintage Pilot Style Eyeglasses With Clear Lenses Elegant Shades Beach Accessories,,,null
600,3,0,Pcs      X     X      Clear Plastic Gift Bag With Handle  Reusable Clear PVC Gift Wrap Tote Bag For Halloween Christmas Retail Boutique Wedding Birthday Party Gifts  Shopping Bag  Party Bag  Party Gift Bag  Craft Tote  Party Favor,,,null
700,2.6,0,pc Bohemian Style Stainless Steel Bracelet For Women Skirt Accessory  Adjustable Wave Titanium Steel Bangle For Men Couple Jewelry,,,null
3000,2,0,pc Vintage   k Gold Plated Stainless Steel Ring Decorated With Cubic Zirconia  Suitable For Women s Daily Wear,,,null
700,6.8,0,Genuine Leather Chain Style Apple Watch Band Compatible With Apple Watch Series           SE  Stainless Steel Watch Band Not Included,,,null
100,4,0.07,CM Casual Geometric Buckle Plus Size Belt With Hole Punch for Jeans Pants,,,null
400,8.6,0.04,pc Men Watch Men s Elegant Quartz Watch With Silver Sus    Stainless Steel Case  Leather Strap  Roman Numerals  Calendar   Simple Style  White Dial  Casual Waterproof Square Shape Watch For Daily Work Wear Or Business Gift Father,,,null
1800,4.8,0.08,Unisex Street Style Punk Belt  Suitable For Matching Jeans  Casual Shorts,,,null
20,4.4,0,Apple Watch Band  pc Compatible With Apple Watch Ultra     Se S                  Series Men And Women Universal Replacement   mm  mm  mm  mm  mm  mm  mm  Two Circles Around The Wrist  Fashionable And Creative Design Brown Leather Apple Watch Strap,,,null
800,1.2,0.08,pc Brass Realistic Bullet Model Ear Spoon Keychain Portable Ear Cleaning Tool Keyring,,,null
100,1.9,0,Leopard Watchband Compatible With Apple Watch,,,null
600,1.6,0,Vintage Gothic Cross Necklace Y K Women Necklace Ins Silver Stainless Steel Chain Necklace,,,null
