selling_proposition,price,discount,goods_title,rank_title,rank_sub,color_count
,2.08,0.2,pair of women's black and white horizontal striped knee socks for spring and autumn,10,in Black Women Over the Knee Socks,
90,17.99,0.07,DAZY Women Fashion Minimalist Texture Fabric Camisole Homewear Set,,,
,7.5,0.5,3pack Contrast Binding Uniform Costume Set & Mask,,,
800,11.59,0.15,7pcs Plus-Size Women's Seamless Solid Color Panties,,,4
90,8.3,0.5,Women's Elastic Waist Solid Color Shorts Set For Home Wear (3 Pieces),,,
500,8.47,0.32,Mesh Underwire Garter Lingerie Set With Choker,,,5
,12.49,0.07,"Apperloth A Rave Festival Sweetness Pink Jacquard Print Hook And Eye Lace Up Back Corset Bustier Shapewear Tube Top With Thong, Suitable For Wearing With A Dress",1,in Women Shapewear Sets,
,22.86,0.08,SHEIN Maternity 5pack Solid Ruched Nursing Bra For Mother,8,in Maternity Lingerie,9
900,12.09,0.14,7pcs Cut Out Garter Lingerie Set,,,
,2.93,0.08,Accessories For Plus-Size Women Solid Color Nipple Covers Bra,8,in Women Plus Intimates,
800,5.39,0.07,"High Waist Tummy Control Shapewear For Women Postpartum Body Shaper To Flatten Stomach And Lift Butt, Sports",,,
1500,8.99,0.05,(random Floral Pattern) Sexy Embroidery Garter Belt Lingerie Set,,,
60,17.19,0,DAZY Women Cute Pajama Set With Bear Pattern,,,6
1200,3.72,0.19,Plain Seamless Bralette,,,5
3000,4.49,0.08,2pack Plain Self Adhesive Bra & 10pairs Nipple Cover,,,
4900,3.09,0.09,"Hollow Out Women Sexy Underwear Seamless Butt Lifter Shapewear Shorts, Sports",,,
9100,6.7,0.21,"12 Pairs/set Women's Mid-calf Socks In Black & White Stripe Design, Breathable, Moisture-wicking & Odor-resistant",,,8
1700,14.99,0.07,Contrast Lace Zip Up Cami Unitard Romper,,,
,4.46,0.28,Women's Lace Lingerie Set (top + Bottom),4,in White Women Bra & Panty Sets,
200,11.99,0,DAZY Sweet Floral Printed Cami Pajama Set With Ruffle Trim,,,
1500,9.89,0.07,"1pc Women's High-Waisted Cross Design Seamless Shapewear Bottom, Sports",,,
,2.2,0.15,Solid Leg Warmers,3,in Women Leg Warmers,6
300,2.01,0.22,SHEIN Leisure-E Seamless Boyshorts,,,
,3.09,0.06,"Sexy Lingerie, Sexy Three-Point Set, Women's Bikini And Sexy Lingerie Set",3,in Black Women Sexy Lingerie Sets,
1000,1.59,0.39,Women's Letter Detail Weave Belted Hollow Out Boyshorts Sports,,,
3600,2.59,0.07,"6pcs Reusable & Washable Nipple Covers, Adhesive Silicone Nipple Pasties",,,
1300,6.99,0.13,"1pc Plus Size Postpartum Seamless Bodysuit Shapewear For Women With Butt Lifter, Tummy Control, Full Body, Adjustable Straps, Sports",,,
4700,3.09,0.09,Women'S Transparent Shoulder Strap Bra Lingerie Accessory,,,5
1100,2.72,0.22,Women's Contrast Trim Thong 3 Pieces Set,,,
300,2.29,0.15,Classic Sexy Women's Sexy Lingerie Mesh Skirt,,,
,3.49,0.05,"Lace Open Crotch Sexy Lingerie Bodysuit, Elasticity, Temptation, Fashionable And Personalized",9,in White Women Sexy Bodysuits,4
100,12.49,0,DAZY Allover Floral Print Nightdress,,,10
1300,4.49,0.18,Exotic-Bondage Floral Lace Cut-out Teddy Bodysuit With 1pair Hand Ring,,,8
5500,10.6,0.15,10pairs Men's Trendy Black & White Sports High Socks For Basketball Students,,,
1500,4.69,0.06,1pc Women's Sexy Lingerie Lace See-Through See-Through Open Crotch Bodysuit,,,6
,3.4,0.15,1pair Knitting Pure Color Pile Leg Warmers With Ruffles For Women,5,in Women Women Leg Warmers,
1400,7.29,0,Ladies' Contrast Color Lace Patchwork Pajama Set,,,
,2.19,0,"Women's Sexy Thong Underwear, Comfortable And Soft, Letter Print, Everyday Breathable Seamless Panty Sports",2,in Black Women Thongs,5
500,1.43,0.32,"1pc Women's Plus Size 15d Tights, Stylish Minimalist Pantyhose",,,
3300,4.39,0.06,Scallop Trim Bralette,,,
5900,3.3,0.13,ROMWE Kawaii 3pairs Ruffle Trim Crew Socks,,,4
,2.99,0,Men's Solid Color Simple Daily Sexy Underwear,1,in New Premium Men's Lingerie,
1100,4.99,0,Solid Underwire Bra,,,5
,2.1,0.13,ROMWE Kawaii White Women's Leg Warmers,1,in White Women Leg Warmers,4
100,8.49,0,Cherry Printed Frilled Trim Decor Women Pajama Set,,,
1100,12.29,0.26,Lace Trim Cami Top & Shorts & Pants PJ Set,,,
,2.09,0,Contrast Lace Bow Front Panty,5,in Women's Blue Underwear,7
,1.89,0.24,SHEIN Leisure-E Natrural Comfy & Soft Low Waist Thong - Black,10,in Black Women Thongs,
400,8.99,0.07,Women Lace Mesh Ruffled Front Split Tie-Front Sleepwear With Thong,,,
,4.99,0.07,Solid Color High Waist Shapewear Shorts,9,in Women Shapewear,7
1100,1.99,0,Plain Seamless Panty,,,7
300,8.69,0,Men's Plaid Home Wear Pants,,,
500,3.45,0.37,6 Pairs Men Black/White Rainbow Striped Trendy & Fashionable Breathable Mid-Calf Socks,,,
700,3.15,0.21,Classic Sexy Rhinestone Studded Fishnet Bodycon Slips,,,
4100,4.78,0.13,Silicone Self Adhesive Bra,,,
60,14.29,0.07,SHEIN Unity Plus Contrast Guipure Lace Fake Button Nightdress,,,
,8.49,0,Men Gingham Slant Pocket Sleep Pants,9,in Men Loungewear Bottoms,5
80,8.79,0,DAZY Lace Splicing Floral Fabric Cute Flower Button Decoration Cami Sleepwear Set,,,
700,2.7,0.16,"2pairs Unisex Mid-Calf Socks With Solid Color, Star And Lightning Pattern, Suitable For Outdoor Leisure",,,
300,4.09,0,Men's Sexy See-Through Mesh Underwear With Open Back Cutout Design,,,
,3.4,0.13,3pairs Women Hollow Out Fashionable Fishnet Tights For Daily Life,10,in Women Women Socks & Hosiery,5
20,21.59,0.07,Plus Size Women's Polka Dot Jacquard Ruffle Hem Short Sleeve And Long Pants Pajama Set,,,
10000,3.9,0.15,5 Pairs Of Women's Black And White Striped Socks Set Minimalist Style Embroidered Pentagram Women's Sports Socks,,,
600,6.19,0.06,Women's High Waist Tummy Control Lace Spliced Shapewear Panties,,,
6400,3.79,0.07,Plain Shapewear Panty,,,
600,4.96,0.17,Women's Lace & Mesh Sexy Cami Dress For Petite Girls,,,
700,4.8,0.14,"5 Pairs Solid Color Simple Style Sport Mid-calf Socks, Suitable For Daily Wear",,,4
100,18.19,0,SHEIN Men Gingham Print Tee and Pants Lounge Set,,,
100,8.29,0.07,Men's Butt Lifting And Shaping Boxer Briefs,,,
400,2.18,0.34,1pair Soft And Skin-Friendly Matte 50d Pantyhose,,,
100,1.49,0,Solid Color Lace Trimmed Comfortable V-Waist Design Thong Panties,,,
,3.83,0.36,Classic Sexy Floral Lace Plunging Neck Backless Teddy Bodysuit,8,in Royal Blue Women Sexy Bodysuits,7
2700,6.59,0,7pack Solid No Show Thong,,,
2300,5.89,0.08,SHEIN SHAPE Women's Body Shaping Bodysuit,,,5
1500,4.99,0.09,"Ladies' Plus Size Ultra-thin Lace Bra Without Padding, 1pc",,,7
40,1.28,0.67,Men's Color-Block Edged Digit Printed Boxer Briefs,,,
500,3.79,0.07,Plain Longline Bralette,,,
,2.5,0.17,Minimalist Solid Tights,4,in Women Tights,7
,15.7,0.14,30 Pairs Men's Black And White Leisure Mid-Tube Socks Suitable For Daily Use,6,in Unisex Men Crew Socks,
3100,6.99,0.07,2pack Floral Lace Bralette Set Lingerie,,,4
600,9.49,0.14,"Classic Sexy 5pcs/Set Romantic Lace Lingerie Set With Underwire, Sexy",,,
,7.19,0.1,SHEIN SHAPE Solid Shapewear Bodysuit,6,in Women Shapewear Bodysuits,4
,8.29,0.14,4pack Floral Lace Cut Out Garter Underwire Thong Lingerie Set,3,in Red Women Sexy Bustiers & Corsets,9
900,4.19,0.09,Solid Seamless Bralette,,,5
400,9.49,0.08,"1pc Women's Waist Cincher, Tummy Control, Butt Lifter, Detachable Shoulder Strap, Body Shaper Bodysuit, Sports",,,
,3.49,0,Ditsy Floral Print Lace Trim Cami Sleep Top,10,in White Women Sleep Tops,
200,4.05,0.46,SHEIN SHAPE Women's Solid Color Sleeveless Shapewear Dress,,,
1000,2.39,0.08,"Nippleless Covers,Seamless Cover Ultra Thin Invisible Breast Lift Tape, Silicone Breast Lift Pasties, Women's Lingerie & Underwear",,,
,6.19,0.15,Embroidered Mesh Sexy Lingerie Set,2,in White Women Sexy Lingerie Sets,6
2900,7.29,0,7pack Plain Simple Thong,,,
200,1.26,0.45,Sexy Erotic Lingerie Bodystocking Combining Fishnet Stockings & Open Crotch Design & Hollow Out Mesh Bodysuit & Garter Neck Belt For Women,,,
500,9.69,0.07,"1pc Women High-Waist Underpants Postpartum Body Shaping Shapewear, Suitable For Multi-Occasions Such As Butt Lifting, Waist Slimming And Tummy Control, Sports",,,
5000,3.29,0.08,Contrast Mesh No-Show Shapewear Panty,,,
500,14.39,0,3pcs Plaid Print Flannel Sleep Shorts,,,
100,15.99,0.07,Men's Boxers Soft Briefs Multicolor Comfort 5 Piece Briefs 7 Sizes,,,
1100,3.69,0.14,Floral Lace Garter Lingerie Set,,,
100,10.69,0.07,"Women's Fashionable Lace Waist Trainer Triangle Bodysuit, 1pc",,,
100,2.7,0.13,"1pair Sports Football Socks With Knee Pad, Long Tube Anti-collision Leg Protective Socks For Players",,,
,5.69,0.08,"2pcs Women's High-Waist Shaping Triangle Panties, Seamless Body-Sculpting Underwear, Breathable Butt Lifter With Waist Control",,,
1100,11.39,0,Floral Print Contrast Piping PJ Set,,,
,3.55,0.23,5pairs Frill Trim Ankle Socks,3,in White Women Crew Socks,8
,1.39,0,Men Silicone High Elastic Soft Ring Lifting Type Underwear Accessories,1,in Men Underwear Accessories,
400,1.47,0.39,"1pair Men Playing Card Pattern Fashionable Crew Socks, For Daily Life",,,
,13.09,0.07,"3pcs/Set Plus Size Pants Suit In White, Grey And Black Colors, Can Be Worn Outdoors",5,in Plus Size Sleep Bottoms,
300,4.49,0,"1pc Men's Sexy Lingerie Bodysuit With Bowknot & Tight-fitting Design, Tempting And Seductive",,,
100,2.3,0.12,DAZY Knit Leg Warmers,,,
300,23.59,0,3pcs Men's Adjustable Plaid Drawstring Casual Home Pants,,,
100,14.69,0.07,"DAZY Ladies' Solid Color 3d Jacquard Texture Fabric Camisole Top & Shorts Homewear Set, Suitable For Summer",,,
2200,13.99,0.07,Solid Tee & Knot Front Pants Lounge Set,,,8
500,1.6,0.11,Alien Print Crew Socks,,,
,1.89,0,3pcs Men Ring-Shaped Underwear Accessory Set,2,in White Men Underwear Accessories,
1400,5.59,0.07,Solid Microfiber Underwire Push Up Bra,,,7
1000,3.37,0.46,Solid High Waist Shapewear Shorts,,,
500,10.29,0,DAZY Floral Print Cami Top And Ruffle Hem Shorts Pajama Set,,,
700,3.88,0.36,"5pairs Men's Fashion Alphabet Print Couple Socks, Random Color Delivery",,,4
700,4.36,0.21,5pcs/Pack Solid Color Briefs,,,
400,13.29,0.11,3pcs Comfortable Seamless Wave Edge & Removable Molded Cup Adhesive Bra Set,,,
1400,4.79,0.2,SHEIN Leisure-E Solid Underwire Microfiber Push Up Bra,,,7
200,5.39,0.07,"Women's Sexy Floral Embroidery Lingerie Set, 2pcs",,,
,3.89,0,DAZY Lace Patchwork Dress Triangle Anti-Glare/Anti-Emptied Safety Shorts,3,in White Women Safety Shorts,
200,5.99,0.2,PU Ring Linked Lingerie Set With 1pair Wristband,,,
200,13.99,0.07,Men 3-Pack Fashionable Long Trunk Underwear With Dollar And Rose Print,,,4
,18.09,0.07,5pcs Lace Bra With Underwire Lingerie,8,in Lace  Bras,4
,8.48,0.47,Ombre Ruched Tube Animal Costume Set With Headband,,,
900,8.49,0,Cherry Print Cami Top & Pants PJ Set,,,
200,1.6,0.11,Men Alien & Astronaut Print Crew Socks,,,
,1.1,0.08,1/5/10/20/40 Pairs Socks Men's Breathable Sports Casual Short Socks,1,in Black Men Ankle Socks,
,5.3,0.15,"8pairs Men's Short Anti-Odor Summer Socks, Breathable Mesh Athletic Low Cut Socks",2,in Men Men Invisible Socks,
30,17.39,0.07,DAZY Vintage V-Neck Home Wear Dress With Design Element,,,
1300,2.89,0.15,Sleeveless Hollow Mesh Sexy Bodysuit,,,
,6.29,0.07,DAZY Solid Rib Knit Thermal Underwear Top,6,in Women Thermal Underwear,4
,21.25,0.15,LUVLETTE Satin With Lace Trim Long Women Pajama Set,,,
100,2.49,0.07,3pcs Sexy Men Mesh Sheer Thong Underwear,,,
300,6.09,0.12,Plus Size Floral Lace Scallop Trim Bralette Frenchy Wireless Lingerie,,,
3200,3.19,0.06,Floral Lace Scallop Trim Bralette,,,11
600,3.13,0.27,Floral Lace Bra Lingerie,,,4
40,8.72,0.57,SHEIN Leisure-E Women's Plain Simple Daily Basic Cami Dress,,,4
800,5.29,0.07,DAZY Women's Lace Front Hollow Out Design Underwire Push Up Bra,,,
700,3.86,0.46,10pairs Women Solid Ruffle Trim Casual Socks For Daily Life,,,8
500,1.6,0.11,Cartoon Cat Pattern Crew Socks,,,
,9.49,0.14,Lace Up Front Lace Trim Lingerie Set With 1pair Leg Ring,6,in Black Women Sexy Bustiers & Corsets,
700,19.49,0.08,Women Underwear Bra (Wireless Padded Bra) 5 Pieces Seamless Bra Set,,,
1100,22.69,0,21pcs Leopard Print Panty,,,
2800,3.99,0.11,Floral Lace Underwire Bra Lingerie,,,7
2400,5.99,0,5pack Contrast Lace Panty Lingerie,,,4
,4.31,0.46,Pure Desire Floral Embroidery Mesh Underwire Lingerie Set,8,in Baby Blue Women Sexy Lingerie Sets,15
600,2.7,0.18,SHEIN Ladies' Cross Back Bra,,,
60,1.7,0.54,Men Sexy Alphabet Printed Thong Underwear With Weaved Strap,,,
400,10.79,0,Lace Trim Button Front Sleep Romper,,,
1300,2.79,0.07,20pairs Plain Nipple Cover,,,
200,14.78,0.21,Plus Size Floral Print Pocket Front Bell Sleeve Shirt And Pants Pajama Set,,,4
300,3.69,0.23,Classic Sexy Cut-out Lace Crotchless Teddy Bodysuit,,,
70,11.49,0.07,Plus Contrast Lace Dress With Thong,,,
2800,10.69,0.07,Friday the 13th | ROMWE Plus Letter Graphic Lettuce Trim Cami Top & Shorts PJ Set,,,
100,14.69,0,DAZY Women's Fashionable Loose Short Sleeve Pajamas Set With All Over Flower Print,,,
2400,5.59,0.07,SHEIN SHAPE Solid Shapewear Bodysuit,,,4
90,5.19,0.07,DAZY Women Seamless Solid Simple Comfortable Wireless Bra,,,4
2700,1.7,0.11,Plaid Pattern Crew Socks,,,7
400,2.51,0.28,Men Leopard Print Boxer Brief,,,
1900,5.39,0.27,Plain Rib Lingerie Set,,,
1900,18.89,0,21-Pack V-Waist Seamless Thong Panties,,,
1200,2.94,0.28,SHEIN DesireSculpt Floral Lace Underwire Bra,,,10
2200,5.39,0,3pack Lace Trim Bow Front Thong Lingerie,,,
90,7.49,0,Draped Collar Lace Up Backless Satin Night Cami Dress,,,
70,20.99,0,DAZY Tie Dye Button Front PJ Set,,,
4400,20.69,0,21pcs/Set Women's Seashell Edge Seamless Triangle Panties,,,
,10.61,0.1,1pc Letter Patched Detail Sleep Tank Top & 1pc Plaid Print Sleep Shorts,5,in Couples' Sleepwear,
,2.99,0.14,Men Striped Mesh Boxer Brief,3,in Men's see-through sexy underwear,
1500,3.99,0,"3pcs/Set Women's Lace Butterfly Bowknot Thong Panties, Sexy Underwear",,,
,12.59,0.07,2pcs Lace Up Backless Cami Top,2,in Women Basic Tops,
,3.49,0.13,SHEIN DelicateAllure Contrast Lace Sheer Mesh Babydoll Slips With Thong,2,in Baby Blue Women Sexy Lingerie Dresses,7
200,14.59,0.07,5PCS Comfortable Casual Wireless Soft Cup Solid Underwear Bra,,,
1800,9.49,0.14,Flower Embroidery Hollow Out Sexy Lingerie Set,,,
3300,2.39,0,Solid Rib Panty,,,
200,2.2,0.15,3pairs Women's Non-Slip Invisible Socks,,,
3400,5.39,0.07,2pack Backless Adhesive Push up Bra Set,,,
7600,3.12,0.44,"10pairs/Pack Men's Solid Color Striped Short Socks , Anti-Odor & Sweat-Absorbent Casual Ankle Socks, Suitable For Daily Wear",,,
900,7.7,0.14,"10pairs/lot Men's Mid-calf Socks In 10 Colors For Spring, Summer, Autumn And Winter. Solid Color Socks Suitable For Classic, Breathable Athletic, Casual And Business Dressing",,,
500,3.29,0,Comfortable Striped Letter Embellished Loose Boxer Shorts Sports,,,
,11.39,0.16,See-Through Lace Front-Tie Sexy Lingerie Set,4,in Newly released sexy underwear and lingerie,4
100,17.59,0,Shein PalaceNights Big Bow Lace Detail Sleepdress,,,
100,22.29,0.07,DAZY Cartoon Graphic Drop Shoulder Tee & Pants Lounge Set,,,
900,1.79,0,Floral Lace Bow Detail Thong Lingerie,,,7
600,4.19,0.09,"Women's Lace Backless Crotchless Bodysuit, Sexy Lingerie",,,
200,3.05,0.5,Men Figure Graphic Contrast Tape Boxer Brief,,,
80,15.29,0,DAZY Women's Lace Patchwork Sheer Cami Nightdress,,,5
400,17.59,0.07,"1pc Women's Corset Halter Pu Leather Waist Slimming Body Shaper Top, Suitable For Wearing With A Dress",,,
400,1.79,0,Ring Linked Panty,,,5
,2.49,0.46,"4 PCS Women's Sexy Hot T-Shaped Underwear, New Sexy String Underwear, Low Waisted Thong, T-Pants, Sexy Underwear",,,
,4.96,0.28,Embroidered Mesh Underwire Lingerie Set,1,in Red Women Bra & Panty Sets,7
20,2.39,0.17,Plain Nipple Cover With 1pc Clear Strap,,,
1000,6.1,0.14,7pairs Solid Crew Socks,,,4
,10.49,0.15,Romantic Color Block Mesh Fashion Lingerie Playwear 6pcs Set,1,in Women Bedroom Costumes,
1200,4.4,0.17,Classic Sexy Fishnet Cut-out Teddy Bodysuit,,,
200,3.49,0,Sexy Men Underwear Single Piece White High Elasticity Mesh Transparent Low Waist Full Coverage Triangle Panties,,,4
300,1.2,0.14,"1pair Women Solid Casual Invisible Socks, For Summer",,,
1500,4.59,0.06,Women's Underwire Bra,,,4
400,15.19,0,DAZY Sexy Sheer Mesh & Lace Patchwork Lingerie Set,,,
,2.78,0.68,Men's Solid Color Simple Summer Basic Sleeveless/T-Shirt For All Seasons,,,
1200,2.61,0.54,5 Pairs Women Black Novelty Cute Ruffled Frilly Ankle Crew Socks,,,
300,7.27,0.25,4pack Floral Lace Cut Out Garter Underwire Thong Lingerie Set,,,9
80,14.09,0,Men's Color Block Lounge Wear Set,,,
100,6.29,0.07,Dazy Star Solid Rib Knit Thermal Underwear Vest,,,4
,9.19,0.15,"Embroidered Sexy Women Lingerie Set, 2 Pieces",9,in Blue Women Sexy Lingerie Sets,
70,3.29,0.08,"Women's Sexy Lingerie Set, Yellow Bikini 2 Pieces Set, Exclusive Design, Body-Flattering",,,
,10.29,0.15,SHEIN Floral Lace Babydoll Slips With Thong,4,in Black Women Sexy Lingerie Dresses,9
,22.89,0,Men Shark Pattern Zip Front Fleece Hooded Loungewear Jumpsuit,2,in Men Loungewear Onepieces,
500,6.39,0.07,"2pcs Palm Shape Solid Front Buckle Reusable Nipple Cover, Invisible Strapless Push Up Breast Pasties, Women's Lingerie & Underwear Accessories",,,
,3.69,0.14,Classic Sexy Floral Lace Harness Lingerie Set,9,in Classic Sexy,
30,24,0,LUVLETTE Retro Polka Flora Satin Long Women Pajama Sets,,,
200,3.3,0.13,ROMWE Kawaii 3pairs Women Bow Pattern Frill Trim Cute Crew Socks,,,
30,2.7,0.16,"6 Pairs Men's Summer Thin Breathable Mesh Low Cut Socks With Tabs, White",,,
400,4.99,0.09,ROMWE Goth Skeleton Graphic Cut Out Lingerie Set,,,
,8.09,0.16,Shein FloralLove Women's Floral Patchwork Embroidered Mesh Sexy Sling Bodysuit,,,
4900,5.16,0.12,Wing Shaped Self Adhesive Silicone Push Up Bra,,,
2100,9.49,0.24,7pack Plain Simple Panty,,,
70,3.09,0,Men Black Mesh Sexy Thong,,,
300,9.87,0.29,"Exotic-Bondage Women Sexy Cami Bodysuit 4pcs/Set, With Underwire, Thong, Leg Ring",,,4
100,4.49,0,3pack Floral Lace Panty Lingerie,,,
,3.59,0.08,2pairs Invisible Push Up Bra Women Backless Strapless Bra Seamless Self-Adhesive Silicone Nipple Cover Sticker Wedding Dress Lingerie,4,in Black Women Lingerie Accessories,
300,8.39,0.07,Women's Fitness Yoga Girdle Three-Breasted Zipper Belly Belt Sweat-Shaping Waist Slimming Belly Sports Girdle,,,
1000,7.79,0.07,"Elegant Valentine's Day Black Pleated Bonbone Detail Turban Hem Tie Back Bodice Corset Shapewear Crop Tube Top, Suitable For Wearing With A Dress",,,
900,1.6,0.16,1pair Women Planet & Star Pattern Fashion Crew Socks For Daily Life,,,
70,5,0.33,SHEIN Maternity Contrast Lace Nursing Bra For Mother,,,
800,2.1,0.16,"1pc Japanese Spring/Autumn Retro Style Sheer Striped Pantyhose With Wide Vertical Stripes, Sexy Tights For Women",,,
,11.39,0.07,"1pc Lace Bustier Corset Tops For Women Sexy Going Out Party Club Top With Buckle, Suitable For Wearing With A Dress",2,in Women Shapewear Tops,4
300,8.05,0.44,7pack Plus Plain Panty,,,
200,11.09,0.07,2pcs Women Seamless High Waist Slimming Briefs With Bones,,,
2400,4.47,0.44,Super High Waisted Shapewear Shorts,,,
800,6.49,0.16,SHEIN Classic Sexy Contrast Lace Underwire Lingerie Set,,,5
600,7.99,0.07,High Waist Tummy Control Thong Panties With Buckle Closure,,,
,16.49,0.07,"Beige 1 Pc Shapewear For Women Tummy Control Body Shaper Zipper Open Bust Bodysuit, Sports",3,in Beige Women Shapewear Bodysuits,
900,7.49,0,Shein CottageSlumber Ditsy Floral Print Lace Trim Cami Top & Shorts PJ Set,,,
3700,8.09,0,5pack Leopard Print Low Rise Thong,,,
,2.31,0.71,"10 Pairs Women's Candy-colored Striped Couples Mid-calf Socks, 35-43 Yards, Black",3,in Women Crew Socks,5
,8.29,0.07,Men's Thermal Compression Shirt Fleece Lined Long Sleeve Athletic Base Layer Cold Weather Gear Workout Top,7,in Men Thermal Underwear,
40,31.44,0.15,Men's Multicolor Short Sleeve And Shorts Home Wear Set,,,
1400,6.09,0,5pack Floral Lace Panty Set Lingerie,,,5
50,1.2,0.14,Over The Calf Fishnet Socks,,,
1000,4.79,0,4pack Solid Rib Panty,,,
500,4.99,0,Men Floral Lace Garter Thong,,,
,16.55,0.02,Flannel Shark Sleepwear,1,in Men Loungewear Onepieces,
5100,11.39,0,Seamless Underwear (7pcs Triangle Panties),,,4
,13.29,0.07,SHEIN Leisure-E Solid Wide Leg Lounge Pants,8,in Women Lounge Bottoms,6
100,2.49,0.17,Men Contrast Binding Brief,,,
,4.89,0.08,Ruched Push Up Bra,5,in Navy Blue Women Bras & Bralettes,
,7.79,0.16,SHEIN Women's Bowknot Lace Front Halter Dress + Thong Sexy Lingerie Set,1,in Baby Blue Women Sexy Lingerie Dresses,5
100,13.45,0.5,"DAZY Overalls Jumpsuit With Broad Leg And Suspended Straps, Suitable For Home Wear",,,
500,2.94,0.35,Plain Shapewear Shorts,,,
,7.89,0,Plus Size Floral Printed Round Neck T-Shirt Dress,,,
,6.15,0.23,Floral Lace Cut Out Garter Underwire Thong Lingerie Set,1,in White Women Sexy Bustiers & Corsets,9
100,13.19,0,Plaid Printed Pajama Set For Women With Short Sleeves And Elastic Waist Long Pants,,,
,3.2,0.14,ROMWE Women's Hollow Out Pantyhose,10,in Best-selling stylish and sexy silk stockings,
10,1.8,0.14,GAWX Women's Mid-Calf Socks,,,
1500,11.99,0,Solid Color Simple Seamless Triangle Panties (Pack Of 12),,,8
500,14.49,0.07,"2pcs Women's Tummy Control Body Shaper Briefs, Firm Waist And Lift Buttocks, Suitable For Various Occasions, Sports",,,
1000,12.29,0.07,"FeelinGirl Shapewear For Women Tummy Control Fajas Post Surgery Compression Body Shaper With Open Crotch, Sports",,,
800,14.49,0.21,Notch Collar Satin Blouse and Ruffle Hem Pants PJ Set,,,14
50,4.29,0.07,DAZY Lightweight Body-Shaping Sexy Lace High-Waisted Underwear,,,
,8.09,0.16,"5pcs Sexy Lingerie Set, Including Lace Wireless Bra, Thong, Mesh Patchwork Skirt, And Two Pairs Of Fishnet Stockings",6,in Women Sexy Lingerie Sets,
,5.18,0.11,"SHEIN Women Cross Strap Bandeau Bra, Summer Solid Bra",4,in Women's Bralettes,
1300,10.79,0.07,"3PCS V-Style Women's Comfortable Sleep Wireless, Soft Cup Solid Bra",,,
,6.92,0.23,"Ladies' Sexy Hollow Out Lace Lingerie Dress 2pcs/Set (Underwire Dress, Thong) (Valentine'S Day Edition)",3,in Red Women Sexy Lingerie Dresses,
100,22.46,0.08,Casual Vest And Shorts Set In Multiple Colors (3 Sets),,,
200,7.45,0.34,Plus 4pack Floral Lace Shortie,,,
,9.29,0.07,SHEIN SHAPE Ladies' Solid Color Slim Fit Sleeveless Bodycon Dress With Back Slit,2,in Black Women Shapewear Slips,
,8.69,0,SHEIN Maternity 5pack Solid Panty For Mother,4,in Maternity Panties,
3500,11.99,0,12pcs/set Women's Seamless Thongs,,,8
700,4.79,0.4,Classic Sexy Floral Lace Scallop Trim Lace Cami Teddy Bodysuit,,,
1800,6.29,0.07,Women High-Waisted Tummy Control Panties With Hook-And-Eye Closure And Thong Design,,,
4600,1.9,0.14,"ROMWE Goth Women's Sheer Summer Pantyhose, Tights, Stockings",,,4
2900,9.89,0.07,"Solid Shapewear Bodysuit, Sports",,,6
50,3.39,0.08,"Sexy Embroidery Teddy Lingerie Sheer Backless Crotchless Bodysuit For Women, Transparent Tight-Fitting Sexy Lingerie",,,
,9.09,0.07,Solid Cami Lounge Dress,10,in Casual  Women Sleepwear,14
,5.69,0.11,SHEIN Plus Size Bralette & Wireless Bra,,,
300,17.9,0.14,ROMWE Goth 3pairs 200g Thermal Fleece Lined Tights In Three Colors,,,
800,7.39,0.49,Shein Underwear&Sleepwear Basics Men 5pcs Letter Tape Waist Boxer Brief,,,4
1700,12.49,0.07,"1pc Compressing Full Shapewear Bodysuit Plus Size High Waist Body Shaper Tummy Control Faja Shorts Waist Trainer Girdle, Sports",,,
1500,1.59,0.06,"1pair Silicone Breast Lift Tape & Nipple Paste, Invisible Adhesive Bra Pads For Summer",,,
,3.29,0,"Men's Elastic Soft Sexy Underwear, Temptation T-Back And U-Shaped Pouch, Low Rise, Blue",2,in Blue Men Sexy Underwear,
400,7.39,0.15,Classic Sexy Ruffle Trim Mesh Lingerie Set,,,
,14.49,0.07,Plus Size Contrast Binding Cherry Print Satin Pajama Set,2,in Baby Pink Plus Size Pajama Sets,
100,2.25,0.36,Men's Mesh Splicing Sexy Thong Underwear,,,
600,14.09,0.07,Half Button Waffle Knit Lounge Set,,,
700,2.6,0.16,1pc Facial Mask Textured Solid Color Stocking,,,
,2.51,0.24,"1pair Women's Over-The-Knee Ruffle Socks, Pile Socks",10,in Best-selling thigh-high socks,6
300,1.46,0.27,Letter Tape Thong Sports,,,4
600,1.26,0.37,Sexy Heart Embroidery Pearl Massage New Style Hot Women Lingerie Thong,,,
,4.3,0,"1pc Seamless, High Waist, Warm, Tummy Control, Postpartum, Sports, Shapewear Underwear",3,in Sport Corset,
,1.7,0.11,"1pair Over-the-Knee Opaque Black Long Socks, Thigh High Socks",8,in Women Women Over the Knee Socks,4
,8.55,0.41,Halloween Two Tone Lace Up Front Costume Dress & Headband,2,in Women Cosplay Costumes,
100,6.1,0.15,5pairs Oil Painting Pattern Long Crew Socks,,,
1500,6.39,0.07,Heart Ring Linked Wireless Bra,,,
,9.09,0,Floral Print Lace Trim Cami Top & Shorts PJ Set,4,in Bridal Sleepwear,
,19.19,0.07,"Women's Plus Size Pajama Set With Half-Placket And Heart Shaped Embroidery On Front, Short Sleeve Top And Long Pants",,,
500,1.8,0.18,2 Pairs Black White Sexy Overknee Long Socks Women Sweet Girls Lolita Bowknot Thigh High Fishnet Stockings Gothic Punk Lace Mesh Legging,,,4
,3.49,0.08,"Men Letter Printed Boxing Shorts, Novelty & Interesting Boxing Shorts, Breathable & Comfortable & Elastic Underwear, Trendy Men Lingerie",2,in Black Men Trunks,
2200,5.31,0.24,5pack Contrast Lace Panty,,,
10,3.41,0.4,Men's Contrast Color Striped Breathable Sleeveless Top For All Seasons,,,
8600,2.29,0.08,1pc Breathable Round Silicone Nipple Cover (apricot),,,
100,2.3,0.15,Glitter Detail Tights,,,
4500,2.66,0.08,"1pc Skin-Colored Lace Invisible Push-Up Sticky Bra, Randomly Comes With Clear Straps",,,
,13.99,0.07,Plus Lace Trim Plunging Neck Sleep Romper,2,in Black Plus Size Sleep Jumpsuits,
300,5.62,0.25,Classic Sexy Bow Front Floral Lace Crotchless Teddy Bodysuit,,,
10000,1.59,0.06,Bikini 2023 Chest Pad Bikini Set Push Up Padded Bikinis Swimsuit Women Swimwear Women 2023 Thicker Breathable Sponge Bra Pad,,,
2300,3.76,0.34,Classic Sexy Floral Lace Cut Out Bow Front Halter Teddy Bodysuit,,,
1000,7.01,0.38,"Women Solid Color Square Neckline Bodycon Short Sleeve Bodysuit With Tummy Control, Sports",,,6
,2.89,0,Men's Solid Color Thong Underwear,5,in Newly available men's sexy underwear,
500,4.79,0.06,Women's Lace Wireless Bra,,,
,2.4,0.27,1PC Sexy Lingerie Black Bodystocking Open Crtoch Hollow Out See Through Cover Up Without Underwear Valentine's Day Women's Swimwear & Clothing Swimsuit,9,in Black Plus Size Sexy Lingerie,
400,2.6,0.16,Bow Decor Fishnet Tights,,,8
100,4.38,0.45,10pairs Men Solid Crew Socks,,,
,3.71,0.65,Men's Solid Color Simple Style Sleeveless Undershirt For All Seasons,,,
