selling_proposition,price,discount,goods_title,rank_title,rank_sub,color_count
,15.8,0.13,SHEIN Teen Girl Knitted Ribbed Pleated T-Shirt And Accordion Pocket Casual Long Pants Set,5,in Teen Girls Sets,9
8200,7.4,0.13,SHEIN Tween Girl Solid Tank Top & Knot Waist Shorts,,,14
3600,4.54,0.45,SHEIN Young Girl Butterfly & Letter Graphic Tee & Shorts,,,5
,4.7,0.11,SHEIN Teen Girl White Knitted Pintuck Fitted Bandeau Cami Top,5,in Teen Girls Tank Tops & Camis,
,9.7,0.14,Young Girl Casual Loose Fit Simple Camouflage Print Multi-Pocket Denim Skirt,8,in Young Girls Denim,7
7600,11.1,0.15,SHEIN Young Boy Letter Graphic Striped Trim Baseball Collar Shirt & Shorts Without Tee,,,7
,11.9,0.15,"Young Girl Casual Basic Street Fashion Romper , Pack Of 3",6,in Young Girls Bodysuits & Jumpsuits,10
,0.64,0.62,"Baby Bath Toy Yellow Duck Shower Spray Toy For Boys, Girls, Children's Pool Swimming Water Play",3,in Kids Play Animal Figures,
1500,8.72,0.15,SHEIN Tween Girls' Woven Solid Color Camisole Top & Wide Leg Pants Set For Casual Wear,,,4
,7.33,0.15,SHEIN Tween Boy Paisley Print Drawstring Waist Shorts,2,in Tween Boys Shorts,
800,7.8,0.14,"SHEIN Young Girls' Casual 2pcs Set, Round Neck Cartoon Printed Short Sleeve Top And Elastic Waist Shorts, Summer",,,
,2.2,0.08,1pc English Initial Letter Charm Golden Twist Necklace For Boys Girls Name Customized Alphabet Choker For Children Birthday Gift,1,in Kids Jewelry & Watches,6
1500,10.06,0.37,SHEIN Streecool Kids Tween Girl Raw Hem Flare Leg Jeans,,,
5400,4.68,0.28,Tween Girl Casual Slogan Print Round Neck Pullover Short Sleeve T-Shirt For Summer,,,7
,10.77,0.24,"Tween Girl Vacation Striped Sleeveless Vest, Pants And Sweater Set With Halter Neck",7,in Tween Girls Cover Ups,
,2.5,0.07,1pc Kids Popular Cubic Zirconia Initial Letter & Crown Pendant Twisted Rope Necklace For Boys Girls For Christmas Party Banquet For Children Birthday Gift,4,in Teen Necklaces,4
200,2.24,0.2,"1pair Girls' Knitted Ribbed Leg Warmers, Perfect For Party Accessory",,,
,2.2,0.08,1 pc Boys girls middle and big kids square acrylic anti-blue light classic rice nail fashion flat lens for daily use,3,in Kids Eyeglasses,
4200,3.74,0.54,SHEIN Young Girl Eyeglasses & Letter Print T-Shirt With Flower Print Shorts Set,,,6
2100,6.15,0.32,SHEIN Tween Girl 2pcs/Set Knitted Casual Heart Printed T-Shirt And Shorts,,,4
,11.9,0.06,Teen Girl Flap Pocket Denim Skirt,1,in Teen Girls Denim Skirts,6
800,3.75,0.44,2pcs/Set Kids' Summer New Pure Color Sleeveless Basketball Pattern Printed Vest Shorts Sports Set For Young Boys,,,
,1.7,0.11,30pcs Girls Random Color Butterfly Design Hair Claw For Hair Decoration,1,in Kids Accessories,4
,13,0.07,"SHEIN Tween Girls' Casual Straight Fit Knee-Length, Soft Washed Denim Shorts",5,in Tween Girls Denim Shorts,
,17.2,0.14,Young Girl 3pcs/Set Fashionable Cute Cartoon Printed Short Sleeve T-Shirt And Leggings,1,in Young Girls Clothing,6
2100,3.25,0.32,Tween Girls' Casual Simple Cartoon Graphic Short Sleeve T-Shirt Suitable For Summer,,,5
300,1.17,0.44,"1pc Children's Personality Cool Sunglasses For Boys And Girls, Anti-Uv, Stylish Summer Sunshade Sunglasses",,,4
3100,25,0.13,"SHEIN Genkimix Kids Tween Girl 6pcs/Set Casual Sport T-Shirt And Sweatpants Outfits, Multicolor",,,7
,9.2,0.08,"2pcs/Set Girls' Sweet & Elegant Sleeveless Top And Lightweight Trousers, Summer",,,
,9.3,0.13,"Tween Girl Knit Solid Color Loose Fit Short Sleeve Top And Shorts, Casual Outfit Set",6,in Tween Girls Sets,6
2700,10.6,0.15,Young Girl's Floral Print Halter Top And Multi-Layer Ruffled Hem Skirt Set With Hat,,,4
,9.7,0.14,SHEIN Tween Girl Spring/Summer Casual Solid Round Neck Ribbed Tank Top,1,in Tween Girls Tank Tops & Camis,7
600,11.8,0.13,"Casual Cartoon Printed Multi-Piece T-Shirt Set For Tween Girls, Suitable For Summer",,,
1900,14.06,0.18,"Multi-Pack (5pcs) Solid Color Wide-Mesh Knitted Loose Sports Shorts For Tween Boys, One In Each Color",,,
,11.3,0.07,"SHEIN Tween Girl Flower Patchwork Pleated Back Tie Waist Cami Dress, Summer",2,in Tween Girls Dresses,4
,12.32,0.26,Tween Boy Ripped Washed Jeans,5,in Tween Boys Denim,4
100,2.08,0.2,2 Pcs/Set New Baby Girls Boys Cute Solid Color Bowknot Hairband Round Sunglasses Set Children Sunglasses Kids Hair Accessories,,,12
,11.8,0.06,SHEIN Teen Girls Ripped Roll Up Hem Denim Shorts,1,in Teen Girls Denim Shorts,
,7.8,0.07,Young Girl Summer Solid Pink Single-Breasted Short Sleeve Shirt + Shorts Casual Outfit Set,3,in Young Girls Clothing,
,9.9,0.07,SHEIN Tween Girls' Summer Casual Striped Sleeveless Romper With Round Neckline And Long Sleeves,1,in Tween Girls Bodysuits & Jumpsuits,4
70,3.9,0.5,2pcs Boy's Blue Lightning Print Short Sleeve T-Shirt And Shorts Set - Comfy And Stretchable Outfit For Children,,,
3500,6.2,0.07,Young Girl 2-Piece Cute Bubble Texture Short Sleeve Top And Shorts Set For Summer,,,5
,6.8,0.07,"SHEIN Big Girls' Knitted All-Match Solid Color Jumpsuit, Short Sleeve, Black, Street Style, Spring/Summer",4,in Tween Girls Bodysuits & Jumpsuits,19
,20,0.07,SHEIN Streecool Kids Tween Girl Heavy Washed Irregular Waist Multi-Pocket Loose Jeans,10,in Tween Girls Jeans,
,13.1,0.07,SHEIN Tween Girl Flap Pocket Solid Denim Skirt,3,in Tween Girls Denim,
,8.04,0.13,Teen Girl Character Print Simple Round Neck Short-Sleeved Two-Piece Set,3,in Teen Girls Sets,
7000,6.65,0.18,SHEIN Young Girl Slogan Print Short Sleeve T-Shirt And Shorts 2pcs/Set,,,4
,8.1,0.11,SHEIN 2pcs Teen Girl Elastic Waist Stretchy Undershorts,2,in Teen Girls Bottoms,7
1000,3.7,0.14,Girls' Casual Fashionable Colorful Letter Slogan Printed Short Sleeve T-Shirt,,,
,4.9,0.13,"SHEIN Teen Girls' Knitted Mesh Floral Pattern Crop Top With Split Hem, Ruched Bust",1,in Teen Girls Tops,
2300,14.6,0.14,SHEIN Tween Girls' Cool Street Style Knit Star Print Round Neck Top And Drawstring Jogger Pants Concert Outfit,,,4
30,9.6,0.06,SHEIN Teen Girl White Loose Split Band Jacquard Beach Vacation Semi-Sheer Sunscreen Knitted Cover Up Cover-Up,,,
1800,4.05,0.29,SHEIN Tween Girl Heart & Slogan Graphic Tee,,,6
2400,1.69,0.16,"200 Pcs/Bag Mix Color Children Cute Cartoon Elastic Hair Bands Baby Girls Lovely Srunchies Rubber Bands Kid Hair Accessories Set Bag Only Show ,Random Packing",,,7
1000,7.8,0.15,SHEIN Young Girl Daily Casual Home Wear Solid Color Sleeveless Vest And Shorts Set,,,
100,2.42,0.44,"Young Girl Knitted Casual Cartoon Letter Printed Round Neck T-Shirt, Suitable For Daily Wear In Spring And Summer",,,
,12.2,0.14,Young Girl's Heart Pattern Distressed Jeans,1,in Young Girls Jeans,4
,12.6,0.15,"Girls' Elegant And Versatile Double-Layer Peter Pan Collar Fringe Long-Sleeved Shirt And Suspender Skirt Set, Perfect For Autumn Picnic, Outdoor Activities And School",,,
5500,6.4,0.16,"SHEIN Tween Girls' Casual Solid Color Sleeveless Woven Top And Shorts Set, Spring/Summer",,,7
,4.4,0.15,SHEIN Young Girl Knitted Solid Color Round Neck Butterfly Patterned Casual Dress,1,in Young Girls Dresses,8
,13.2,0.15,SHEIN Tween Girl Casual And Colorful Candy-Coloured Soft And Comfortable Tank Top,5,in Tween Girls Tank Tops & Camis,
1100,5.56,0.47,SHEIN Young Boy Comfortable Casual Color-Blocking Top And Shorts Set,,,4
,6.9,0.07,Tween Girl Summer Fresh Striped Flare Sleeve V-Neck Belted Dress,5,in Tween Girls Dresses,6
,10.3,0.13,SHEIN Teen Girl Summer Casual Floral Cropped Ruched T-Shirt And Skirt Two Piece Set,,,
,6,0.08,"1pc Leisure And Fashion Crossbody Walking Bag With Mobile Phone Cloth Bag Vertical Coin Purse For ,Girl,Travel,Back To School,Gifts",1,in Kids Bags & Luggage,4
40,2.22,0.4,Set Of 3 Vintage Small Frame Round Sunglasses For Men And Women With Round Face,,,7
500,4.94,0.24,"SHEIN Tween Boy Summer Knitted Short Sleeve Sports Style Round Neck T-Shirt , Easy Bear Graphic Print",,,4
,9.3,0.07,SHEIN Tween Girls' Summer Casual Sleeveless Long Geometric Patterned Side Split Dress,4,in Tween Girls Dresses,
,10,0.07,SHEIN Tween Girl Knit Solid Color Pocketed Sports Skirt With Safety Short,4,in Tween Girls Activewear,8
10,6,0.06,Tween Girl Casual Slogan Graphic Short Sleeve Tee For Summer,,,
4900,7.7,0.13,SHEIN Tween Girls' Cartoon Print Short Sleeve Set,,,7
3700,8.3,0.14,SHEIN Young Girl Portrait Print Tank Top And Pleated Skirt,,,6
,12.73,0.17,SHEIN Tween Girl Knit Solid Color Bowknot Decor Casual Shorts 3pcs/Set For Summer,5,in Tween Girls Bottoms,4
3800,5.55,0.34,SHEIN Young Girl Heart Print Tee & Contrast Binding Shorts,,,11
,3.2,0.16,Young Girl's Casual Cartoon Printed Stand Collar Tank Top For Summer Suitable For Summer,3,in Young Girls Tank Tops & Camis,8
200,6.64,0.27,SHEIN Young Girl Rib-Knit Drop Shoulder Curved Hem Tee & Leggings,,,12
,8.4,0.13,SHEIN Tween Girls' Sports Street Fashion Knitted Solid Color Flare Pants For Spring/Summer,1,in Tween Girls Pants,4
5000,9.11,0.15,SHEIN Tween Girl's Knitted Tie-Dye Heart Printed T-Shirt + Color-Block Shorts Vacation Casual Sets,,,8
,10.36,0.12,"SHEIN Tween Girl Spring And Summer Boho Ripped High Waist Wrap Front Denim Skort, Summer Break Outfits",10,in Tween Girls Denim,
70,10.8,0.14,"Tween Girl 3pcs Knit Solid Color V-Neck Pintuck Short Sleeve T-Shirt Set, Casual",,,
,5.4,0.16,SHEIN Young Girl Ditsy Floral & Heart Print Belted Tank Romper,3,in Young Girls Bodysuits & Jumpsuits,12
,9.8,0.15,"SHEIN Mommy And Me Matching Outfits (2 Pieces Sold Separately) - Woven Red Vacation Beach Maxi Dress With Ruffle Hem And Bow For Young Girls, Perfect For Summer, Travel, And Mother-Daughter Outfits",,,
,6,0.06,"Tween Girl 1pc Casual Printed Crewneck Pullover Short Sleeve T-Shirt, Summer, Youth Clothing",1,in Tween Girls Clothing,
,12.9,0.07,SHEIN Tween Girl Solid Pleated Denim Skirt,2,in Tween Girls Denim Skirts,
10000,11.8,0.06,SHEIN Teen Girls Ripped Raw Hem Denim Shorts,,,5
100,6.45,0.33,Little Girls' Simple Letter Printed T-Shirt And Belted Shorts 2pcs/Set,,,
800,18,0.08,"Young Girl Summer Solid Color Heart Pattern Shorts Set, Multiple Pieces For Daily Outfits",,,
,10.3,0.06,SHEIN Teen Girl Floral Knit V-Neck Swimsuit & Swim Trunks Set,,,
9100,11.46,0.33,SHEIN Young Girl Letter Printed Short-Sleeved Shorts Three-Color Casual Suit Summer,,,12
1900,3.8,0.14,1pc Young Boy Slogan Printed Short Sleeve T-Shirt,,,
,5.5,0.08,"Young Girl Elegant And Flower Patterned Button Design Tank Top With Elastic Shorts Set, Suitable For Vacation And Travel In Spring And Summer",9,in Young Girls Clothing,6
900,5.56,0.38,Tween Girl Floral Print Round Neck Short Sleeve T-Shirt And Shorts Casual Outfit For Summer,,,4
700,5.7,0.12,Tween Girl Casual Round Neck Knitted Printed T-Shirt,,,
,4.6,0.32,"Girls' Teenagers Casual Apricot-Colored Round-Neck Pullover Short Sleeve T-Shirt With Printed Design, Summer Top",,,
100,6.5,0.14,2pcs Young Boys' Custom Game Controller Printed Short Sleeve T-Shirt And English Printed Shorts Set,,,
10,5.1,0.07,"6pairs, Y2K Cool Fantasy Classic Fashion Glasses, Color Matching Style, For Boys Girls Outdoor Sports Party Vacation Travel Supplies Photo Prop",,,
7200,8,0.12,Tween Girl Mock Neck Tank Top & Paperbag Waist Belted Shorts,,,11
10000,16,0.15,SHEIN Young Boy 3pcs Animal Print Tee & 3pcs Shorts,,,12
,9.9,0.14,SHEIN Tween Girl Cool Street Style Knit Round Neck Short Sleeve T-Shirt And Plaid Pattern Shorts Set,4,in Tween Girls Sets,5
10,9.1,0.15,"2pcs Young Boys' Casual Dinosaur Printed Black Overalls And Solid Color Round Neck Short Sleeve T-Shirt Set, Suitable For Daily Wear, School, Travel, Sports, Spring And Summer Seasons",,,
,6.37,0.17,Tween Girl's Casual Tie-Dye Pattern Short Sleeve T-Shirt And Shorts Set For Summer,5,in Tween Girls Sets,7
,13.5,0.13,SHEIN Tween Girl Character & Letter Printed Short Sleeve T-Shirt And Irregular Hem Denim Skort 2pcs/Set,10,in Tween Girls Sets,4
,9.3,0.15,SHEIN Young Girl Casual & Comfortable Knitted Sporty Tank Dress,3,in Young Girls Activewear,8
,10.59,0.15,SHEIN Tween Girls' Everyday Casual Tropical Print Cami Top And Pants Set,7,in Tween Girls Sets,
,13.1,0.13,Tween Girl Spider Web Print Zip Up Hoodie Without Tee,1,in Tween Girls Sweatshirts,
20,0.65,0.62,"1pc Korean Fashionable Elegant Earrings With Pearl & Diamond Inlaid Heart Pendant, Can Be Worn In Two Ways, For Women",,,
6900,6.5,0.16,SHEIN Young Girl Ditsy Floral Print Ruffle Trim Cami Top & Paperbag Waist Skirt,,,12
,11.4,0.14,SHEIN Young Girl Summer Casual Short Sleeve T-Shirt With Graphic Print And Distressed Denim Shorts Outfit Set,9,in Young Girls Sets,
900,3.85,0.23,SHEIN Teen Girls Solid Ruched Bust Tank Top,,,
,11.21,0.12,SHEIN Tween Girls' Casual Floral Print Square Collar Cap Sleeve Dress For Spring And Summer,3,in Tween Girls Dresses,
300,7.25,0.09,"Young Boys' Funny Expression Fluorescent Printed T-Shirt And Shorts Set, Summer",,,
,6.5,0.08,Solid Color Mini Crocodile Pattern Princess Handbag Crossbody Bag,,,7
,10.59,0.14,SHEIN Teen Girl Letter Graphic Cami Top & Shorts & Mesh Top,7,in Teen Girls Sets,4
900,6,0.08,Young Girl Abstract Printed Sleeveless Halter Top And Casual Shorts Set For Summer,,,
600,3.65,0.47,SHEIN Solid Color Tank Top Suitable For Summer Teen Girls' Side Drawstring Tank Top,,,7
200,9.87,0.16,Young Girl Summer Cute Cartoon Printed Short Sleeve T-Shirt,,,9
3000,8.2,0.08,Young Girl Unicorn Pattern Printed Short Sleeve Top And Denim Print Skirt,,,
,10,0.12,Tie-Dye Pattern Casual Pants For Teen Girls,,,
,16,0.07,"SHEIN Tween Girls Y2K Spring Summer Boho Stonewashed Causal Ripped Baggy Wide Leg Denim Jeans With Slant Pocket,Girls Summer Clothes Outfits",8,in Tween Girls Denim,
,10.1,0.07,SHEIN Tween Girl Cross Wrap Bikini Swimsuit With Tropical Print Beach Skirt,10,in Tween Girls Bikini Sets,6
,7.7,0.14,SHEIN Young Boy Casual Tropical Letter Print Short Sleeve T-Shirt And Shorts Summer Set,1,in Young Boys Clothing,7
,4,0.13,"Young Girl's Summer Loose Fit Casual T-Shirt With Slogan Print, Round Neckline And Drop Shoulder Sleeves",,,
,17.9,0.13,SHEIN Teen Girl Baseball Jacket With Letter Embroidery And Pleated Skirt Set,,,7
,13.49,0.22,Teen Boy Sports Casual Knitted Straight Leg Sweatpants With Woven Stripes,9,in Teen Boys Sweatpants,
2900,7.1,0.14,"Dinosaurs, Summer, 2pcs Young Boy Casual Cartoon Creative Dinosaur Pattern Short Sleeve T-Shirt And Shorts, Suitable For Summer",,,
,8.25,0.16,SHEIN Tween Girls Leopard Print Patchwork Top And Shorts Two-Piece Set,,,7
2700,7.9,0.14,Young Girl Cartoon Printed Round Neck Short Sleeve T-Shirt And Solid Color Pleated Skirt Casual 2pc Outfit,,,
10000,4,0.13,Young Girls' Bowknot Printed Round Neck Short Sleeve T-Shirt,,,
300,3.9,0.19,Tween Girl Summer Casual Short-Sleeved T-Shirt With Independence Day Character Letter Print 4th Of July Outfit,4,in Tween Girls T-Shirts,
,5.7,0.14,SHEIN Young Girl American Vintage Knitted Tie-Dye Heart Pattern Round Neck Short Sleeve T-Shirt,,,4
,6.5,0.14,Summer Trendy Sporty Casual Two-Piece Set For Little Girls,,,5
3700,7.5,0.14,SHEIN Young Girl Monochrome Crop Top With Letter Back & Skort Sports Suit,9,in Young Girls Activewear,8
300,7.43,0.15,SHEIN Tween Girl Star Print Cami Top & Striped Bow Front Shorts,,,
,3.96,0.49,"SHEIN Young Boy Gray Striped Sports & Casual Fashionable Jogger Pants, Suitable For Summer And Autumn",,,9
2800,6.84,0.19,"SHEIN Young Boy Casual Letter Print Short Sleeve Tee And Shorts 2pcs/Set, Summer",,,7
100,12.5,0.15,"Tween Girl Colorblock Short Sleeve Top With Contrasting Trim, Front Button Closure & Pocket Details And Shorts Summer Casual 2pcs Set",,,
1500,12.8,0.07,"SHEIN Tween Girl Spring Summer Boho Ripped Raw Hem Denim Jeans Shorts,Girls Summer Clothes Outfits",1,in Tween Girls Denim,5
80,7.06,0.09,Young Girl's Summer Creative Heart Printed Round Neck Short Sleeve T-Shirt And Shorts Set,,,
,15.3,0.1,"Tween Girl Blue Denim Jeans With Five-Pointed Star, Frayed Hem And Wide-Leg Casual Pants",8,in Tween Girls Jeans,
600,11.3,0.13,"1pair Black Large Size Teenage Girls' Roman Sandals With Folded PU Fabric, Sparkling Back Strap, Hook And Loop Fastener, Round Toe, Peep-Toe Style, Flat & Comfortable, Suitable For Girls Aged 3 And Above For Casual, Vacation, Beach, Parent-Child Wear In Summer",,,
,5.57,0.34,Young Girl Letter Graphic Cami Romper With Tee,,,6
,13.9,0.08,"6pcs Girls' Casual Tie Dye Printed Short Sleeve T-Shirt And Shorts Set, Summer",,,
2100,9.7,0.14,Young Girl Cartoon Unicorn Print Short Sleeve And Shorts Casual Two-Piece Set Snug Fit Home Clothing,10,in Young Girls Clothing,4
600,1.86,0.31,"1pc White Litchi Embossed PU Polyurethane Strap Casual Round Dial Quartz Watch & 1pc Rhinestone Decor Bracelet, For Daily Life Holiday",,,
,10.36,0.17,SHEIN Teen Girl Summer Knit Letter Patchwork Round Neck T-Shirt And Shorts Casual Two-Piece Set,9,in Teen Girls Sets,7
10,24.99,0,"Badgley Mischka Girls' Heels Dress Shoes, Zip Closure, Shiny Rhinestones. (Little Kids/Big Kids/Teens)",,,
,10.5,0.14,"Young Girl Simple Multicolor Tight-Fit 5pcs Shorts Set For Sport, Yoga, Running",1,in Young Girls Leggings,9
,8,0.14,Young Girl Toddler Girls Ruffle Hem Cami Top & Butterfly Print Flare Leg Pants,,,
,17.2,0.14,Young Girl 3pcs/Set Fashionable Cute Cartoon Unicorn & Rainbow Printed Short Sleeve T-Shirt And Leggings Set,,,
2600,5.8,0.16,SHEIN Young Girls' Striped Color Block Ruffle Trimmed Dress With Decorative Bow,,,4
700,5.8,0.06,"SHEIN Tween Girls' Black Stretchy Yoga Pants With Pockets, Elastic, Comfortable, Breathable And Moisture-wicking, Suitable For Sports Activities Like Running And Cycling",,,
3800,7.4,0.12,Girls' (Big) Knitted Flare Pants With Crossed Waistband Print Design,,,
2300,11.2,0.07,"SHEIN Tween Girl Spring Summer Boho Causal Ripped Roll Up Hem Denim Jeans Shorts,Summer Girls Clothes",5,in Tween Girls Clothing,
,1.68,0.33,"1pc Black PU Polyurethane Strap Glamorous Rhinestone Decor Round Dial Quartz Watch & 1pc Bracelet, For Daily Life",,,
,8.5,0.14,SHEIN Tween Girl Halter Top & Floral Print Belted Shorts,,,
10,9.4,0.14,"SHEIN 2pcs/Set Pure Color Casual Tween Girl Round Neck Top With Letter Print And Flower Decor, Spring",,,6
3900,10.2,0.07,SHEIN Tween Girl Casual Solid Color Simple Ruffled A-Line Skirted Leggings Sports Outfit,2,in Tween Girls Skirts,
2700,7.7,0.5,"1pair Girls' Embroidered Pearl Design Rural Style Shoes, Suitable For Spring And Autumn",,,
,8,0.15,SHEIN Young Girl Preppy Style Heart-Shaped Print Striped Trim Ribbed Collar Sleeveless Dress For Summer,4,in Young Girls Dresses,12
,7.8,0.06,SHEIN Teen Girl Letter Patched Detail Unitard Tank Romper,1,in Teen Girls Bodysuits & Jumpsuits,5
,2.7,0.07,2pcs Girls Heart Pattern Hair Bonnet,2,in Baby & Kids Hats,6
,7.39,0.11,SHEIN Tween Girl Solid Elastic Waist Shorts,1,in Tween Girls Activewear,4
,6.8,0.14,SHEIN Young Girl Spring And Autumn Casual Cute Cropped T-Shirt And Cami Jumpsuit Fashionable Two-Piece Suit,,,
,8.18,0.25,SHEIN Tween Girl Summer Casual Comfortable Solid Color Round Neck Short Sleeve T-Shirt Set Of 3,,,10
9400,6.65,0.18,SHEIN Young Girl Tie-Dye Relaxed Fit Round Neck T-Shirt And Shorts Set For Casual Wear,5,in Young Girls Sets,4
200,7.22,0.19,Young Girl's Unicorn Printed Rainbow Striped Short Sleeve T-Shirt And Shorts Set,,,
,14.1,0.13,SHEIN Tween Girl Casual Knit Round Neck Short Sleeve Two Piece Set,9,in Tween Girls Sets,8
8300,13.8,0.13,SHEIN Tween Girl Heart Print Cami Top & High Low Hem Top & Wide Leg Pants Set,,,4
,7.9,0.14,SHEIN Young Girl Heart Pattern Belted Asymmetrical Hem Plaid Dress,,,5
3100,11.2,0.14,SHEIN Teen Boy Casual Casual Comfortable Anime Print Short Sleeve Top And Shorts Two-Piece Set,,,
4800,9.88,0.19,SHEIN Young Boy Letter & Palm Tree Print Tee & Drawstring Waist Shorts,,,13
30,5,0.14,SHEIN Tween Girl Cool Street Style Short Sleeve Knitted Top With Ruched Detail For Spring And Summer,,,
7100,9.1,0.15,SHEIN Young Girl Figure Graphic Ruffle Trim Tee & Floral Print Mesh Overlay Belted Skirt,7,in Young Girls Sets,5
700,3.25,0.24,Young Boy Casual Cartoon Excavator Letter Print Round Neck Short Sleeve T-Shirt,,,4
,3.86,0.1,Young Girls' Summer Casual Slogan Printed Short Sleeve T-Shirt,3,in Young Girls T-Shirts,
100,12.4,0.14,SHEIN Young Girl Summer 2pcs/Set Strawberry & Letter Print Short Sleeve T-Shirt And Embroidered Elastic Waistband Denim Shorts With Belt,,,8
,7.41,0.18,"Tween Girl Casual Minimalist Letter Print Round Neck T-Shirt Set, Suitable For Summer",,,
10000,2.77,0.37,SHEIN Young Boy Slogan Graphic Tee,,,
800,6.7,0.13,Young Girl 2pcs Knit Bell Bottom Leggings Set For Spring And Autumn,8,in Young Girls Bottoms,5
1200,7.5,0.14,SHEIN Young Girl Knot Hem Tank Top & Striped Paperbag Waist Belted Shorts,,,8
,9.8,0.07,"Tween Girl Floral Printed Bikini Set, Holiday Style",9,in Tween Girls Clothing,
5200,11.35,0.33,Tween Girl Floral Print Ripped Flare Leg Jeans,,,4
,7.3,0.14,SHEIN Young Girl Floral & Letter Graphic Tee & Ruffle Trim Skirt,,,6
2800,5.28,0.27,SHEIN Tween Boys'  Round Neck Printed Knitted Short Sleeve T-Shirt,,,10
6200,8.2,0.15,SHEIN Young Girl Butterfly Print Knot Hem Tee & Flare Leg Pants,,,6
60,11.2,0.13,SHEIN Tween Girls' Casual Knitted Hoodie With Back Pattern & Slogan Print For Autumn And Winter,5,in Tween Girls Sweatshirts,
2500,19,0.14,Tween Girl 3pcsset Solid Color Knitted Round Neck Top And Shorts Casual Vacation Outfit,,,4
,8,0.12,SHEIN Tween Girl 1 Piece Of Fashionable Casual Letter Printed Fleece Round Neck Sweatshirt,3,in Tween Girls Sweatshirts,4
1800,9,0.14,SHEIN Young Girl Bear Print Tee & Plaid Pleated Skirt,,,
,7.93,0.23,SHEIN Tween Girl Letter Graphic Cami Romper & High Low Hem Tee,,,
1600,9.41,0.18,SHEIN Tween Girl Trendy Street Style Spring/Summer Knit Round Neck Short Sleeve And Shorts Set,,,9
2000,1,0.09,"200pcs Headband For Girls, Black Solid Color Elastic Hairband For Daily Use, Simple And Durable, Thick Ponytail Headband, Simple And Elegant Style, High Elasticity And Seamless Hair Accessories",,,
1500,5.5,0.14,SHEIN Tween Girl One Shoulder Top & Daisy Floral Print Shorts,,,
2900,0.97,0.31,"10pcs Various Cute Rings Set, Girls Candy Color Rings, Ideal Gifts For Kids, Without Box",,,
400,17.33,0.08,SHEIN New Arrival Tween Girls' Light Blue Y2K Love Heart Letter Printed Ripped Snowflake Denim Pants,5,in Tween Girls Jeans,4
100,10.19,0.14,SHEIN Teen Girls Letter Graphic Drop Shoulder Tee & Biker Shorts,,,8
,4.85,0.08,SHEIN Tween Girl Casual Rainbow Striped Adjustable Strap Casual Dress,1,in Tween Girls Dresses,
4300,6.02,0.46,"Teen Girl 3pcs Casual Short Knit T-Shirt Set, , Round Neck",,,
,8.6,0.08,SHEIN Tween Girl Casual Solid Color Round Neck Short-Sleeved Dress With Side Cinched Drawstring Hem,,,4
600,12.6,0.07,SHEIN Tween Girls' Knitted Solid Color Sleeveless Bodycon Dress Set With Round Neck And Outerwear,6,in Tween Girls Dresses,4
1800,10.7,0.07,SHEIN Sensorimotor Kids Tween Girl's Tropical Plant Printed One-Piece Swimsuit And Swim Shorts Set,2,in Tween Girls One-Pieces,
,8,0.15,SHEIN Sensorimotor Kids Young Girls' Tropical Print One-Piece Swimsuit With Swimming Trunks 2pcs/Set,4,in Young Girls Beachwear,7
,8.9,0.14,Young Girl Heart Print Bow Front Peplum Tank Top & Button Shorts,,,7
,2.75,0.45,Young Boy Casual Simple Slogan Print Short Sleeve Round Neck T-Shirt Suitable For Summer,,,
5400,12,0.14,SHEIN Tween Girl Tie-Strap Sleeveless Solid Colored Top And Solid Colored Vacation Style Cami Dress Two-Piece Set,,,
400,10.49,0.08,Tween Girl Floral Print Bikini Swimsuit With Kimono Matching Set,,,
1400,8.7,0.11,Teen Girls' Slogan & Printed Short Sleeve T-Shirt And Shorts Set,4,in Teen Girls Sets,6
2200,3.11,0.38,"SHEIN Girls' Cute Fun Letter Rocket Smiling Face Print Casual Comfortable Daily Round Neck Short Sleeve T-Shirt, Summer",,,10
,5.9,0.16,"Young Girl Chevron Pattern Cami Cover Up, Mommy And Me Matching Outfits (Sold Separately)",8,in Young Girls Beachwear,
2700,7,0.15,SHEIN Young Girl Summer Vacation Solid Color Short Sleeve Top And Tropical Print Shorts Outfit,5,in Young Girls Clothing,5
,7.98,0.18,SHEIN Tween Girls' Casual Round-Neck Tie-Dye Drop-Shoulder T-Shirt And Cycling Shorts,,,
,7.9,0.14,SHEIN Young Girl Eyelet Embroidery Trim Batwing Sleeve Tee & Shorts,,,
4600,9.5,0.07,SHEIN Tween Girl Tie Dye Drawstring Side Ruched Side Fitted Dress,,,4
5100,6.55,0.23,SHEIN Toddler Girls' Knitted Solid Color Short Tank Top For Summer 3pcs/Set,,,
1400,6.9,0.08,"Young Girl 3Pcs/Set Lovely And Elegant Flower Printed Camis And Shorts With Bag For Traveling, Beach, Home And Spring Break Season",,,
200,17.1,0.07,SHEIN Tween Girls Cute Star Print Washed Denim Straight Leg Jeans,4,in Tween Girls Jeans,
2200,11.7,0.15,SHEIN Young Girl Cami Romper & Flap Pocket Button Front Shirt,,,8
,3.99,0.2,"SHEIN Young Girl Sweet & Cute Rainbow Striped V-Neck Spaghetti Strap Dress, Summer",3,in Young Girls Dresses,
10000,17.7,0.07,"SHEIN Tween Girls Y2k Spring Summer Trendy High Waist Flap Pocket Side Flare Leg Cargo Jeans,Girls Summer Clothes Concert Outfit",,,
,1.5,0.12,2pcs/Set Colorful Acrylic Beaded Elastic Bracelet With English Letters Big Sis Lil Sis. Suitable For Sisters To Wear On Birthday,5,in Kids Jewelry & Watches,
1200,2.2,0.08,"1pc Unisex Square Frame Stud-patterned Blue Light Blocking Glasses For Junior High And High School Students, Daily Use",2,in Kids Eyeglasses,
,5.91,0.27,Tween Girls' Casual Slogan Printed Black Pullover Sweatshirt With Round Neck,2,in Tween Girls Sweatshirts,
,14.36,0.16,SHEIN Tween Girls' Sporty Leisure Knitted Sweatshirt And Shorts Two Piece Set,,,4
,8.46,0.48,40cm/15.74inch Rabbit Plush Toy Soft And Cute Rabbit Plush Toy - Ideal Gift For Friends - Cute Sleeping Pillow And Doll Three Color Styles To Accompany Sleeping Rabbit To Sleep Pet Toy Gentle Home Bed Ornament Easter Gift Birthday Gift,,,
4700,4.8,0.17,SHEIN Streecool Kids Young Girl Letter Printed Cool Short Sleeve Top & Shorts Set For Summer,,,4
70,9.22,0.18,SHEIN 2pcs/Set Tween Boy Casual Holiday Short Sleeve Printing Loose Knitting T-Shirt And Woven Solid Color Shorts,,,7
5600,8.46,0.18,"THE POWERPUFF GIRLS X SHEIN Tween Girl Casual And Cute Bright Cartoon Printed Short Sleeve T-Shirt And Shorts Set, Summer",,,
5000,9.9,0.14,Tween Girl Knitted Monochrome Fitted Casual Leggings Set (2 Pieces),5,in Tween Girls Leggings,4
