selling_proposition,price,discount,goods_title,,rank_sub,color_count
,6.4,0,Customized Personalized Heart Shaped Lace Name Necklace   Perfect For Mother s Day  Valentine s Day  Birthday  Anniversary  Graduation  Christmas  Family And High End Gift For Friends And Classmates,3,in Customized Fashion Word Necklaces,null
7200,2.1,0,pcs Set Simple Heart  Butterfly  Flower  Rhinestone   Faux Pearl Stud Earring Set For Women As A Gift For Dating Vacation,,,null
,8.2,0.1,A Multi Functional Electronic Watch With        Touch Screen  Designed For Female Students With Its Pink Silicone Strap  Equipped With Various Sports Modes  Camera Control  Social Software Message Reminders  Suitable For Gifting  Sports  And School Scenarios,7,in Women Digital Watches,null
,1.5,0,pcs Set Fashionable Elegant Vintage Multi Element Metal Jewelry Set Including Necklace  Earrings  Ring And Bracelet With Heart  Butterfly  Star  Geometric  Faux Pearl  Bead  Flower And Leaf Design Perfect For Holidays  Parties  Dates And Daily Wear  Without Box,9,in Women Jewelry Sets,null
7400,1.1,0,Multi pack Random Mix color Popular Bohemian Rainbow Acrylic Beads Chain Body Jewelry Belly Chain For Women  Gift,,,null
,3,0.09,pcs Flower Hair Claw Clips  PCS For Thick Hair Strong Hold Nonslip Hawaiian Cute Large Hair Clips Banana Clip For Thin Hair Hair Accessories For Women Girls Holiday Gifts,10,in Women Hair Accessories,null
,2.7,0,Rhinestone Decor Heart   Key Charm Bracelet,3,in Women Chain Bracelets,null
,2.8,0,PC Bubble Letter Necklace Balloon Initial Necklaces for Women Delicate Alphabet Pendant Inflated Name Personalised Jewellery Gift,1,in Women Pendant Necklaces,null
,3.4,0.08,pair Large Frame Woman Multicolor Star Y K UV Protection Ladies Sunglasses  Sporty Sun Shades Fashion Glasses Fashion  Eyewear With Bohemian Style Suitable For Parties And Trips  Summer Beach Accessories,9,in Boho Women Fashion Glasses,null
,1.4,0,pair Exaggerated European   American Style Metal Flower Stud Earrings For Women s Daily Wear,1,in Women Stud Earrings,null
,1.2,0.08,pcs Large Square Lightweight Plastic Hair Claw Clip  Black White Brown  Fashionable  Elegant  High Quality  Suitable For Daily Outdoor Activities  Hair Styling  Face Washing  Make Up  Clothing Accessories  Headwear  Etc,1,in Casual Hair Claws,null
500,1.9,0,pairs Set  Fashionable High End Earrings Set For Women  UV Resistant Metallic Earrings   C Shaped Hoop  Tear Drop Stud  Modified Hoop For Daily Casual Wear,,,null
600,1.1,0,European And American Cross Border Jewelry  Fashionable Design  Pearl And Tassel Earrings  Ear Cuffs  Ear Drops  Sweet And Cool Elegant  Metal Beaded Earrings For Women,,,null
,2.9,0,pcs Clay Beads    pc Bead Spinner Kit  Electric Bead Rotator For Jewelry Making  Includes    Colors Of Clay Beads And Jewelry Charms  Packed In A Gift Box For Making Waist  Bracelet Or Necklace,4,in DIY Kits,null
,1.7,0.11,pc     Sterling Silver Needle Cubic Zirconia Stud Earring  New Trend Fashion Jewelry For Women,7,in Wedding Fashion Jewelry,null
,3.9,0,Customized Name Men Women Necklace  Fashionable Personalized Simple Cursive Alphabet Font Stainless Steel Five Pointed Star Choker Necklace  Birthday Jewelry Family Holiday Gift For Mother On Mother Day,1,in Customized Fashion Word Necklaces,null
200,1.32,0.18,Roll Of About    Meters     cm No     Nylon Jade Wire Braided Rope And Bead Rope Suitable For Diy Bracelets And Necklaces Braided Jewelry Jewelry Production,,,null
10000,1.49,0.01,Pieces Faux Pearl Multi Layered Wide Twist Earrings Set Party Date Gift Suitable For Daily Wear,,,null
,3.15,0.5,PCS Dark Hair Accessories For Woman Set Seamless Ponytail Holders Variety Hair Scrunchies HairBands Scrunchy Hair Tie,,,null
1400,0.25,0.79,pc Women s Fashionable Bowknot Pendant Necklace,,,null
10000,2.17,0.1,pc Satin Bonnet Silk Bonnet Adjustable Bonne For Sleeping Hair Bonnet With Tie Band Bonnets For Women Men Silk Bonnet Satin Bonnet Bow,,,null
800,1.9,0.05,pcs Transparent Plain Glasses Female With Big Frame  Blue Light Blocking Glasses  Light Weight,,,null
900,0.86,0.8,pcs Women s Milk Coffee Colored High End Light Weight Plastic Hair Claw Fashionable   Versatile Square Shaped One Type Large Size Hair Clip For Daily Wear  Outdoor Activities  Bathing And Matching Clothes Casual,,,null
1100,1.25,0.22,pcs set Vintage English Alphabet   Symbol   Star Sign Design Constellation Card Pendant Necklaces,,,null
100,3.3,0.06,Pc Summer Handheld Fan   Speed Silent USB Rechargeable Portable Mini Electric Fan For Indoor And Outdoor Use,,,null
3000,0.96,0.2,pcs Combination Multilayered Vacation Style Foot Chain  Simple Fashion Retro Design Decorative Foot Chain Suitable For Women s Casual Daily Wear,,,null
10,0.87,0.42,Meters    mm Flat Faux Suede Braided Cord Velvet Leather Thread String Rope For DIY Necklace Jewelry Making Supplies,,,null
1000,1.6,0,Fake Nose Ring Hoop Fake Septum Fake Nose Ring Minimalist And Stylish Style Copper Inlaid Cubic Zirconia U Shaped Nose Clip  No Piercing Nose Ring Nose Clip Nose Stud For Women Nose Ring Jewelry For Women Men,,,null
,0.96,0.26,pc Zodiac Sign Symbol Pendant Necklace  Birthday Gift,8,in Men Pendant Necklaces,null
5100,1.3,0.07,pair American Independence Day Flag   Five Pointed Star Printed Acrylic Five Pointed Star Earrings,,,null
,3.93,0.35,pcs Jewelry Making Pliers Set   Needle Nose  Chain Nose  Round Nose   Wire Cutter   Perfect for Jewelry Repair  Wire Wrapping   Crafts,1,in Tool Kits,null
10,6.5,0.07,Glasses Display Stand Sunglasses Storage Box Transparent Eyeglasses Rack Organizer Sun Glasses Showcase Prop  Pink,,,null
1200,2.8,0,pc Luxury Full Rhinestone Heart Anklet With Thick Chain,,,null
900,1.2,0,pc Silver Creative Design Infinity Symbol Necklae  Collarbone Chain For Women,,,null
300,1.5,0.06,pc Money Magnet Bracelet   Career And Wealth Attraction Bracelet  With Green Dongling Stone  Yellow Tiger Eye Stone  And  mm Round Crystal Beads,,,null
200,0.87,0.42,Glossy Minimalist Water Drop Design Hoop Earrings Copper Jewelry Vintage Elegant Style For Women Daily Wear,,,null
30,0.76,0.46,pc Copper Material Jump Ring Opener Ring Tools For Jewelry Making DIY Craft Circle Bead Pliers Opening Tools,,,null
2500,1.12,0.49,Stainless Steel Bangle Bracelet With Swan Pendant   Full Diamond Heart Shaped   Many Stars Rhinestone Decor  Best Gift For Couples  Suitable For Daily Wear And Dating,,,null
100,1.6,0,pc Luxury Shiny Silver Alloy Ring With Cubic Zirconia Decoration  Suitable For Women s Daily Wear Or Engagement Ring,,,null
3100,0.87,0.38,pc Bohemian Stainless Steel Chain Colorful Starfish Pendant Women s Necklace Gift For Friends,,,null
,0.69,0.62,box Earring Back Plug,2,in Jewelry Findings & Components,null
5000,1.44,0.2,Pair Gorgeous Cubic Zirconia Stud Earrings For Women For Wedding Engagement Anniversary Party Jewelry Valentine s Day Gift,,,null
,1.6,0.06,pcs Set Women s Fashionable Clothing Buckle Ring With Silk Scarf Holder For Tightening Shirt Hem Or T Shirt Knot  Perfect To Show Waistline,5,in Women Waist Accessories,null
10000,2.33,0.03,pcs Leaf Charm Beaded Bracelet,,,null
500,1.4,0,Pair Of Fashionable And Cute Cartoon Mouse Earrings  Fashionable Animal Rhinestone Decorative Earrings  Small And Exquisite Earrings  Suitable For Festivals And Parties To Wear,,,null
,2.5,0,pair Fashionable Ladies  Twist Mobius Loop Design Simple Earrings,5,in Women Hoop Earrings,null
70,0.96,0.26,pcs pack Silver Lobster Clasp Hook Connectors For DIY Jewelry Making Necklace Bracelet Chain Accessories,,,null
1900,1.9,0.3,pcs set Fashionable Bohemian Style Glass Beaded Bracelet Set  Suitable For Women s Daily Wear,,,null
2100,0.93,0.51,Elegant Promise Ring Women Bowknot Cubic Silver Plated Zirconia Ring Wedding Engagement Gift Jewelry,,,null
,2.2,0,pcs Bohemian Style Glass Beaded Stackable White Bracelets For Women,4,in Women Bracelets,null
700,5.46,0.22,pc Multi layer Foldable Hanging Eyeglasses Storage Box,,,null
,2.5,0.14,PC Portable Mini Transparent Zipper Storage Bag  Compact Multifunctional Organizer  Headphone And Charger Case With Keychain  Transparent Travel Accessories  Exquisite And Compact  Suitable For Storing Small Items  Data Cable Storage Bag  Bracelet Bag  Makeup Bag Flower Alphabet A To Z Pattern Sunflower Daisy Zipper Style And Color Are Random Random Style And Size Of Circular Rings,5,in Bag Accessories,null
,1.52,0.2,pcs set Fashionable Geometric Resin Round Shaped Large Rings For Women s Party Accessories,8,in Women Ring Sets,null
100,3.03,0.58,box Clay Beads Kit For Friendship Couple Bracelet Making Kit  Flat Round Polymer Clay Shell Faux Pearl Beads Ocean Style For Jewelry Making  For Birthday Valentines Gift For Girls Suitable For Beginners,,,null
10000,1.6,0,pair Bohemian Zinc Alloy Bead Decor Water Drop Earrings For Women For Daily Decoration,,,null
,0.66,0.49,Evil Eye Bracelet Hamsa  Hand Pendant Bracelet Elastic Beaded Bracelet,4,in Men Beaded Bracelets,null
,2.34,0.22,pc  Stainless Steel Cross English Scripture Twisted Mesh Bracelet For Men  Adjustable Length,,,null
1100,1.1,0.08,pcs Headband For Girls  Black Solid Color Elastic Hairband For Daily Use  Simple And Durable  Thick Ponytail Headband  Simple And Elegant Style  High Elasticity And Seamless Hair Accessories,,,null
50,1.9,0.1,PC Portable Mini Transparent Zipper Storage Bag  Bag Accessiores   Compact Multifunctional Organizer  Headphone And Charger Case With Keychain  Transparent Travel Accessories  Available In Black And White Colors  Exquisite And Compact  Suitable For Storing Small Items  Data Cable Storage Bag  Bracelet Bag  Makeup Bag,,,null
2000,1.4,0,Disc Layered Necklace,,,null
,1.5,0,Color Block Geometric Drop Earrings,10,in Women Dangle Earrings,null
600,3.47,0.35,pcs Watering Can Comb Set Styling Comb Set   Pcs Slick Back Hair Brush Set With   Pc Edge Brush   Pc Hair Brush   Pc Rat Tail Comb  Teasing Brush For Smoothing Baby Hair,,,null
800,1.68,0.2,pcs Bohemian Vacation Travel Commemorative Bracelet,,,null
3200,1.5,0,pc Geometric Rhinestone Earrings Copper Jewelry,,,null
300,4.9,0,Personalized Stainless Steel Name Necklace Custom Tag Pendant Necklaces For Women And Men  Jewelry Gift,,,null
6800,1.52,0.05,pcs Set Fashionable Soft Ceramic Rice Beads Faux Pearl   Heart Charm Anklet Set Random Color   Suitable For Women s Daily Wear,,,null
100,1.62,0.4,pc Fashionable Cartoon  Italian Pendant Charm Stainless Steel Detachable Module Bracelet For Men  Women  Girls  Anime Jewelry,,,null
,2.66,0.14,pc Best Selling Mini Pocket Fan Portable Battery Quiet Small Fresh Handheld Small Fan The Battery Type Does Not Include The No   Battery  So The No   Battery Should Be Self Equipped,6,in Gender Neutral Accessories,null
,2.17,0.51,pc multifunctional wooden hanger for underwear  belts  ties and vest storage  drying  hanging and organizing wardrobes  student dormitories and homes,7,in Accessories Storage,null
,2.4,0,SHEIN SXY  pcs Rhinestone Decor Anklet,6,in Women Foot Jewelry,null
,3.2,0.09,pc Unisex Tortoise Shell Color Square Frame Double Bridge Pilot Style Fashion Sunglasses For Vacation Boho Shades Beach Accessories,2,in Women Glasses & Eyewear Accessories,null
400,1.3,0,pair Popular   Simple U Shaped Rhinestone Earrings,,,null
,6.2,0,Personalized Name Necklace With Figaro Chain  Unique Customized Name Necklace Gift For Grandmother  Mother s Day Gift  Christmas Gift,8,in Customized Fashion Word Necklaces,null
1300,1.3,0,Boho Shell Decor Necklace For Men Women For Holiday,,,null
10000,4.5,0,pcs Set Lucky Four Leaf Clover Design Bracelet  Necklace  Earrings  Bangle And Ring,,,null
9600,2.76,0.11,White Miniature Jewelry Box  Jewelry Travel Case  Portable Jewelry Organizer For Earrings  Necklaces  Wedding Accessories  Travel Storage,,,null
100,13.96,0.11,pc Crystal Tower Drinking Water Bottle  Energy  Amethyst  Transparent Quartz  Water Cup  Healing Crystal  Festival Gift  Go Out To Carry Storage Drinking Water,,,null
,2,0.2,pcs set Fashionable Ring Set With Heart Shaped Design  Geometric Style And Bohemian Element Accent,1,in Women Ring Sets,null
400,1.5,0,pair Bohemian Style Wooden Leaf  Pink And Green Beaded Stud Earrings  Fashion Women s Jewelry Gift,,,null
,0.69,0.47,pc Transparent Elastic Thread Beading Cord        mm     m Long  For Diy Bracelet  Necklace And Jewelry Making,5,in Jewelry Making Thread & Cord,null
,0.65,0.57,pc Cleaning Brush for Hair Combs   Plastic Handle for Easy Removal of Dirt and Dust   Embedded Beauty Tool for Cleaning and Maintenance,2,in Pink Hair Styling Tools,null
5400,1.6,0,Stainless Steel Bead Ball Pendan Sea Theme Beach Gifts For Women Men Girls Boys Necklace,,,null
2500,1.68,0.2,Star   Bead Decor Bracelet,,,null
,3.5,0,pcs Set Women s Rose Gold Stainless Steel Rhinestone Decorated Butterfly   Round Shaped Dial Quartz Watch And Alloy Bracelet  Suitable For Daily Wear Holiday,1,in Women Watch Sets,null
10,2,0,pair Disney Minnie And Mickey Mouse Stud Earrings,,,null
200,2.1,0,Pcs Set Gold Bangle Bracelets Set For Girls   Multi Layer Stackable Textured Bracelets Boho Jewelrys For Women,,,null
200,1.46,0.3,pc Devil s Eye Natural Stone Beaded Bracelet  Bring Good Luck  Money  Health   Unisex  Made Of Tiger Eye Stone    Perfect New Year Gift,,,null
,2.9,0.09,Girls Rhinestone Decor Square Frame Fashion Glasses,10,in Kids Fashion Glasses,null
,1.15,0.62,set Towel   Terry Cloth   Linen Twisted Headband Spa Face Wash Makeup Hair Band Set,7,in Hair Accessory Sets,null
7400,2.1,0,pc Bohemian Turtle   Starfish Decor Beaded Layered Anklet For Women For Summer Beach Travel,,,null
10000,1.6,0,Rhinestone Decor Hoop Earrings,,,null
10,3.4,0.08,pc Ladies  Blue Mirrored Reflective Punk Metal Aviator Frame Sunglasses  Perfect For Daily Travel   Streetwear Fashion,,,null
600,1.05,0.34,Safety Pin Design Stud Earrings,,,null
1100,2.1,0,pcs Set Fashionable Simple   Elegant Pearl   Heart Beaded Bracelet For Women,,,null
8800,2.9,0,pc Glamorous Copper Rhinestone Heart Charm Bangle For Women For Daily Life,,,null
400,0.85,0.55,pair Tassel   Pearl Decor Stud Earrings Elegant,,,null
50,1.46,0.23,Pack Approximately    Pcs Multi Color Pink Purple White Assorted Shaped Nail Charms Acrylic Multi Shapes White Heart Flower Bowknot Bear Design Resin Charms For Nail Art Manicure,,,null
100,1.5,0,pcs Set Upper And Lower Fake Teeth   th Generation Perfect Smiling Veneers  Punk Men s Halloween Vampire Costume,,,null
1000,2.79,0.1,Pink Trendy Travel Jewelry Box  Personalized Gifts Birthday Gifts For Women Christmas Gifts For Teens Girls Initial Travel Jewelry Case Without Mirror A Z,,,null
2400,1.7,0,pcs Fashionable Minimalist Geometric Waterdrop Shaped Earrings,,,null
600,1.3,0,pcs Set Fashionable Exquisite Retro Vacation Theme Jewelry Set With Rice Pearls  Butterfly Heart Pendant  Rhinestone  Tassel  Link Chain  Snake Bone Chain  Airplane Chain  Metal Anklet  Perfect For Seaside Vacation  Beach Parties  Festivals  And Dating  Also Great As Gifts For Daily Wear,,,null
3700,1.68,0.2,pcs set Luxury Square Shape Rhinestone Inlaid Necklace  Earrings  Ring Set  Suitable For Party   Formal Dress Accessory,,,null
800,1.25,0.22,pc European And American Fashionable Simple Style Chain With ABS Pearl Pendant Women Necklace For Festival Gift And Daily Wear,,,null
300,2.7,0.07,pcs Women s Pink Purple Green Gradient Color Flower Shaped Lightweight Plastic Hair Clips  Fashionable And Versatile  With An Elegant And Minimalist Design  Suitable For Daily Wear  Parties  Work  Vacation  And Hair Styling Such As Tieing Up  Braiding  And Putting On Makeup  To Match Clothing And Other Accessories,,,null
6200,1.5,0,Medium Sized Exaggerated Drop Shaped Earrings With New Design Concept For Women To Wear Daily And Dress Up,,,null
100,5.96,0.19,Pieces  Kraft Paper Cake Box     X     X       Portable Birthday Gift Box Empty Box Party Versatile Blank Box Gift Box,,,null
7700,3.1,0,pcs Elastic rope beaded women s bracelet,,,null
3900,1.5,0,pair New Fashion Creative Pineapple Stud Earrings For Women s Summer Beach Accessories,,,null
900,13.44,0.2,PCS    CompartmentsGlass Beads for Jewelry Making     Colors  mm Crystal Beads Bracelets Making Kit    Box Round Beads Suitable for Beginners,,,null
200,2.3,0,pcs Gold Bracelets For Women Stretch Beaded Bracelets Stackable Plated Bead Ball Bracelet For Women Trendy Gift,,,null
200,1.4,0,pc Fashionable Vintage Multi Layered Turquoise Conch Starfish Faux Pearl Turtle Beaded Anklet For Men And Women  Summer Beach Holiday Accessories,,,null
4600,0.96,0.2,Round Drop Earrings,,,null
10000,3.3,0.11,pairs Fashionable Stainless Steel Women s Large Personality Style Jewelry,,,null
10000,0.77,0.45,Slogan Graphic Drop Earrings,,,null
100,1,0,Minimalist Round Design Stud Earrings,,,null
,3.39,0.41,pc Handmade Green Aventurine Tree Ornament Exquisite Dongling Jade Jewelry Amorphous Natural Stone Wealth Tree For Home Decoration For Random Size,,,null
1200,3,0,European And American Stylish Geometric Waterdrop Crossover Vintage Ring And Bracelet Set For Women  Simple And Trendy Jewelry,,,null
300,1.1,0.08,pcs Fashionable Classic Matte Hair Claw Clip   Trendy Flower And Butterfly Styles   Durable Hair Clip Suitable For Chic Ponytails And Updos   Perfect Hair Accessory For Women And Girls  Ideal For Music Festivals  Parties  Gift Sets  Holiday Gifts And Decorations  These Decorative Hair Clips Are A Subtle Highlight For Any Hairstyle,,,null
,0.87,0.33,pcs set    MM Sunflower Acrylic Beads Matter Mix Color Spacer Acrylic Beads For Making Bracelet Earrings,1,in Beads,null
1100,1.5,0,Acrylic Rectangle Drop Earrings,,,null
10000,1.6,0.2,pcs set Simple Gold tone Circular Pendant Tassel Beaded Anklet For Women  Suitable For Daily Wear And Vacation,,,null
1400,0.87,0.42,Faux Pearl Butterfly Decor Stud Earrings,,,null
900,5.3,0,Pcs Random Preppy Heishi Bracelets Set Friendship Bracelets Bulk Adjustable Stretch Beaded Bracelets Colorful Clay Bracelets Bohemian Aesthetic Jewelry For Women Girls Christmas Birthday Party,,,null
30,2.8,0.1,pc Summer Mini Handheld Quiet Small Fan With Lanyard  Portable Battery Small Fresh Fan  This Product Does Not Have Batteries  You Need To Come With   No    Batteries,,,null
5100,2.5,0,pcs set Fashionable Flower Decor Jewelry Set For Women For Gift,,,null
,8.1,0,pc S    Sterling Silver Love Heart Pendant With Diamond Inlay  Fashionable All match Ladies  High end Wedding Jewelry Necklace,1,in Fine Pendant Necklaces,null
3000,1.5,0,Stone Drop Earrings Vintage Hook White Stone Oval Decor Drop Earrings,,,null
600,0.24,0.8,pair Exquisite Rhinestone Decor Luxury Stud Earrings,,,null
,2.9,0.06,pc    Square Scarf Moonlit Silk Chain Geometric Print Bandana Headwrap Bandana Hair Band Head Band Ideal For Dressing Up Your Look,4,in Women Scarves & Scarf Accessories,null
700,2.1,0,pcs Exquisite Gold Plated Women s Fashion Bracelets  Minimalist And Cute Jewelry Design That Can Be Stacked,,,null
,2,0,pc Lucky Bracelet For Both Men And Women  Vintage Synthetic Red Agate Bracelet For Family And Friends  Niche Red Beaded Bracelet As Gift For Boyfriend  Girlfriend And Best Friend,5,in Men Beaded Bracelets,null
2500,0.66,0.61,Glow In The Dark Beaded Mittens Anklet,,,null
1600,1.2,0,Shell Decor Bracelet,,,null
1100,1.9,0,Card   pcs Non Piercing Gold Magnetic Lip Studs   Earrings With Small Size Ear Bone Studs In Solid Color,,,null
6700,2.4,0,pcs set Heart Charm Beaded Bracelet,,,null
200,1.5,0,pcs Set Silicone Dental Veneers  Upper   Lower Teeth Braces  Beauty Teeth Whitening  Comfortable Fit Mouthguard,,,null
,2.9,0,pcs set Minimalist   Fashionable Five Petals Flower Copper Necklace  Earrings  Bracelet Set For Date And Birthday Gift,5,in Women Jewelry Sets,null
1300,0.53,0.72,pcs Set Women s Spiral Hair Ties Elastic Hair Bands Rubber Hair Ties For Ponytail Sweet Cute Cartoon Colorful Hair Accessories For Girls Daily Decorations Casual,,,null
400,0.76,0.42,pc Constellation Graphic Braided Bracelet,,,null
,4.02,0.36,Dark Hair Accessories Set Hair Scrunchies For Women  Soft Elastic Hair Ties  Ponytail Holder Rubber,5,in Hair Accessory Sets,null
30,1.9,0.05,pcs Set Black And White Portable Mini Clear Zipper Key Pouch Keychain  Compact Multi Function Storage Bag  Earphone And Charger Case With Keychain  Transparent Travel Accessory,,,null
7300,6.5,0,pcs Set Chic European And American Style Braided Steel Wire Bangle  Personality Roman Numerals Stainless Steel Women Bracelet Set,,,null
2300,1.44,0.2,pc Fashion Trend Simple Elegant Lady Style Golden    Letters Large Letter Pendant Necklace,,,null
2600,3.5,0,pairs French Sweet   High End   Personalized   Fashionable   Vintage   Luxurious   Faux Pearl   Cracked Ice Pattern   Windmill   Flower   Flame Design Exquisite Earrings Set,,,null
4100,1.4,0,Random Color Beaded Ball Drop Earrings,,,null
2400,1.7,0,French Vintage Style Purple Faux Pearl Bracelet For Women s Party Jewelry,,,null
1100,1.5,0,Pc Dainty Faux Pearl Bead Chain Necklace Choker Necklace For Women Daily Wear,,,null
10000,2.5,0.07,pc High Pressure Spray Bottle For Hairdressing And Makeup  Moisturizing  Refillable  Fine Mist Sprayer For Gardening And Watering Plants,,,null
600,3,0.06,pcs Package Orange Acetate Mermaid Color Iridescent Marbling Half Moon Hair Claw Clip Elegant Hair Accessories For Women s Party  Dance  And Tea Party Hairstyling Street,,,null
300,5.3,0,Strands  mm Colored Clay Beads  Mixed Color Flat Round Heishi Beads  Craft Kit For Girls  For Diy Jewelry Making Of Bracelets  Necklaces And Earrings,,,null
,2.2,0,Pcs Golden Silvery Beaded Bracelets For Women  Golden Plated Faux Pearl Bracelets Gold Stackable Stretch Bead Ball Bracelet Set Stackable Stretch Bead Ball Bracelet Set Bohemian Faux Pearl Golden Bracelet Stack Jewelry Gifts For Women Teen Girls,2,in Women Beaded Bracelets,null
,4.24,0.2,pc Women s Mini Cute Handheld Fan  Usb Port With Data Cable  Two Tone Flower Decor And Stand  Large Wind Power  Lightweight For Outdoors   Indoors  Dating Gift,2,in Hand Fans,null
100,2.5,0.07,pc Women s Solid Color Wide Brim Baseball Cap  Sunscreen Comfort Horse Hat With Pony Tail Hole  Outdoor Wear Fashion Comfort Women s Summer Breathable Sun Hat  Outdoor Pony Tail Hat  Adjustable Sports Hat  Empty Top Design  Fashion Bucket Hat For Hiking Fashion Sun Hat  Adjustable Breastless Beach Hat  Breathable UV Protection Backless Horse Tail Hat  Outdoor Fashion Pointed Hat,,,null
,0.87,0.57,Pc Portable Squeeze Eyeglasses Case   PU Leather Soft Sunglasses Bag Pouch  Pocket Mobile Phone Sunglasses Eyewear Organizer Holder,4,in Glasses Storage,null
10000,2.9,0,pcs luxury exaggerated women s Cubic Zirconia pair ring set ring fashion women s ring personalized jewelry,,,null
10000,2.1,0,set Golden Geometric Irregular Hollow Out Square Bangle And Ring Combination  Simple And Versatile Women s Party Gift,,,null
,2.3,0.04,pc Multifunctional Hanger Pants Hanger Scarf Storage Hanger,2,in Accessories Storage,null
4600,2,0,pair Bohemian Style Beaded Flower Pattern Earrings,,,null
10,1.4,0,Layered  mm Satellite Chain Anklet Women Summer Foot Chain Bracelet Fashion Ankle Straps Jewelry,,,null
,0.96,0.2,Butterfly Decor Mittens Bracelet,1,in Women Mitten Bracelets,null
90,0.75,0.5,pc Mini Faux Pearl Decor Cute Hair Claw Elegant,,,null
800,2.69,0.21,pc  random Color  Miniature Stainless Steel Toy Shopping Cart For Storage  Decoration  Diy Crafts  Dollhouse Accessory,,,null
100,0.86,0.46,Glow In The Dark Butterfly Decor Chain Bracelet,,,null
600,4.1,0,pcs Colorful Polymer Clay Smiling Face Bracelets Set  Bohemian Style Macaron Color Hand Strings For Parties   Music Festivals,,,null
,2.7,0,Set Of    Women Non Fading Rings  Stylish Personalized Tarnish Resistant Ring Set,2,in Women Ring Sets,null
100,2.4,0.08,Elegant Vintage Pillbox Hat Hair Clip Fascinator Hats For Women Cocktail Hat Tea Party Headwear Pillbox Fascinator,,,null
700,1.7,0,pcs Simple CCB Bead Elastic Anklet Set  Versatile Foot Jewelry Set,,,null
700,0.97,0.35,pc Natural Shell   Coconut Tree Pendant Clay Beaded Anklet  Beach Vacation Style  Suitable For Women s Daily Wear,,,null
10000,2.3,0,pc European And American Style Fully Beaded Heart Chain Bracelet  Hip Hop Street Style  Gold For Women  Silver For Men And Couples,,,null
10000,1.26,0.1,pair High end   Unique Design Clover Shaped Stud Earrings For Women,,,null
2900,1.3,0,pc Stainless Steel    Letters Necklace For Women  Pendant Chain With Initial Letter Pendant  Jewelry Gift,,,null
300,2.6,0,Set  Pcs Cubic Zirconia Surgical Steel Fake Ear Ring Studs Faux Non Pierced Ear Ring Ear Cuff For Women Men No Piercing Body Jewelry CZ Dia  mm  mm,,,null
700,1.16,0.42,Outer Space Planets Beads Bracelets Men Boy Loss Natural Stone Bangles Gifts For Brothers Anniversary Jewelry Earth Mars Venus Pluto Jupiter Saturn Moon Sun Uranus,,,null
,3.8,0.07,pc Fashionable Rimless Readers With Cheeky Blush Lenses And Rhinestone Trimming  Anti Blue Light Glasses For Computer,2,in Women's Reading Glasses,null
70,1.6,0,One Vintage   Glamorous Turquoise Ring  Unisex Fashion Jewelry  Perfect For Anniversary And Birthday Gifts  Parties And Events,,,null
,2,0.05,Hat Rack Hat Holder Cap Rack Cap Holder Hat Organizer Hanger Hooks  Storage Holders Racks For Baseball Caps  Bathroom Storage Rack  Adhesive Hat Racks For Wall  No Drilling  Wall Mounted Hanging Hook For Hat Towel Clothes,2,in Hat Storage,null
300,2.7,0,pcs Fashionable Personalized Exquisite Gold Color Leaf Jewelry Layered Rice Bead Bracelet Set  Ideal As Valentine s Day  Date  Or Travel Souvenir Gift For Women,,,null
1700,1.4,0,pcs Simple Cross Pendant Beaded Necklace   Bracelet Jewelry Set For Women  Holiday Dating Gift Daily Accessory,,,null
1900,1.2,0.2,Cubic Zirconia Decor Bracelet,,,null
,5.91,0.19,pc Unisex Portable Foldable   In   Multifunctional Solid Color Fan With USB Charge      mAh Rechargeable Battery And Phone Holder Function  This Mini Handheld Fan Is Perfect For Daily Use  Outdoor Activities  Sports  Beach  Traveling  Pool Parties  Office  Study And Home Life In Summer,10,in Hand Fans,null
1800,3.5,0,pcs Set Fashion Random Color Resin Seed Beads SWIFTIE Letter Bracelet Set For Women Summer Daily Wear,,,null
