selling_proposition,price,discount,goods_title,,rank_sub,color_count
,1.9,0,pc Men s Hiphop Style Copper Maillon Twisted Chain Necklace  Various Lengths And Widths Available,6,in Men Chain Necklaces,null
60,1.45,0.34,Retro Men s Braided Natural Obsidian Bracelet  Beaded Tiger Eye Leather Braided Stacking Multilayer Bracelet,,,null
400,1.4,0.07,Clover Decor Hair Slide With Stick Street,,,null
1000,0.87,0.67,pcs  mm Mixed Color Glass Gradual Change Double Color Beads Diy Bracelet Necklace Materials,,,null
,2,0,Pcs Golden Stainless Steel Necklace Extender Chain Necklace Extenders Tail Chains For Bracelet Anklet Stainless Steel Chain Extenders For Jewelry Making,6,in Jewelry Findings & Components,null
400,2.4,0,Yanxyad Colorful Beaded Drop Earrings Handmade Square Hoop Bohemia Style Layered Jewelry Vacation Style Party Accessories Gift For Women,,,null
900,0.69,0.54,pc    CM     inch  Ladies Flower Design Hair Clips Back Of Head Flower Grab Clips For Daily Cute Casual,,,null
8600,1.36,0.2,Fashionable New Style Full Rhinestone Snake Shaped Bracelet Set Including  pcs  chain In Green Rhinestone Design  Quantity Of Rhinestones Varies,,,null
,1.99,0.29,Pair Of Minimalist     Sterling Silver Bowknot Stud Earrings Suitable For Women Daily Wear,1,in Fine Earrings,null
,1.35,0.16,pcs Simple   High Elasticity Women s Basic Hair Ties For Daily Use Casual,8,in Hair Ties,null
6700,1.4,0,Faux Pearl Drop Earrings,,,null
100,2.45,0.26,pc Middle Ages Traditional Letter Initial Wax Seal Stamp With Brass Head   Wooden Handle For Diy Thanksgiving Card envelope gift Wrap wedding Engagement Party Invitation,,,null
7600,2.28,0.05,pcs Bohemian Style Women s Metal Bracelet Set,,,null
10000,1.3,0,pair Bohemian Style Creative Flower Pendant Earrings  Suitable For Women s Daily Wear,,,null
400,1.49,0.29,DAZY  pc Women Faux Pearl Detail Music Note Design Creative Hair Claw Elegant,,,null
2400,3.6,0.08,Pc New Fashion Anti Blue Light Unisex Eyeglasses  Colorful Butterfly Frame Flat Glasses Blue Light Frames Clear Glasses Accessories,,,null
2700,2.6,0,pcs Set Multilayer Bohemian Minimalist Metal Chain Women Hand Bracelet Set Simple Chain Bracelet,,,null
9500,1.6,0,pcs Random Color Block Beaded Anklet,,,null
,1.2,0,Pcs Ladies Fashion Simple Rhinestone Love Sparkling Ring Set Party Gift Opening Adjustable,3,in Women Single Ring,null
5500,2,0.05,pcs Sports Headbands In Wide Solid Color Plain Design Casual,,,null
700,1.8,0,pc Vintage Elegant Enamel Floral Design Micro Inlaid Cubic Zirconia   Resin Women Ring,,,null
100,1.77,0.34,pc Red Adults Shirt Suspender Trousers Suspenders  Unisex   Adjustable With   Clips   Elastic Straps,,,null
10000,1.4,0,pairs set Fashionable Zinc Alloy Spring Design Cuff Hoop Earrings For Women For Daily Decoration,,,null
10000,2,0,pcs Simple C type Copper Earrings For Women  Date Or Vacation Gift,,,null
,3.7,0,pc   k Gold Plated Titanium Steel Bracelet Vintage Elastic Polishing Bangle For Women Girls Fashion Aesthetic Jewelry,8,in Women Bangles,null
100,1.6,0.06,pcs Rhinestone Decor Faux Pearl Hair Clip Royal,,,null
1100,2.2,0,pcs Mixed Alloy Seashell Gold Color Pendant For DIY Necklace Jewelry Accessories Holiday,,,null
10000,1.76,0.02,Pcs Bracelet Women s Clay Disc Bracelet Rainbow Polymer Clay Fruit Flower Bead Bracelet Stackable Surfing Elastic Rope Bracelet Summer Beach Jewelry,,,null
,6.2,0.07,pcs Square Fashion Tinted Lens Y K Boho Black Pink Sunglasses For Women Outdoor UV Protection Party Accessories  Cute,10,in Square Women Sunglasses,null
,6.1,0.08,Cute  pcs Women Fashionable Minimalist Butterfly   Square Buckle Belt For Daily Life Bow,5,in Casual Women Belts & Belts Accessories,null
7200,1.6,0.06,pc Satin Sleep Cap For Women  Wide Elastic Band Sleep Cap  Fashion Satin Cap For Sleeping  Night Sleeping Head Cover Silk Bonnet Satin Bonnet,,,null
10,2.8,0.07,PCS Corsage Boutonniere Pins  Sewing Corsages Flower Pins  Long  inch Floral Diamond Rhinestones Pins  Straight Head Pins For Wedding  Jewelry DIY Decoration  Quilting And Craft By Sunenlyst,,,null
,1.34,0.04,pair Korean Fashionable   Minimalist Gold plated Small Peanut Shaped Earrings Suitable For Daily Wear  Parties  As A Gift For Valentine s Day,7,in Women Stud Earrings,null
,1.8,0.05,pcs  pcs  pc Women s Oversized Plastic Gradient Color Fashion Sunglasses Set For Streetwear  Summer  Vacation And Daily Use   Womenswear Boho,1,in Boho Women Glasses Sets,null
3600,2.2,0.04,pc Metallic Hollow Out Hairpin Ponytail Holder With Teeth Street,,,null
6000,2.8,0,pc Clear Jewelry Box  Plastic Organizer Storage Container With Adjustable Divider For Jewelry Craft Bead  Gift For Valentine s Day,,,null
6900,1.5,0,pair Fashionable Faux Pearl Bowknot Design Pendant Earrings,,,null
6300,1.4,0,pair Vintage Waterdrop Earrings,,,null
2700,0.38,0.71,pair Wooden Triangle Shaped Earrings For Women  Vintage And Unique,,,null
2600,1.6,0,pairs set European And American Exaggerated Metallic Large Hoop Earrings Set  Personality Trendy Simple Fashion Circle Combo Hoop Earrings,,,null
,1.52,0.2,Pc Glamorous Rhinestone Decor Geometric Design Ring For Men For Party Silver Fashionable Popular Jewelry Gift Party,8,in Men Single Ring,null
600,0.96,0.36,pc Natural Black Agate Tiger Eye Beaded Bracelet For Men s Fashion Jewelry,,,null
,1.9,0,pcs  inch Gold Pink Thank You Stickers Kraft paper Seal Labels Small Business Supplies Handmade With Love Stickers for Gift Decor,6,in Gift Wrapping Supplies,null
2800,5.28,0.34,pc Women Floral Crochet Fashion Bucket Hat Boho,,,null
,3.4,0,Fashionable and Popular Men s Stainless Steel Minimalist Hoop Earrings for Jewelry Gift and for a Stylish Look,1,in Men Beaded Necklaces,null
,2.2,0.08,pc Pneumatic Cushion Brush  Cute Cartoon Hair Decoration Comb Scalp Massage Comb  Random Color,2,in Hair Styling Tools,null
700,9.9,0,PCS Glass Beads For Jewelry Making     Color Randomly  mm Glass Crystal Beads Friendship Bracelets Making Kit For DIY Earrings Necklaces Rings With Spacer Beads,,,null
,2.2,0,Cubic Zirconia Cross Decor Bracelet,7,in Women Chain Bracelets,null
,1.7,0,pc Fashionable Metallic Minimalist Chain Bracelet For Men  Party Gift,3,in Men Chain Bracelets,null
2200,2.9,0,pc Bohemian Style Eye   Colored Oil Drop Design Palm Shaped Stainless Steel Pendant Necklace  Suitable For Daily Wear,,,null
800,1.46,0.23,pcs Clear Mini Elastic Rubber Hair Tie  Durable  Reusable  Soft  Portable  Perfect Accessory For Daily Life And Sports,,,null
80,1.32,0.34,pcs Ring Size Reducer   Invisible Adjuster For Loose Rings   Fit Any Rings   Perfect For Wedding Accessories Men Women Rings Size Loose Rings Essentials,,,null
200,1.9,0,Pair Of Silver Color Cubic Zirconia Stud Earrings  Multi Pierced Earring Effect  Hip Hop Style  Cubic Zirconia Curved Line And Hook Earrings,,,null
2500,1.9,0,pcs New Fashion   k Gold Plated Stainless Steel Material Waterproof Tarnish Resistant Twisted  Snake   Beaded Chain Bracelet Set  Perfect For Women s Daily Wear  Party Dressing And Gift Giving,,,null
1500,6.8,0.07,pcs Women s Solid Color Crosstitched Headbands Set  Fashionable Hair Accessories Casual,,,null
,2.5,0,Fashionable Minimalist Beaded Bracelet With Freshwater Pearls  Summer Female Accessory,9,in Women String Bracelets,null
5700,3.6,0.08,pairs Men s Multicolor Classic Retro Summer Holiday Leisure Fashion Sunglasses Casual,,,null
2500,1.4,0,pcs Set Vintage Multi Layer Faux Pearl Cross Pendant Gold Tone Necklace For Women s Wearing,,,null
1200,2.8,0.07,pcs Women  cm Coffee Color Mini Hair Claw Clip Versatile   Simple Hairpin For Everyday Use,,,null
,4.1,0.07,pairs Square Frame Eyeglasses Clear Glasses Accessories,9,in Women Eyeglasses,null
2000,0.27,0.78,Minimalist Drop Earrings,,,null
100,1.68,0.42,pc Men Solid Fashion Tie For Daily Life Casual,,,null
,3.9,0.07,Pc Women Sun Visor Hat Wide Brim Summer Sun Hats UPF     UV Protection Beach Hats Foldable Golf Visor For Women,2,in Women Masks & Visor Hat,null
2900,1.6,0,pc Fashionable Chic Metal Bubble    Alphabet Pendant Clavicle Chain Necklace  Suitable For Daily Wear  Office   Parties  Ideal As Birthday And Gift For Mom And Girlfriend,,,null
7500,2.9,0,Pairs New Earring Set Inlaid Faux Pearl Earring Circle Set,,,null
5700,2.9,0,pairs Rhinestone   Faux Pearl Decor Earrings,,,null
,10.2,0,Seaside Blue Starfish Shaped Jewelry Dish  Gift For Valentine s Day,2,in Jewelry Trays,null
,0.25,0.77,Yunjing Unisex Casual Fashionable New Arrival Cross Pendant Necklace With Gemstones For Women,7,in Men Fashion Jewelry,null
,1.44,0.2,Textured Metal Geometric Drop Earrings,4,in Women Dangle Earrings,null
1100,0.85,0.5,pair Fashionable Exaggerated Beach Style Metallic Irregular Shell   Starfish Shaped Women Earrings,,,null
1900,4.65,0.14,pcs Women Multicolor Sporty Stretchy Sweat Wicking Headband Yoga Running Hair Accessories,,,null
10,0.69,0.57,Vintage Triangle Hollow Out Brooch Pin  Unisex Lapel Pin For Shirt Collar Decoration   Elegant Brooch Suitable For All Outfit  Ideal Gift For Men  Great For Birthday  Boyfriend  Father And Lover Gift Giving,,,null
5200,1.44,0.2,Pair Elegant Cubic Zirconia Stud Earrings For Women For Wedding Engagement Anniversary Party Jewelry Valentine s Day Gift,,,null
8000,1.36,0.2,pc Luxury Zinc Alloy Cubic Zirconia Decor Ring For Women For Party,,,null
5800,1.2,0,Pair Stainless Steel Korean Style Cute Small Flower Stud Earrings For Women Sweet Statement Spray Paint Metal Flower Earring Party Birthday Jewelry,,,null
,1.37,0.09,pc Multi Purpose Clear Plastic Storage Box With Fixed             Compartments     Adjustable Compartments And       Removable Compartments For Earrings  Rings  Jewellery Organizing  Nail Art Supplies Sorting,4,in Jewelry Boxes & Organizers,null
9300,1.7,0,pcs Starfish Stud Earrings,,,null
5400,2.4,0,pair Style Exquisite Fruit   Beverage Design Stud Earrings,,,null
8400,1.9,0.1,pcs Star Hair Clips     s Y K Snap Hair Barrettes Non Slip Star Hair Accessories Silver Metal Hair Clips For Girls Women Street Tiaras,,,null
,3.1,0,Rhinestone Decor Choker,2,in Women Chokers,null
,2.2,0,Structured Layered Cuff Bangle,4,in Women Bangles,null
,1.8,0,pc Random Color   mm Mini Colorful Apple Natural Healing Crystals Stone Figurine Hand Carved Craft Christmas Ornament Decor Gift,,,null
,2.1,0,RINTOLER  pcs set Vintage Unusual Matte Lava Rock   Wooden Beads With Spacer Elastic Bracelet,2,in Men Bracelet Sets,null
5600,1.52,0.2,Minimalist Hoop Earrings,,,null
,1.7,0.06,pc Women s Metallic Fashion Belt With Geometric Patterned Decor  Adjustable   Removable  For Skirts   Pants  Prevent Skirt Lift  Suitable For Daily Casual Wear  Gift For Friends,1,in Women Waist Accessories,null
800,0.59,0.65,pc Cute Bear   Dice Charm Keychain for gifts  wallets  school bags  backpacks  and satchels,,,null
1700,1.3,0.07,Cute   Piece Of Synthetic Turquoise Travel Turtle Decorative Keychain Key Accessory  Emotional Support And Encouragement Gift  Can Be Used As A Holiday Gift For Loved Ones  Family  Friends  And Classmates  New Year Gift  Thank You Gift  Where You May Wamder  Where You May Roam  May This Turn Journey With You  And Safely Bring You Home,,,null
9400,1.3,0,Rhinestone Butterfly Pendant Layered Necklace,,,null
,1.76,0.2,pc Fake Piercing Navel Belly Ring With Pink Butterfly Design For Women s Jewelry Copper Jewelry,2,in Women Body Jewelry,null
2200,1.5,0,Petal Drop Earrings,,,null
2300,5.8,0,Personalized Custom Name Necklace  Daily Name Jewelry,,,null
200,0.76,0.42,pcs lot   x  mm Diy Earring Findings Hooks Clasps Jewelry Making Accessories,,,null
4800,1.7,0.35,pcs    pcs Transparent OPP Packaging Bags Halloween Candy Bag For Packing Books  Accessories  Stationery  And Other Items  With Dust Proof And Moisture Proof Card Protection,,,null
4000,1.12,0.2,Pair New Fashion Glossy Metallic Earrings For Women  Hoop   Geometric Oval Shape Earrings,,,null
5800,1.3,0,Tassel Drop Earrings,,,null
9700,1.6,0,pair of European and American fashion big circle earrings women s popular simple squished earrings earrings exaggerated posing accessories,,,null
,2,0,pc Golden Silver Sexy Y Shaped Chain Necklace Body Jewelry For Date  Party  Valentine s Day Gift,6,in Women Long Necklaces,null
1700,1.3,0,Hollow Out Round Drop Earrings,,,null
3900,1.36,0.2,pairs Minimalist Hoop Earrings,,,null
,4.48,0.2,pairs Rattan Earrings  Lightweight Geometric Shape Tassel Bohemian Earrings  Straw Wicker Weave Hoop Dangle Earrings For Women,5,in Women Earring Sets,null
2700,1.2,0,pc Simple   Fashionable Love Heart Pendant Necklace For Women  Daily Wear Accessory,,,null
200,2.49,0.14,Men s Stainless Steel Snake Head Chain Bracelet  Punk Style  Motorcycle Themed Everyday Jewelry Gift,,,null
2000,0.48,0.73,pc Ladies  Elegant Oversized Bowknot Hair Clip Ribbon Satin Bow Barrette With Spring Clasp For Fixing Hair Bun Casual,,,null
,1.96,0.11,pcs Mixed Golden Dirty Braid Set  Personalized Street Party Braided Hair Clips Hair Accessories Boho,6,in Boho Hair Clips,null
,1.8,0.05,PCS Bride White Lace Glove Short Lace Glove Floral Courtesy Lace Glove For Wedding Tea      s Party Costume Favors For Women,10,in Wedding Accessories,null
,5.4,0.08,pc Women s Fashionable Y K Handmade Crochet Sunflower   Daisy Bucket Hat Knitted Cap  Suitable For Daily Wear,9,in Women Bucket Hat,null
5800,1.28,0.2,Two Tone Chain Design Earrings,,,null
600,0.46,0.69,pair Luxurious Golden Multi Layer Rhinestone Design Earrings  Fashionable And Elegant  Versatile  High End Women s Everyday Jewelry,,,null
,2.88,0.1,Women Floral Pattern Fashionable Bandana For Daily Life Elegant Bandana Hair Band Head Band Ideal For Dressing Up Your Look,2,in Women Belts & Belts Accessories,null
2600,2.3,0,pc Y k Minimalist Alphabet Necklace  Stainless Steel Name Necklace     Letters A Z Charm Pendant Necklace  Initial Letter Necklace  Golden Tone Girls  Birthday Gift,,,null
30,9.42,0.23,pcs set Crystal Epoxy Resin Diy Jewelry Pendant Making Kit With Silicone Molds And Drilling Tool,,,null
2300,1.3,0,pc Minimalist All Match Bowknot Pendant Necklace,,,null
3500,1.5,0,Sterling Silver  MM Snake Chain Bracelets Factory Fashion Hot Top Quality Jewelry Charm Cute Women Lady Wedding,,,null
400,3,0.09,pc Lazy Style Long Curly Claw Ponytail Hairpiece  Ancient Hair Bun  Elastic Scrunchie  Natural Looking Voluminous Hair Extension,,,null
,1.75,0.03,pc Stainless Steel Fashionable Simple Alphabet Pendant Necklace For Various Outfits  It Could Be Couple s Necklace Or Friendship Necklace  Ideal Gift For Festival,1,in Women Chain Necklaces,null
3300,1.5,0,pcs Geometric Drop Earrings,,,null
7300,1.7,0,pair Colorful Oil Drip Four Petal Flower Shaped Dopamine Stud Earrings For Women  Simple   Sweet Daily Accessory  Perfect Gift For Vacation,,,null
400,2.1,0.09,DAZY  pcs Telephone Wire Design Hair Tie Casual,,,null
,5.4,0,Jewelry Display Stand Tabletop Organizer Tray For Earrings  Necklaces  And Rings  Iron Art Pendant Hanger And Wooden Tray For Hair Ties And Accessories  Gift For Valentine s Day,6,in Jewelry Towers,null
,1.52,0.2,pcs Women Gorgeous Golden Glitter Bridesmaid Hair Clips   Perfect Proposal Gift   Crease Free Favor Casual,10,in Casual Hair Clips,null
60,2.22,0.26,Men s Suspender Men Women Y Back Braces Adjustable Elastic Solid Color Suspender Belt,,,null
8500,2,0,pcs Set Bohemian Style Handmade Rice Beads   Beaded Elastic Bracelet Set For Women s Holiday Party,,,null
200,1.98,0.1,Pack Crushed Glass Stones Resin Fillings Crystal UV Epoxy Filler DIY Crafts Art Decorations Handmade Jewelry Making Mold Fillings,,,null
,1.4,0.5,pc Men s  cm Plaid Casual Handmade Necktie  Suitable For Business Dress Shirts  Party Outfits,,,null
10000,1,0,New Arrival  pcs set Simple   Fashionable Hollow Out Leaf Shaped Non piercing Ear Cuff,,,null
100,1.16,0.36,pc Unisex Fashion Tiger Eye Beaded Bracelet   Handmade Elastic Bangle   Suitable For Daily Wear And Parties   Birthday Gift,,,null
200,2.22,0.21,Fire Paint Wax Pellet Mold  When Darkness Loves Us Wax Seal Stamp Mold Silicone Mold Candle Molds Seal Stamp Wax Mold Seal Wax Bead Mold Craft Making Tools,,,null
200,2,0,pair Exaggerated Red  White    Blue Beaded Earrings For American Independence Day  Fashionable And Unique Rice Shaped Beaded Earrings,,,null
,1.97,0.06,pc Fashionable Women s Eyeglasses  Suitable For Daily Wear  No Makeup Look  Outdoor Travel   Photoshoot Accessory Cute Shades Beach Accessories,8,in Square Women Fashion Glasses,null
30,1.28,0.33,mm   mm Natural Stone Beads Multicolor Hematite Stone Round Loose Beads For Jewelry Making Diy Bracelets Necklace,,,null
,3,0,pc Portable Jewelry Organizer Storage Case  Minimalist Multi Grid Jewelry Storage Box For Travel  Gift For Valentine s Day,5,in Jewelry Boxes,null
300,11.6,0.14,pc Clear Acrylic   Compartments Eyeglass Storage Box Sunglasses Showcase Holder,,,null
300,2.3,0.08,Boho New Fashion Printed Silk Scarf For Women  Color Block Square Scarf  Versatile Accessory,,,null
4200,1.7,0,Pair Fashion Vintage Women Colorful Printed Earrings Gift,,,null
3900,2.88,0.2,pc Letter Detail Cubic Zirconia Round Charm Necklace,,,null
1900,4.24,0.2,Men Fashion Punk Rhinestone Cross Charm Necklace For Daily Decoration For A Stylish Look,,,null
,1.19,0.3,pcs Wardrobe Punch Free Hook  Yes  Belt  Scarf Storage Rotary Four Claw Hook  Household Multifunctional Clothing Hat Hook  Bag Tie Storage Hanger,5,in Belts Storage,null
8100,2.16,0.2,pairs Fashion Steel Earrings Golden Silver Color Round Hoop Earrings Fashion Jewelry Base Earring For Women Gift,,,null
900,4.99,0,MOTF PREMIUM FAUX PEARL DROP EARRINGS,,,null
30,0.67,0.61,pc Metal Rod Bracelet Helper Tool For Bracelet  Necklace  Watch Clasps And Zipper,,,null
400,2.4,0,European And American Fashion New Geometric Splice Pendant Statement Party Necklace,,,null
,1.76,0.02,Minimalist Rhinestone Inlaid Chunky Hoop Earrings For Women  Fashionable   Chic Geometric Circle Drop Earrings,8,in Women Hoop Earrings,null
200,0.65,0.62,pc Simple   Delicate Pendant Necklace With Single Shiny Rhinestone  Silver Plated Collarbone Chain For Women  Four Seasons  Daily Wear  Ins Style,,,null
200,2,0,pc Fashionable Rhinestone Bracelet  Women s Everyday Roman Style Bracelet  Unique Wedding Jewelry,,,null
500,2.6,0,pcs Laser Reflective Gift Bag  Various Sizes Reusable Seal Bag With Laser Rainbow Design  Suitable For Small Business Candy Bag And Self sealing Bag For Sample Display  Holiday Gift Bag,,,null
100,2,0,Cubic Zirconia Decor Cuff Ring,,,null
2100,1.9,0,Pink Flower Decor Chain Bracelet,,,null
500,1.9,0,pcs Set Simple  Fashionable  Vintage Gold Colored Beaded Bracelet Set For Women As Gift For Girlfriend  Mom,,,null
,1.52,0.2,pcs set Bead Decor Waist Chain,2,in Women Body Chains,null
100,1.96,0.11,mm Reiki Infused Lightworkers Healing Bracelet For Women Men Healing Crystal  Energy Bracelet  Labradorite Gemstone Bracelet   Reiki   Yoga Meditation Jewelry,,,null
10000,1.4,0.07,Hollow Out Round Decor Drop Earrings,,,null
100,0.76,0.42,pc Vintage Beaded Bracelet Natural Stone Lava Stone Tiger Eye Stone Beaded Bracelet,,,null
,2.8,0.2,pair Men Square Frame Fashion Glasses Travel Accessories Vintage,2,in Men Accessories,null
10000,2,0,pc Gold Plated Copper Chunky Alphabet Balloon Bubble Initial Letter Pendant Necklace for Women Men Personalized Fashion Jewelry,,,null
1900,1.14,0.29,pc Metallic Spring Hair Clip With Butterfly   Starfish   Geometric Detail Vintage Hair Accessory Boho,,,null
4500,2.8,0,pcs set of ultra light bamboo earrings suitable for parties and daily wear,,,null
4200,1.8,0.05,pcs Set Women Hair Claw Clip Combination Black White Brown Square Shell Shape  Fashionable And Versatile Perfect Hair Claw Clip  Suitable For Daily Life  Going Out  Outdoor Activities  Shower  Washing Face  Makeup  Music Festival  Party All Seasons Hair Clip,,,null
20,4.22,0.36,Double UV Sunscreen Sleeves Cool Compression Sleeves For Men And Women Golf Outdoors,,,null
300,1.15,0.57,pc      cm Outdoor Sun Protection Shawl For Women  Lightweight Silk Scarf For All Seasons Windproof Sandproof Classic Belt Pattern Colorful Orange Blue Red Square Scarf For Women Bandana Hair Band Head Band Ideal For Dressing Up Your Look,,,null
500,1.9,0,pc Popular Women s Fashionable Summer Seashell Pendant Necklace  Delicate   Cute  Ideal For Wedding  Engagement  Party   Other Occasions,,,null
5500,2.4,0,pcs Leaf Charm Beaded Bracelet,,,null
400,1.17,0.61,pc Solid Color Bath Headband    pcs Bath Wrist Band,,,null
4400,1.3,0,Round Drop Earrings,,,null
,9.5,0,pcs Soft Pottery Alphabet Beads  Ccb Shell  Lobster Clasps  Zinc Alloy Pendants DIY Jewelry Making Kit   For Making Necklaces  Bracelets  And Beaded Accessories,5,in Jewelry Making,null
,3.3,0,pc Fashionable New Design Geometric Circle Irregular Pendant Necklace  All Match Style  European And American Style,2,in Women Chain Necklaces,null
800,1.57,0.32,pcs  mm Classic Solid Color Glass Beads For Handmade Diy Beaded Jewelry  Suitable For Daily Wear  Men And Women  Can Be Used For Bracelet And Necklace Braiding,,,null
10000,1.28,0.2,pairs set Fashionable Simple Delicate Heart Shape Rhinestone Decor Women s Stud Earrings,,,null
400,12.3,0.12,Lightweight Business Casual Mini Rhinestone Decor Box Bag  Perfect Bride Purse For Wedding  Prom   Party Events Evening Bag Dinner Bag Glamorous Elegant Exquisite Quiet Luxury Rhinestone For Party Girl Woman Bride Perfect For Party Dinner Banquet For,,,null
2700,0.75,0.56,pc Women s Silver Tone Metallic Butterfly Waistband For Adjusting Size Of Pants Or Skirts Suitable For Daily Casual Wear And Christmas Gift Giving To Friends,,,null
200,1.7,0,Rhinestone Decor Hoop Earrings,,,null
3800,1.5,0,Cubic Zirconia Flower Stud Earrings,,,null
60,2.5,0,pcs What Would Jesus Do Wwjd Bracelets Pack Hwlf W W J D Bracelet He Would Love First Pink Elevated Faith Braclet Christian Friendship Cross Gifts God Woven Bangles Novelty Jewelry With Card,,,null
700,3,0,Pcs Silicone Cross Bracelet Bracelets With Cross Cross Bracelet Jewelry Gifts For Women Men,,,null
300,2.2,0.12,Adorable Keychain   Perfect Gift For The Special Woman In Your Life  Soft Plush Pendants For Bags And Pendants Car Accessaries Women Key Chain Charms Plush Keychain,,,null
7600,2.4,0,pcs Bohemian Style Glass Beaded   Seed Beaded Pink Stack Bracelet For Women,,,null
10000,2.5,0.04,Pair Reusable Sauna Sweat Lifting Belly Tummy Slimmer Waist LegArm Trainer Body Shaper Belt  Shape Your Body,,,null
,4,0.07,pcs Women Floral Prints Pattern Sweet Style Candy Color Scrunchie Cute,10,in Hair Ties,null
,1.68,0.2,Faux Pearl Bow Decor Elegant Bridal Garter Belt For Wedding Cute,6,in Bridal Fashion Anklets & Leg Chains,null
,3.5,0,pcs  mm Bangle Bracelets  Dubai Style  Gold  Wedding Jewelry  Gift,9,in Women Bracelet Sets,null
9500,1.68,0.2,pcs Cubic Zirconia Butterfly Decor Chain Linked Earring,,,null
6900,5.8,0.06,pcs Women s Large Size Solid Color Bowknot Hair Clip With Silk  Satin Texture  Fashionable   Retro Hair Accessory For Daily   Outfits    Colors,,,null
,2.1,0.09,pc White Letters Decorative For Beach Bag  Decorative Charm Insert Bag Accessories  Beach Bag Accessories  For Women s Rubber Beach Handbag EVA Bag  Personalized Handbag  D Letters  DIY Your Bag LetterA Z,10,in Bag Charms,null
,1.36,0.15,Pcs Strong Luminous Beads Glow In The Dark Acrylic Loose Spacer Beads Round Ball Beads Candy Color For Jewelry Marking DIY Necklace Bracelet,7,in Jewelry Making Beads,null
10,2.1,0.05,pc Hip Hop Trendy Couple s Luxurious Shell Stainless Steel   K Gold Plated Bracelet Women s Wedding Party Gift  Engagement  Good Luck   Handmade Simple Style Chain  Clover Single Side Chain  Versatile Lucky Grass Bracelet Jewelry,,,null
1000,1.71,0.1,Reiki Bracelets Women Healing Crystal Yoga Stone Bracelet Beads Opal Simplicity Jewelry Couple Gift Lady,,,null
100,2.4,0.08,pcs Hot Toys   Superhero Shoe Charms Cartoon DIY Clog Sandals Shoes Accessorie Decorations Boy Kids Gifts,,,null
4000,2.2,0.08,Street  pc Ladies Fashion Solid Color Breathable Half Mesh Sponge Baseball Cap  Suitable For Spring   Summer Daily Wear   Travel,,,null
,2.3,0.04,pc Women s European And American Style Fashionable Black Sunglasses  Outdoor Sports Eyewear With Large Frame Shades Beach Accessories,6,in Casual Women Fashion Glasses,null
100,3.3,0,Personalized Letter Necklace For Women Simple Choker Chain Custom Name Pendant Stianless Steel Girls Gift For Mama Mother  Gold,,,null
700,0.96,0.31,Textured Metal Drop Earrings,,,null
500,2.5,0,pc Fashion Stainless Steel Chain Cute Cartoon    Pendant Necklace For Women Girls Daily Jewelry Accessories Gifts,,,null
1400,3.4,0.08,pc Women Solid Color Vintage Distressed Half Mesh Washed Baseball Cap  Suitable For Breathable And Sun Protection Outfits In Spring And Summer,,,null
2000,2.2,0.08,pc Plastic Frame Square Sunglasses For Summer Beach  Uv Protection Elegant Shades Beach Accessories,,,null
,1.9,0.05,pcs Korean Style Sweet Pearl Earrings  Autumn Winter  Unpopular Design  Circle And Pearl Decor  Drop   Hoop Earrings For Women Elegant,2,in Wedding Fashion Jewelry,null
500,1.6,0,pc Sparkling Full Diamond Women Necklace Single Claw Diamond Water Drop Bridal Necklace Elegant Bridal Neck Jewelry For Wedding Prom Party,,,null
1900,1.8,0.05,pc Fashionable Oversized Y K European And American Style Personality Sunglasses For Summer Beach Shades Beach Accessories,,,null
,1.2,0,pcs Minimalist Geometric Open Ring For Women  Alloy Metal,7,in Women Ring Sets,null
6300,2.2,0,pcs Fashionable And Lovely Flower   Cubic Zirconia Ear Studs For Women s Pierced Ears,,,null
,1.28,0.02,pcs   pcs Jewelry Storage Bags  Small Transparent Sealing Bags For Collectibles  Trinkets  Amp  Earring Storage  Advanced Anti Tarnish Jewelry Storage Bag   Compact  Amp  Transparent  Perfect For Necklaces  Bracelets  Amp  Rings   Travel Friendly  Amp  Space Saving Display Stand Self Sealing Jewelry Storage Bags   PVC Ziplock Bags For Rings  Earrings  Amp  Small Accessories Portable Transparent PVC Jewelry Bag   Compact  Amp  Convenient Jewelry Storage,1,in Hanging Jewelry Organizers,null
6300,2.1,0,pcs set Fashion Glass Dolphin Charm Beaded Bracelet For Women For Decoration Party,,,null
