selling_proposition,price,discount,goods_title,rank_title,rank_sub,color_count
600,10.4,0.07,Tween Boy Letter & Tropical Print Beach Swimsuit,,,
500,8.4,0.13,SHEIN Young Girl Spring/Summer Knit Solid Color Spaghetti Strap Jumpsuit For Holiday & Leisure,,,7
500,4.65,0.17,SHEIN Young Girls' Cartoon & Striped Colorblock Ruffle Armhole Dress,,,4
800,15.7,0.13,SHEIN Tween Girl Casual Sports Style Simple Color Block Multiple Shorts Sets,,,6
100,15.4,0.07,SHEIN Tween Girl Star Print Flare Leg Jeans,,,4
700,8.5,0.15,Young Girl Solid Color Top & Strawberry Print Bottom Swimwear Set,9,in Young Girls Beachwear,
6300,9.8,0.13,SHEIN Tween Girls' Casual Geometric Print Halter Neck Sleeveless Top And Skirt Set,,,
2600,1.54,0.5,1set Children's Number Counting Finger Math Learning Board Toy For Early Education And Intelligence Development,1,in Kids Learning & Education Toys,
1700,12,0.06,Teen Girl Flap Pocket Denim Skirt,3,in Teen Girls Denim Skirts,6
3800,9.3,0.11,Teen Girl Summer Casual Sunglasses & Coconut Tree/Letter Printed Short Sleeve Shorts Set,,,
300,5.1,0.12,"Tween Girl White Shirt, Summer Tops, Summer, Casual Simple English Printed Short Sleeve Round Neck T-Shirt, Suitable For Spring And Summer",,,
1800,3.72,0.15,"Young Girl Tie-Dye Slogan T-Shirt, Casual Minimalist Letter Print Round Neck Short Sleeve T-Shirt, Summer",,,
600,12.2,0.13,SHEIN Tween Girls' Summer Vacation Style Cold Shoulder Multi-Layered Lace Top And Floral Printed Skirt Two-Piece,,,
1300,12,0.07,Young Girl Denim-Like Floral Print Shorts 3pcs/Pack,,,
500,1.5,0.12,3pcs Bohemian Beach Style Love Heart & Rice Bead Design Elastic Anklet For Kids,1,in Kids Ankle Chain,
700,8.3,0.14,SHEIN Tween Girl Tie Dye Twist Hem Tank Top & Bow Front Shorts,,,
4700,9.1,0.07,"SHEIN 3pcs/Set Tween Girls' Flower Printed Swimsuit With Casual & Party Outfits For Beach Vacation, Spring And Summer, Bathing Suit Vacay Vibe",,,4
1400,12.1,0.15,SHEIN Tween Girls' Casual Striped Short Sleeve Shirt And Skirt Set In Multi-Colors,,,4
200,6,0.06,SHEIN Tween Girl Stretchy Knit Geometric Patterned Bodycon Slip Dress With Non-Adjustable Shoulder Straps For Vacation And Leisure,,,
1600,5.2,0.15,SHEIN Tween Girls' Streetwear Athletic Knit Colorblock Raglan Sleeve Top,,,
800,3.84,0.6,SHEIN Young Girl Knitted Plain Color Alphabet & Car Pattern Loose Round Neck Casual T-Shirt With Knitted Checkered Shorts Set,,,
1500,10.3,0.06,SHEIN Teen Girls Ripped Raw Trim Denim Shorts,,,6
900,4.2,0.07,Tween Girl 1pc White Knitted Ribbed Tank Top Casual Simple Style,,,
300,11.74,0.16,SHEIN Teen Boys' Streetwear Ink-Splash Digital Print T-Shirt And Solid Color Drawstring Waist Pocket Shorts Set,,,
1600,6.84,0.6,Tween Girl Casual Street Style Cool Pink Washed Ripped Loose Fit Cropped Straight Leg Jeans,,,4
1800,4.88,0.2,SHEIN Tween Girl Funny Boba Milk Tea & Cat Pattern Round Neck Short Sleeve T-Shirt,,,6
700,4.3,0.5,SHEIN Tween Girl Casual Round Neck Drop Shoulder T-Shirt With Bear And Letter Pattern,,,
1000,8.82,0.1,Young Girl Letter Print Round Neck Short Sleeve T-Shirt And Long Pants Sports Set,,,
600,5.7,0.4,2pcs Young Boy Casual Patchwork Letter Print Comfortable Crewneck Short Sleeve T-Shirt And Shorts Set For Summer,,,5
1300,10.6,0.15,Tween Girl Striped Print Shirt & Shorts & Cami Top,,,5
3500,7.2,0.14,SHEIN Tween Girl Letter Graphic Tie Dye Drop Shoulder Tee,,,
1500,5.1,0.12,SHEIN Teen Girls Solid Ruched Cami Top & Scrunchie,,,5
1500,6.5,0.16,SHEIN Young Girls' Denim-Look Fabric Cute Unicorn Printed Cropped Jacket,,,
1300,6.4,0.14,Young Girl Solid Color Rib-Knit Ruffle Armhole T-Shirt And Tie-Waist Shorts Set For Summer,,,
,4.12,0.14,"Tween Girl Casual Simple Short Sleeve T-Shirt With Letter Pattern, Suitable For Summer",,,
,11.4,0.14,Tween Girl 6pcs Sports Multicolored Basic Crop Tops With Strap,,,
300,10,0.13,"Tween Girl Casual Solid Color Ribbed Round Neck Top, Summer",,,7
,12.54,0.18,Tween Boy Casual Basketball Themed Print Short Sleeve Top And Number Print Shorts Knitted Two-Piece Set,,,6
900,3.55,0.15,SHEIN Tween Girl Spring/Summer Casual High Waist Solid Color Ribbed Knit Cycling Shorts Leggings,1,in Tween Girls Leggings,8
400,4.8,0.16,"SHEIN Young Girl Casual And Vacation Butterfly Element Printed Jumpsuit With One-Shoulder Strap, Summer",,,6
1000,5,0.09,"Young Girl Summer New Arrival Fashionable Dress With Ruffle Cuffs And Pocket Design, Featuring Floral Print And Striped Patchwork Details",,,6
2500,11.88,0.08,Tween Girls' Denim Mini Skirt,,,4
,9.9,0.07,"Tween Girl Two Piece Set Of Cute Bubble Pleated Cherry Print Pajamas, Comfortable Fabric And Lapel Design, Perfect For Pajama Parties And Relaxing Nights",,,
1700,12.9,0.15,Tween Boys' Loose Fit Casual Round Neck Pattern Short Sleeve T-Shirt & Shorts Set,7,in Tween Boys Clothing,4
700,10.2,0.06,Tween Girl Two Tone Wrap Cross Bikini Swimsuit & Butterfly Print Beach Skirt,,,4
1500,16.2,0.14,SHEIN Tween Girl Cool Street Spring And Summer Knit Pure Color Round Neck Sleeveless Vest With Straight Shorts Three-Piece Set,,,
700,20.58,0.16,SHEIN Tween Boy 5pcs Loose Fit Casual Round Neck Seagull Print Short Sleeve T-Shirts,4,in Tween Boys T-Shirts,4
1800,1.31,0.18,"1pc Blue Baby Bathing Toy For Boys And Girls, Turtle Shaped, Suitable For Children's Bathing, Swimming And Water Playing",8,in Kids Stuffed Animals & Toy Figures,
,11.5,0.14,Tween Boys' Holiday Style Loose Fit Round Neck Short Sleeve Knit Top And Woven Shorts Set With All-Over Letter Print,,,4
2400,9.6,0.15,"SHEIN Young Girl Rainbow Cherry Blossom Colorblock Trimmed Cami Jumpsuit, Summer, 2pcs",,,8
,19.31,0.08,SHEIN 3pcs/Set Tween Girl'S Daily Casual Knit Round Neck Short-Sleeved T-Shirt With Slogan Print And Shorts And Long Pants For Home,,,
,5.5,0.11,SHEIN Tween Girl Solid Color Round Neck Long Sleeve T-Shirt,,,5
80,3.4,0.08,"1pc Girl's Cute One Shoulder Bag With 24 Letters Chest Pack Hanging Crossbody Bag, Ideal For Daily Use, Outdoor, Travel, Hiking, Easy To Carry, Ideal Gifts",10,in Kids Waist Bags,5
600,11.59,0.18,SHEIN Tween Boy Basketball Pattern Tee & Letter Patched Detail Shorts,,,11
500,11.2,0.13,"Girls' Cute And Stylish Sparkly Slip-On Flat Sandals, Comfortable And Lightweight Slippers, Suitable For Parties, Outdoor Activities And Beach. Random Pattern Outsole Design.",,,4
700,16.2,0.19,Children's Simple But Comfortable Waterproof Sports Shoes,3,in Kids Sneakers,
2600,6.5,0.16,SHEIN Tween Girl Loose Casual Turn-Down Collar Ruffle Hem Short Sleeve Shirt With Cute Pattern,9,in Tween Girls Blouses,
,3.25,0.54,SHEIN Tween Boy Letter Graphic Colorblock Tee,,,4
1800,10,0.13,SHEIN Tween Girls' Green/Yellow/Blue/Purple 4-Color Solid Color Vest Set,,,7
1000,11.59,0.18,SHEIN Tween Boy Slogan & Palm Tree Print Tee & Shorts,,,4
900,12.8,0.15,SHEIN Tween Girl Drop Shoulder Blouse & Cami Top & Shorts,,,4
1400,11.3,0.14,"Tween Girl 2pcs/Set Iridescent Coated Fabric Sleeveless Crop Top And Shorts Set, Summer",,,
300,10.3,0.07,SHEIN Tween Girl Block Striped Halter Neck Dress,,,
100,10.4,0.12,"SHEIN Teen Girl Summer Trendy Casual Design Print T-Shirt With Pleated Skirt Set, Perfect For Daily Wear And Sister Gatherings",,,4
7000,12.9,0.15,"SHEIN Tween Girls' Spring Summer Boho 2 Pieces Solid Short Sleeve T Shirt & White Distressed Ripped Raw Hem Denim Jeans Shorts Set,Summer Girls Clothes Outfits",,,
600,8.4,0.13,SHEIN Tween Girl Slogan Graphic Drop Shoulder Tee & Biker Shorts,,,5
1000,5.6,0.13,"SHEIN Tween Boy 1pc Funny And Interesting Printed Basic Round Neck Short Sleeve T-Shirt, Youth",,,5
100,7.6,0.14,"Tween Girl Tie-Dye Beach Vacation Vibes, Casual Simple Short Sleeve Shirt And Shorts Set Ideal For Summer",,,
1200,2.85,0.34,Young Girl Colorful Design Slogan & Cartoon Unicorn Print Short Sleeve T-Shirt,,,4
400,2.6,0.07,3pcs Cute Colorful Flower & Heart Hairbands For Girls Of Different Ages,,,
100,4.51,0.16,"TEENAGE MUTANT NINJA TURTLES X SHEIN Young Boy Casual Cartoon Letter Print Round Neck Short Sleeve T-Shirt, Summer",,,
1600,8.5,0.14,SHEIN Tween Girl Tropical Print Cami Top & Shorts & Tee,,,
2600,3.27,0.09,"SHEIN Teen Girl Solid Color Ribbed Camisole, Suitable For Summer",,,11
2500,8.93,0.17,Tween Girl Solid Color Knitted Short Sleeve Round Neck Top And Loose Shorts Casual Two-Piece Outfit,,,6
400,7.5,0.11,Teen Girl Casual Minimalist Flower Pattern Knitted Oversized T-Shirt Suitable For Summer,3,in Teen Girls Tops,
2200,10.7,0.13,SHEIN Teen Girl Off-Shoulder Doll Collar High-Waisted Floral Orange Tone Loose Shorts Set For Leisure And Vacation,,,
700,6.05,0.16,Young Girl Beautiful Intelligent Pattern Short Sleeve T-Shirt And Floral Printed Shorts Outfits,,,
1000,11.3,0.07,Tween Girl Tropical Print Ruffle Hem Bikini Swimsuit With Beach Skirt,,,
30,1.9,0.1,"4pcs/set Girls' Lovely Mermaid Pendant Beaded Bracelet & Necklace Set For Daily Wear, All Seasons, Random Color",1,in Kids Jewelry Sets,
400,2.91,0.12,"266pcs Girls Multicolored Hair Ties Set, Beautiful Hair Accessories Bowknot Hairbands, Elastic Rubber Bands Collection For Ponytail Hairstyling",6,in Kids Hair Accessories,
1900,10.99,0.15,SHEIN Tween Boys' Casual Plant Patterned Short Sleeve Button-Up Shirt & Solid Color Shorts Woven 2pcs/Set,,,
,6.7,0.07,Young Girls' 2pcs/Set Double-Layered Ruffle Edge Camisole Top & Wide Leg Pants Summer Outfits,,,4
1800,4.24,0.23,"Young Girl Summer Holiday Beach Playtime Purple Small Crinkled Blossom Pattern Sleeveless Loose Fit Mid-Length A-Line Strap Dress, Summer",,,
3600,6.7,0.14,Young Boy Night-Glow Shark Print Knit Short Sleeve Tight-Fit Two-Piece Pajama Set,,,
2200,16.7,0.16,10pcs Young Girl Underwear Set Printed With Letter & Unicorn Pattern,2,in Young Girls Underwear,
700,3.8,0.1,Young Boy Cartoon & Letter Graphic Tee For Summer,,,
,7.9,0.13,SHEIN Tween Girl Casual Simple Cartoon Letter Print Short Sleeve T-Shirt And Shorts 2pcs Set Suitable For Summer,,,
2200,7.9,0.08,"Young Boy Coconut Tree Printed Short Sleeve T-Shirt And Solid Color Elastic Waist Shorts, Summer",,,
400,10.6,0.14,SHEIN Tween Girl Knit Solid Color Off Shoulder Top With Pleated Casual Skirt,,,
,7.1,0.14,Young Girl Color Block Elegant College Style Simple Polo Collar Regular Sleeve Dress For Summer,,,
,9.22,0.17,SHEIN Tween Boy Letter Patched Detail Hooded Tank Top & Drawstring Waist Shorts,,,9
900,2.8,0.1,"28pcs Girl's Pink Flower, Fruit, Rainbow & Princess Design Hair Clip, Barrette & Headband Set",,,8
2000,6.05,0.32,SHEIN Tween Girl Chinese Dragon Graphic Flare Leg Pants,,,
800,7.6,0.14,SHEIN Young Girls' Cool Black Street Style Cute Swag Camo Leggings And Sports Suit,,,4
900,11.3,0.07,Tween Girl Tropical Print Ruffle Trim Bikini Swimsuit With Cover Up Pants,,,
,15.3,0.07,SHEIN Tween Girl Cute Sweet Short Sleeve And Long Pants Knit Flame Retardant Pajamas Set,,,
4800,10.1,0.14,"SHEIN Genkimix Kids BOY Casual Sporty College Street Style Mesh Patchwork Shorts, 4pcs/Set Gray+Navy Blue+Sky Blue+Black Sports Shorts Suitable For Everyday Wear, Travel, Exercise, Spring And Summer Seasons",,,
1000,5.7,0.14,SHEIN Young Girl's American Vintage Style Love Heart Printed Tie Dyed Knitted Short Sleeve T-Shirt,,,4
,8.93,0.2,SHEIN Young Boy Color-Block Trim Short Sleeve T-Shirt And Shorts Set For Summer,,,
,6,0.08,"2pcs/Set Young Girls' 4th Of July Outfits Casual Star & Heart Print Cami Top And Shorts Set For Festivals, Beach & Holiday In Spring/Summer",,,
500,9,0.14,Tween Girl Set Of 3 Knitting Solid Color Sleeveless Tops For Daily Wear & Leisure In Spring And Summer,6,in Tween Girls Tank Tops & Camis,6
2500,14.17,0.69,"1set Children's Girls Simulated Dishwashing Sink With Running Water Loop, Kitchen Sink For Pretend Play, Suitable For Daily Use",3,in Kids Toy Kitchen Products,
5300,6.3,0.14,Young Girl Letter Graphic Drop Shoulder Sweatshirt,2,in Young Girls Sweatshirts,
1600,5.35,0.16,Tween Girl Pom-Pom Decor Cover Up,,,
300,8.5,0.08,Young Girl Summer Cool Striped Camisole Top And Long Pants Set,,,9
1300,8.97,0.25,"SHEIN Young Girl Casual Street Style Sweatshirt And Waistband Denim Effect Pants With Belt, 2pcs/Set",,,
2000,6.2,0.13,Teen Boy Casual Fashionable Summer Coconut Tree Print T-Shirt,9,in Teen Boys T-Shirts,
2200,7.7,0.13,Girls' (Big) Casual T-Shirt And Tight Shorts 2pcs/Set,,,
1400,11.8,0.07,Tween Girl Fashionable Casual Color Block Denim Shorts,,,
1000,15.7,0.13,SHEIN Teen Girls' Knit Ribbed Pleated T-Shirt And Bell Bottom Pants Casual Two-Piece Outfit,,,9
100,3,0.14,SHEIN Tween Girl Slim Elegant Solid Color Sleeveless Round Neck Crop Top,,,7
600,25.99,0.3,"23 Pcs 18 inch Doll Clothes and Accessories - Suitcase Luggage , Pillow, Sunglasses, Camera, Passport, Mobile Phone , Computer Doll Travel Gear Play Set Fit 18 inch Girl Doll (No Doll)",7,in Doll Accessories,
3600,8,0.07,"Tween Girls' Detachable Padded Asymmetrical Neck Separates Swimsuit Set, Safe",,,8
1000,10.9,0.13,Kids Comfortable Lightweight Flat Sandals With Flower Detailing For Girls Fashionable Trendy Shoes,10,in Kids Flat Sandals,
1000,3.25,0.24,Young Boy Casual Slogan Print Round Neck Short Sleeve T-Shirt,,,
500,10.6,0.15,SHEIN Young Boy Casual Colorblock Long Sleeve Jacket With Spider Printed Pattern,5,in Young Boys Jackets,9
1500,7.7,0.07,"Young Girl 2pcs Cute Printed Outfit Set, Summer",,,
,21.9,0.08,Tween Boy Ripped Jeans,,,
800,8.9,0.07,SHEIN Tween Girl Ruffle Trim Wrap Belted Dress,,,9
100,10.15,0.25,SHEIN Young Girl 3pcs Striped Ruffle Trim Tee,,,9
1200,7.87,0.16,Young Girl Cartoon Graphic Hooded Cover Up,2,in Young Girls Cover Ups,
,10.7,0.14,"Tween Girl Casual Knitted Round Neck Short-Sleeved T-Shirt With Letter Print And Color Block Shorts Set, Daily Wear",,,6
,6.3,0.13,SHEIN Tween Girl Tie Dye Cami Top & Shorts,,,6
3100,11.9,0.13,SHEIN Teen Boys' Casual Positive Letter Print T-Shirt And Color Block Shorts Set,,,
300,5.6,0.13,SHEIN Tween Girl Summer Casual Slogan Printed Short Sleeve T-Shirt,,,5
500,10,0.07,SHEIN Tween Girl Allover Print Belted Maxi Cami Dress,,,
100,5.8,0.58,SHEIN 3pcs Teen Girl Black/Pink/White Cropped T-Shirt With Ruched & Frilled Design,,,
,15.9,0.14,SHEIN Tween Girl 2pcs/Set Sporty Knitted Solid Color Stand Collar Long Sleeve Top And Solid Color Pants Outfits,,,
300,3.7,0.16,Spider & Young Boy Casual Spider Pattern Short Sleeve Round Neck T-Shirt Suit For Summer,4,in Young Boys T-Shirts,
800,3.48,0.19,SHEIN Young Girl Knitted Floral Print Cami Dress,,,
1200,8.3,0.13,"Fashion Children Sandals Elegant Girls"" Princess Shoes Spring And Summer Heart Jelly Shoes Vacation Flat Beach Shoes",,,
200,6.3,0.09,2pcs Young Girl Casual 3D Deer Printed Short Sleeve T-Shirt And Shorts Set For Summer,,,
2200,9.2,0.12,"Tween Girls' Casual Simple OK Bear Printed Short Sleeve T-Shirt And Shorts Set, Suitable For Summer",,,
3800,3.5,0.24,SHEIN Young Girl Cute Short Sleeve T-Shirt With Graphic Text,,,
10000,10.6,0.08,Young Girls' Cartoon Printed Short Sleeve T-Shirt And Denim Shorts Set For Summer,,,
600,6.3,0.07,"Tween Girls' Casual Letter Print Round Neck Short-Sleeve T-Shirt, Summer",10,in Tween Girls T-Shirts,5
1800,12.2,0.13,"SHEIN Teen Girl Casual Fit Pink Letter Printed T-Shirt & Cycling Shorts, Sports Streetwear Casual 2pcs/Set",,,
1700,6.1,0.09,Girls' Solid Color Bell Bottom Pants Sleeveless Vest Ins Style Outfit,,,
400,6.9,0.08,"Young Girl 2pcs/Set Casual Style Lighweight Knitted T-Shirt And Flared Pants, Featuring 3D Printed Giraffe Pattern, Spring Summer",,,
100,8.5,0.12,SHEIN Tween Girl Letter Graphic Thermal Lined Sweatshirt,,,
1600,7.51,0.17,"SHEIN Palm Tree And Sunset Vintage Western Scenery Pattern, 2pcs/Set Tween Girls Casual Summer Short Sleeve T-Shirt And Shorts Outfits",,,
1500,7.5,0.05,"Teen Girl Beach Letter Print Fashionable Casual And Comfortable Casual Top, Summer",,,
1300,5.8,0.15,Young Girl Summer Cool Cami Top & Floral Printed Shorts 2pcs Holiday Outfits,,,
,3.8,0.14,Young Girl Casual Colorful Letter And Plaid Pattern Printed Short Sleeve T-Shirt,,,
,8.7,0.13,Teen Girls' Casual Colorful Bowknot & Heart-Shaped Pattern Short Sleeve T-Shirt Plus Legging Set,,,
,1.86,0.11,"2pcs Children's Colorful American Flag Pendant Beaded Necklace And Bracelet Set, Suitable For Boys And Girls Daily Wear, Festival Party",,,
500,6.3,0.14,SHEIN Young Girl Striped Asymmetrical Neck Top & Paperbag Waist Belted Shorts,,,
200,10.4,0.06,Tween Girl New Fashion Printed Bikini Set With Lace Trim,1,in Tween Girls Tankinis,
1100,11.4,0.13,SHEIN Tween Girl Knit Face Print Loose Fit Casual Sweatshirt With Round Neck,,,4
,4.86,0.24,SHEIN Young Girls' (Little) Fashionable One Shoulder Ruffle Overlay Jumpsuit For Summer,,,10
50,13.6,0.13,Teen Girl Loose Crew Neck Sweater,,,
100,12.6,0.06,Teen Girl 8 Pieces Underwear Comfortable Panties Briefs,6,in Teen Girls Underwear,
3400,11.6,0.15,SHEIN Young Girl Summer Cartoon Girl Printed Round Neck Short Sleeve T-Shirt And Ripped Shorts Casual Twopiece Set,,,
500,13.5,0.15,SHEIN Young Boy Contrast Trim Polo Shirt & Knot Waist Shorts,,,4
,12.4,0.14,"Summer 2pcs Young Girl Round Neck Short Sleeve Strawberry & Letter Print T-Shirt With Embroidery Design, Elastic Waistband Denim Shorts With Pockets And Belt",,,8
1500,12.7,0.13,Teen Girl Holiday Leisure Solid Color Sleeveless Ruffled Hem Shorts Two-Piece Set,,,
,10.2,0.06,SHEIN Teen Girl Lemon Print Bikini Swimsuit With Beach Skirt,,,
3800,2.6,0.1,2pcs Girls Bow Decor Hair Clip For Daily Life,,,5
,9.2,0.14,Tween Girls' Flower Printed Short Sleeve T-Shirt And Skirt Set,,,4
400,12,0.14,SHEIN Streecool Kids Young Girl New Casual Fashionable Vintage Sense Distressed Straight Leg Jeans With Washed Effect,6,in Young Girls Jeans,4
2200,11.2,0.13,SHEIN Tween Girl Button Detail Knot Front Wide Leg Pants,10,in Tween Girls Pants,
2200,10.79,0.15,"SHEIN Tween Girls' Knit Letter Printed T-Shirt + Woven Utility Shorts Sports Casual Two Piece Set, Summer",,,9
1000,1.5,0.32,"2pcs Girls' Cute Neutral Tone Flower Hair Claw, Suitable For Daily Use",,,
,9.9,0.12,"SHEIN Teen Girl Knitted Overlap Waistband, Mesh Patchwork, Multi-Pocket Base Layer Leggings Two Piece Set",2,in Teen Girls Leggings,
700,9.1,0.07,SHEIN Tween Girl Solid Pleated Skirt,3,in Tween Girls Skirts,
800,5.85,0.43,SHEIN Tween Girl Letter Graphic Tank Top & Striped Flare Leg Pants,,,
1000,5.18,0.44,SHEIN Teen Girls Star Print Flare Leg Pants,3,in Teen Girls Pants,
900,9.5,0.17,Tween Girl Solid Color Simple Daily Sleeveless Tank Top,,,7
3200,14.9,0.14,SHEIN Tween Girl Casual Comfortable Simple Car & Letter Print Top And Denim Shorts Set,,,
80,8.9,0.15,SHEIN Young Boy Car & Slogan Graphic Tee & Shorts,,,
800,1.9,0.05,12pcs  Girls Star Design Cute Snap Clip For Hair Decoration,,,4
,5.19,0.24,2024 New Summer Trendy Tween Boys' Printed English Slogan Short Sleeve T-Shirt With Round Neck (1pc),,,
2400,6.73,0.15,SHEIN Young Girl Bow Front Tulip Hem Skort,7,in Young Girls Shorts,6
600,10.2,0.06,"SHEIN Tween Girl 1set Wrap Bikini Swimsuit With 1pc Tropical Print Cover Up Skirt, Bathing Suit",,,6
700,4.1,0.13,SHEIN Tween Girl Casual Simple Spider Logo Print Short Sleeve T-Shirt With Round Neckline Suitable For Summer Outfits,,,4
300,8.93,0.12,SHEIN Young Girl's Lovely Water Washed Comfortable Casual Soft Denim Skirt Shorts,5,in Young Girls Denim Shorts,
700,18.8,0.15,SHEIN Tween Girl Letter Patched Striped Trim Baseball Collar Jacket & Tank Top & Pleated Skirt,,,
2300,6.3,0.07,Tween Boy 2024 New Summer Short Sleeve T-Shirt With Letter Print And Round Neck,2,in Tween Boys Tops,4
,3.8,0.14,Simple Style Casual Short Sleeve T-Shirt With Letter Slogan Print For Toddler Girls,,,
200,3.57,0.39,SHEIN Tween Boy Cartoon Fish & Letter Print Basic Round Collar Short Sleeve T-Shirt For Summer,,,
10,7.8,0.08,"Young Girl 2pcs/Set Fashionable Sunflower/Flower & Letter Print Knitted Short Sleeve T-Shirt And Slim Faux Ripped Jeans With Sunflower Belt, Summer Casual Outfit",,,
3000,10.2,0.07,7pcs/Set Solid Color Underwear Set For Tween Girls,2,in Tween Girls Underwear,
300,8.8,0.07,Tween Boys Landscape Pattern Printed Short Sleeve T-Shirt And Drawstring Shorts Two-Piece Set,,,
2700,6.2,0.1,SHEIN Teen Girl Solid Color Ruched Knit Round Neck Casual Short Sleeve T-Shirt With Hair Band,,,4
100,1.9,0.1,1PC 10 Color Hair Chalk For Girls Makeup Kit Hair Chalk Comb Temporary Washable Hair Color Dye For Kids Birthday Halloween Christmas Gifts Toys For Girls Kids Age 5 6 7 8 9 10 11 12 Year Old,,,
1400,12.1,0.15,SHEIN Young Girl Gingham Print Puff Sleeve Top & Ripped Denim Shorts Set,,,7
200,10.5,0.06,Tween Girls' Letter Printed Short Sleeve T-Shirt And Paper Bag Waist Belted Shorts Casual Outfit,,,
10,9.4,0.13,SHEIN Tween Boy Letter Patched Detail Hooded Tank Top & Drawstring Waist Shorts,,,9
80,8.9,0.14,SHEIN Young Girl Knitted Solid Color Sleeveless Top With Woven Floral Loose Casual Vacation Skirt Set,,,
5200,8.4,0.14,SHEIN Young Girl Batwing Sleeve Tee & Paper Bag Waist Pants,,,6
,8.9,0.16,SHEIN Young Boy Blue & White Tropical Printed Vacation-style Standard Collar Short Sleeve Two-piece Set For Street & Casual Wear In Summer,,,6
500,3.05,0.5,SHEIN Tween Girl Fun Boba Cat Pattern Round Neck Short Sleeve T-Shirt,,,6
600,3.93,0.36,Tween Girl 1pc Heart Print Tee Without Shorts,,,6
900,7.2,0.12,"SHEIN Teen Girl Elegant Square Neck Slim Solid Color Sleeveless Tank Top, Summer",,,9
,9.83,0.16,Tween Girl 3pack Butterfly Print Criss Cross Bikini Swimsuit With Pants,,,
3300,16.4,0.12,SHEIN Teen Girl Knitted Ribbed Pleated T-Shirt And Accordion Pocket Casual Pants Two-Piece Set,,,9
3800,15.7,0.14,"SHEIN Young Girl's Summer Cat & Leopard Print Cute Round Neck T-Shirt, Shorts & Casual Three-Piece Set",,,9
4400,10.2,0.06,"SHEIN Tween Girl High Elasticity Solid Casual Denim Jeans Shorts, Tween Girl Summer Boho Clothes Outfits",,,
900,3.74,0.47,"SHEIN Tween Girls' Knitted Bodysuit, Solid Color, Street Style, Military Green, Short Sleeve, Spring/Summer",,,19
1300,5.3,0.09,Young Girls' Casual Watermelon Print Short Cami Top And Shorts Set For Summer Playtime,,,
3900,4.8,0.14,SHEIN Tween Girl Knitted Spliced Weaving Contrasting Color Bow Knot Camisole Top For Daily Casual Wear,,,
200,7.17,0.38,SHEIN Young Girl Printed Cat & Sequin Decorated Outfit Set For Fall And Winter,,,
400,7.23,0.08,"Young Boys' Letter Printed Short Sleeve T-Shirt And Shorts Set, Summer Casual Outfits",,,
,12.5,0.06,Teen Girls Allover Print Bikini Swimsuit With Flounce Sleeve Cover Up Set Matching Set,,,4
,3.74,0.27,SHEIN Young Girl Letter Graphic Cami Dress,,,4
4400,9.9,0.07,Tween Girls' Spliced Leopard Print Bikini Set,,,4
500,6.7,0.07,SHEIN Tween Girl Wide Waistband Phone Pocket Detail Active Skirt,10,in Tween Girls Activewear,
,14.7,0.07,SHEIN Tween Girl Bear Print Tee & Plaid Pants,,,
,11.8,0.07,Tween Girls Solid Ruffle Trim One-Piece Swimsuit And Coconut Resort Print Skirt Two-Piece Set,,,4
1900,6.3,0.1,"Teen Girl Coconut Tree Printed Letter Round Neck Short Sleeve T-Shirt, Summer",,,
,10.6,0.07,"SHEIN Streecool Kids Tween Girl Strap Overall Jumpsuit In Street Style, Black",,,
600,14.45,0.16,SHEIN Tween Girl Letter Patched Raglan Sleeve Pullover & Shorts,,,4
3000,19,0.06,SHEIN Streecool Kids Teen Girls Solid Color Simple Everyday Flared Jeans,9,in Teen Girls Jeans,
5300,7.6,0.14,SHEIN Tween Girl Off Shoulder Top & Tropical Print Paperbag Waist Shorts,,,6
7500,9.5,0.12,"Tween Girl Beach Heart Print Halterneck One Piece Swimsuit With Cover-Up Shorts And Top 2pcs Set, Summer",,,
100,8.4,0.13,Young Girl Casual And Simple Heart Printed Short Sleeve And Long Pants Two-Piece Set Is Suitable For Spring And Autumn,,,4
80,4.35,0.21,SHEIN Tween Girls' Casual And Sweet Round Neck Pearl Embellished Twisted Short Sleeve T-Shirt,,,4
5200,16.3,0.15,SHEIN Tween Girl Casual Spring/Summer Woven Solid Color Off Shoulder Top And Loose Pants Set,,,4
,15.6,0.14,SHEIN Tween Girls' Everyday Casual Spring/Summer Woven Multicolored Stripe Cami & Pants Set,,,
500,3.96,0.16,"Young Girl Retro 90s Style, Casual Short Sleeve T-Shirt With Scenic Print, Perfect For Summer",,,
600,5.9,0.06,"Tween Girl 1pc Casual Printed Short Sleeve T-Shirt, Summer, Student, Youth Clothing",,,
900,12.9,0.15,SHEIN Tween Girl Letter Graphic Tee & Shorts & Tank Top,,,
,15,0.07,SHEIN Genkimix Kids Tween Girls' Casual Wide Leg Wash Distressed Denim Jeans,,,
3300,15.9,0.15,SHEIN Genkimix Kids Young Girl Solid Color Simple Versatile Shorts Set Of Four,9,in Young Girls Bottoms,7
3800,2.2,0.08,"4pcs Necklace Set With Butterfly, Daisy, Bohemian Style And Beach Vacation Element",,,
4400,10.83,0.19,"SHEIN Tween Girl Everyday Casual Rainbow Short Sleeved Knit Top And Knit Long Flared Pants Set, Spring/Summer",,,
900,8.3,0.14,SHEIN Tween Girl Woven Solid Color Ruffle Strap Adjustable Short Vest Top And Matching Shorts Set With Ruffled Hem,,,5
1300,7.9,0.14,SHEIN Young Girls' Sporty And Cool Knit Solid Color High Waist Shorts 3pcs/Set For Spring/Summer,,,4
3900,6,0.08,"Tween Girl Casual Round Neck Short Sleeve T-Shirt With Letter Print, Summer",,,5
200,7.3,0.13,"SHEIN Slogan, Young Girls Casual Simple Short Sleeve T-Shirt And Shorts Set For Summer",,,
400,5.4,0.07,Tween Boy Casual Commuting Fashion In Spring And Summer Paisley Scarf Print Drawstring Waist Shorts,,,
4400,6.9,0.15,2pcs Young Boy Cool Fluorescent Galaxy Printed Round Neck T-Shirt And Tight Fitting Long Pants Snug Fit Set,,,
1900,11.59,0.18,Tween Boy Casual Lettering Printed Round Neck Pullover T-Shirt Side Seam Pockets Solid Color Shorts Knitted Two-Piece Set,,,
5300,10.6,0.14,SHEIN Tween Boys' Graphic Printed Short-Sleeved T-Shirt And Shorts Two-Piece Set,,,5
7500,5.4,0.16,SHEIN Young Girl Letter Tape Tie Dye Crop Tank Top & Contrast Binding Track Shorts,,,
,11.6,0.25,SHEIN Teen Girl Ripped Raw Hem Jeans,,,
2100,9.4,0.15,SHEIN Tween Boy Casual Street Style Loose Round Neck Short Sleeve T-Shirt And Knitted Shorts Set With Letter Print,,,5
1700,6.8,0.07,"Tween Girl Summer Casual Color Block Round Neck Short Sleeve Top And Leopard Print Bermuda Shorts Set, 2pcs",,,
,10.9,0.19,Kids Hollowed Sandals Summer Beach Outdoor Luminous Flip-flops For Boys And Girls(toddler/little Kid/big Kid),6,in Kids Shoes,
600,11.8,0.07,SHEIN Tween Girl Solid Color Strapless Jumpsuit,,,
,4.1,0.15,"SHEIN Young Boys' Casual Car Printed Short Sleeve Round Neck T-Shirt, Suitable For Summer",,,4
