selling_proposition,price,discount,goods_title,rank_title,rank_sub,color_count
,12.29,0.08,Color Block Thin Border Pocket Letter Print Short Sleeve Shorts Maternity Homewear,4,in Maternity Loungewear,
,5.29,0,Plus Butterfly Print Contrast Binding Lettuce Trim Cami Nightdress,9,in Plus-Size Women's Casual Sleepwear,
4900,5.29,0.07,Shein Underwear&Sleepwear Basics 3pcs Solid Ruched Tube Bra,,,
2100,2.71,0.32,High Waisted Shapewear Panty,,,
1500,13.79,0.07,Drop Shoulder Top-stitching Knot Waist Lounge Set,,,4
,3.3,0.15,"1pair White Y2k Style Pink Bowknot Twisted Ball Leg Warmers, Warm Lolita Winter School Style Stockings",6,in Women Women Leg Warmers,
20,6.7,0.5,Green Bathrobe Collar Men Household Clothes Set,,,
1800,7.79,0.1,Plus Size Wire-free Floral Bra,,,
,4.84,0.09,"Women's Front Closure Bra With Steel Ring, 1pc",10,in Black Women Bras & Bralettes,5
1600,7.91,0.28,2pack Solid Shapewear Shorts,,,
900,8.59,0.07,High Waisted Shapewear Shorts,,,
1000,6.39,0.07,Solid Wireless Buckle Front Bra,,,
300,7.49,0.06,Heart Print Lettuce Trim Romper,,,
10000,5.8,0.15,Multicolored Ribbed No Show Socks - 10 Pairs,,,
600,7.49,0.07,Women Fashionable Solid Color Short Sleeve Bodysuit Shapewear,,,
,4.09,0.07,High Waisted Shapewear Shorts,4,in Women's Pink Shapewear,9
200,11.89,0.14,5pcs Plus Size Women's Solid Color Basic Daily Panties,,,
,17.69,0,TOM & JERRY X SHEIN Men Cartoon Letter Print Home Clothing Set,6,in Blue Men Loungewear Sets,
,6.59,0.16,Pure Desire Floral Lace Underwire Lingerie Set,3,in Red Women Sexy Lingerie Sets,15
400,8.09,0.07,2PCS Women Strapless Bra Seamless Front Buckle Bra Tube Tops No Pad Beauty Back Breathable Wireless Wedding Brassiere Push Up Bras Sexy Female Lingerie Invisible,,,9
400,19.39,0.07,5pack Plain Simple Bra,,,11
400,9.1,0.14,"10pairs/Set Men's Mid-Calf Socks In Random Design With Basketball & Butterfly Printed, Soft, Comfortable, Anti-Odor & Moisture Absorbing",,,
500,12.29,0.24,Women's Solid Color Lace Patchwork Pajama Set,,,
2500,5.99,0.08,Cut-out Shapewear Bottom,,,
,7.59,0.11,Plus Size Women's Solid Color Underwire Low-Cut Bra,2,in Beige Plus Size Bras & Bralettes,
100,5.69,0.08,DAZY Women's Ribbed Cami Bralette And Triangle Panties Underwear Set,,,5
20,7.48,0.57,"Plus Size Women Pajama Set With Lace Splicing, V-Neckline And Ruffled Sleeves",,,
300,8.39,0,Women Nylon Satin Triangle Panties (Pack Of 5),,,
200,11.29,0,Lace Insert Cami Night Dress,,,
,4.99,0.09,Solid Ribbed Knit Bralette Sports,1,in Navy Blue Women Bras & Bralettes,4
,8.16,0.29,Leopard Contrast Piping Satin Lounge Set,5,in Baby Pink Women Pajama Sets,
,17.49,0.07,DAZY Women's Letter Print Drop Shoulder Short Sleeve Top And Loose Shorts Homewear Set,9,in Hot Pink Women Lounge Sets,
20,13.49,0.08,3pcs Front-Closure Women's Bra With Underwire,,,
40,7.64,0.15,Plus Size Round Neck Casual Short Sleeve Top And Printed Shorts Pajama Set For Summer,,,
7400,2.09,0.05,"Plus Size Comfortable Breathable Elastic Fabric Nipple Covers For Wedding Season, Cut To Any Shape 1 Roll (3m Length)",,,5
,6.69,0,Plus Size 2pcs/set Romantic Butterfly Print Cami Top And Shorts Home Wear Set,6,in Black Plus Size Pajama Sets,
2000,2.39,0,SHEIN Leisure-E Solid Ribbed Knit Panty,,,
,3.79,0.07,Comfortable Lace Basic Camisole Top For All Seasons,6,in Black Women Basic Tops,
500,6.69,0.07,"Casual Comfortable Front Closure Push Up Lace Bra, Prevents Sagging & Covers Side Boobs, Adjustable, 1pc",,,
,4,0.15,6 Pairs Women Casual Sport Short Socks No Show Socks,5,in White Women Invisible Socks,7
200,6.05,0.35,"Ladies' New Solid Color Sauna Sports Leggings For Summer 2024, High Waist, Butt Lift, Tight-Fitting Body Shaping Training Pants, One-Piece, With Sauna Slimming Effect And Cropped, Perfect For Women's Slimming, Yoga, Fitness, Tightening Control Of Abdominal Part To Sculpting Ideal Body Shape Shapewear Shorts",,,
1000,8.46,0.27,Women's Wire-free Solid Color Bra (3pcs/set),,,4
,10.99,0.07,Plus Size Lace Patchwork Small Floral Print Cami Dress For Home Wear In Summer,1,in Beige Plus Size Nightgowns & Sleepshirts,
2800,4.79,0.08,Floral Lace Underwire Bra Lingerie,,,11
,5.28,0.09,Women's Plus Size Tummy Control High Waist Lace Trimmed Shaping Tights (1pc),2,in Black Plus Size Shapewear Bottoms,4
,7.5,0.58,Sheer Lace Tie Front Ruffle Hem PJ Set,,,
90,12.89,0,DAZY Cute Cat Printed Camisole & Shorts Pajama Set With Contrast Trim & Bow Decor,,,
,5.99,0,5pack Contrast Lace Panty Set Lingerie,1,in Women's Casual Underwear,4
1700,6.59,0,Women 7pcs Solid Comfortable Seamless Thong,,,
1100,5.81,0.33,Tie Back Satin Cami Top & Ruffle Hem Shorts PJ Set,,,
,17.82,0.11,LUVLETTE Plus Dream Curve Support+ Strapless Push-Up Bra,2,in Luvlette Plus Instimates,4
,8.99,0.14,2pcs Lace Patchwork Underwire Bra And Thong Set,1,in Navy Blue Women Sexy Lingerie Dresses,4
1300,3.42,0.05,1pc Women's High Waisted Tummy Control Butt Lifter Panties Postpartum Waist Trainer Body Shaper Shapewear Waist Trainer Corset Shapewear Shorts,,,
600,1.25,0.62,"5 Pairs Of Women's Invisible Socks,Low Cut Ped Sock, White Socks,Short Socks,Black Socks,Women Socks,Cute Socks,Girls Socks,Ankle Socks,Thread Anti Slip Design, Breathable And Sweat Wicking Design, Soft And Comfortable, Suitable For Daily Wear, Home Sports, Office Wear, Ruffle Lace Design, Suitable For All Seasons And Various Holidays To Wear, Invisible Socks And Short Socks, Colors Are Optional",,,
200,4.79,0.06,Women's Breathable Simple Thin Sports Bra With Front Button No Wires And Seamless Latex Underwear,,,5
700,3.3,0.13,"3pairs Bow Knot & Lace Trimmed Mid Calf Thin Socks, Simple Design, Summer, White, For Girls",,,
1200,7.89,0,Contrast Binding Cami Top & Cartoon Print Shorts PJ Set,,,
4200,10.59,0,2pcs/Set Women's Purple Floral Print Pyjama Set With Contrast Trim & Bow Accented Cami Top And Shorts For Summer Lounge,,,
200,9.15,0.22,Men's Cartoon French Fries Printed Homewear Set,,,
700,2.49,0.51,Ladies' Solid Color Bra,,,
600,4.85,0.1,SHEIN 3pcs Women's Letter & Shark Printed Briefs,,,
,3.7,0.16,5pairs/set Men's Comfortable Personality Letter Print Mid-calf Socks For Autumn And Winter,2,in Men Men Crew Socks,
1500,4.79,0.06,SHEIN Solid Strapless Bralette Lingerie,,,
900,3.29,0.06,Silicone Cat Ear Shaped Seamless Nipple Covers,,,
300,1.49,0,"Sexy Open Crotch Lace & Pearl Decor, Transparent, No-detachable Thong, Hot Erotic Lingerie",,,
500,13.29,0,LOONEY TUNES X SHEIN Men 1pc Rabbit Print Contrast Trim Tee & 1pc Shorts PJ Set,,,
3400,3.42,0.07,1pc Self-adhesive Silicone Lift Bra Cups,,,
,7.89,0.07,Plus Size Women's Lace Patchwork Sexy Backless Lingerie Bodysuit,2,in Plus Size Sleep Jumpsuits,
1400,3.44,0.45,Classic Sexy Plus Contrast Lace Mesh Romper Bodysuit,,,6
60,15.39,0,"GARFIELD X SHEIN Men's Cartoon Printed Short Sleeve Top And Plaid Shorts Homewear 2pcs/Set, Summer",,,
,5.59,0.57,Men's Printed Simple Daily Home Wear Short-Sleeve And Shorts Set,,,
,2.99,0,Solid High Waist Shortie,2,in Women Safety Shorts,
,2.47,0.08,"Women's Wing-Shaped Self-Adhesive Bra, Underwear Accessory",2,in Black Women Lingerie Accessories,4
300,6.99,0,7PCS Women's Solid Panties Seamless Underwear Panties Solid Briefs Mid Rise Sexy V-Cut Waist Comfort Breathable Women's Lingerie Ice Silk Thongs Intimate,,,
600,4.59,0.08,Women Solid Color High Waist Body Shaping Panties,,,
,1.7,0.15,1pair Women Mesh Ruffle Trim Romantic Style Crew Socks,8,in Women's invisible socks listing,
1000,9.49,0.07,Comfortable And Traceless Push Up Bra With Cup Side Gathering & No-Wire Design For Small Bust Women,,,5
,6.09,0.14,Bow Front Lace Trim Satin Babydoll Slips,7,in White Women Sexy Lingerie Dresses,5
,5.59,0.08,2pack Floral Print Contrast Lace Wireless Lingerie Set Without Robe,3,in Women's Floral Bras,
700,1.99,0,Women's Strapless Seamless Bra,,,5
,3.56,0.13,Seamless Shapewear Bandeau Bodysuit,4,in Black Women Shapewear Bodysuits,
,5.69,0.08,Solid Color High Waist Hip Lifting Tummy Control Body Shaping Shorts,1,in White Women Shapewear Bottoms,7
1900,2.49,0.07,"2pcs/pack Women's Removable Triangle Bra Pads, Bra Accessories",,,
,8.09,0,SHEIN Maternity Letter Graphic Lace Trim Sheer Lounge Dress Without Panty For Mother,3,in Black Maternity Sleepwear,
200,6.9,0.14,14pairs Solid Ankle Socks,,,9
30,8.25,0.5,Men's Plaid Short Sleeve Top And Long Pants Homewear Set,,,
,10.09,0.06,Classic Sexy Plus Size Women's Lace Strapless Sexy Dress With No Underwire Bra And T-Back Panty,9,in Plus Size Sexy Lingerie,6
1300,3.49,0.08,"2 Pairs Women's Push Up Silicone Bust Patch Overseas Cordless Invisible Lingerie Teddy Lace Patch,Sticky Bra For Breast Lift Pasties Nipple Covers Invisible Silicone Adhesive Bra Petals Stick On Bra Strapless  Bar  Push UpBra Backless Bra Sticky  Bra Seamless Bra No Show Bra",,,
1000,14.79,0.07,Plus Size Strawberry & Floral Print Loose Fit Short Sleeve Top And Shorts Homewear Set,,,
300,4.1,0.15,4pairs/Pack  Cute Cartoon Short Socks For Women,,,
,12.24,0.22,3pcs Plaid Print Sleep Pants,1,in Plaid Pajama Pants,
300,14.29,0.07,Rib-Knit Cami Top & Ruched Drawstring Pants Lounge Set,,,
500,10.45,0.2,Contrast Lace Knot Front PJ Set,,,4
,10.49,0.08,"Women's Summer Solid Color Abdominal Control Short Sleeve Bodysuit, Sports",5,in Women's Pink Shapewear,6
,5.89,0.08,Solid Shapewear Slip,3,in Black Women Shapewear Slips,
200,11.19,0,FRIENDS X SHEIN Summer Sofa & Duck Print Contrast Lace Cami PJ Set,,,
900,10.59,0,Bear Print Contrast Piping Satin PJ Set,,,
,0.62,0.72,Striped & Skull Pattern Crew Socks,4,in Black Women Crew Socks,
,12.99,0.29,Men 2pcs Drawstring Waist Sleep Pants,8,in Men Loungewear Bottoms,
1400,1.99,0,"Women's Solid Color Lace Pattern Hollow Side Seamless V-String Panty, Ladies' Underwear",,,
2600,9.89,0.08,Adjustable Strap Bra Set 3pack,,,
,1.49,0.17,Women Sexy Diamond Design Lace Triangle Panties,6,in White Women Thongs,4
5100,2.49,0,8pcs Reusable Washable Nipple Covers - Thin And Lightweight,,,
,8.99,0.14,2pcs Women's Sexy Lace Splice Underwire Bralette With Lingerie Skirt And Thong,3,in Newly released sexy underwear and lingerie,4
100,3.59,0,SHEIN PetitDoll Women's Solid Color Triangle Panties With Nylon Lace And Bow Decoration,,,
,2.09,0.09,Solid Bandeau Bra,5,in Women's Strapless Bras,5
2700,2.8,0,1pc Two Tone Polyester Fitness Yoga Pants Shapewear Waist Trainer Corset,,,
2300,3.89,0.07,"1roll Breast Lift Tape, Invisible Push Up Adhesive Tape, Anti-Droop Nipple Paste, Disposable Sports Tape, 2pcs Circle-Shape Apricot And Khaki Silicone Nipple Covers, Prevent Light Leakage, Invisible Breast Stickers, Waterproof Nipple Cover For Swimming, Men And Women, Flesh Color.",,,
,33.19,0.07,8pcs/Set Women's Pure Color Simple Bra & Panty Sports Comfort Set,,,
3900,6.83,0.1,SHEIN 7pcs/Set Women's Thong Strap Letter Print Panties Sports,,,
,6.79,0,Striped Print Satin Cami Night Set,4,in Baby Pink Women Pajama Sets,
,3.16,0.38,Floral Lace Scallop Trim Lingerie Set,6,in Burgundy Women Sexy Lingerie Sets,
,2.99,0.09,1pc Sexy Open Crotch Temptation Deep V Undress Minimalist Sexy Hollow Out Lace Bodysuit,9,in Women Sexy Bodysuits,
,9.49,0.12,"2pcs/Set Simple Loose Fit Striped Knitted Top With Side Split And Shorts, Casual Homewear Set, Suitable For Home Use",1,in Black Women Lounge Sets,6
100,7.37,0.27,"Men 1pc Knitted Fabric & Mesh Design Breathable & Comfortable Compression Undershirt With Back Support, Suitable For Sports",,,
600,14.49,0.07,Plus Size Women's Leopard Pattern Printed Silk-Like Short Sleeve Shirt And Shorts Set,,,
50,10.79,0,SHEIN Women's Simple Color-Block Bow Decoration Ruffle Triangle Panties,,,
2100,18.79,0.07,5pack No Show Bra,,,11
100,7.05,0.5,Men Solid Tee & Plaid Pants PJ Set,,,
1000,7.19,0.08,1pc Women Buttoned Low Cut Backless Sexy Bodycon Cami Dress For Casual And Work Wear,,,
,4.29,0.07,"Women'S Front Closure Push-Up Padded Bra, Black",7,in Black Women Bras & Bralettes,
80,17.39,0,TEENAGE MUTANT NINJA TURTLES X SHEIN Men's Casual Knitted Cartoon Letter Print Black Short Sleeve T-Shirt And Shorts Homewear Set,,,
,4.69,0.08,Solid Underwire Bra,8,in Casual Bras,
200,4.99,0.07,DAZY Contrast Lace Bow Front Bra,,,8
1800,12.29,0.07,4Pcs Women Sexy Flower Lace Bras Top Comfortable Bralette Underwear Female Hollow Out Wireless Lingerie Seamless Bra,,,
3100,11.72,0.21,3pack Super Push Up Microfiber Soft Cup Bra Set,,,8
1000,5.89,0,Plus Size Mini Floral Printed Cami Slip Dress,,,
1500,14.49,0,11pcs/pack Seamless Solid Color Triangle Panties,,,
,7.89,0.07,New Arrival European And American Sexy Youth Plaid Mini Skirt Student Cosplay Set,4,in Red Women Sexy Lingerie Sets,4
200,11.89,0.07,"One Piece Women's Vintage Court Style Crop Strapless Top, Monet Painting Style Floral Printed, Boned And Sexy Corset Crop Top, Perfect For Party, Suitable For Wearing With A Dress",,,
800,12.79,0,Shein LuxeNights Leopard Print Contrast Piping Satin PJ Set,,,
300,16.39,0.07,"1pc Women's Body Shaper Jumpsuit With Butt Lift And Waist Compression, Enhanced Version, Triple Row Of Hooks, Adjustable, Sports",,,
,4.99,0.15,Floral Print Bow Front Lace Lingerie Set,8,in Valentine’s Day,5
600,1.47,0.36,1pair Women Cartoon Sunflower & Bee Pattern Cute Crew Socks For Daily Life,,,
,2.19,0,Lace Triangle Panties For Women Lingerie,8,in Women's Lace Underwear,4
1400,6.46,0.24,Panda & Slogan Graphic PJ Set,,,
1100,5.27,0.34,5pack Letter Patched Detail Brief,,,
,1.5,0.12,Men Fire Pattern Crew Socks,5,in White Men Crew Socks,4
600,5.99,0,6-Piece Ultra-Thin Nude-Feeling 3D Three-Dimensional One-Piece Seamless Mid-Waist Briefs For Women,,,
500,1.47,0.36,1pair Men's Novelty Pizza Print Mid-calf Socks,,,
90,7.59,0.07,"3pcs Seamless Women's Bralette, Ribbed Knit Strapless Bandeau, Comfortable Around The Chest",,,
700,3.09,0.09,Simple Seamless Bralette,,,
700,8.47,0.35,Plus Lace Trim Nightdress,,,
,2.84,0.34,"1pc Seamless High Waist Warmth & Tummy Control Panties, Postpartum Recovery Triangle Butt Lifter Body Shaper For Women Shapewear Waist Trainer Corset Shapewear Shorts",7,in Sports Shaper & Sports Safety,
4800,6.72,0.09,Solid Push Up Bra,,,12
8500,1.29,0.07,6pack Plus Bra Extender Hook Strap,,,4
,10.65,0.28,Solid Belted Lounge Robe,3,in Women Lounge Robes,5
1800,4.99,0.09,SHEIN DesireSculpt Floral Lace Underwire Push Up Bra Lingerie,,,11
40,7.97,0.45,Men Striped Jacquard Contrast Piping Satin PJ Set,,,
,4.19,0.13,Plus Size Seamless Bra Without Wires,9,in Black Plus Size Bras & Bralettes,4
,9.34,0.29,SHEIN Maternity Letter Embroidery Contrast Binding Belted Robe For Mother,3,in Maternity Sleepwear,
200,7.88,0.32,Shein Underwear&Sleepwear Basics Men 4pcs Sheer Boxer Brief,,,
60,2.9,0.15,5pairs Food Print Ankle Socks,,,
,2.39,0,Floral Lace Bow Back Panty Lingerie,4,in Black Women Briefs,10
4100,3.74,0.28,Solid High Waisted Shapewear Panty,,,
,4.79,0.08,Solid Underwire Bra With 1pair Detachable Straps,4,in Comfy Minimalist Bras,4
900,12.29,0.24,Women's Lace Trimmed Camisole & Tie Waist Shorts & Pants Sleepwear Set,,,
600,5.26,0.35,7pack Plain Simple Thong,,,5
,9.99,0,"Plus Size Flamingo Printed Round Neck Sleep Dress With Lace, Casual Summer",,,
800,2.09,0.05,"20pcs Underarm Sweat Pads For Women, Ultra Thin & Invisible, Antiperspirant & Perspiration Absorption Patches, Armpit Detox & Odor Control, Sweat Barrier Stickers",,,
700,5.49,0.21,Satin Cami Top & Shorts PJ Set,,,13
,7.09,0.24,"4pcs Sexy Lingerie Set Tempting Role Play Schoolgirl Uniform Costume, Innocent Separable",,,
,12.69,0.11,"Shein Underwear&Sleepwear Basics Seamless Plus Size Vertical Stripe Bra Set, 4 Pieces",10,in Seamless Curve Bras,
,5.56,0.36,Men Gingham Print Slant Pocket Sleep Pants,3,in Men Loungewear Bottoms,
2700,12.49,0,12pack Solid Simple Thong,,,7
,2.71,0.32,Classic Sexy Floral Lace Plunging Teddy Bodysuit,3,in Burgundy Women Sexy Bodysuits,
2900,2.99,0.09,Sexy Deep V-Neck Front Closure Bra,,,
,7.09,0.16,Classic Sexy Floral Lace Harness Crotchless Lingerie Set,10,in Navy Blue Women Sexy Lingerie Sets,
100,5.89,0.06,2pcs Summer Clear Straps Strapless Front Closure Push-Up Adhesive Invisible Bra Set,,,
,4.99,0.06,5pairs Women's Reusable Adhesive Push Up Breast Lift Pasties,8,in Beige Women Lingerie Accessories,
40,9.02,0.36,Men's Plaid Pattern Home Wear Set,,,
4600,10.09,0.08,2pack Contrast Lace Bra Set Lingerie,,,
2700,3.99,0.07,SHEIN SHAPE Women's High Waist Tummy Control Slimming Panties,,,4
,4.59,0.06,SHEIN SHAPE Seamless High-Waisted Brief Shapewear Short Body Shaper Cut-Out Butt Lifter-Tummy Waist Control,10,in Black Women Shapewear Bottoms,
1300,4.64,0.44,Classic Sexy Contrast Lace Harness Mesh Babydoll Slips Without Thong,,,6
700,3.37,0.16,3pcs Icy Silk Breathable Seamless Solid Color Low-Rise Triangle Panties,,,
800,7.95,0.41,Waffle Knit Asymmetrical Neck Drop Shoulder Waffle Knit Lounge Set,,,4
200,6.29,0,SHEIN Men Solid Lounge Top,,,
10000,13.49,0.08,Shein Underwear&Sleepwear Basics Men 5pcs Letter & Cartoon Graphic Boxer Brief,,,
90,8.09,0,Floral Print Tee & Bow Front Pants PJ Set,,,
1700,5.03,0.26,Satin Lace Trimed Split Night Dress,,,8
700,6.59,0.13,"Women Seamless Tummy Control Butt Lifter Backless High-Waisted Shapewear Romper, Sports, Suitable For Wearing With A Dress",,,
1900,13.29,0,SHEIN 12pcs Ladies' Bowknot Decoration Triangle Panties,,,
600,2.99,0,Plain Seamless Bralette,,,6
,13.72,0.22,3-Piece/Set Multicolor Printed Women Casual & Comfortable Sleepwear Pants Set,6,in Women Sleep Bottoms,
50,5.2,0.13,10pairs Solid Ankle Socks,,,
10,13.75,0.29,Men's 3pcs Mesh Breathable Sport & Fitness Base Layer Tank Top,,,
2200,4.31,0.2,SHEIN Leisure-E Stretchy & Smooth Seamless No Show No Padding Wireless Lounge Bralette - White,,,
2600,3.29,0.06,Solid Wireless Tube Bralette,,,
,10.79,0,Men Moon & Slogan Graphic Tee & Galaxy Print Shorts PJ Set,6,in Men Loungewear Sets,
600,15.89,0,Shawl Collar Satin Night Set,,,5
4600,10.86,0.28,Solid Tee & Tie Waist Wide Leg Pants Lounge Set,,,8
5400,6.09,0,7pack Plain Ribbed Thong,,,11
3100,7.49,0,Solid Color Comfortable Triangle Panties With Ribbed Detail,,,
,4.49,0.18,SHEIN Appliques Cut Out Halter Lingerie Set,3,in Hot Pink Women Sexy Lingerie Sets,9
100,4,0.5,Backless Contrast Lace Babydoll Slips,,,
10,8.69,0.07,Plus Size Lace Bra And Panty Lingerie Set (Full Coverage),,,
,3.5,0.15,ROMWE Goth 2pairs Women's Black Fishnet Stockings With Skull & Spider Pattern For Four Seasons,9,in Best-selling women's patterned color socks,
50,11.99,0.7,2 Pairs Invisible Push Up Sticky Bra Adhesive Strapless Silicone Bras Nippless Covers Ultra-Thin Breast Lift Pasties,,,
,2.15,0.1,1Pair Reusable Invisible Silicone Nipple Cover Self Adhesive Breast Chest Bra Pasties Pad Mat Stickers Accessories Lift For Woman,2,in Beige Women Lingerie Accessories,
,4.09,0.07,Jockmail 1pc Men's Breathable Mesh Triangle Underwear,3,in Black Men Briefs,7
1000,4.6,0.15,2pcs/Set Ladies Solid Color Oil-Gloss Reflective Glossy Pantyhose,,,6
10,3.99,0.11,SHEIN Plus Size Bralette & Wireless Bra,,,
,13.86,0.12,3pcs Solid Knot Front Lounge Shorts,10,in Women Lounge Bottoms,5
,13.99,0,12pcs/Pack Ladies' Solid Color Lace Triangle Panties Lingerie,4,in Women's Lace Underwear,
300,10.89,0.07,Lace Trim Body Shaper Bodysuit,,,
200,9.99,0.29,Men Plaid Print PJ Set,,,
,3.9,0.13,7pairs Randomly Shipped Ladies' Solid Color Breathable Mesh Low Cut Anti-Slip Invisible Boat Socks For Daily Wear And Ins Style Clothing,3,in Unisex Women Invisible Socks,
80,16.29,0,DAZY Summer Casual Comfortable Bear Printed Short Sleeve Shirt And Pants Pajamas Set,,,6
200,9.01,0.04,7pack Plain Simple Panty,,,6
,15.59,0.07,DAZY Women's Solid Color Simple Pleated Sleeveless Top And Pants Homewear Set,2,in Navy Blue Women Lounge Sets,
1700,2.09,0,Contrast Lace Bow Front Ribbed Knit Brief,,,7
3100,3.69,0,Plain Simple Shortie,,,12
7000,9.99,0,ROMWE Goth 6pack Floral Lace Scallop Trim Panty,,,
500,4.55,0.56,Men Color-Blocked Letter Printing Boxer Briefs With Contrast Trim (Set Of 3),,,
1500,3.89,0.07,"Women Sexy Lingerie Set, Tempting Lace Teddy, Hot Open Crotch Lingerie Uniform, Nightwear",,,
300,14.09,0.07,"Women's Daily Casual Soft & Comfortable Wide Strap Push-Up Bra With Seamless & Underwire Design, Basic 3pcs/Set",,,
,4.99,0,4pcs Women's Seamless & Invisible V-shaped Panties Set,10,in Black Women Briefs,
,3.9,0.13,5pairs/set Men's Solid Color Mid-calf Socks With Letter & Heel Detail,7,in Men Men Crew Socks,
40,4.79,0.06,"Women's Seamless Strapless Body Shaper, Tube Top Style Tummy & Waist Control Anti-Curling Undergarment, 1pc",,,
1400,2.99,0,Women Lace Thong Panties With Butterfly Embellishment (Pack Of 3),,,4
2400,2.99,0.06,"Women's Wirefree Bra And Bralette (No Padding), Solid Color, Sold Separately",,,6
300,9.95,0.17,"5pcs Women Comfortable Seamless High Waist Underwear, Tummy Control Butt Lifter Panties, High Waist High Elasticity Abdomen Control Shapewear, Sports",,,
1000,9.69,0,"2pcs/Set Women's Rose Print Pajamas With Contrast Trim Collar Short Sleeve Button-Up Top And Bow-Tie Shorts, Suitable For Home Use",,,
500,4.18,0.29,Elegant And Romantic Embroidered Women's Sexy Lingerie Set,,,
,4.79,0.06,"Sexy Lingerie Jumpsuit, Open Cut Breast Revealing Jumpsuit, Women's Jumpsuit, And Sexy Lingerie",4,in Black Women Sexy Lingerie Sets,
,10.49,0.15,Floral Lace Underwire Garter Bustier Set With 1pair Stocking,1,in Black Women Sexy Bustiers & Corsets,5
300,6.89,0,Leopard Print Frill Trim PJ Set,,,
200,15.09,0,SHEIN Unity Cartoon Graphic High Low Tee & Leggings PJ Set,,,
100,12.69,0,Men's Solid Color Top And Plaid Long Pants Home Suit,,,
2400,9.99,0,Shein CottageSlumber Floral Print Contrast Piping Satin PJ Set,,,
200,4.95,0.42,Men Buffalo Plaid Slant Pockets PJ Pants,,,5
2800,4.39,0.06,Scallop Trim Bralette,,,
10,8.39,0,SHEIN 5pcs Women's Plain Triangle Panties With Bow Decorations,,,
3300,14.27,0.16,SHEIN 3 Sets Rib Knit PJ Set,,,
1000,8.69,0.07,Cut Out Backless Drop Shoulder Sleep Dress Open Back Dress,,,
1400,7.99,0,7pack Solid Panty Set,,,4
200,10.09,0.33,Plus 4pack Patch Detail Ruffle Trim Cop Costume Set,,,
300,12.29,0.08,The Powerpuff Girls | ROMWE Plus Size Women'S Casual Contrast Trim Spaghetti Strap Pajama Set,,,
200,24.09,0.07,6pcs Women Plus Size Imitated Silk Contrast Color Lace Cami Top And Shorts Pajama Set In Multiple Colors,,,
3400,3.6,0.08,"Face Lift Bandage,1Pc Facial Massage Bandage Face Lift Tpu Far Infrared Facial Lift Tape Face Slimming Bandage",,,
,4.94,0.38,10pairs Solid Crew Socks,6,in Women's invisible socks listing,
900,4.49,0.1,Solid Simple Bra,,,6
200,6.19,0,Cow Print Button Front Sleep Romper,,,
100,4.99,0,"6pcs Women's Ice Silk Seamless Panties With Wave Pattern Design Peach Butt For Yoga And Fitness, Lightweight And Breathable",,,
40,3.66,0.7,Men's Slogan Print Home Clothing Set,,,
1700,5.79,0.46,Solid Shapewear Bodysuit,,,4
600,1.96,0.6,3pairs Women Solid Casual Slouch Crew Socks For Daily Life,,,
,2.1,0.13,1pair Plain White Leg Warmers,3,in Women Women Leg Warmers,16
,10.69,0,Men Cartoon Graphic PJ Set,2,in Men Loungewear,
,8.99,0,Plus Strawberry Print PJ Set,9,in Black Plus Size Pajama Sets,5
900,1.37,0.54,New Arrival Sexy Lingerie High Elasticity Hollow Out Lace & Transparent Mesh Dress,,,
1100,8.59,0,6pcs Women Breathable Comfortable Seamless Fashion Underwear,,,
900,18.29,0,Notch Collar Satin Blouse and Ruffle Hem Pants PJ Set,,,14
90,12.11,0.26,3pcs Spring And Autumn Casual Plaid Pajama Pants With Bow Decoration,,,
20,15.89,0,Men Lapel Neck Striped Shirt & Shorts PJ Set,,,
100,3.7,0.18,"90g Spring & Autumn Fashionable Sexy Tights For Women, Seamless And High Elastic Imitation Skin Tights",,,
,5.88,0.05,Lace Trim Satin Pajama Set,10,in Black Women Pajama Sets,7
,3.52,0.05,"Women's High Elasticity Seamless Fitness Yoga High Waist Push Up Tummy Control Tight Athletic Leggings With Peach Buttocks, Quick Drying & Squat Proof Shorts Shapewear Shorts",8,in Sports Shaper & Sports Safety,4
,10.82,0.05,SHEIN Maternity Contrast Binding Letter Embroidery Self Belted Robe,1,in Black Maternity Sleepwear,
2300,6.79,0.08,"1pc Seamless Body Shaper Corset With Removable Shoulder Straps, Sports, Suitable For Wearing With A Dress",,,
70,4.29,0.07,"1pc Women Sexy Lingerie Set With Lace, Bowknot And Perspective Design, Three-Piece Uniform Set",,,
,1.24,0.11,"10/50/100pcs Disposable Nipple Covers, Seamless Breathable Self-AdhesiveInvisible Bra, Women's Lingerie & Underwear Accessories",3,in Multi-pack accessories,
4200,11.99,0,4pack No Show Panty,,,6
,5.97,0.28,2pack Floral Lace Underwire Bra Set Lingerie Set,7,in Women's Bralettes,
70,9.59,0,"Men's Simple Solid Color Shorts, 2pcs Homewear Set",,,
100,20.39,0.07,DAZY Floral Print Drop Shoulder Tee & Pants Lounge Set,,,
1300,7.79,0,Women Fashionable Wave Edge Hollowed-Out Triangle Panties (Pack Of 5),,,
700,6.77,0.22,5pack Letter Graphic Panty,,,12
800,6.99,0,Plus Size Floral Print Cami Top & Shorts Pajama Set,,,
100,20.69,0,DAZY Women's Lace Splice Front Knot Pajama Set,,,
300,8.89,0,Lace Trim Cami Top & Shorts PJ Set,,,
20,13.79,0.07,4pcs Men's Ice Silk Boxer Shorts Loose Comfortable Breathable Underwear For Home And Travel,,,
100,14.99,0,Valentine's Day Men's Heart Print Homewear Set,,,
200,16.79,0.11,Plus Minimizer Bandeau Solid Strapless Bra,,,5
,5.83,0.09,"Strapless Push-Up Bra, Non-Slip, Breathable, Invisible, Underwire, Single-Piece, Suitable For Small Breasts And Large Breasts",6,in Beige Women Bras & Bralettes,
,5.09,0.07,"1pc Burgundy Sexy Lingerie Nightgown, Comfortable Milk Silk Fabric With Lace Trim",4,in Burgundy Women Sexy Lingerie Dresses,
,4.2,0.14,"5 Pairs Men's Trendy Breathable Simple White Athletic Mid-Calf Socks With Vertical Stripe Design And Non-Slip Cuff, Suitable For Daily & Outdoor Wear",7,in White Men Crew Socks,
300,3.11,0.49,Classic Sexy Plus Size Women's Sexy Hollow Out Lingerie With Bow Decorations,,,
,5.99,0.16,Ruffle Trim Dobby Lace Teddy Bodysuit,3,in Baby Blue Women Sexy Bodysuits,
50,5.79,0.19,"Ladies' Seamless Push-Up Bra, Comfortable & Wire-Free, Solid Color",,,
,5.58,0.31,SHEIN DelicateAllure Floral Lace Ruffle Trim Halter Babydoll Lingerie Set,6,in White Women Sexy Lingerie Dresses,8
,20.99,0.07,Men 5pcs Solid Tank Sleep Top,1,in Men Basic Tops,
300,15.19,0.07,Plus Size Summer Casual Sleeveless Top And Long Pants Pajama Set,,,
