selling_proposition,price,discount,goods_title,rank_title,rank_sub,color_count
700,14.5,0.16,"SHEIN Young Boy 3pcs/Set Cool Fashion Sleeveless Jacket, Short-Sleeve T-Shirt & Pants Outfit",,,
2300,8.6,0.05,Teen Girl Floral Print Ruffled One-Piece Swimsuit With Spaghetti Straps,,,
,15.8,0.19,Kids' Chunky Sneakers Sports Shoes,,,
200,9.24,0.23,SHEIN Tween Boy Paisley Print Short Sleeve And Shorts Two Piece Set For Summer,,,
200,5.8,0.06,"Tween Girl Casual Palm Tree & Letter Print Round Neck Pull-Over Short Sleeve T-Shirt, Summer",,,6
1000,16.9,0.07,SHEIN Tween Girl Zipper Fly Wide Leg Jeans,,,
100,2.9,0.09,"1pc 4th Of July Independence Day Headbands For Girls ,Ameicican Flag Decor Patriotic Hairbands, Kids Hair Accessories",,,
1000,3.2,0.16,Young Boy Casual Minimalist Vacation Themed Sleeveless Tank Top Suitable For Summer,,,
1100,15.9,0.15,"Teenage Girls' High-Heeled Sandals With Open Toe And Ankle Strap In Black, Large Size, Medium Heel",1,in Teen Heeled Sandals,10
900,12.7,0.13,SHEIN Teenage Boys'  Character Print Cotton Short Sleeve T-Shirt And Shorts Set,,,
70,8.4,0.15,SHEIN Genkimix Kids Young Boy Half Button Tee & Roll Up Hem Shorts,,,
1000,11.9,0.14,Young Girls' Basic Casual Elastic Waist Rolled Hem Multicolored Denim Shorts 2pcs/Set,9,in Young Girls Denim Shorts,
1900,7.1,0.12,Tobefonseca Dark Big Girls' Cartoon Letter Printed Short Sleeve T-Shirt For Summer,,,
,9.1,0.06,"(All Accessories Are Paint And Powder Free)Kids Girls Makeup Set Girls Pretend Makeup Set, Washable Toddler Makeup Toy Set With Princess Makeup Bag Ages 3+",,,
200,14.1,0.06,SHEIN Bubble Crinkled Double Layered Skirted Cami Dress For Teen Girls,,,
600,5.4,0.11,Tween Girls' American Independence Day Festival Y2K Heart Swag Cool T-Shirt,,,4
200,4.55,0.16,"SHEIN Young Boy Casual Cartoon Pattern Short Sleeve Round Neck T-Shirt, Summer",6,in Young Boys T-Shirts,5
100,23,0.08,Tween Boy Patched Frayed Casual Jeans,,,
900,6.2,0.1,"Teen Girl Pressed Flowers T-Shirt, Boho Wildflowers Shirt, Plant Shirts, Vintage Botanical Tee, Pastel Floral Nature Shirt, Garden Lover Gift, Casual Short Sleeve Tee Suitable For Summer",,,
1400,6.48,0.4,SHEIN Tween Boys Extended Size Casual Coconut Tree Printed Short-Sleeve Shirt With Lapel And Shorts Weave Two-Piece Suit With Slanted Pockets,3,in Tween Boys Extended Size Clothing,
1600,11.2,0.06,SHEIN Teen Girl Ditsy Floral Print Ruched Bust Cami Dress,,,4
1100,6.8,0.27,"SHEIN Young Boy 2pcs Casual Smiling Face Tie-Dye Printed Short Sleeve T-Shirt And Shorts Set, Suitable For Summer",,,
300,8.5,0.13,Tween Boy Basic Round Neck Short Sleeve T-Shirt And Shorts Set For Daily Wear,,,
100,20.2,0.16,Young Girl Woven Solid Color Turn-Down Collar Gigot Sleeve Cardigan And Woven Floral Elegant Skirt Set,,,
600,10.99,0,"JNSQ Tween Girl Knitted Solid Color Sleeveless Dress With Shorts, Casual And Sporty",,,
100,2.5,0.07,Cartoon Pattern Jade Dog  Melody One Shoulder Crossbody Chest Bag Oxford Cloth Baby Accessory Bag,,,4
800,3.8,0.14,"Girls' Cartoon Cow & Letter Slogan Printed Short Sleeve T-Shirt, Casual",,,
400,4.2,0.14,"GARFIELD X SHEIN Young Boy Casual Cartoon Printed Funny Short Sleeve T-Shirt, Summer",,,
300,10.8,0.14,SHEIN Tween Girl Solid Cami Top & Wide Leg Pants,,,13
100,4,0.39,SHEIN Tween Girls' Full Print Alphabet & Heart Pattern Short Sleeve T-shirt,,,
600,3.1,0.09,"1pc Children Girls' Solid Color USA Independence Day Theme Red/Blue/White Faux Pearl & Rhinestone Decorated 6cm Wide Headband With Simple Knot, Suitable For Festivals, Runway Shows, Etc.",,,
100,8.6,0.05,SHEIN Teen Girl Knitted Geometric Pattern Vacation Casual Spaghetti Strap Dress,,,
100,4,0.13,SHEIN Young Girl Toddler Girls Solid Ruffle Hem Skirt,,,5
200,11.1,0.15,3pcs/Set Young Boy Casual College Style Solid Color Shorts With Elastic Waist And Decorative Rope,,,
300,11.2,0.14,SHEIN Tween Boy Casual Street Cool Cartoon Bear Print Round Neck Pullover Short Sleeve T-Shirt Pure Color Shorts Knitted Two-Piece,6,in Streetwear,
600,9.6,0.15,SHEIN Young Girl Knitted Solid Color Polo Collar Bodycon Dress With Knitted Solid Color Shorts Sports Suit Set,,,
500,8.69,0.26,Girls Tropical Print High Neck Bikini Swimsuit,,,
100,14.1,0.15,"5pcs Young Boy Casual Korean Style Plain Round Neck Short Sleeve T-Shirt, Multicolor Pack (5 Colors In Each Pack)",,,
100,11.5,0.07,"SHEIN Gentleman Style 2pcs/Set Vest With Chest Pocket & Suit Pants For Tween Boys, Suitable For Formal Occasions Like Birthday Party, Evening Party, Performance, Wedding, Etc. Shirt And Accessories Are Not Included.",7,in Tween Boys Suits,4
40,11.3,0.14,SHEIN 3pcs/Set Knitted Color-Block Loose-Fit Shorts With Contrast Hem For Tween Girls,,,6
,11.1,0.06,Teen Girls Tropical Print Wrap Bikini Swimsuit With Swim Shorts,,,4
100,8.2,0.15,SHEIN Young Girl Drop Shoulder Ribbed Knit Tee & Leggings,,,12
900,3.4,0.13,"Young Girl 3D Cartoon Dogs Graphic Tee, Casual & Simple Short Sleeve T-Shirt With Cartoon Dogs Pattern For Summer",,,
1200,10.7,0.14,SHEIN Young Girl Woven Floral Square Neck Ruffle Trimmed Casual Dress,,,
100,11.7,0.14,Tween Boy Casual Football Printed Glow-In-The-Dark Green Round Neck Short Sleeve T-Shirt And Shorts Knitted 2pcs Outfits,,,
,10.3,0.13,"Young Girl Lovely Casual Ladylike Heart-Shaped Strap Dress Set, Valentine's Day, Summer",,,
500,4.21,0.16,"Tween Boy Casual Simple Cartoon Animal Print Round Neck Top, Suitable For Summer",,,
1100,13.7,0.14,SHEIN Tween Boy's Stylish Coconut Tree Printed Vest And Shorts Set For Leisure Wear,,,
600,10.5,0.13,SHEIN Tween Girl Fashionable Street Style Punk Casual Short Sleeve Top And Long Pants Two-Piece Set,,,
,3.2,0.3,SHEIN Young Girl Toddler Girls Stand Collar Lettuce Trim Tee,,,
100,12.8,0.06,SHEIN Teen Girl Flutter Sleeve Square-Neck Shirred Dress,,,9
400,23.87,0.46,"Children's Autumn And Winter Double Wheel Sneakers, Sports Shoes",,,
,13.9,0.06,Teen Girl Fashionable Summer Beach Holiday Printed Swimsuit Set,,,
600,5.7,0.11,SHEIN Teen Girls Ruched Bust Tie Front Puff Sleeve Crop Tee,,,4
300,8.3,0.15,Young Girls' One-Piece Swimsuit With Seashell Decor & Mesh Splicing Front,3,in Young Girls One-Pieces,4
,5.9,0.08,"4pcs Girls' Safety Shorts, Thin Anti-Chafing Underwear, Assorted Colors",1,in Baby & Kids Tights,6
,8.9,0.07,Tween Girls' Solid Color Textured Bikini Swimwear Set,,,4
,6.3,0.1,Teen Girl's Summer Casual Dolphin Print Short Sleeve Round Neck T-Shirt,,,
,6.6,0.25,SHEIN Young Boy Snug Fit Cartoon Car Pattern Color-Block Round Neck Short Sleeve Shorts Knitted 2-Piece Homewear Pajamas Set,,,
200,10.08,0.16,Tween Girl Leaf Print Zipper Front Bikini Swimsuit,,,5
2500,10.9,0.15,SHEIN Young Girl Solid Color Sleeveless Knitted Round Neck Casual Sports Jumpsuit Dress,,,
600,1.7,0.11,"1pc Zinc Alloy Ballet Dancing Girl Pendant Necklace For Little Girls, Pink Resin Inlayed Rhinestone Pendant, Size: 6x2cm; Suitable For 7-14 Years Old Girls For Daily Use",,,
100,5.15,0.43,SHEIN Young Boy Coconut Tree Print Tank Top & Drawstring Waist Shorts,,,
100,17.1,0.06,SHEIN Teen Girls Wide Leg Jeans,,,
600,14.2,0.07,SHEIN Tween Girl Contrast Dobby Mesh Fold Pleated Hem Keyhole Back Dress,,,
1400,14,0.1,"Tween Girl's Straight-Leg Ripped Jeans, Casual Washed Denim",,,
300,12.8,0.06,Teenage Girls' Cute And Elegant Medium Wash Ripped And Wrinkled Denim Shorts,,,
2600,6,0.13,"Teenage Boy's Casual Short Sleeve T-Shirt With Character Slogan Print, Summer",,,
,8.4,0.15,Little Girls' Printed Random Pattern Spaghetti Strap Tankini And Bottom Set,,,
1400,10.8,0.11,Teen Girls Solid Drop Shoulder Thermal Lined Hoodie,9,in Teen Girls Sweatshirts,7
1600,4.8,0.14,"Young Girl Casual And Simple Dinosaur Printed Ruffled Dress, Suitable For Summer",,,
10,3.9,0.07,1pc Children Embroidered Daily Casual All-Match Outdoor Sunshade Baseball Cap,,,8
1100,8.2,0.07,"Tween Girl Summer Two-Piece Swimsuit Set, With Unique Texture Fabric",,,
200,11.6,0.15,SHEIN Tween Boy's Cool Tie-Dye Hooded Short Sleeve T-Shirt And Shorts For Summer,,,
,6.5,0.07,Girls' Cute Pink Patchwork Raincoat For All Seasons,,,
5800,8.17,0.18,"SHEIN 2pcs/Set Young Boy's Camo Printed T-Shirt And Shorts, Casual Sports Outfits",,,
100,6.3,0.07,Tween Boy Star Print Elastic Waist Shorts For Summer,,,
,9.7,0,"SHEIN Tween Boys"" Extended Size Car Printed Short Sleeve T-Shirt And Shorts Set",4,in Tween Boys Extended Size Sets,
700,16.9,0.06,Teen Girl Pink Short Sleeve Cardigan And Shorts Casual Casual 2pcs Homewear Set,4,in Teen Girls Pajamas,
500,1.92,0.52,SHEIN Tween Girls Extended Size Casual Spring And Summer Knitted Round Neck American Flag Print Tank Top,,,
800,6.08,0.13,Young Boy Summer Casual Set 4th Of July Outfits Letter Print Short Sleeve T-Shirt & Star Printed Shorts 2pcs/Set,,,
100,6.8,0.13,SHEIN Tween Girl Knitted Loose Fit Short Sleeve Embroidered Letter Casual T-Shirt,,,
300,8.4,0.05,SHEIN Teen Girls Ribbed Knit Split Hem Dress,,,
900,10.6,0.15,SHEIN Young Girl Knitted Solid Color Heart Pattern Pleated Round Neck Short Casual Tank Top Three-Piece Set,,,
500,7.32,0.12,Tween Boy Donuts Print Drawstring Waist Swim Shorts,4,in Tween Boys Swimwear,
,12.3,0.07,"SHEIN Tween Girl Lapel Collar Button Front Cute Denim Shirt With Back Bow Decoration And Curved Hemline,Girls Summer Beach Washed Vacation Clothes Outfits",4,in Tween Girls Denim Tops,
200,6.9,0.13,"Teen Boys' Casual Simple  Printed Round Neck Short Sleeve T-Shirt, Suitable For Summer",,,
900,10.93,0.17,3pcs Tween Girls' Heart & Leopard Print T-Shirt,,,
500,14.9,0.13,SHEIN Teen Girl Black And White Geometric Print Short Sleeve Shirt And Loose Jumpsuit Casual Vacation Two-Piece Set,,,
400,7.5,0.05,Teen Girls Ribbed Criss Cross One Piece Swimsuit,,,
,10.5,0.14,SHEIN Tween Boy Letter Graphic Baseball Collar Shirt & Shorts Without Tee,,,6
200,18,0.15,"3pcs/Set Kids' Summer Clothes - Young Boy Comfortable Casual Style Metal Necklace Decoration Round Neck Short Sleeve T-Shirt With Woven Label Decoration Shorts, Suitable For Outdoor Play, Street Snap, Party And Home Leisure With High Cost Performance",,,
200,3.6,0.08,4pcs Fashionable Sunglasses Cute Children's UV Protection Sunglasses - Perfect Gift For Kids On Children's Day,,,5
,7.6,0.11,"Teen Girl T-Shirt, Summer Tops, White Top, Casual And Simple Knitted Oversized Tee With English Letter Print, Suitable For Summer",,,
100,18.4,0.07,SHEIN Tween Girl Casual Woven Solid Color Ruffle Hem Cap Sleeve Dress,,,4
100,2.6,0.5,"Young Boy Casual Simple Cartoon Dinosaur Printed Short Sleeve Round Neck T-Shirt, Suitable For Summer",,,
100,4.26,0.15,"SHEIN 1pc Young Boy Casual & Simple American Independence Day Printed Shorts, Suitable For Daily Wear, Independence Day Events, Travel & Play, And Spring & Summer Season",,,
40,18.72,0.11,SHEIN Tween Girl Solid Color Woven Ruffle Hem Dress For Vacation And Leisure In Spring And Summer,,,
200,11,0.13,"SHEIN Teen Girl Basic Black, White, And Gray Tight-Fitting, Long, And Versatile Camisole Camisole For Casual, Inner Layer",,,
300,14.6,0.19,"1 Pair Girls' All-Match Breathable Sneakers With Hook-And-Loop Closure, Embroidered Butterfly & Heart Decor, Casual White Shoes",6,in Kids Sneakers,
300,4.7,0.08,SHEIN Tween Boy Casual Doughnuts Print Swim Trunks With Loose Fit Woven Fabric Beach Shorts,,,
100,7.7,0.07,Tween Girl Sleeveless Summer Ballet Leotard Hollow-Out Back High Stretch For Dance Show/Practice,,,
1600,8.2,0.14,SHEIN Young Girl Contrast Color Flying Sleeve Dress,,,9
200,4,0.15,"Young Girl Light Pink Heart-shaped Casual Cute T-shirt, Regular Sleeve, Round Neck, Summer",,,
1500,4.2,0.13,SHEIN Teen Girl Knitted Solid Color Pleated Irregular Hem Casual Bandeau Tank Top,,,
1800,16.7,0.07,SHEIN Teen Boy Color-Blocked Drawstring Pattern Shorts Set With False 2 In 1 Design,1,in Teen Boys Activewear,
100,3.3,0.08,SHEIN Teen Girl Lettuce Trim Cami Top,,,11
40,11.4,0.11,"Teen Girl Pressed Flowers Sets, Boho Wildflowers,Plant Sets, Vintage Botanical Sets, Pastel Floral Nature Sets, Garden Lover Gift, Casual And Simple Wildflower Pattern Short Sleeve Round Neck Two-Piece Set For Summer",,,
,12.6,0.15,GARFIELD X SHEIN Tween Boy Casual Cartoon Printed Loose Fit Short Sleeve T-Shirt And Shorts Summer Outfits,,,
700,1.2,0.14,"10pcs/Set Colorful Cartoon Cake Shaped Children Rings - Perfect Party Favor And Gift For Daughter And Granddaughter, No Box Included",7,in Kids Fashion Jewelry,
2000,6.1,0.08,"Tween Girl Casual Letter Printed Round Neck Pullover Short Sleeve T-Shirt, Summer",,,
100,8.5,0.08,Young Girl 3pcs/Set Summer Short Sleeves Patterned Shorts With Matching Hat,,,
300,7.97,0.17,"Tween Boy Casual Outfit 2pcs/Set Round Neck Short Sleeve T-Shirt And Sports Shorts, Color-Block Design In Three Colors",,,6
200,8.8,0.06,"Elegant Floral Print Halter Neck Dress For Tween Girls, Perfect For Summer Vacation, Beach Party",,,
3100,6.6,0.14,SHEIN Tropical Printed Casual Shirt For Tween Boys,3,in Tween Boys Shirts,
300,5.85,0.5,SHEIN Retrotrend Kids Tween Girl Elegant And Cute Retro Ladylike Flower Print Spaghetti Strap Dress,,,
5700,2.1,0.09,"2pcs American Flag Color Pom Pom Flower Hair Clip For Girls, Independence Day Decoration Hair Accessories",,,24
100,11.6,0.11,"Teen Girl Casual Cartoon Anime Girl Pattern Short Sleeve T-Shirt And Shorts Two Piece Set, Suitable For Summer",,,
90,4.8,0.14,SHEIN Tween Girl Solid V Neck Tee,,,
400,5.3,0.2,"Tween Girl Students Casual Apricot Color Crewneck Pullover Short Sleeve T-Shirt With Print, Summer Top",,,5
400,7.7,0.07,Tween Boy Cartoon Graphic Drawstring Waist Swim Shorts,,,
700,17.7,0.06,SHEIN Teen Girl Woven Floral Pattern Square Neck Backless Wide Shoulder Strap Bodycon Dress,,,
100,3.5,0.15,Young Boy Casual Simple Cartoon Cat Baseball Print Tank Top Suitable For Summer,,,
200,6.5,0.14,SHEIN Tween Girl Allover Print Puff Sleeve Peplum Top,,,
800,8.3,0.14,Tween Girl Casual Square Neck Short Sleeve Simple Solid Color Comfortable 3pcs T-Shirt Set,,,
300,20.8,0.07,"3pcs Teen Boy Sporty Casual Fit Multi Pocket Cool Casual Shorts, Outdoor Cargo Shorts For Spring & Summer",1,in Teen Boys Bottoms,
1000,7.6,0.15,Young Boy Striped & Cartoon Graphic Beach Swimsuit,,,
100,9.98,0.12,"Tween Boys' Swimwear Set - Short Sleeve Round Neck T-Shirt With Printed Logo, Swim Trunks With Random Printed Pattern, Bathing Suit Beach Outfit Summer Vacation",2,in Tween Boys Swimwear,4
40,9.6,0.4,Children's Plush Warm Snow Boots,10,in Kids Boots,
100,10.6,0.06,"SHEIN Tween Girl Vacation Casual Solid Color Woven One Shoulder Sleeveless Loose Jumpsuit, Mommy And Me Matching Outfits (3 Pieces Sold Separately)",,,
100,12.7,0.19,Kids' Athletic Mesh Sneakers New Spring Autumn Season Soft Soled Lightweight Slip-Resistant Shoes For Sports And Daily Wear,,,4
,6.4,0.2,20cm Adorable Corgi & Friends Plushies Dolls Lifelike Dog Plush Toys Soft Siberian Husky Chow Lion Akita Dolls Cute Dogs Plushie Perfect Gifts For Kids Birthday Decor Home Holiday Festival Gifts Girls Boys,,,
700,15.9,0.07,SHEIN Tween Girl Letter Print Short Sleeve T-Shirt With Checked Fireproof Long Pants Pajama Set,,,
200,1.5,0.06,4pcs Toddler Girls Butterfly & Faux Pearl Decor Snap Clip,,,
900,11.3,0.07,"Tween Boy 1pc Casual Sports Outdoor Workout Cargo Pants With Large Pockets, Woven Strap Decoration, Number 23 Iron-On Patch, Spring And Autumn",,,5
300,7.6,0.13,SHEIN Tween Girl Slogan Graphic Drop Shoulder Tee,,,
3200,12.1,0.13,Teen Boy Casual Retro Car Pattern Short Sleeve Round Neck T-Shirt And Shorts Set Suitable For Summer,,,
400,14.8,0.13,Summer Fashionable Casual Flat Sandals With Retro Style For Children,,,
100,2.5,0.07,"53/57/113pcs Girls' Princess Pink Set Of Hair Accessories, Including Simple And Seamless Non-Damaging Hair Ties, Ponytail Holders, Flower Claw Clips, Rectangular And Irregularly Shaped Geometric Claw Hair Clips, Perfect For Daily Use.",,,
800,9.5,0.08,"Young Girl Cute Independence Day Striped And Star Printed Sleeveless Dress, Summer",,,
300,16.15,0.05,Kids' Fashionable Wedge Heel & Thick Sole Sandals,,,
200,2.97,0.42,"5 Pairs Anti-Slip Socks For Infants With 3D Heel And Point Glued Sole, Low-Cut Floor Socks And Bounce Socks",,,
,10.3,0.07,"Tween Girl Floral Print Two-Piece Swimwear Set, Perfect For Beach Vacation",,,
100,20.3,0.15,"1pair Sweet Girls' Pink Thick-Soled Mary Jane Shoes With Bowknot & Faux Pearl Decoration, Spring New Arrival",1,in Teen Pumps,6
2700,5.6,0.11,Tween Boy Elastic Waist Shorts With Letter And Cross Printed Detail,10,in Tween Boys Shorts,4
,15.3,0.13,SHEIN Teen Girl Black And White Colorblock Cropped Tank Top And Loose Fit Streetwear Casual Cargo Pants Set,,,
800,3.12,0.6,"Young Boy Casual Simple Short Sleeve T-Shirt And Shorts Set, Summer",,,
80,12.8,0.14,SHEIN Tween Boy Letter Graphic Raglan Sleeve Hoodie Without Tee,1,in Tween Boys Sweatshirts,5
100,22.5,0.14,"2024 New Teen Girls' Sports Shoes Sneakers, White",8,in Teen Sneakers,
600,9.9,0,SHEIN Tween Boys Extended Size Casual Loose Fit Cargo Pants With Pockets,5,in Tween Boys Extended Size Pants,
,9.3,0.08,Tween Boy Summer Casual Solid Color Cargo Shorts 2pcs/Set,,,
100,13.5,0.07,SHEIN Tween Girl Vacation Casual Woven Floral One Shoulder Sleeveless Wide Leg Jumpsuit (2 Pieces Sold Separately),,,
90,5.5,0.17,SHEIN Young Girl Unicorn Print Bow Shoulder Cami Dress,,,
,21.7,0.06,"SHEIN Teen Girl Y2K Spring Summer Boho Stonewashed Ripped Boyfriend Baggy Denim Wide Leg Long Jeans,Girls Summer Clothes Concert Outfits",,,
1000,2.4,0.08,"1pc Cartoon Dinosaur & Unicorn Nylon Chest Bag, Cute Crossbody Bag For Kids",,,7
100,8.75,0.32,"GORLYA Tween Girls' Sleeveless Straight Wide Leg Jumpsuit For Sports And Casual Wear, Perfect For Spring, Summer, Outdoor Activities, Shopping, Walking, Parties And School",,,
300,7.65,0.39,SHEIN Tween Boy Paisley Print Shirt & Shorts Without Tee,,,4
50,9.9,0.14,Tween Boy Streetwear Flame Printed Short Sleeve T-Shirt And Shorts 2PCS Outfit,,,
70,11.65,0.34,"High-Capacity Student Backpack With Cute Ins Style Design, Suitable For 14-16 Years Old Teenagers, Fashionable And Practical Schoolbag",,,4
7700,14.7,0.15,SHEIN Young Girl Knitted Solid Color Fitted Casual Cami Romper 5pcs/Set,,,
100,6.9,0.14,"Young Boy Casual And Simple Cartoon Astronaut Pattern Short Sleeve And Shorts Two-Piece Set, Suitable For Summer",,,
200,11.2,0.15,SHEIN Tween Boy Short Sleeve Textured 3D Fabric Dress Shirt And Casual Shorts 2pcs/Set Outfit,,,6
600,6.8,0.13,"Tween Boy Casual Simple Cartoon Pentagram Pattern Shorts, Suitable For Summer",,,
100,8.8,0.05,Teen Girl Fashionable Summer Printed Cross Design Two-Piece Swimsuit,,,
300,2.1,0.09,"1pc Girls' Black Heart Pattern Jacquard Ultra-Thin And High Elasticity Pantyhose, Suitable For Daily Wear, Campus Cute Style",,,14
100,14.5,0.13,"Girls' Casual Sandals New Arrival Summer Flat Shoes For Little & Big Kids, Children's Beach Shoes For Girls",3,in Kids Flat Sandals,8
200,8.5,0.13,"Tween Girl Sports & Leisure Knitted Belted Straight Shorts With Letter Print, Spring/Summer",,,
300,13,0.08,"Young Boy Gentleman Two-Piece Polka Dot Print Short Sleeve Shirt With Bow Tie And Khaki Suspenders Shorts, Fashionable And Handsome, Suitable For Birthday Parties, Weddings, Banquets, Performances.",1,in Young Boys Suits,
,5.7,0.08,Young Boy Floral Print Button Front Shirt,,,
100,10.3,0.06,Teen Girl Random Color Printed Swimsuit Set,,,
400,4.06,0.17,Young Boy Summer Casual Simple Vintage Car Pattern Short Sleeve Round Neck T-Shirt,,,
90,5.6,0.16,Young Girl Color-Contrast V-Neck Crop Casual Sweater Vest,,,
,2.2,0,1 pair of sweet cute fashion bunny bracelets princess birthday gift bracelets,,,
1300,12,0.14,Teen Girls' Fashionable Flat Sandals For Summer Beach,10,in Teen Flat Sandals,
1000,1.7,0.06,4pcs Toddler Girls Bow & Faux Pearl Decor Fashionable Hair Clip For Daily Decoration,,,
100,2.5,0.17,"8pcs Hair Clips Ribbon Bow Barrettes For Women, Girls, Tassel Hair Bands Butterfly Bows With Long Tail, Suitable For Toddlers, Teens, Children",,,
100,9.8,0.16,SHEIN Young Boy Summer Casual Spider Element Printed Round Neck Short Sleeve Compression Swimwear And Knitted Shorts Set,,,
100,5.5,0.07,Tween Girl Purple & White Plaid Printed Two-Piece Swimwear With Removable Bra Pads Aged 8-12,,,
60,8.8,0.07,Tween Boy 2-Pack Element Random Printed Short Sleeve Shirt With Turn-Down Collar And Matching Design Shorts Summer Outfit,,,
200,2.2,0.08,"1pc Korean Style Delicate Hair Band Crown Headband For Daily Wear And Wedding Party, Forest Design",,,
100,9.8,0.13,SHEIN 3pcs/Set Solid Color Basic Style Vest For Tween Boys' Casual Wear,,,4
2900,3.3,0.15,SHEIN Young Boys' Casual Striped Suit Shorts,,,
100,3.92,0.17,"Young Girl T-Shirt, Summer Tops, Casual And Cute Heart Cartoon Print Pink Short Sleeve T-Shirt, Suitable For Summer",,,
100,11.8,0.14,SHEIN Tween Boy 2pcs House Embroidered Drawstring Waist Shorts,7,in Tween Boys Shorts,9
900,6,0.2,"SHEIN Young Girl Knitted Loose Casual T-Shirt, With A Round Collar, Combination Of Alphabet, Number And Mesh Design",,,
100,10.2,0,"SHEIN Tween Boys' Extended Size Leisure Solid Color Round Neck Short Sleeve T-Shirt, Printed Shorts And Backpack Knit Three-Piece Suit",2,in Tween Boys Extended Size Sets,
100,9.9,0.07,Young Boy Summer 3pcs/Set Short-Sleeved T-Shirt Combo With Construction Vehicle Prints,,,
400,10,0.15,Young Boy Simple & Cool Car Printed Snug Fit Short Sleeve T-Shirt And Shorts Set For Loungewear,,,
,2.2,0.08,1pc Children's Geometric Pc Frame Windproof Cycling Fashionable Sunglasses With Optional Colors,9,in Kids Fashion Glasses,8
,9.41,0.16,Tween Girl Tropical Print Frill Trim Bikini Swimsuit With Beach Skirt,,,
600,16.9,0,"70pcs Blue Color Children's Medical Kit Set For Boys And Girls Role Play Nurse Toy, Birthday Christmas Gift",4,in Kids Dress Up & Pretend Toys,
20,10.1,0.15,SHEIN Young Girl's Embroidered Short Sleeve Top With Puff Sleeves And Woven Solid Color Ruffle Shorts Two-Piece Set For Summer Vacation,,,
100,1.6,0.06,1pc Girls' 12-16 Years Old French Vintage Large Black Bow Hair Accessory Sweet Spring Clip For Daily Life,,,11
700,7,0.16,SHEIN Young Girl Knitted Geometric Pattern Tank Top Sweater,,,
200,5.35,0.41,SHEIN Young Boy Cartoon Lion & Letter Print 2pcs Outfit,,,12
600,6.97,0.2,"Tween Girl Strapless Seamless Breathable Ice Silk Wrapped Chest Anti-Light Bra With Buckle, Wire-Free",,,6
1100,5.61,0.21,SHEIN Tween Girls' Sports High Elasticity Leggings,,,
800,13.7,0.14,3pcs/Set Young Boy Cartoon Printed Contrast Color Short Sleeve T-Shirt With Round Neck,,,
300,15.12,0.26,Tween Girl 2pcs Set Novelty Pattern Comfortable Pajama Set For Fall/Winter,,,
300,16.5,0.06,SHEIN Teen Girl's Woven Hollow Out Embroidery Patchwork Lace Trim Spaghetti Strap Bodycon Dress,,,
400,1.6,0.11,1 Pc Fashion Simple Stainless Steel O Chain Necklace For Kids Minimalist Decor Necklace For Trendy Street Jewelry For Daily Life,10,in Teen Necklaces,
50,5.4,0.08,Young Boy Ice Silk Short Sleeve T-Shirt And Shorts Set,,,
300,9.17,0.28,Tween Girl's Woven Floral Print Loose Casual Skirt,,,
,1.59,0.59,"5 Pairs/set Cartoon Car & Striped Socks For Kids, Breathable And Odor Resistant, Suitable For All Seasons",,,
100,8.5,0.08,"Tween Girls' Solid Color Ribbed Knit Separate Bikini Swimsuit Set, Spring/Summer",,,12
2000,3.15,0.28,"Tie-Dye T-Shirt, 'Cool Little Dude', Young Boy Casual Short Sleeve Round Neck Tee, Suitable For Summer",,,
200,9.02,0.1,SHEIN Tween Girl Summer Beach Vacation & Leisure Spring/Summer Knitted American Flag Print Bra & Ruffled Hem Bikini Bottom Set 4th Of July Bikini Set,,,
1500,7.2,0.14,"2pcs Young Boy Summer Outfits, Handsome Boy Short Sleeve Shirt With Star Print Shorts, Children's Casual Wear",,,
50,5.1,0.09,"Young Girl Cute And Trendy Pink Dragon Printed T-Shirt, Casual Round Neckline, Summer",,,
2800,6.55,0.5,"Teen Girls Casual Simple Slogan Printed Short Sleeve Round Neck T-Shirt + Shorts 2-Piece Set, Suitable For Summer",,,
40,8.2,0.12,SHEIN Teen Girl Elegant Blue And White Floral Printed Spaghetti Strap Camisole Top And Skirt Set,,,
,8.9,0.07,Tween Girls' Fresh Texture Vacation Leisure Bikini Swimsuit Set With No Underwire,,,
,8,0.12,Teenage Girls' Puff Sleeve Floral Printed Short Sleeve Blouse,,,
30,10.24,0.2,"SHEIN Teen Boy Casual Loose Comfortable Coconut Tree Pattern Short Sleeve Top And Shorts Set, Spring And Summer",,,
800,6.1,0.13,SHEIN Tween Boy Summer College Style Classic Short Sleeve Striped Colorblock T-Shirt,,,
900,18.2,0.13,SHEIN Teen Boy 5-Pack Casual Basic Comfortable Round Neck Sleeveless Tank Tops For Spring And Summer,3,in Teen Boys Tanks,
400,5.4,0.16,"1pc Young Boys' Casual, College Style, Simple And Practical, Soft And Comfortable Short Sleeve T-Shirt With Digital Pattern, V-Neck, Loose And Breathable, Suitable For Daily Wear, School, Travel And Sports In Spring And Summer",,,
300,12.7,0.06,SHEIN Teen Girl Spring Summer Boho Raw Edge Hem Slant Pocket Distressed Denim Jeans Shorts,,,
,12.4,0.14,SHEIN Tween Boy Marled Side Stripe Tee & Sweatpants Set,,,
,5.62,0.27,"Young Girls Floral Pattern Elegant Sweet Ruffle Cap Sleeve High Waisted Dress, Summer Vacation, Cute Sleeveless Dress",,,6
100,10,0.06,"SHEIN Teen Girl's Woven Spaghetti Strap Dress With Floral Print, Knot And Hollow Out Detail For Casual Wear",,,4
3400,11.4,0.14,SHEIN Girls' Casual Vacation Embroidered Flower Denim Skirt Shorts 2pcs/Set,,,
100,2.5,0.11,5pairs Kids Solid Casual Ankle Socks For Daily Life,,,4
600,12.1,0.15,"SHEIN Tween Girl Summer Holiday Floral Printed Woven Cami Top And Straight Pants Set (Mommy And Me Matching Outfits, 6 Separate Pieces For Sale)",,,
1100,2.8,0.1,"3pc Elegant Rhinestone Wavy Head Hoop For Women And Girls - Glitter Hair Band For Face Wash, Skincare",,,
30,5.2,0.07,"1pc Baby Smart Phone Toy, Music & Light Story Machine For Early Education, Festival Gift",,,
400,17.8,0.07,Tween Girl Butterfly Printed Casual Wide Leg Jeans With Pockets,,,
50,3.2,0.09,"3pcs Stylish Sunglasses For Lovely Babies, Kids, Anti-Uv Cute Shades",,,13
400,3.33,0.24,"SHEIN Young Boy Solid Color Hooded Vest Casual Short Sleeve Top, Suitable For Summer",,,
50,8.4,0.07,Tween Girl Tropical Print Ruffle Hem Bikini Swimsuit,,,
500,8.9,0.06,"GOR Tween Girls' Casual Printed Straight Dress Suitable For Outdoor Party, Shopping And Vacation",,,
