selling_proposition,price,discount,goods_title,,rank_sub,color_count
1500,3.3,0,pc Titanium Steel Bangle  Mirror Polished  Vacuum Plated  Not Easy To Fade  Lucky Four Leaf Clover With Rhinestone  Fashionable Classic Style  Suitable For Daily Wear Silver Bracelet Gold Bracelet Stainless  Steel  Jewelry  Mothers Day Gift Teachers  Day Gift,,,null
1000,1.57,0.25,pcs Set Ball Beads Cuff For Women Men Bohemian Beach Gold Silver Color Bracelets Charms Metal Statement Jewelry,,,null
,2.4,0.08,Glasses Cleaner  pcs Glasses Cleaner Eyeglass Cleaner Eye Glass Cleaners Spray Zeiss Lens Cleaner Spray Eye Glass Cleaner Lens Cleaner Spray Eyeglasses Cleaner Spray Glasses Cleaner Spray Eye Glasses Cleaner Sunglass Cleaner Suitable For TV Screen Cleaning  IPad Screen Cleaning  Mobile Phone Cleaning  Monitor Cleaning  Laptop Screen Cleaning Agent,,,null
6000,1.7,0,Pc Shell Open Rings For Women Men Aesthetic Gold Color Stainless Steel Rings Wedding Summer Jewelry Accessories Gift,,,null
4700,2,0,Stainless Steel Waterproof Gold Plated Butterfly Shape Bracelet   Necklace Set  Suitable For Women s Daily Wear,,,null
200,0.75,0.53,pc  And Christian Gifts Keychains For Men Bible And Keychains Jeremiah       Keychains For Father Goddard Baptism Christmas Easter Valentine s Day Gifts,,,null
200,2.17,0.55,pc Baseball Caps Sequin Glitter Star Distressed Baseball Cap Hat High Bun Ponytail Adjustable Unisex Vintage Washed Low Profile Unstructured Trucker Cap Dad Hat Solid Color Hip Hop Cap For Men Women For Outdoor Trave Gifts,,,null
3000,2.1,0,pcs Wooden Geometric Drop Earrings,,,null
300,3.1,0,Cubic Zirconia Flower Decor Stud Earrings,,,null
1500,2.9,0,pairs Bamboo Joint Heart Design Hoop Earrings,,,null
900,1.32,0.18,pair Bohemian Round Soft Pottery Exaggerated American Flag Element Earrings Set For Independence Day,,,null
10000,1.6,0,pair Western Style Personality Retro Exaggerated Heart Shaped Fan Tassel Earrings  Suitable For Women s Daily Parties And Festival Gifts,,,null
100,2,0.05,Rhinestone Heart Drop Earrings,,,null
,1.6,0,Tucker Hat Chain Baseball Cap Decor Chain,1,in Women Body Chain Top,null
,1.8,0,Nylon Sport Loop Compatible With Apple Watch Band                     mm  Adjustable Breathable Women Men Braided Strap Compatible With Apple Watch Series Ultra                   SE,9,in Smartwatch Band,null
1000,6.16,0.2,pcs set Fashion Water Drop Earrings For Women For Daily Decoration,,,null
4800,1.6,0.06,Set Of   Stretch Beaded Bracelets  Multi Element Star   Square CCB Charm Bracelets,,,null
2000,1.6,0,pair European And American Exaggerated Metallic Flower Stud Earrings  Suitable For Women s Daily Wear,,,null
1600,4.2,0,pc Alloy   Rhinestone Ocean Themed Bracelet With Coral  Starfish  Shell And Anchor Pendants  Suitable For Ladies  Daily Wear,,,null
,3.2,0,pc Titanium Steel Bangle  Mirror Polished  Vacuum Plated  Not Easy To Fade  Lucky Four Leaf Clover With Rhinestone  Fashionable Classic Style  Suitable For Daily Wear,2,in Women Bangles,null
200,2.8,0,One Piece Dry Battery Electronic Watch For Women With Rose Gold Frame  Suitable For Daily Life And Festival Gift,,,null
600,1.22,0.24,Heart Decor Threader Earrings,,,null
9400,3.5,0,Letter Necklace Layered Initial Cross Necklace  Layering Square Letter Pendant Figaro Chain Cross Choker from A Z Capital Jewelry for Women Girls,,,null
1400,0.67,0.58,pc Fashionable Light Luxury Heart Decor Red Anklet For Women,,,null
70,1.3,0.07,DAZY Butterfly Design Hair Claw Cute,,,null
,1.75,0.03,Rhinestone Decor Hoop Earrings,9,in Women Hoop Earrings,null
100,1.7,0,pair New Vintage Geometric Round Hollow Pendant Earrings  Personalized Minimalist Women s Party Gift,,,null
1800,1.7,0,pair Vintage   Elegant Natural Turquoise Teardrop Shaped Earrings For Women,,,null
600,0.77,0.49,pc Butterfly Turquoise Bracelet Suitable For Women s Daily Wear  Holiday Gift,,,null
2300,2.7,0,pc Simple   Trendy   Classic Industrial Design Hexagon Bangle Bracelet,,,null
200,1.9,0,pcs DIY Flower Charm,,,null
8300,1.27,0.09,pair Women s Golden Color Faceted Circular Stud Earrings,,,null
6000,1.7,0,Pc Shell Open Rings For Women Men Aesthetic Gold Color Stainless Steel Rings Wedding Summer Jewelry Accessories Gift,,,null
4700,2,0,Stainless Steel Waterproof Gold Plated Butterfly Shape Bracelet   Necklace Set  Suitable For Women s Daily Wear,,,null
3000,2.1,0,pcs Wooden Geometric Drop Earrings,,,null
300,3.1,0,Cubic Zirconia Flower Decor Stud Earrings,,,null
1500,2.9,0,pairs Bamboo Joint Heart Design Hoop Earrings,,,null
10000,1.6,0,pair Western Style Personality Retro Exaggerated Heart Shaped Fan Tassel Earrings  Suitable For Women s Daily Parties And Festival Gifts,,,null
100,2,0.05,Rhinestone Heart Drop Earrings,,,null
1000,6.16,0.2,pcs set Fashion Water Drop Earrings For Women For Daily Decoration,,,null
,1.6,0.06,Set Of   Stretch Beaded Bracelets  Multi Element Star   Square CCB Charm Bracelets,5,in Women Beaded Bracelets,null
2000,1.6,0,pair European And American Exaggerated Metallic Flower Stud Earrings  Suitable For Women s Daily Wear,,,null
1600,4.2,0,pc Alloy   Rhinestone Ocean Themed Bracelet With Coral  Starfish  Shell And Anchor Pendants  Suitable For Ladies  Daily Wear,,,null
200,2.8,0,One Piece Dry Battery Electronic Watch For Women With Rose Gold Frame  Suitable For Daily Life And Festival Gift,,,null
600,1.22,0.24,Heart Decor Threader Earrings,,,null
2300,1.6,0,pcs Bohemian Style Glass Bead Bracelets With Spring Colorful Elements,,,null
100,1.7,0.11,pcs Set Colorful Macaron Color Hair Clips Y k Style Cute And Sweet Casual,,,null
5500,0.96,0.56,pcs Fashion Kawaii New Space Astronaut Bunny Doll Keychain For Women Men Cute Backpack Pendant Accessories Couples Gift Car Key Ring  Soft Rubber Small Pendant Keyring Pendant Bag Ornaments Car Key Accessories,,,null
1100,2.3,0,pc Gold Stainless Steel Ball Design Trendy Necklace With Vintage Multilayered Beads  Hip Hop Style Personality Clavicle Chain  Elegant Necklaces,,,null
10000,2.3,0,pcs set Textured Metal Bracelet,,,null
3100,1.5,0.12,Vintage Faux Pearl Decor Starfish Shaped Hair Clip Stylish Hair Bun Maker Accessory  Suitable For Women And Girls For Daily Wear,,,null
100,4.5,0.04,pc      Colorful Natural Stone Handmade Beaded Elegant Fashion BOHO Jewelry Copper Gold Plated Lobster Clasp Women Necklace As Summer Gifts For Her,,,null
4900,1.6,0,Classic Round Shaped Ring Set Suitable For Women s Daily Wear,,,null
,2.9,0.06,pc Women s Sponge Mesh Color Block Hollow Out Breathable Baseball Cap,5,in Women Baseball Cap,null
1300,1.44,0.2,pair Fashionable And Luxurious Carved Plant   Flower Design Earrings With Imitation Pearls For Summer Outfits  Exaggerated European And American Style Ear Jewelry,,,null
300,2.3,0,pair Metallic Ball Chain Drop Earrings,,,null
3500,1.76,0.2,Minimalist Cuff Bangle,,,null
,2.3,0,Fashionable and Popular  pcs Men Star   Flower Decor Beaded Necklace for Jewelry Gift and for a Stylish Look,6,in Men Necklace Sets,null
100,1.6,0.06,pc Women s Glittering Rhinestone Decorated Bowknot Mesh Hair Twist Clip Bun Maker  Suitable For Parties,,,null
500,3.1,0,pc Portable Leather Jewelry Storage Box With Snap Closure  For Earrings  Necklaces  Rings  Bracelets,,,null
2300,1.7,0.06,pc Women s Solid Color Double Layer Bow Hair Claw Clip With Ribbon Streamers  Suitable For Daily Use Elegant,,,null
,3.5,0.08,pc Unisex Solid Drawstring Adjustable Sun Protection Casual Bucket Hat For Outdoor,5,in Men Bucket Hat,null
60,5.15,0.28,pc Color Block Double Braided Head Wrap Hat,,,null
1000,6,0,pc Heart   Rhinestone Decor Zinc Alloy Bracelet Design WatchBand Compatible With Apple Watch Band   mm   mm   mm   mm   mm   mm   mm Apple Watch Strap Compatible With Apple Watch Series Ultra     SE,,,null
,1.5,0,pc Faith Wwjd Bracelet What Would Jesus Do Letter Matching Couple Protection Braided Rope Inspirational Christian Gift Friendship Bracelet Gift,10,in Women String Bracelets,null
10000,2.7,0.07,pcs Women s Silver Tone Cute Fashionable Hair Clips With Star And Cloud Design  Suitable For Short Hair Daily Wear Casual,,,null
2300,1.8,0.05,pair Simple And Twisted Geometric Ear Clip For Ladies,,,null
1400,2.2,0,SHEIN VCAY Geometric   Tassel Drop Earrings,,,null
1500,1.3,0.07,pc Women Black Solid Casual Banana Clip For Daily Life Street,,,null
1600,1.8,0.05,pcs Ballet Style Long Ribbon Bow Hair Clip  Fashionable And Cute Women Hair Accessory  Suitable For Daily Wear On Any Occasion,,,null
400,1.3,0.07,pc Elegant Bow Decorated Hair Claw Clip  Large Size Hair Clipper For Women And Girls  Suitable For Anti Slip Ponytail And Bun Hairstyles,,,null
1700,1.6,0,Rhinestone Detail Star Drop Earrings,,,null
,6.6,0,Layering Stacking Graffiti OOAK      Beach Boho Bohemian Colourful Beads Creative Handmade Mix Gem Natural Stone Beaded Necklace Necklace For Women Jewelry Wholesale Graffiti OOAK,2,in Women Beaded Necklaces,null
,0.96,0.2,Fashionable and Popular Men Arrow Charm Necklace Alloy for Jewelry Gift and for a Stylish Look,2,in Men Fashion Jewelry,null
200,5.92,0.2,Rhinestone Decor Visor Hat,,,null
6500,2.08,0.2,pc Ladies  Round Plastic Fashion Sunglasses Suitable For Outdoor Travel  Party Decoration  Blocking Strong Light  Filtering Harmful Rays  Cycling And Everyday Use Boho,,,null
1800,2.3,0,pcs Set Women s Bohemian Style Elephant Tassel Pendant Beaded Boho Bracelet,,,null
10,1.3,0,Sanrio Hello Kitty Cartoon Beaded Pendant Bracelet For Women,,,null
6200,1.5,0,Fashionable Silver Tone Hoop Earrings,,,null
4100,2.4,0.08,pcs Set Large Hair Bows For Women  Satin Double Layer Big Hair Clips Bowknot Hair Barrette French Hair Accessories Cute,,,null
300,0.99,0.6,pcs Self Sealing OPP Bags Pouches Laser Iridescent Zip Lock Bag Repeatable Packaging Jewelry Retail Bag Pouches Bags Gift Wrapping Bags,,,null
100,1.3,0.07,Heart Pendant Keychain,,,null
1400,2,0,pc Stylish Cross Pendant Thin Chain Men s Necklace  Waterproof And Fadeless  Ideal For Daily And Festive Parties,,,null
3200,1.8,0,pair Luxury   Delicate   Full Faux Pearl   Circular Ear Studs  Korean Style   Niche Design   High Fashion Earrings,,,null
1600,1.9,0,Bohemian Style Handmade Crystal Beaded Bracelet With Women s Vacation   Party Wear Jewelry,,,null
4500,1.9,0,Minimalist Hoop Earrings,,,null
100,1.8,0,pcs Rhinestone Decor Jewelry Set,,,null
100,4.4,0,pcs Geometric Minimalism C Shaped Faux Pearl Earrings Set For Women   Birthday  Vacation Or Date Gift,,,null
,3.4,0.08,Pairs Women s Square Shape Stud Accent Black Transparent Blue Light Blocking Glasses For School Clear Glasses Accessories,5,in Women Eyeglasses,null
,1.2,0.2,Fashionable and Popular  pc Men Minimalist Chain Necklace  Stainless Steel Jewelry for Jewelry Gift and for a Stylish Look,4,in Men Chain Necklaces,null
1900,1.76,0.2,pcs set Minimalist Beaded Bracelet,,,null
70,6.9,0.12,pc Oversized Tail Keychain Plush Animal Key Chain  Women s Handbag Pendant  Pom Poms Purse And Car Key Accessories  Women Girls Gift Random Pattern Therian Tail,,,null
900,2.2,0,pc Lace Floral Hollow out Pattern Silicone Strap  Waterproof Sports Watch Band For Women  Compatible With Apple Watch                   ultra se,,,null
8200,1.8,0,pcs Set Fashionable Minimalist Metal Stackable Anklet Set For Women  Perfect For Beach Vacation And Party  Gift,,,null
500,2.4,0.08,Pcs Basketball Series Shoe Charms For Clogs Sandals  PVC Shoe Charms Premium Quality Popular Decorations Accessories Great Gifts For Christmas  Birthday  Party,,,null
3600,2.1,0.05,pc Jasmine Flower Rhinestone Pearl Tassel Hair Clip Boho,,,null
3200,2,0.05,pcs Women s Wide Comfortable Elastic Headbands In Black  White And Gray For Yoga  Sports  Outdoor Activities And Vacation Casual,,,null
,3.6,0.12,Piece Of New Fashion Gold Bracelet Women s Watch Retro Luxury Fashion Simple Elegant Light Luxury Elegant Versatile Watch Women s Quartz Watch,7,in Women Watches,null
5100,1.4,0,Evil Eye Pendant Necklace,,,null
900,1.3,0,Flower Design Stud Earrings,,,null
700,0.82,0.45,Pc Punk Rock Double C Ear Cuffs Double U Shaped Ear Cuff Clip Earrings For Women No Piercing Fake Cartilage Earring,,,null
50,1.71,0.1,Sport Silicone Band Compatible With Apple Watch Band   mm   mm   mm   mm   mm   mm   mm Women Men Soft Wristband Waterproof Replacement Sport Strap Compatible With Apple Watch Band Series                   SE Ultra,,,null
1100,1.6,0.11,Silky Satin Hair Bows Big Hair Bows For Women Hair Ribbons Oversized Long Tail White Hair Bow Black Hair Bow Large Hair Ribbon Barrettes Metal Clips Bowknot Aesthetic Hair Accessories,,,null
3300,1.5,0,pcs Artistic   Vintage Leather Hollow Out Teardrop   Round Wooden Earrings For Women,,,null
600,1.5,0,pcs Faux Pearl Colored Plastic Starfish   Shells For Necklace  Bracelet  Clothing  Earring Diy Decoration  Wedding Supplies  Material,,,null
5100,1.8,0,pc Vintage Moonstone inspired Wide Multi layer Ring For Women  Daily Casual Accessory,,,null
,12,0,pc     Degree Desktop Rotating Cosmetic Storage Box  Large Capacity Makeup Box  Plastic Circular Skincare Display Box  Multifunctional Makeup Box  Skincare Storage Box  Plastic Makeup Brush Storage Box  Kitchen Supplies  Rotatable Storage Tray  Salt  Sauce And Vinegar Countertop Storage Rack  Seasoning And Seasoning Rack Seasoning Box,6,in Home Life,null
5100,2.1,0,pcs Fashionable Heart Shaped Ring Set  Simple Geometric Design With Rhinestone Embellishment  Bohemian Style,,,null
,1.5,0,pc Apple Watch Case Black Sport     Degree Protection Waterproof And Anti Drop Case Compatible With Apple Watch Case Screen Protector   mm  mm  mm  mm  mm  mm  mm Tpu Soft Bumper Case Apple Watch Series   Ultra       Se       Accessories,2,in Watch Case & Screen Protectors,null
20,1.5,0,pc    Letters Couple Bracelets For Women Teen Girls Adjustable A Z Initials Braided Bangles Graduation Birthday Gifts Jewelry Valentine s Day,,,null
800,2.2,0,pc Multilayer Stacked Personalized Fully Crystal Cross Pendant Necklace For Layering,,,null
,1.86,0.02,pcs set Minimalist Metallic Chain Anklet Set For Women For Summer Outdoor,9,in Women Anklets,null
900,1.7,0,Elegant Flower Earrings For Women,,,null
5100,3.5,0.08,pcs Women Plastics Square Frame Fashion Sunglasses For Daily School Life Clothing Accessories Boho,,,null
2600,3.2,0.09,Boho Round Frame Fashion Glasses,,,null
1600,2.04,0.03,pcs Set Bracelets For Women Waterproof   Adjustable         Trendy Thin Dainty Stackable  Link Paperclip Chain Bracelet Pack Fashion Accessories Gifts For Women Girls,,,null
4800,2,0,pcs set Fashionable Chic Chunky Hoop Earrings Set  Suitable For Parties  Dates  Gifts And Daily Wear,,,null
700,1.3,0,pcs Round ABS Pearl Beads  White And Ivory   mm   mm  For DIY  Skin Friendly And Fadeless  Single Double Hole     pcs Pack,,,null
6700,2.4,0,pc Fashionable Zinc Alloy Cross Pendant Necklace For Women s Daily Wear,,,null
50,1.45,0.5,pcs Men s Hip Hop Stainless Steel  Chain Rotate Decompression Ring Cross Set,,,null
1300,2.2,0.08,Bohemian Small Flowers Decor Artificial Leather Rope Bracelet  Simple Retro Layered Bracelet  Holiday Gift,,,null
4000,5.8,0.06,pcs set Women s Trendy All match Belt With Triple Circle Alloy Buckle Decoration,,,null
400,7.9,0,pc Pink European Style Resin Tray With Retro Bowknot Design Fruit Plate For Jewelry   Fruit Storage   Display  Gift For Valentine s Day,,,null
100,1.7,0,Cloud Charm Necklace,,,null
500,2,0,pair Bohemian Style Beaded Antique Bronze Plate Fashion Pendant Earrings  Women s Personality Party Gift,,,null
700,5.5,0.08,Unisex Fashion Baseball Cap Sunscreen Sunshade Hat Truck Driver Cap Patchwork  D Embroidery Vintage Digital Washed Hat,,,null
500,6.11,0.14,Pieces Set  Thank You Card And Sticker Set     Thank You Business Cards  With    Packaging Bags And     Stickers For Wedding And Party Supplies,,,null
400,1.26,0.16,pc Butterfly   Copper   Cubic Zirconia Fake Nose Ring,,,null
,1.7,0.11,pc Women Faux Pearl Beaded Elegant Keychain for gifts  wallets  school bags  backpacks  and satchels,5,in Women Keychains,null
1500,2.58,0.32,Oversized Cat Eye Clear Lens Glasses Retro Gradient Jelly Color Spectacles Party Prom Decorative Glasses For Women Men,,,null
,6.1,0,pcs Mixed Color Gift Bag  Modern Paper Gift Wrapping Bag For Party,1,in Gift Wrapping Supplies,null
8200,1.1,0,Flower Design Stud Earrings,,,null
2500,2.9,0,Starfish   Conch Charm Necklace,,,null
900,1.3,0,C Shaped Love Heart Teardrop Design Gold Color Women s Earrings  Exquisite Jewelry Gift For Girls,,,null
600,0.87,0.46,pcs Cow Print Scrunchie Casual,,,null
1100,1.9,0,pc Elegant   Stylish White Cubic Zirconia Inlaid Women Ring For Wedding Engagement Mother Day Gift,,,null
1000,1.7,0,pcs Hangover Gift Bag Loose Single Party Gift Drawstring Tool Bag Suitable For Wedding Bride Gifts  Hangover Survival Guests  Bridesmaids  Single Party Supplies,,,null
7600,1.9,0,pc Bohemian  Vintage Beach Anklet With Tassels   Coins  Perfect For Matching With Swimwear Or Dance Costumes  Ideal Gift For Mother,,,null
900,3.46,0.48,Women s Big Brim Sun Hat Floppy Foldable Bowknot Straw Hat Summer Beach Hat,,,null
1800,2.4,0.2,A Roman Numeral Black Shell Love Gold Women s Bracelet Everyday Versatile Stainless Steel Jewelry,,,null
6200,2.4,0.08,pcs Set Lovely Floral Printed Hair Claw   Hair Claw Set For Daily Use Boho Casual,,,null
800,1.6,0,Minimalist Stud Earrings,,,null
800,3.7,0,pcs Set Bohemian Classic Minimalist Copper Beads With Scattered Distribution  Elastic   K Gold Plated Bracelet For Women  Summer Bracelet  Friend Gift,,,null
1000,2.25,0.22,pc Printed Bandana Women s Fashionable Imitation Neck Scarf Elegant Square Bandana Bandana Hair Band Head Band Ideal For Dressing Up Your Look,,,null
1500,1.65,0.25,pcs set Bohemian Shell Decor Stone Beaded Anklet Set For Women For Summer Beach Travel,,,null
2400,9.7,0.08,A CEY Abaya Made Of Breathable And Skin Friendly Fabric  Suitable For Women Daily Wear,,,null
900,3,0,pcs Beach Style Alloy Faux Pearl   Shell Shaped Pendant Necklace Set  Suitable For Women  Couples  Daily Wear  Jewelry Gift,,,null
4100,1.8,0,pc Non Piercing Navel Ring With  mm Large Cubic Zirconia And   Rhinestones For Women Daily Wearing,,,null
7400,8.08,0.2,pcs Plastic Frame Geometric   Classic Sunglasses Combo  Summer Decoration Vintage Shades Beach Accessories,,,null
2300,1.6,0,pair High End Geometric Design Comma Shaped Earrings For Women  European And American Style  Fashionable And Creative Jewelry For Beach Summer Outfit,,,null
1800,2.8,0,PCS Rings Set Stackable Thin Rings Cubic Zirconia Wedding Rings For Women Wedding Bands Aesthetic Jewelry,,,null
900,2.7,0,pc Hip Hop Style Flip Cover Chain Necklace With Rhinestone Detail  Sparkling Unisex Fashion Jewelry Valentine s Day Gift,,,null
2900,1.5,0,pair  Licensed Disney Lilo   Stitch Cute Cartoon Floral Stud Earrings For Women   Teen Girls Lovely Ear Accessories Jewelry Gift For Fans,,,null
,2.65,0.02,pcs set Fashion Faux Pearl Earrings Geometric Twist Hoop Design For Dating   Party  Golden Color,2,in Women Jewelry Sets,null
1600,2.6,0,pc Boho Bead Decor Flower Charm Necklace For Women For Daily Decoration,,,null
800,1.6,0.06,pcs Pressure Headband For Women With Teeth Non Slip Special Face Wash Headband Net Red Hair Card Broken Hair Clip Headband Hair Bundle Tiaras,,,null
1800,1.7,0,pc Fashionable And Elegant Diamond Inlaid Rotatable Ring For Women  Rotating Anti Anxiety Stress Reducing Ring  Sweet Little Known Ring For Women  Adjustable Ring Suitable For Couples On Wedding Day  Ladies  Tail Ring  Bee   Chrysanthemum Rotating Ring  Simple And Trendy Couple s Hand Ornament  Romantic Joint Ring And Tail Ring,,,null
300,3.1,0,Rectangle Pointer Quartz Watch,,,null
600,1.89,0.27,pcs Cubic Zirconia Eternity Band Ring Delicate Jewelry Party Wedding Engagement Decor For Women Girls Gift,,,null
700,1.5,0,pair Of Lovely Forest Style Small Fresh Colorful Geometric   Floral Detail Round Earrings  Suitable For Women s Daily Wear,,,null
10000,1.36,0.2,Pairs Punk Hoop Earrings Set Big Circle Earrings Jewelry for Women Girls Steampunk Ear Clip Punk Style Earring Ear Ring,,,null
300,10.49,0.4,Color Block Cheerleader Costume Set,,,null
4100,1.3,0,Pair Of Simple Geometric Drop Shaped Earrings For Women  Versatile Cold Style Earrings  European And American Ccb Earrings  Earrings Accessories,,,null
20,2.9,0,pc Fashionable Seashell  Starfish   Mermaid Multiple Pendants Collar Necklace  Beach Vacation Style,,,null
6300,1.2,0,pair Fashionable Zinc Alloy Faux Pearl Decor Drop Earrings For Women For Daily Decoration,,,null
10000,1.12,0.2,pair Fashion Rhinestone Decor Earrings For Women For Daily Decoration Dating Gift,,,null
,1.65,0.34,pair Fashion Gold Color A Z    Letters Cuff Link For Men For Father s Day Gift,7,in Men Cufflinks and Tie Clips,null
300,2.4,0,pc Clover   Mother Of Faux Pearl Decor Stainless Steel Bracelet  Minimalist Style For Women,,,null
6200,3.2,0.06,pc Women s Multicolor Triangular Cat Eye Fashion Sunglasses  Suitable For Traveling Cute Shades Beach Accessories,,,null
900,1.7,0,pcs Acrylic Colorful Star Shaped Earrings With US Flag  Suitable For Independence Day  Daily Wear  Vacation  Party And Dating  Exquisite Jewelry Set For Girlfriend,,,null
1100,2.06,0.36,Fashionable Floral Printed Square Scarf For Women  Casual Sunscreen Headscarf Or Shawl Bandana Hair Band Head Band Ideal For Dressing Up Your Look,,,null
3000,2.7,0,pcs Minimalist Chain Bracelet  Stainless Steel Jewelry,,,null
,2.9,0.06,pc Women s Diameter   cm Stretchable Cap With Ribbon  Bowknot  Silk Like Material  Wide Brim  Suitable For Sleeping  Hair Styling  Beauty And Hairdressing Silk Bonnet Satin Bonnet,7,in Women Hats,null
1100,1.7,0,pcs    pcs Self Adhesive Sealing Clear OPP Bags  Resealable Plastic Bags For Large Scale Packaging Of Small Gifts  Party Favors  And Toys,,,null
4400,1.6,0.2,pcs Flower Decor Jewelry Set,,,null
300,8.7,0,pc     Silver Mini Cute Luxury Artificial Clover Pendant Necklace  Perfect For Women s Daily Wear Holiday,,,null
,5.84,0.2,pcs Gold Tone Square Buckle Everyday Dressy Waist Belt For Women s Clothes  Jeans And Dresses Casual,3,in Casual Women Belts & Belts Accessories,null
100,1.9,0.05,Rhinestone Leaf Design Brooch,,,null
1200,1.6,0,pc Blue Fashionable Wave Rings For Women  Daily Wear Ring,,,null
600,2.25,0.25,box    pcs Fashionable White Acrylic Bead Accessory Set For Ladies  Clothing   Accessories  Suitable For Diy Bracelet   Necklace Making  Daily Wear,,,null
4700,1.5,0,pcs Simple Personalized Acrylic Letter apple polymer Clay bead String Bracelet For Teacher s Day,,,null
500,0.96,0.26,pc Girl Fashion Cute Bag Charms Yellow Pink Blue Black Enamel Metal Happy Smile Face Keychain For Women,,,null
400,0.96,0.31,Fashionable And Minimalist Twist Rope Necklace  Perfect For Holiday Parties And Dating  As A Gift Or Daily Accessory,,,null
1600,1.9,0,Bohemian Style Handmade Crystal Beaded Bracelet With Women s Vacation   Party Wear Jewelry,,,null
4500,1.9,0,Minimalist Hoop Earrings,,,null
100,1.8,0,pcs Rhinestone Decor Jewelry Set,,,null
100,4.4,0,pcs Geometric Minimalism C Shaped Faux Pearl Earrings Set For Women   Birthday  Vacation Or Date Gift,,,null
,3.4,0.08,Pairs Women s Square Shape Stud Accent Black Transparent Blue Light Blocking Glasses For School Clear Glasses Accessories,5,in Women Eyeglasses,null
,1.2,0.2,Fashionable and Popular  pc Men Minimalist Chain Necklace  Stainless Steel Jewelry for Jewelry Gift and for a Stylish Look,4,in Men Chain Necklaces,null
1900,1.76,0.2,pcs set Minimalist Beaded Bracelet,,,null
70,6.9,0.12,pc Oversized Tail Keychain Plush Animal Key Chain  Women s Handbag Pendant  Pom Poms Purse And Car Key Accessories  Women Girls Gift Random Pattern Therian Tail,,,null
900,2.2,0,pc Lace Floral Hollow out Pattern Silicone Strap  Waterproof Sports Watch Band For Women  Compatible With Apple Watch                   ultra se,,,null
8200,1.8,0,pcs Set Fashionable Minimalist Metal Stackable Anklet Set For Women  Perfect For Beach Vacation And Party  Gift,,,null
6300,1.2,0,pair Fashionable Zinc Alloy Faux Pearl Decor Drop Earrings For Women For Daily Decoration,,,null
10000,1.12,0.2,pair Fashion Rhinestone Decor Earrings For Women For Daily Decoration Dating Gift,,,null
6200,3.2,0.06,pc Women s Multicolor Triangular Cat Eye Fashion Sunglasses  Suitable For Traveling Cute Shades Beach Accessories,,,null
1100,2.06,0.36,Fashionable Floral Printed Square Scarf For Women  Casual Sunscreen Headscarf Or Shawl Bandana Hair Band Head Band Ideal For Dressing Up Your Look,,,null
3000,2.7,0,pcs Minimalist Chain Bracelet  Stainless Steel Jewelry,,,null
1100,1.7,0,pcs    pcs Self Adhesive Sealing Clear OPP Bags  Resealable Plastic Bags For Large Scale Packaging Of Small Gifts  Party Favors  And Toys,,,null
4400,1.6,0.2,pcs Flower Decor Jewelry Set,,,null
100,1.9,0.05,Rhinestone Leaf Design Brooch,,,null
600,2.25,0.25,box    pcs Fashionable White Acrylic Bead Accessory Set For Ladies  Clothing   Accessories  Suitable For Diy Bracelet   Necklace Making  Daily Wear,,,null
4700,1.5,0,pcs Simple Personalized Acrylic Letter apple polymer Clay bead String Bracelet For Teacher s Day,,,null
400,0.96,0.31,Fashionable And Minimalist Twist Rope Necklace  Perfect For Holiday Parties And Dating  As A Gift Or Daily Accessory,,,null
,5.2,0,New Arrival Square Casual Simple Atmosphere Steel Strap Gold Dial Women s Wristwatch,8,in Women Quartz Watches,null
1100,2.2,0,pc Y K Sweet Cool Natural Beaded Starfish   Imitation Shell   Blue Glass Charm Bracelet For Women  Daily Party,,,null
800,0.87,0.33,pair Vintage Wooden Round Hollow Out Pendant Earrings,,,null
1000,1.3,0,Water Drop Charm Earrings,,,null
,1.9,0.05,pc White Color Elegant Vintage Pure Color Hair Bow Barrette With Ribbon Streamers  Suitable For Daily Use  Festival Gift  Party  Etc  Cute,5,in Casual Hair Clips,null
1600,3.46,0.5,Solid Wide Brim Straw Hat Boho,,,null
1000,1.3,0.07,Butterfly Decor Hair Slide With Stick Street Hair Clips,,,null
2800,1.6,0.06,Pc Women s Y K Style Butterfly Alligator Hair Clip  Metal Hair Clip For Daily Use Royal,,,null
1800,2.9,0,Colorful hot pink shell sequin beaded flower drop earrings statement earrings for girl and women gift for her summer beach,,,null
