selling_proposition,price,discount,goods_title,rank_title,rank_sub,color_count
700,12.6,0.15,SHEIN Young Girl Summer Solid Color 3D Flower Mesh Strap Vest And Skirt With Bowknot Decoration Lovely 2pcs Set,,,4
,6.3,0.07,"1pc Teenage Girls' Casual Printed Round Neck Pullover Short Sleeve T-Shirt, Summer, Student Clothing",,,
100,12.6,0.16,SHEIN Young Boys' 4pcs/Set Comfortable Macarons Color Casual Breathable Shorts Suitable For Spring And Summer,,,
200,6.7,0.07,Tween Girls' Floral Printed Bikini Swimsuit With Shoulder Straps,,,
,6.18,0.13,"Young Girl Stretchy American Style Ice Cream & Fireworks Print Short Sleeve Dress Summer Gift, Independence Day, Party",,,
,13,0.07,"Tween Boy Dark Grey Simple Sport Football Printed Round Neck Short Sleeve Top Matching Shorts, Casual 2PCS Home Wear Outfit",5,in Tween Boys Pajamas,
1500,7,0.14,"3D Dinosaur Print, Tyrannosaurus Rex Print, Young Boy Casual Simple Round Neck Short Sleeve T-Shirt And Shorts Set, Suitable For Summer",,,
2500,4.06,0.15,Young Girl's Cartoon Pattern Short Sleeve T-Shirt,,,
1000,11.88,0.18,SHEIN Tween Boys' Casual Street Graffiti Letter Print Round Neck Loose Fit T-Shirt With Solid Color Knitted Shorts Set,,,8
2100,14.2,0.06,SHEIN Teen Girl Woven Solid Color Bubble Ruched Double Layered Hem Swing Cami Dress,3,in Teen Girls Dresses,
1800,11.4,0.11,Teen Girl Solid Drop Shoulder Hoodie,1,in Teen Girls Sweatshirts,7
2200,3.8,0.16,"Young Boy Casual Short Sleeve Cartoon Space Pattern Round Neck T-Shirt, Suitable For Summer",,,
,12.3,0.08,Tween Boy Spring/Summer Casual Camo Cargo Denim Shorts,4,in Tween Boys Denim,
600,4.4,0.14,"Tween Girl Spider Pattern Knit Round Neck Short Sleeve T-Shirt, Sporty Style",,,
300,8.84,0.18,SHEIN Young Boy Casual Round Neck Matching Dinosaur Print Short Sleeve T-Shirt And Shorts Set,,,6
100,7.03,0.29,SHEIN Young Boy Color Blocking Striped Pocket Shirt And Striped Shorts Two Piece Set,,,7
200,8.3,0.14,SHEIN Young Boy 3pcs/Set Casual Shorts With Applique Detailing,,,
1000,7,0.15,Nick 90s X SHEIN Tween Boy Cartoon Figure Graphic Tee,,,
200,7.6,0.07,SHEIN Tween Girl Loose Casual Round Neckline Striped Pattern Side Slit Pullover Dress,,,
100,10.8,0.06,SHEIN Teen Girls One Shoulder Belted Romper,,,
800,8.53,0.16,Nick 90s X SHEIN Young Girl Joyful Friends Print Color Block Short Sleeve T-Shirt And Shorts Set,,,
,7.5,0.11,SHEIN Teen Girl Loose Fit Drop Shoulder Tie-Dye Graphic Colorful Bright Street Casual Sports T-Shirt,,,
2700,13.8,0.07,Tween Girl 3pcs Plaid Print Elastic Waist Pants Wearable In All Seasons,,,
100,11.1,0.14,SHEIN Tween Boy Patched Detail Top & Track Shorts Set,,,4
1200,4.3,0.27,"1pc Teenage Girls' Casual Printed Round Neck Pullover Short Sleeve T-Shirt, Summer, Student Clothing",,,
800,5.04,0.32,Young Girl's Color Block Striped Ruffle One-Piece Swimsuit,,,
200,17.2,0.07,"SHEIN Tween Girl Y2K Spring And Summer Streetwear Ripped Straight Leg Jeans,Girls Summer Clothes",,,
10,10.5,0.13,SHEIN Tween Girl Loose Casual Round Neck Bunny Cute Printed T-Shirt And Shorts Set,,,
400,9.8,0.08,Young Girl Flower Printed Shorts For Summer,,,
500,11.6,0.07,Tween Girl 4pack Solid Bikini Swimsuit With Cover Up Set,,,
,7.9,0.13,"Tween Girl Casual Summer Landscape Printed Short Sleeve T-Shirt And Shorts Set, Suitable For Summer",,,
2400,4.4,0.29,Tween Girls' Fashionable Sporty Knitted Solid Color Flying Sleeve Square Neck T-Shirt,,,
1700,8.51,0.53,SHEIN Streecool Kids Tween Girls' Stylish Casual Denim Cargo Pants With Side Flap Pockets,,,
1000,4.17,0.44,Young Boys' Casual Spider & Digital Print Short Sleeve T-Shirt And Shorts 2pcs/Set,,,
,12.6,0.07,SHEIN Tween Girl Y2K Grey Summer Raw Edge Slant Pocket Denim Shorts,,,
2800,8.55,0.25,Tween Boy Holiday College Sailboat Printed Polo Collar Short Sleeve Half-Zip Sweater And Solid Shorts Set,,,
1100,7.9,0.14,SHEIN X Care Bears Tween Girl Loose Fit Casual Round Neck Short Sleeve T-Shirt With Colorful Teddy Bear And English Letter Print,,,
4100,9.4,0.08,"Tween Boy Sports Outfits 2pcs/Set, Summer, For Big Kids, Casual Digital Printed Set",,,
500,14.2,0.06,Teen Girls' Solid Color Basic Casual Sports Bra Set (Multiple Pieces),3,in Teen Girls Underwear,
600,8.37,0.17,SHEIN Teen Girls Textured Cut Out One Piece Swimsuit,,,6
3100,11.5,0.12,SHEIN Tween Girl Solid Color Loose Casual Denim Shorts With Ripped And Fringed Edge,,,
1300,6.44,0.44,Teen Girl Heart & Slogan Graphic Hoodie,,,
,3.66,0.27,SHEIN Young Boy Letter Graphic Tee,,,
1000,8.8,0.06,Teen Girls Solid Ring Linked Bikini Swimsuit,,,5
1200,18.7,0.14,SHEIN Genkimix Kids 6pcs Young Girls' Casual Comfortable Multicolor Short Sleeve T-Shirt And Sports Pants Set,,,
,3.8,0.07,Young Girl Cartoon And Slogan Printed Short Sleeve T-Shirt,,,
700,3.93,0.42,"Tween Boy 2024 New Summer Casual Short-Sleeved Round-Neck T-Shirt With English Print, White",,,
1900,5.4,0.14,SHEIN Tween Girl Elegant Solid Color Round Neck Ruffle Hem Side Tie Tank Top,,,13
400,12.5,0.13,SHEIN Tween Girl Car & Letter Graphic Pullover & Cami Unitard Jumpsuit,,,
700,8.9,0.06,Teen Girl Floral Print Smocked Ruffle Hem Bikini Swimsuit,,,
1900,6.7,0.07,Tween Girl Floral Print Bikini Swimsuit,,,
300,6.3,0.07,Tween Girl Casual Fun Printed Round Neck Pullover Short Sleeve T-Shirt Summer Top,,,
800,11.4,0.14,Tween Boy Casual Street Fashion Alphabet Print Round Neck Short Sleeve Pullover T-Shirt And Solid Color Patchwork Shorts Knitted 2-Piece Outfit Set,,,
500,12.24,0.28,"Tween Girls' Blue Jeans With Five-Pointed Star Patchwork, Straight Leg Wide Leg Denim Pants",,,
1400,13.9,0.14,Young Girl Vintage Basic Distressed Short Denim Jacket For Daily Wear,6,in Young Girls Denim,5
200,3.2,0.09,"100pcs/set Mixed Color Flower, Rabbit Ears, Five-pointed Star, Crown Hair Clips Set For Baby Girls",,,8
2900,10.4,0.05,SHEIN Teen Girls' Knitted Solid Color U Neck Tight-Fitting Sport Jumpsuit,10,in Teen Girls Bodysuits & Jumpsuits,
1300,10.4,0.11,Teen Girl Solid Elastic Waist Sweatpants,3,in Teen Girls Sweatpants,
2900,13.3,0.15,SHEIN Young Girl ChocoLa Music Festival Jacquard Monochrome Square Neck Sleeveless Long Dress,,,9
10,6.8,0.13,Girls' Casual Butterfly & Heart Print Short Sleeve T-Shirt And Leggings 2pcs/Set,,,
700,7.39,0.16,Tween Girls' Round Neck Butterfly Printed Casual Dress With Cut Out Shoulder Design,,,
1500,7.5,0.15,SHEIN Young Girl 2pcs/Set Casual Tie Dye Letter Print Short Sleeve Round Neck T-Shirt And Shorts Summer Outfits,,,5
900,15.2,0.07,Young Girl Letter Printed Short Sleeve T-Shirt And Shorts Set,,,
1300,4,0.07,Young Girl Slogan Printed T-Shirt,,,
1200,6.8,0.14,SHEIN Tween Boy Solid Color White Casual Basic Pocket Spring Autumn Winter Turn-Down Collar Shirt,2,in Tween Boys Shirts,7
70,3.9,0.07,"Tween Girl 1pc Black Striped Tank Top, Casual And Simple, Spring And Summer",,,
100,17.2,0.14,Young Girl 3pcs/Set Fashionable Leopard Love Letter Slogan Print Short Sleeve T-Shirt And Leggings Set,,,
,7.1,0.15,SHEIN Tween Girl Round Neck Flower Pattern Mesh T-Shirt Inside With Strap Camisole And Vest Four Pieces Set,,,4
100,7.22,0.12,"Tween Girl 2pcs Printed Bra & Bikini Bottom 4th Of July Bikini Set, For Summer Beach",,,
1300,11.8,0.06,SHEIN Teen Girls Ripped Raw Hem Denim Shorts,4,in Teen Girls Clothing,4
300,6.63,0.15,Teen Girl Summer Vacation Style Plant Printed Spaghetti Strap Dress,,,
900,4,0.07,"4pcs Heart Shaped Fashionable Glasses Set For Boys And Girls, Suitable For Daily Use",1,in Kids Fashion Glasses,11
500,8.7,0.14,SHEIN Tween Girl Checker Print Sweater Vest Without Tee,6,in Tween Girls Sweaters,
,12.8,0.15,SHEIN Tween Girl Ruffle Trim Top & Floral Print Ruffle Hem Skirt,,,
,5.7,0.08,"10 pairs/pack random color children's autumn winter summer solid color simple socks, suitable for sports and leisure daily travel the best choice",,,
2200,9.3,0.06,Teen Girl Twist Front Ruched Side One Piece Swimsuit,,,
1400,12.77,0.08,SHEIN Tween Boy Ripped Frayed Bleach Wash Denim Shorts,,,4
,9.8,0.15,SHEIN Tween Girl 3d Flower Decorated Hollow Out Knitted Cardigan,2,in Tween Girls Cardigans,
1200,4.48,0.29,1pc Fashionable Basketball Pattern Printed Basic Round Neck Short Sleeve T-shirt For Tween Boys,,,
600,3.45,0.46,1pc Tween Boys Basic Round Neck Short Sleeve T-Shirt With Cartoon & Letter Print,,,
50,4.88,0.2,SHEIN Tween Girls' Letter & Flower Pattern Short Sleeve T-shirt,,,4
300,18.3,0.14,SHEIN Tween Girls' Casual Sports Streetwear Vest Top And Overalls Set,,,7
1400,14,0.07,Tween Girl Cherry Print Short Sleeve Cardigan And Shorts Casual 2pcs/Set Homewear,9,in Tween Girls Pajamas,
1300,20.39,0.08,Tween Girls Fashionable Casual Sleeveless Top And Shorts Denim Set,4,in Tween Girls Denim Two-piece Outfits,
2000,9.2,0.06,SHEIN Tween Girl Cold Shoulder Ruffle Trim Dress,,,
100,5.1,0.09,Young Boy Street Fashion Cartoon Print Round Neck T-Shirt For Summer,8,in Young Boys T-Shirts,
1500,4.46,0.16,"GARFIELD X SHEIN Young Boy Casual Cartoon Printed Short Sleeve T-Shirt, Summer",,,
1000,15.5,0.07,"SHEIN Tween Girl 3pcs Sleepwear Set, Including Avocado Printed Camisole, Shorts And Long Pants",,,
900,14.6,0.15,SHEIN Solid Color Casual Spring And Summer Tween Girls' Cargo Pants With Side Flap Pockets,9,in Tween Girls Pants,6
,3.9,0.15,"SHEIN Young Girl Skull, Bull Head And Floral Print Short Sleeve T-Shirt",,,
50,10.55,0.18,SHEIN Tween Boys' Playful Vacation Style Short Sleeve T-Shirt And Shorts,10,in Tween Boys Sets,4
1300,5.68,0.08,Tween Boys' Casual Fun Letter Checker Print Round Neck Pullover Short Sleeve T-Shirt For Summer,,,
6400,9.07,0.63,SHEIN Teen Girls Flap Pocket Wide Leg Cargo Jeans,,,4
,8.7,0.14,SHEIN Teen Boy Loose Sports Hooded Top And Shorts Set With Letter Print,,,
,9.3,0.12,Teen Boy Cartoon Astronaut & Moon Printed T-Shirt And Letter Printed Shorts Set,,,
100,9.9,0.15,SHEIN Young Boy 3pcs Solid Tie Front Shorts,,,
,14.8,0.08,Tween Girl Flap Pocket Raw Hem Crop Denim Jacket,2,in Tween Girls Denim Jackets & Coats,4
2000,11.2,0.15,SHEIN Young Girl Ribbed Tank Dress,,,
3100,11.65,0.34,"3sets  Boy's Casual Summer Outfits, Coconut Tree Graphic Short Sleeve T-Shirt + Shorts Sets",,,
300,8,0.05,SHEIN Teen Girl's Small Flower Printed Bikini Set With Spaghetti Straps,,,4
1200,13,0.13,Tween Boy 4pcs Summer Simple Casual Round Neck Sleeveless Tank Top,5,in Tween Boys Tanks,
1200,4.1,0.45,SHEIN Young Girl Flying SleeveColorblock Floral Pencil Dress,,,
200,5.9,0.08,"Sweet Girl's Bow Decor Floral Romper, Casual Romper For Summer Holiday Outdoor Gift Party",,,
600,7.4,0.13,"Teen Boy Casual Simple Letter & Expression Pattern Short Sleeve T-Shirt, Suitable For Summer",4,in Teen Boys Tops,
4200,5.1,0.15,"Young Girl Mommy And Me Matching Outfits
(2 Pieces Are Sold Separately)",,,
200,6,0.15,SHEIN Tween Girls' Woven Solid Color Floral Square Collar Ruffle Strap Casual Vacation Shirt,2,in Tween Girls Blouses,
60,8.8,0.05,SHEIN Teen Girl Summer Beach Swimsuit,,,5
600,4.45,0.46,SHEIN Young Girl Casual Holiday Cake Tiered Ruffle Square Neck Dress,,,8
,9.9,0.05,SHEIN Teen Girls' Knitted Ribbed Waist Pleated Slit Casual Dress,,,
1000,11.6,0.15,"4pcs Young Boy Casual Loose Fit Shorts, Perfect For Travel, Schooling, Spring And Summer",,,
400,7.3,0.14,SHEIN Young Girl Summer Casual Striped Short Sleeve Top And Shorts,,,12
100,6.2,0.07,"Young Boy Summer Fashionable Short Sleeve Shirt And Shorts Set, Apricot",,,
400,8.9,0.15,SHEIN Young Girl Fresh Color Block Cute Summer Suspender Skirt,,,4
300,4.1,0.13,SHEIN Tween Girl Summer Casual Solid Color Short Sleeve Lettuce Hem Ribbed Knit Tee,,,6
100,7.5,0.14,Young Girl Solid Color Sleeveless Tank Top And Skorts Summer Sports Outfit,6,in Young Girls Activewear,8
800,3.25,0.35,SHEIN Young Girl Fashionable Glittery Decorated Dress,,,
300,9.5,0.08,"Tween Boy Sportswear Two-Piece Set, Casual And Versatile USA Letter Print Set, Suitable For Older Children",,,
400,3.2,0.16,Young Boys' Casual Solid Color Summer Shorts,,,4
1300,8.29,0.44,SHEIN Tween Boys' Casual Summer Holiday Style Striped Knitted Round Neck Tank Top,,,
300,12.9,0.06,SHEIN Teen Girls' Flower Pattern Mesh Pleated Cami Dress,5,in Teen Girls Dresses,
400,9.9,0.07,2pcs/Set Tween Boy Casual Letter Print Hooded Vest And Shorts Summer Outfits,,,
900,7.9,0.07,Tween Girl Solid Color Hollow Out Spaghetti Straps Bikini Separates Swimwear Set For Summer,,,4
,11.8,0.08,Young Girl Summer New 3pcs Spaghetti Strap Dress Set,5,in Young Girls Dresses,
700,7.8,0.06,Tween Girl Tropical Print Bikini Swimsuit,,,
1200,5.14,0.33,Young Girl's Floral Printed Cami Top & Elastic Waist Shorts Set,,,4
300,7.7,0.07,"Tween Girl Floral Bowknot Bikini Set, 2pcs Clean And Well-Fit Swimsuit For Summer Beach Vacation",,,
2500,11,0.06,Teen Girls' One-piece Swimsuit,9,in Teen Girls One-Pieces,4
800,6.3,0.16,SHEIN Young Girl Floral Printed Cami Top And Shorts Set,,,5
80,1.8,0.1,1pc Back-To-School Blue Hidden Ribbon Bow Hair Clip With Long Ribbon,,,4
600,16.5,0.06,SHEIN Streecool Kids Vintage Street Style Casual Loose Distressed Teen Girls' Blue Denim Wide Leg Pants,3,in Teen Girls Jeans,
600,9.8,0.15,SHEIN Young Boy Striped Print Tee & Shorts & Bag,,,9
500,5.4,0.05,Teen Girl 4pcs Solid Brief,,,
600,10.03,0.26,SHEIN Genkimix Kids Tween Girl 4pcs Round Neck Tee,,,
1500,3.6,0.1,Teen Girl Round Neck Sleeveless Solid Color Tank Top Blouse,,,4
500,6.83,0.25,SHEIN Tween Girls' Extended Size Tie Dye Pattern Short Sleeve T-Shirt And Pants Set With Round Neck,,,
100,12.8,0.07,"SHEIN Tween Girl Summer Boho Trendy Cute Knot Shoulder Ruched Bust Cami Baggy Denim Jumpsuit Romper,Girls Summer Vacation Clothes Outfits",2,in Tween Girls Denim Overalls & Jumpsuits,
100,7.3,0.5,SHEIN Tween Girl Casual Tank Top And Pants Set With Bowknot Decor,,,
600,5.6,0.15,Young Girl One-Piece Swimsuit (Little Kid) With Random Digital Print,,,
,12,0.14,Teen Boy Color Block Patchwork T-Shirt And Shorts Set For Summer,,,
3300,1.8,0.1,2pcs WWJD Letter Embroideried Woven Wristband Bracelets Protection Pray Bracelets Inspirational Christian Jewelry For Family Friend Boys Girls,6,in Kids Bracelets,
,5.35,0.37,SHEIN Tween Girl Casual Printed Short Sleeve Car & Letter Pattern Drop Shoulder T-Shirt,,,8
,5.7,0.16,SHEIN Young Girl Summer Autumn Tropical Patterned Fresh Vacation & Casual Outdoor Play Jumpsuit,,,11
4700,4.87,0.58,"Teenagers' Leisure Anti-Slip Wear-Resistant Pu Round Toe Flat Fashion Women's Slippers For Summer Vacation, Beach, Euopean And American Styles",4,in Teen Shoes,10
400,13.2,0.14,SHEIN Young Boy 3pcs Solid Tie Front Sweatpants,5,in Young Boys Sweatpants,5
100,9.9,0.05,Tween Girl Color Block Ruffle Hem Bikini Swimsuit,6,in Tween Girls Tankinis,
2700,6,0.13,"Young Girl Cute Cartoon Printed Dress, Casual And Comfortable Swing Hem Dress Suitable For Parties And Vacation",,,
3400,9.1,0.15,SHEIN Young Boy Car & Letter Graphic Tee & Shorts,,,
600,6.21,0.25,Tween Girl Slogan Graphic Thermal Lined Sweatshirt,,,
,9.9,0.13,Tween Girl Knitted Pleated Skorts For Sports And Street Fashion,,,4
200,7,0.15,SHEIN Young Girl Knitted Solid Color Sleeveless Top With Shoulder Cutouts And Woven Loose-Fit Floral Print Casual Vacation Shorts Set,,,
400,3.8,0.07,Tween Girl Vacation Casual Solid Hollow-Out Cover Up Top And Shorts,,,
800,9.4,0.15,SHEIN Young Girl Cartoon Graphic Tee & Overall Romper,,,
600,19.5,0.06,SHEIN Teen Girls Floral Print Wide Leg Jeans,,,
,17,0.14,"SHEIN Teen Boys' Casual Woven Label Drawstring Shorts, Summer, Multi-Pack",,,5
100,10.95,0.25,SHEIN Teen Girls' Knitted Trim T-shirt And Flared Pants Casual Outfit Set,,,
,4.1,0.13,SHEIN Tween Girl Casual Minimalist Five-Pointed Star & Slogan Print Short Sleeve T-Shirt Suitable For Summer,,,10
,1.29,0.7,SHEIN Young Girl Slogan Graphic Tee,,,
500,13.8,0.15,SHEIN Tween Girl 2pcs/Set Long Sleeve Jacket And Floral Strappy Dress Set,,,6
10000,2.5,0.07,"1pc Boys And Girls Nylon Zipper Close Stylish Letter Chest Bag, All-In-One Casual Bag Suitable For Everyday Use",1,in Kids Waist Bags,
700,14.6,0.13,SHEIN Tween Girl Casual Knitted Short Sleeve Round Neck Top And Straight Pants Set For Spring/Summer,,,
4000,9.2,0.12,Tween Girl Casual American Flag Print Short Sleeve T-Shirt And Shorts 2pcs Outfit For Summer,,,
,6.05,0.37,"SHEIN Young Girl Top With Ruffle Trim And Paperbag Waist Pants, 2pcs/Set",,,4
200,6.3,0.09,Young Boy Fashionable Bear Printed Short Sleeve Top And Knitted Shorts Casual Outfit,,,
700,4.2,0.14,"SHEIN Tween Girl Leopard Pattern Woven Short Sleeve Pullover Shirt, Perfect For Spring/Summer Vacation",,,
600,8.17,0.1,SHEIN Teen Girls Dalmatian Print Ring Linked Bikini Swimsuit,9,in Teen Girls Bikini Sets,5
1300,1.73,0.14,10Pcs/Set New Cute Ribbon Bowknot Hair Clips For Kids Handmade Baby Girls Hair Accessories,7,in Kids Hair Accessories,5
,11.2,0.14,"SHEIN Teen Boys' Casual Fit Paisley  Pattern Full Print Shorts With Blue And Black Drawstring, Summer",,,4
,6.7,0.07,Tween Girl Floral Print Bikini Swimsuit,,,
1100,11.5,0.14,"Tween Girl Casual Simple Cartoon Printed T-Shirt 3pcs/Set, Black, Pink & Apricot, Suitable For Summer",,,13
,5.7,0.11,SHEIN Teen Girls Ruched Bust Tie Front Tee,,,4
400,8,0.13,"Tween Girl Casual Simple Cartoon Cat Pattern Short Sleeve T-Shirt And Shorts Set, Summer",,,
200,7.8,0.13,Tween Girl Casual Simple Heart And Milk Print Short Sleeve T-Shirt And Shorts 2pcs Set For Summer,,,
100,3.65,0.43,SHEIN Tween Boy Casual Basketball & Letter Print Short Sleeve T-Shirt,,,
2700,3.7,0.08,"5 Pairs Expression Print Socks, Comfy & Cute Cartoon Crew Socks, Children's Stockings & Hosiery",,,5
3400,11.4,0.12,SHEIN Teen Girl Black/White Casual Sleeveless/Short Sleeve Basic T-Shirt Tops 4-Piece Set,,,
600,12.6,0.14,SHEIN Tween Girl Cut Out Tank Top & Flap Pocket Cargo Pants,,,
,12.4,0.12,"Teenagers' Casual Vacation Style Cropped Knitted Cover Up, White With Wide Neckline And Flared Long Sleeves, Can Be Worn Over Inner Tank Top, Sun Protection Cover-Up, Half Mesh Crochet Design, Sassy Top",,,
200,14.3,0.13,"Girls' Cute Beige Bow Knot Flat Sandals For Daily Casual, Holidays, Beach",2,in Kids Sandals,11
400,6.3,0.14,SHEIN Genkimix Kids Young Boy Striped Print Tee & Shorts,,,14
800,12.1,0.14,SHEIN Tween Girl Summer Solid Color Round Neck Top And Flower Printed Pleated Wide-Leg Pants Casual Loose 2-Piece Outfit,,,5
600,10.3,0.15,SHEIN Young Girl Ombre Puff Sleeve Pleated Hem Dress,,,
,7.5,0.07,Tween Boy Palm Tree Print Swim Shorts,9,in Tween Boys Swimwear,
500,5.9,0.16,SHEIN Young Girl Colorblock Bow Shoulder Cami Dress,,,5
10000,7.3,0.09,"2pcs Young Boys' Casual Palm Tree & Waves Sunglasses Slogan Allover Print Vest And Palm Tree & Waves Patterned Shorts With Hat, Suitable For Summer, Outdoor, Casual, Beach Vacation, And Travel",,,
700,7.9,0.12,SHEIN Tween Girl Mock Neck Tank Top & Paperbag Waist Shorts,,,11
4000,9.8,0.15,Young Boy Daily Boho Street Casual Casual Destroy Raw Hem Elastic Waist Denim Shorts,4,in Young Boys Denim Shorts,6
700,9.1,0.07,Tween Girl Solid Crisscross Back Bikini Swimsuit,,,5
600,3.8,0.1,Young Boy Slogan Printed Casual Short Sleeve T-Shirt,,,
1300,13.49,0.12,SHEIN 2pcs/Set Tween Boys' Color-Blocked Drawstring Patterned Leggings & Athletic Shorts Set,1,in Tween Boys Activewear,
1100,13.9,0.14,SHEIN Tween Girl Butterfly Print Cami Top & Tee & Sweatpants Set,,,5
,16.89,0.34,SHEIN Tween Boy 3pcs Letter Graphic Elastic Waist Thermal Lined Sweatpants,,,
3500,3.55,0.5,"2pcs Boys' Summer Outfit - Cartoon Car Printed Short Sleeved T-Shirt And Shorts, Fashionable, Casual And Comfortable",,,
,10.6,0.12,SHEIN Teenage Girls' Knitted Butterfly Embroidery & Printed Casual Lettuce Trim Short Sleeve Summer T-Shirt Set Of 3,,,
1400,5.6,0.13,Tween Girls' Cat And Letter Printed Short Sleeve T-Shirt,,,6
400,7.2,0.14,SHEIN Teen Girls Floral Print Ruffle Trim Shirred Bodice Blouse,1,in Teen Girls Blouses,
60,13.5,0.15,Tween Boys' Loose Fit Casual Solid Color Notched Collar Short Sleeve Shirt And Pants 2pcs/Set,,,6
800,4.5,0.13,SHEIN Teen Girls Tie Dye & Butterfly Print Tee,,,
3000,8.93,0.19,"SHEIN 2pcs/Set Young Boys' Casual College Style Comfortable Fashionable Practical Versatile Soft Comfortable Cool Street Graffiti Hand-Painted Breathable & Comfortable Short Sleeve T-Shirt And Checkerboard Pattern Shorts, Suitable For Spring And Summer",,,
,8.8,0.15,SHEIN Young Boy Sailboat Printed Polo Shirt And Shorts Set,,,4
600,5.98,0.16,"SHEIN Tween Boy Hamburger Print Short Sleeve Crew Neck T-Shirt, Casual And Simple, Suitable For Summer",,,
300,4.4,0.15,SHEIN Round Neck Short Sleeve Tee For Young Girls With Bead Embellishments And Knot Detail On Hem,,,6
1000,8.55,0.19,SHEIN Tween Boy Camo Print Tee & Drawstring Waist Shorts,,,
,5.6,0.15,SHEIN Young Girl Casual And Elegant Shorts For Commuting With 3D Bow-Knots,,,7
1300,21.3,0.07,SHEIN Tween Girls' Cute Starry Pattern Washed Straight-Leg Jeans,,,
10,5.01,0.48,SHEIN Tween Boy Coconut Tree Print Tee & Tropical Print Shorts,,,
,8.8,0.15,SHEIN Young Boy Solid Tee & Cartoon Graphic Shorts & Bag,,,22
1600,8.6,0.14,Tween Boy Letter Print Hooded Short Sleeve T-Shirt And Shorts Set,,,
,11.5,0.07,SHEIN Tween Girl's Woven Floral Print Holiday Strappy Dress,,,4
300,9.7,0.13,SHEIN Tween Girl Letter Graphic Cami Top & Tee & Shorts,,,4
200,9.5,0.15,SHEIN Young Girl Letter Graphic Cami Top & Geo Print Paperbag Waist Shorts,,,5
600,6.7,0.07,"SHEIN Tween Girl 3pcs/Set Knitted Ribbed Comfortable And Breathable Sports Tank Tops, Light Colors",,,
100,7.7,0.08,Young Boy Letter Print Short Sleeve T-Shirt And Shorts Casual Set,,,
2200,8,0.07,Teen Girls' Tree Pattern Swimsuit Set,,,4
300,8.37,0.26,SHEIN Tween Girl 4pcs Solid Color Loose Fit Casual Tank Top With Round Neck For Summer,,,7
600,6,0.13,Tween Boy Casual Simple Cartoon Bear Pattern Short Sleeve Round Neck T-Shirt Suitable For Summer,,,
900,8.4,0.14,SHEIN Young Boy 2pcs/Set Casual Comfortable Color-Block Fashion T-Shirt And Shorts Outfits,,,4
,13.2,0.14,SHEIN Tween Boy Letter Graphic Raglan Sleeve Hoodie & Shorts,,,7
500,9.4,0.13,"SHEIN Tween Girl Knitted Solid Color Short Sleeve V-Neck Top And Shorts Set, Spring/Summer Outfits",,,
300,9.9,0.13,SHEIN Tween Boys' Casual Comfortable Slogan Print T-Shirt And Shorts Set,,,9
300,3.3,0.13,SHEIN Tween Girl Simple & Elegant Solid Color Tweed Knit Strapless Top,,,
700,13,0.06,SHEIN Tween Girls' Everyday Casual Geometric Printed Short Sleeve Dress For Spring/Summer,,,
,5.3,0.13,Tween Boy Summer Letter & Car Printed Round Neck Casual Short Sleeve T-Shirt,,,
1300,7.5,0.15,"Young Girl Casual 2pcs/Set Ditsy Floral Spaghetti Strap Crop Top And Shorts, Summer Vacation",,,
700,12.5,0.06,SHEIN Teen Girls Ripped Roll Up Hem Denim Shorts,,,
,5.4,0.14,SHEIN Young Girl 2pcs Bow Front Shorts,,,8
700,14.1,0.13,SHEIN Tween Girls' (Large) Letter Print Sleeveless Top With Long Pants Two-Piece Set,,,
900,4.06,0.08,"SHEIN Tween Girl Knitted Crossed High Waisted Cycling Shorts, Versatile Basic Style",6,in Tween Girls Activewear,4
40,9.69,0.21,Tween Girl Panda & Slogan Graphic Tee & Shorts,,,4
,6.75,0.34,SHEIN Tween Girl 3pcs Cotton Ribbed Knit Solid Halter Top,,,
1200,4.73,0.22,"Teenage Boys' Stylish Street-Inspired Printed Round Neck T-Shirt, Summer",,,
2100,14.8,0.13,Girls Open Toe Hollow Out Gladiator Sandals For Outdoor,,,
,9.5,0.13,SHEIN Tween Girl Loose Casual Round Neck Drop Shoulder Slogan Graphic T-Shirt And Biker Shorts Set,,,
700,7.9,0.13,New Thick-Soled & Soft-Soled Anti-Skid & Comfortable & Casual & Outdoor & Lightweight & Vacation & Beach Slippers With Versatile Soft Soles For Women,,,11
500,5.2,0.12,SHEIN Teen Girl Sweet & Cute Contrast Lace V-Neck Camisole Tank Top For Summer,,,4
2300,11.5,0.14,SHEIN Tween Boys' Color Block Short Sleeve T-Shirt And Shorts Set,,,5
400,12.2,0.16,Young Girl 7pcs Cartoon Graphic Contrast Binding Brief,10,in Young Girls Underwear,
,9.5,0.09,Young Girl Casual Long Sleeve Shirt And Tank Top With Sports Shorts Set For Summer,,,5
,15.8,0.07,Tween Girl Ripped Wide Leg Jeans,,,5
100,13.3,0.06,"SHEIN Teenage Girls Shoulder Pad Long Sleeve T-Shirt With Shorts, Faux Two-Piece Beach Swimsuit Set",,,
400,10.2,0.07,Tween Boy Fashionable Daily Casual Short Sleeve Workwear Pocket Shorts 2 Piece Set,,,
600,4.4,0.14,"Tween Girl Casual Simple Cartoon Figure Pattern Short Sleeve T-Shirt, Suitable For Summer",,,
,3.9,0.09,"Young Girl 1pc Casual Fashion Slogan Printed Short Sleeve T-Shirt For Spring, Summer, Autumn",,,
600,3.65,0.32,Young Girl Summer Sleeveless Dress Fashionable Sweet And Casual Style Children Refreshing Breathable Waist-Cinching Dress,,,
300,8.2,0.14,"White Car, Tween Boy Casual Simple Round Neck Short Sleeve T-Shirts And Shorts Set, Summer",8,in Tween Boys Clothing,9
,12.1,0.08,"Teen Boy Swimwear. Top With Fixed Printing, Bottom With Random Printing.",3,in Teen Boys Swimwear,
,5.8,0.08,Tween Girls' Casual Fun Printed Round Neck Pullover Short Sleeve T-Shirt Summer Top,,,
,2.47,0.47,SHEIN Young Girl Summer Short-Sleeved Cat Print Round Neck Dress,,,
1100,8.9,0.05,Teenage Girls' Color Block Swimsuit Set With Bow Decoration,,,4
2000,4.9,0.16,SHEIN Young Girl Fashionable Sweet Knitted Solid Color Halterneck Integrated Dress Sportswear,1,in Young Girls Activewear,
400,4.25,0.49,Young Boy Dinosaur Printed Camouflage Patchwork Short Sleeve T-Shirt And Shorts 2pcs Set For Summer,,,
900,10.4,0.15,SHEIN Young Girl Toddler Girls Bow Front Polo Neck Dress,,,
600,10.6,0.12,"Children's Summer Outdoor Fashionable Flat Sandals For Girls, Stylish One-Strap Party Slippers",8,in Kids Fashion Slippers,
500,11.59,0.1,SHEIN Teen Girl Distressed Denim Shorts With Frayed Hem And Pockets,,,5
3700,9.5,0.07,"SHEIN Tween Girl Simple Casual Letter Printed Tank Top Plus Heart Patterned Shorts Flame Resistant Comfortable Home Sleepwear Set, Summer",,,
2300,5.85,0.35,SHEIN Young Boy Summer Casual Spider-Web Printed Round Neck Short Sleeve T-Shirt And Shorts Set,,,12
1200,10.1,0.14,"SHEIN Tween Girls' Matching College Style Polka Dot Short Sleeve T-Shirt And Skirt Set, Round Neck",,,
700,3.05,0.29,Young Girl's Butterfly & Checkerboard Pattern Printed Short-Sleeved T-Shirt,,,
1900,4,0.15,"Tween Boy Casual Cartoon Pattern Sleeveless Top, Round Neck, Summer",,,
100,17.5,0.15,2pcs/Set Casual Solid Color Shirt And Shorts For Teenage Boys On Vacation,,,
