selling_proposition,price,discount,goods_title,rank_title,rank_sub,color_count
200,3.39,0.7,Pocket Letter Embroidery Imitation Silk Collar Shirt And Shorts Pajama Set,,,
,20.99,0.07,5pcs Solid Underwire Bra,1,in Women Multi-piece Sets  Bras,
,10.29,0,Cherry Printed Sweet Sleepwear Set With Lapel Button Up Top And Bowknot Shorts For Women,2,in Women Sleep & Lounge,
80,3.74,0.65,Plus Size 'GOODNIGHT' Pattern White Short Sleeve T-Shirt And Black & White Checked Shorts Set,,,
,13.79,0,12pcs Solid Color Seamless Comfortable Triangle Underwear,3,in Women Panties,4
,6,0,1 Pcs High Waist Trainer Body Shaper Tummy Slimming Sheath Woman Flat Belly Control Panties Hip Butt Lifter Briefs Panty Shapewear,2,in Sport Corset,
10000,5.69,0.07,"Women Strapless Seamless Bra, Single Piece",,,4
200,2.63,0.2,"2pcs/1pair (Extra Large Diameter 12cm/4.72in) Skin Tone Round Shaped Apricot Color Silicone Breast Lift Tape, Nipple Concealer, Anti-Exposure Feature; Cool, Strong Adhesive And Reusable Invisible Bra For Summer",,,
1200,13.03,0.2,SHEIN Men Letter Graphic Top & Pants Lounge Set,,,4
700,6.25,0.26,Cup & Letter Graphic Drop Shoulder Night Dress,,,
400,10.45,0.2,Ribbed & Lace Trimmed Cami Top And Pants Homewear Set,,,4
600,5.73,0.43,Butterfly Pattern Contrast Lettuce Trim Women's Pajama Set,,,7
,6.07,0.24,Slogan Graphic Drop Shoulder Nightdress,5,in Hot Pink Women Nightgowns & Sleepshirts,8
200,4.38,0.33,Women Cute Koala Round Neck Short Sleeve Top And Shorts Pajama Set,,,4
1200,3.4,0.29,Satin Heart Printed Spaghetti Strap Sleepwear,,,
500,4.78,0.47,Heart & Slogan Graphic PJ Set,,,
600,5.95,0.37,Heart & Letter Graphic Satin PJ Set,,,8
600,4.29,0.28,Women Fashionable Printed Camisole And Shorts Home Wear Set,,,4
200,3.81,0.22,Cami Cat Print Nightdress,,,
1600,4.52,0.22,Heart & Letter Graphic Lettuce Trim Cami PJ Set,,,9
600,7.98,0.28,Lapel Collar Contrast Binding Satin Blouse & Shorts PJ Set,,,
,9.3,0.11,"2pcs Contrast Color Stripe Knitted Casual Loose Long Sleeve Top And Side Split Shorts Homewear Set, Suitable For Home Use",6,in Women Lounge Sets,6
,14.69,0.07,DAZY Minimalist Rabbit Printed Knitted Jacquard Fabric Bathrobe For Home,,,
,7.09,0,Scoop Neck Lace Panel Cut Out Back Slip Dress,5,in Women's black sleepwear,
400,7.97,0.31,Color-Blocked Collar And Hemline Short-Sleeve Top And Shorts Comfortable Pajama Set For Summer,,,
,2.67,0.45,Ladies' Sleep Dress With Eyelashes And Text Pattern,3,in Baby Blue Women Nightgowns & Sleepshirts,
50,1.96,0.5,"5pairs Women's Thin Floral Low Cut Socks, Breathable & Sweat-Absorbent Women's No Show Socks",,,
10000,4.44,0.36,Butterfly Print Short Sleeve Top And Shorts Summer Casual Pajamas Set,,,
200,8.05,0.29,Pocket Embroidery Jacquard Satin Lapel Sleepwear Set,,,
700,6.57,0.22,Contrast Slogan Print Top And Letter Print Shorts Pajama Set,,,
1200,5.75,0.1,Plaid Cami Pajama Set With Eye Cover,,,4
,3.42,0.22,Floral Print Cami Nightdress,10,in White Women Nightgowns & Sleepshirts,
1300,3.06,0.45,Bear Print Cami Sleep Dress,,,7
700,5.73,0.43,Sheer Mesh Insert Rib-knit Tank Top & Shorts PJ Set,,,
1700,6.89,0,Contrast Lace Satin Cami Night Dress,,,5
800,3.93,0.2,Women'S Cartoon Slogan Printed Cami Sleep Dress,,,
500,3.31,0.45,Heart Print Lettuce Trim Slip Nightdress,,,
1100,5.37,0.26,Butterfly Print Cami Top & Shorts PJ Set,,,
500,7.62,0.24,Leopard & Coffee Color Printed Short Sleeve Top And Pants Women's Pajama Set,,,
,9.65,0.37,Heart Print Contrast Piping PJ Set,9,in Pink Women Pajama Sets,4
1000,6.29,0.16,Contrast Binding Lettuce Trim Cami Top & Shorts Lounge Set,,,
2500,8.96,0.11,Heart Print Contrast Piping Satin Blouse & Shorts PJ Set,,,
100,6.79,0.2,Heart Print Nightdress,,,5
200,11.29,0,Heart Embroidery Contrast Binding Satin PJ Set,,,4
,4.74,0.07,Solid Bandeau Bra,1,in Comfy Minimalist Bras,8
,4.68,0.33,"1pc Men's Seamless Breathable Compression Abdominal Control Sport Slimming Shirt, Suitable For Daily Wear, Sports, Business And Banquets",2,in Men Shapewear,
300,1.96,0.5,5pairs Women Floral Pattern Casual Invisible Socks For Daily Life,,,
,6.09,0,Lace Splice Cami Top And Shorts Tight Sleepwear Set,4,in Women's black sleepwear,
1500,5.25,0.29,SHEIN Unity Colorful Stripe Print Pajama Set,,,
1000,4.65,0.38,Plus Solid Racerback Curved Hem Tank Nightdress,,,7
1400,10.99,0.08,Satin Lapel Collar Button Front Contrast Binding Night Set,,,22
600,5.19,0.2,Cartoon Graphic PJ Set With Eye Mask,,,
500,0.31,0.76,"4pcs Heart Shaped Bra Strap Clip, Invisible Anti-Slip Bra Strap Holder For Women's Underwear Accessories",,,6
,10.29,0.11,"Seamless Wirefree Bra For Women, Ideal For Sports, Yoga, Sleeping, Anti-Sagging & Push-Up, Plus Size, Solid, Thin Material, Autumn/Winter",2,in Plus Size Bras & Bralettes,
30,6.27,0.51,Men Home Wear Imitation Silk Summer Short Sleeves Pajamas,,,
100,4.9,0.57,Women Plus Size Round Neck Letter Print Short Sleeve Top And Long Pants Home Pajama Set,,,
500,4.44,0.22,5pack Plain Simple Solid Brief,,,20
,1.36,0.6,Plus Solid Bandeau Bra,1,in Beige Plus Size Bras & Bralettes,
,3.09,0.54,Letter Graphic Contrast Binding Lingerie Set Sports,3,in Sporty Bras,6
70,5.77,0.45,Fashionable And Sweet Women's Heart Patterned Pajama Set For Summer,,,7
1700,5.03,0.28,7pcs Heart & Striped Print Brief,,,
,5.99,0,Contrast Lace Split Thigh Satin Cami Nightdress,10,in Dusty Pink Women Nightgowns & Sleepshirts,
3700,10.87,0.02,Frill Trim Cami Top & Pants PJ Set,,,
,4.09,0.09,"Seamless Shockproof Sports Bra, Push-Up And Gathering For Running, Yoga, Back Beauty, Lightweight Section, Support And No Underwire",1,in Mother's Day Bras,
800,5.82,0.37,Heart Print Bowknot Decor Short Sleeve Top And Long Pants 2pcs Sleepwear Set,,,4
,10.49,0.09,Heart Embroidered Satin Pajama Set,7,in Baby Blue Women Pajama Sets,
200,5.24,0.34,Lace Panel Home-wear Set,,,9
,8.34,0.22,Plus Size Women's Contrast Trim Short Sleeve Shirt And Shorts Pajama Set,1,in Dusty Pink Plus Size Pajama Sets,9
6500,7.19,0.08,Shein Underwear&Sleepwear Basics 3pack Plain Ruched Bralette Set,,,5
,10.69,0,Floral Printed Lace Trimmed High Slit Sexy Nightgown Cami Dress,4,in Sexy Nightgowns,4
,7.46,0.13,Plus Size Solid Underwire High Support Underwire Simple Bra,1,in Plus Size Push-Up Bras,6
,10.49,0,SHEIN Women's Ribbed Triangle Panties,8,in Women Multi-piece Sets  Panties,
20,4.31,0.56,Plus Size Cartoon Expression And Letter Printed Short Sleeve Top And Long Pants Pajama Set,,,4
,12.69,0,12pack Plain Simple Panty,8,in Women Briefs,8
2500,7.39,0.08,Embroidery Mesh Underwire Lingerie Set,,,13
,2.49,0,Hollow Out Scallop Trim Lace Panty Lingerie,2,in White Women Briefs,5
500,2.21,0.33,"1pc Women Glittery Fishnet Pantyhose, Sparkling & Ultra-Thin & Elastic & Slim Fit, Star Pattern",,,
,18.09,0.07,5pcs/Set Ladies Solid Color Lace Bra Set,8,in Women Multi-piece Sets  Bras,4
900,4.99,0.07,"Women Solid Color Strapless Adjustable Bra, 1pc",,,4
800,10.89,0,Tank Top & Buffalo Plaid Bow Detail Pants PJ Set,,,
,2.64,0.02,Women's Panda Text Pattern Camisole Sleepwear Top,3,in Women's youthful-style sleepwear,
,2.99,0.06,"6/12pcs With Box, Nude Feeling, Silicone Breast Lift Tape, Anti-slip, Strapless And Reusable Women Breast Invisibility Cover, Silicone Nipple Cover",1,in Multi-pack accessories,
,5.99,0.08,Women's Leopard Print Underwire Bra And Panties Set With Lace Trim,,,
,2.2,0.12,"2pcs/set Silicone Invisible Bra Lift, Skin Tone. Suitable For Wedding, Halter Tops With Anti-sagging, Push-up, Anti-lighting, And Anti-convex Point Function",1,in Underwear & Sleepwear,
,2.19,0.08,6pcs Solid Color Jacquard Breast Lift Sticker,1,in Black Women Lingerie Accessories,
500,5.86,0.31,Cartoon And Graphic Print PJ Set,,,
70,1.77,0.48,5pairs Men Summer Mesh Socks Breathable Sweat-Absorbing Short Casual Socks,,,
,4.99,0.06,1pc Ladies' Front Closure Bra With Steel Ring,5,in Mother's Day Bras,5
2800,21.26,0.02,3pcs/Set Women's Sweet Solid Lace Bow Knot Pajama Set,,,7
1700,4.64,0.4,5pcs Pure Color Comfortable Triangle Panties,,,
1500,17.78,0.22,5pcs Contrast Eyelash Lace Bow Detail Belted Satin PJ Set,,,4
10000,5.99,0.08,"2pcs/set Backless Seamless Bra With Fixed Cups And No Wire, Comfortable And Simple Design For Women",,,4
,15.59,0,3pcs Solid Cami Top & Shorts PJ Set,5,in Women Pajama Sets,4
1000,12.49,0.14,Plus Contrast Piping Pocket Patched Satin PJ Set,,,8
600,3.89,0.35,Floral Print Lettuce Trim Slip Nightdress,,,
80,4.57,0.57,Men 5pcs Solid Boxer Brief,,,
,13.65,0.08,3pack Push Up Full Cup Microfiber Soft Cup Bra Set,6,in Comfy Minimalist Bras,8
,12.32,0.15,Men Contrast Piping PJ Set,1,in Red Men Loungewear Sets,
,19.9,0,LUVLETTE Dream Curve 2ndSkin Wireless Full Coverage Seamless Side Support Lounge Bra,9,in Luvlette Bras,7
,8.19,0.08,Women's Summer Casual Folded Simple Short Sleeve Top And Shorts Homewear Set,,,
600,5.3,0.22,Heart Print PJ Set,,,7
2700,5.83,0.27,Women's Front Closure Bra,,,
900,9.09,0.28,Satin Cami Nightdress & Contrast Lace Robe PJ Set,,,7
10000,4.32,0.2,"Multicolor Women's Short Socks For Summer, Thin Ankle Socks And Low-cut Boat Socks",,,10
1400,6.5,0.13,"6pcs Women's Solid Color Ultra-Thin Sheer Stockings, Sexy Pantyhose",,,
10000,5.72,0.12,2pack Ruched Bandeau Bra Set,,,
2600,13.06,0.12,Plus Size Solid Color Wireless Bra,,,6
,4.26,0.49,Plus Contrast Lace Split Hem Cami Nightdress,3,in Black Plus Size Nightgowns & Sleepshirts,5
700,11.69,0.07,Half Button Drop Shoulder Night Dress,,,4
,13.09,0.07,Plus Contrast Lace Tie Back Jumpsuit,10,in Plus-Size Women's Black Sleepwear,
,10.59,0.07,Women's Striped Silky Satin Pajamas Short Sleeve Top With Shorts Sleepwear PJ Set,,,
700,4.55,0.43,Plus Crisscross Back Satin Cami Nightdress,,,6
3400,7.85,0.03,Floral Print Lace Trim Bow Front PJ Set,,,9
6800,14.59,0.1,"5pcs/Set Women's Seamless Back Beauty Bra Top, One-Piece Design, Padded & Wire-Free, Thin & Skin-Friendly, No Sense Of Restraint, Sleep Bra",,,
500,6.85,0.45,Women's Letter Printed Round Neck Short Sleeve T-Shirt And Stripe Pants Pajama Set,,,10
1900,10.13,0.22,Letter and Graphic Print Top & Shorts & Pants PJ Set,,,6
300,11.09,0,Women's Slogan Printed Short Sleeve Top And Long Pants Pajama Set,,,4
,2.59,0,1pc Romantic Style Sexy Lace Women Panty,2,in Women's Pink Underwear,
90,5.85,0.5,Plus Size Women's Summer Pajamas Set With Slogan Printed Short Sleeve Top And Long Pants,,,
,1.94,0.73,"10 Pairs Men's Socks, In Pure White, Pure Black, And Pure Gray, Invisible Socks, Short Socks, One Size Fits Eu 35-43, 3 Colors Couple Boat Socks",1,in Men Ankle Socks,
10,4.99,0.07,1pc Casual-Comfy Women's Stylish Mesh Splice Front Buckle Strapless Bra,,,
,8.5,0.14,"20 Pairs Women's Multicolor Summer Low Cut Socks, Thin Shallow Mouth Short Socks",8,in Women Women Socks & Hosiery,13
1300,8.81,0.22,Slogan Graphic Tee & Sweatpants PJ Set,,,8
,12.59,0,Men Satin Letter Patched Contrast Piping PJ Set,1,in White Men Loungewear Sets,4
80,3.06,0.3,Women's Cartoon Cat Printed Casual Camisole Pajamas Jumpsuit,,,4
1500,1.99,0,"Women's Sexy Temptation Pure Desire Shorts, Lace Edge, Cross, Cat's Eye, Low Waist, Triangle, Ice Silk Underwear",,,
3600,7.49,0,Slogan Graphic Bow Front PJ Set,,,
,3.59,0,4pcs Women's Mid-Rise Color-Blocked Triangle Panties With Bowknot And Ribbed Design,7,in Women Panties,4
1400,3.96,0.32,Letter & Cartoon Print PJ Set,,,6
,12.39,0.07,3pcs Plaid Print Bow Front Sleep Shorts,7,in Women Lounge Bottoms,
,4.4,0.14,"10 Pairs Men's Simple Solid Color Low Cut Socks, Moisture Absorbing & Suitable For All Seasons",1,in Men Invisible Socks,4
900,7.89,0.23,"Women's Printed Elastic Waistband Shorts With Bow Decoration, Sleepwear Bottom",,,
,5.01,0.15,Floral Lace Bow Front Lingerie Set,1,in Women Sexy Lingerie,5
100,9.99,0,SHEIN X Care Bears Tie-Dye Heart Print Casual Loose T-Shirt Nightdress For Summer,,,
400,4.2,0.34,Silk-Like Contrast Flower Printed Cami Top And Shorts Pajama Set,,,
,9.69,0,4-Pack Women Leakproof Triangle Physiological Panties,4,in Women Safety Shorts,
10000,13.29,0,10pcs Women Low-Waist Triangle Panties Color Block Comfortable Soft Sexy,,,
100,3.96,0.62,Plus Size Women's Casual Short Sleeve Sleep Dress With Heart Print,,,
1800,5.39,0.07,"Women's Tummy Control & Butt Lifting Underwear With Removable 1cm Thick Pad To Enhance & Shape Buttocks, Natural & Invisible Peach Butt Look, Sports",,,
,9.17,0.1,Heart Print Contrast Piping Belted Satin Sleep Robe,5,in White Women Robes,
,3.34,0.44,Randomly Sent 10 Pairs Of Solid Color Basic Short Socks,9,in Women Ankle Socks,5
600,12.75,0.25,Solid Tank Top & Knot Waist Leggings & Robe Lounge Set,,,8
,8.68,0.29,Plus Size Lace Patchwork Pajama Romper,4,in Plus Size Sleep Jumpsuits,
2000,7.79,0,Lace Trim Solid Sleep Dress,,,6
200,5.35,0.3,Floral Print Round Neck Nightdress,,,
1300,2.79,0,Letter Graphic Tape Waist Ribbed Knit Boyshorts Sports,,,
1400,8.69,0,5pcs Women's Fashionable Triangular Underwear With Letter Printed Elastic Band Sports,,,
400,4.75,0.33,Fashionable Alphabet Print Sleeveless Dress With Curved Hem For Home Wear,,,
2600,7.79,0,Shein Underwear&Sleepwear Basics 3pack Contrast Lace Panty Set Lingerie,,,4
,3.21,0.37,Heart Print Spaghetti Strap Sleep Dress,5,in Black Nightgowns,
10000,6.93,0.05,Plus Heart Print Cami Top & Shorts PJ Set,,,7
,11.19,0.07,Marled Knit Drawstring Waist Lounge Set,1,in Dusty Pink Women Lounge Sets,4
1000,5.03,0.41,Plus Slogan Graphic PJ Set,,,4
,12.59,0,Men 2-Piece Set Comfortable And Breathable Iced Silk Short-Sleeved Shorts Pajamas Solid Color Summer Casual Open-Front Collar Homewear,1,in Blue Men Loungewear Sets,5
300,6.15,0.23,Women's Bear Print Camisole Trousers Pajama Set,,,
500,10.99,0.08,3pcs Men Long Elastic Breathable Printed Boxer Briefs,,,
7200,6.79,0.11,Plus Solid Wireless Bra,,,4
,7.79,0.13,The Powerpuff Girls | ROMWE Plus Cartoon Graphic Racerback Lingerie Set,2,in Black Plus Size Bra & Panty Sets,
,5.89,0,Women Fashion Standard Code Cartoon Rabbit Pattern Pajama Set,10,in Heart Print Sleepwear,
5400,9.49,0.24,7pack Allover Print Contrast Binding Brief,,,
4600,6.49,0,Letter & Striped Print Tie Waist PJ Set,,,11
300,5.49,0,Contrast Lace Satin Cami Nightdress,,,
,2.69,0.1,"8pcs Reusable Washable Round Nipple Covers, Ultra-thin Nipple Stickers",5,in Multi-pack accessories,
400,11.49,0.07,Plus Contrast Lace Ruched Bust Satin Nightdress,,,
20,5.06,0.23,Heart & Letter Printed Short Sleeve T-Shirt And Shorts Pajama Set,,,
10000,1.39,0.07,"2pcs/set Silicone Invisible Round Nipple Covers, Anti-sagging Push Up Breast Lift Tape For Camisoles",,,
,9.59,0,Heart Print Contrast Lace Bow Front Cami PJ Set,3,in Pink Women Pajama Sets,12
,3.35,0.09,"Lace Crotchless Sexy Lingerie Bodysuit, No Need To Take Off, Elasticity Temptation, Fashionable And Personalized Bodysuit",1,in Women Sexy Bodysuits,4
,6.89,0.08,'s Home Wear Sleeveless Dress,4,in Black Women Lounge Dresses,
,3.11,0.2,"Thin Silicone Breast Pads For Women's Strapless Dress, Waterproof, Push-Up And Lift For Small Chest, Independent Packaging, Perfect For Wedding Dresses Photo Shoots",2,in Women's Wedding Lingerie Accessories,
,10.49,0,4pack Plain No Show Shortie,9,in Women Boyshorts,12
1400,8.81,0.16,SHEIN LUNE Plus Letter Trim Rib-knit Crop Tank Top & Shorts PJ Set,,,4
700,3.8,0.4,Plus Leopard & Lightning Print Tank Nightdress,,,
1400,10.59,0,Women Contrast Floral Print Short Sleeve Top & Pants Summer Pajama Set,,,
70,4.3,0.4,"Floral Print Satin Camisole And Shorts Set, Home Clothing",,,6
,11.39,0,"5pcs/Set Women Breathable Ice Silk Seamless Underwear, High-Waist, Leak-Proof, Triangle Panties With Mesh Holes",5,in Women Safety Shorts,
,7.19,0,THE POWERPUFF GIRLS X SHEIN Cartoon And Tie Dye Print Contrast Binding Slip Nightdress,10,in Blue Women Nightgowns & Sleepshirts,
,6.09,0,Solid Color Lace Trimmed Spaghetti Strap Sleepwear Dress,4,in White Women Nightgowns & Sleepshirts,6
,7.89,0.29,Plus Size Cherry Printed Lace Patchwork Hollow Out Bra And Underwear Set,1,in Plus Size Bra & Panty Sets,
1600,17.29,0,ROMWE Kawaii Star Print Tank Top & Plaid Print Pants PJ Set,,,
,3.49,0.05,"Women's High Waist Tummy Control Underwear With Butt Lifter For Postpartum And Shaping, Sports",1,in Tummy control Women Shapewear,
8800,4.55,0.24,3pack Solid Panty Set,,,4
4400,3.91,0.02,Floral Print Contrast Binding Satin Cami Nightdress,,,4
3900,3.29,0.11,"1pc Women's Seamless Beauty Back Bra, One Piece Wireless Bra With Pad, Sleep & Yoga Bra, Comfortable & Breathable, No Pressing Or Constraint Feeling, Black",,,6
30,6.57,0.1,"1pc Plus Size Seamless Body Shaper With Butt Lifter, Strap And Chest Support, Tummy Control Bodysuit For Women Gym Workout",,,
200,7.25,0.34,Plus Contrast Piping Satin PJ Set,,,
300,14.29,0.07,"SHEIN X Care Bears Plus Size Summer Loose Fit Sleep Dress With Colorful Stars, Bear & Dreamy Printed Pattern, Wide Shoulder, And Energetic Pink-Blue Contrast Color",,,
,5.82,0.45,Plus Size Homewear Heart Print Round Neck Short Sleeve T-Shirt And Shorts Pajamas Set,3,in White Plus Size Pajama Sets,7
1100,3.29,0.08,"1 Pc Sexy Lips Print Men's Underwear, Comfortable And BreathableElastic Boxer Shorts, Valentine's Day, Ultra-Thin Running Sports FitnessBoxer Trunks",,,
,12.19,0,Plus Size Pink & White Striped Print Silk-Like Short Sleeve Pajamas Set,9,in Pink Plus Size Pajama Sets,
2800,12.69,0.07,Plus Crisscross Back Tank Top & Shorts PJ Set,,,
8400,7.69,0,5pack Plain Simple Panty,,,
,3.33,0.39,Plus Pineapple Print Lettuce Trim Cami Nightdress,8,in Pink Plus Size Nightgowns & Sleepshirts,5
,3.5,0.48,Plus Size Cute Panda Printed Short Sleeve Nightgown,5,in Women's Curve Cute Sleepwear,
90,5.07,0.22,Cute Kitten Summer Pajamas 2pcs/Set,,,5
200,10.53,0.25,SHEIN SilkySpell Women's Long Sleeve Contrast Lace Robe And Cami Slip Nightgown Sleepwear Set,,,8
,10,0.14,"6pairs Women's Random Color Fashionable Bubble Pile Socks, Comfortable, Breathable, Classic, European Style, Knee-high, Casual scrunch socks",2,in Best-selling thigh-high socks,
,2.79,0,"Women's High Waist Triangle Panties, Soft, Comfortable, Crisscross Design",1,in Black Women Briefs,
3900,9.49,0,Contrast Lace Ruffle Hem Night Dress,,,
,3.89,0.07,2 Pairs Plus Size Underwear Accessories Anti-Slip And Lifting Breast Adhesive Pasties,1,in Black Plus Size Lingerie Accessories,10
1200,7.99,0.16,Plus Heart Print Cami Nightdress,,,
1600,4.81,0.22,Plus Marble Print Tank Nightdress,,,
,8.49,0.07,Plus Size Sexy Lace Splice Slit Hem Cami Dress,6,in Burgundy Plus Size Nightgowns & Sleepshirts,4
,6.19,0,Plus Letter Graphic Racerback Nightdress,8,in Black Plus Size Nightgowns & Sleepshirts,
200,3.57,0.42,SHEIN Classic Sexy Women's Sexy Lingerie,,,
200,5.1,0.4,Plus Size Women Simple Casual Leopard Print Sleeveless Dress For Daily Wear,,,
800,4.37,0.29,Dinosaur Print Cami Top & Shorts Sleepwear Set,,,
5500,8.04,0.03,Floral Print Bow Front PJ Set,,,8
500,8.29,0,Plus Size Letter & Heart Print Short Sleeve T-Shirt And Shorts Pajama Set,,,
,11.39,0,Plus Contrast Piping Satin PJ Set,4,in Pink Plus Size Pajama Sets,
50,8.49,0.21,Cute Cartoon Printed Short Sleeve And Shorts Homewear Set,,,
,4.7,0.15,9pairs Men Solid Invisible Socks,7,in Men Invisible Socks,5
,4.03,0.45,Plus Slogan Graphic Nightdress,6,in Black Plus Size Nightgowns & Sleepshirts,
300,12.79,0.07,THE POWERPUFF GIRLS X SHEIN Plus Cartoon And Letter Graphic Drop Shoulder Nightdress,,,
,5.33,0.14,"Women Silver Coated PU 3 Rows 10 Buckle Cincher Gym Workout Sweat Enhancing Shorts With Ion Technology, High Waist Compression Yoga Squat-Proof Tummy Control Fitness Pants Shapewear Shorts",,,
4200,3.11,0.22,Women's Heart Pattern Sleepwear Cami Romper Set,,,
,7.59,0.07,SHEIN Classic Sexy Plus Size Lace Sexy Lingerie,2,in Black Plus Size Sexy Lingerie,
900,4.96,0.25,Plus Star Print Nightdress,,,
1100,5.82,0.31,Women's Printed English Words Pajamas Set,,,
1500,7.36,0.15,Plus Heart Print PJ Set,,,
3900,13.91,0.2,Plus Tie-Dye Wash Tee & Ruffled Shorts PJ Set,,,
300,6.49,0,"Women's Animal Printed Round Neck Short Sleeved T-Shirt And Shorts Pajama Set, Suitable For Summer",,,
1000,4.63,0.37,Plus Heart & Letter Graphic Ruffle Hem Cami Nightdress With Eye Mask,,,5
,7.29,0,Cherry Print Lettuce Trim Cami Top & Shorts PJ Set,7,in Women's white sleepwear,4
100,6.4,0.2,"6 Pairs Men's And Women's Breathable Half Terry Sports Socks With Cushioning, Crew-Length",,,
700,0.96,0.4,"2pairs Women Solid Casual Fishnet Crew Socks, For Daily Life",,,
,7.09,0.07,Plus Size Lingerie For Women Sexy Lingerie Bodysuit One-Piece Teddy,10,in Black Plus Size Sexy Lingerie,7
,5.79,0,Shein LuxeNights Floral Print Cami Top & Shorts PJ Set,3,in Royal Blue Women Pajama Sets,6
,8.99,0.1,Plus Heart Print PJ Set,10,in Plus Size Pajama Sets,9
,6.4,0.14,3pairs Women's Fall Winter Slouch Knit Socks Slouchy Socks Women Scrunch Socks Women Scrunchie Socks women crew socks,2,in Sexy lace socks,8
3500,6.39,0.1,"NONE SMELL Women Hook Waist Trainer Corset High Waist Sauna Sweat Shorts Yoga Shorts Fat Burn Tummy Control Workout Fitness Gym Sweat Shorts, Sports",,,
1400,6.39,0,Sleeveless Sleep Dress With Simple English Print And Round Neckline,,,
1300,6.13,0.26,Plus Slogan Graphic Cami Nightdress,,,
1100,9.79,0,Women's Plus Size Pajama Pants Set,,,11
500,7.29,0,Cartoon And Avocado Print Pajama Set,,,
,4.22,0.42,Plus Size Cat Print T-Shirt Dress For Sleepwear,8,in Women's Curve Cute Sleepwear,
500,14.79,0.08,SHEIN X Care Bears Plus Cartoon Graphic Tee & Shorts PJ Set,,,
,7.19,0.15,Shein FloralLove Printed Mesh Back Cross Strap Sexy Women's Sleepwear Set With G-String,,,
,14.99,0.07,"Women's Contrast Color Fine-Edged Split Design Short Sleeve & Long Pants Homewear Set, Decorated With Bowknot And Jacquard",,,
10,4.29,0.09,Women Plus Size Sexy Lingerie Bodycon Dress Long Sleeve Cut Out Fashion Nightdress Bikini Cover Up,,,
600,10.29,0.07,"Plus Size Simple Casual Set, Women's Oversized Eye And Slogan Printed Short Sleeve Round Neck Relaxed Fit T-Shirt And Shorts Home Outfit 2pcs/Set",,,
4900,8.35,0.05,Plus Striped Print Drop Shoulder Tee & Shorts PJ Set,,,
,5.89,0.29,Plus Size Women's Contrast Color Flower Printed Satin Cami Pajama Set,9,in Burgundy Plus Size Pajama Sets,
500,11.89,0.08,Plus Contrast Lace Star Mesh Insert Tie Back Nightdress,,,
,1.6,0.11,"1pair Cute White Lace Frilly Socks For Women, Spring/Summer Mid-Calf Ice Silk Lolita Style JK Socks, Thin Breathable Stockings",,,
6400,8.29,0,2pcs/Set Slogan Print Contrast Color Tank Top And Shorts Pajama Set,,,
,4.48,0.34,Pure Desire Floral Print Mesh Sheer Lingerie Set,10,in White Women Sexy Lingerie Sets,
600,7.76,0.39,Panda & Slogan Graphic Tee & Shorts & Pants PJ Set,,,
,11.09,0.07,Plus Cut Out Cami Night Dress,7,in Burgundy Plus Size Nightgowns & Sleepshirts,
,11.29,0,3pcs Plaid Bow Front PJ Set,7,in Plaid Sleepwear,
,8.79,0.07,"Women's Plus Size Lingerie Sets, Sexy Open Back Babydoll Strappy Lace Chemise",,,4
100,16.53,0.19,Men Dual Pocket Hooded Belted Sleep Robe,,,
500,8.15,0.42,SHEIN Plus Mouth Print Tee & Biker Shorts PJ Set,,,5
,6.2,0.15,Plus Slogan Graphic Contrast Binding Cami Nightdress,4,in White Plus Size Nightgowns & Sleepshirts,
600,10.17,0.33,Plus Letter Graphic Tee & Striped Pants PJ Set,,,
,3,0.12,2 Pairs Creative Cartoon Hamburger & French Fries Pattern Women's Mid-Calf Socks,,,
1400,1.6,0.16,LGBT Rainbow Striped & Cat Print Crew Socks,,,7
3800,8.69,0,Plus Slogan Graphic PJ Set,,,5
2300,25.12,0.28,3 sets Tie Front Lounge Set,,,
,5.89,0,Letter Print Spaghetti Strap Nightgown,2,in Women Plus Sleep & Lounge,6
300,4.2,0.45,Women'S Floral Printed Camisole & Pants Pajama Set,,,
100,1.93,0.23,Solid Leg Warmers,,,16
1100,11.09,0,Plus Size Women's Tie-Dye Casual Short Sleeve Top And Pants Pajamas Set,,,
,7.09,0,Plus Flamingo Print Nightdress,3,in White Plus Size Nightgowns & Sleepshirts,4
500,6.46,0.24,Panda & Slogan Graphic Tee & Pants PJ Set,,,
,7.49,0,Plus Heart Print Tank Top & Shorts PJ Set,1,in Blue Plus Size Pajama Sets,
900,7.29,0.08,"1pc Women Sexy Deep U Back Sleeveless Top, Slim Fit, Removable Pads, Casual, Inner Or Outer Wear, Sapphire Blue",,,11
,14.79,0.08,Women's Color Block Trim Ribbed Short Sleeve Long Pant Homewear Set,,,
,7.39,0,Plus Size Loose Heart Print Sleep Dress,2,in Black Plus Size Nightgowns & Sleepshirts,
,7.42,0.01,5pack Solid Ribbed Knit Brief,5,in Women's Casual Underwear,
,5,0.14,10 Pairs Women Socks Spring Summer New Arrivals Mid Crew Length Sweat-Absorbent Breathable White Black Gray Athletic Ankle Socks   Universal Size,3,in Women Socks & Hosiery,
,0.66,0.69,"1pc Thin Heart Print Sexy See-Through Tights, Soft And Comfortable Nylon Material Suitable For Spring And Autumn Daily Wear",8,in Red Women Tights,
,1.94,0.22,Lace Hollow Out Triangle Panties Lingerie,3,in Burgundy Women Briefs,4
,5.6,0.14,"New Fashion Ice Silk Socks: Women's Rolled Cuff Thin Mushroom-Headed Lace Socks, Stylish Pile Socks With Exquisite Lace Design, Super Thin And Comfortable, Available In Multiple Colors, Fashionable And Versatile, High-Quality Breathable Fabric",,,
,11.19,0,"Women's Seamless Solid Color Thongs, 12pcs/pack",2,in Women Thongs,7
2800,13.29,0.08,"(3pcs/set) Women's Seamless Wave Edge Bra, Comfortable And Breathable Underwear",,,
100,8.71,0.09,"Women's Elegant Homewear Dress, Plus Size Long Solid Color Round Neck Comfortable Strap Loose Casual Pajamas Nightgown 1pc",,,
300,9.19,0,Lettuce Trim Tank Top & Shorts PJ Set,,,
,5.99,0,Contrast Lace Satin Cami Nightdress,8,in Women's romantic-style sleepwear,5
,11.39,0.04,8pcs Ladies' Low-Rise Sexy Lace Thong Panties Set,,,
300,15.89,0,Men Contrast Piping Satin PJ Set,,,
200,1.81,0.68,6pairs Women's Black Mid-Calf Socks,,,4
400,9.15,0.24,Plus Heart Print Contrast Piping Satin PJ Set,,,
2800,9.65,0.22,7pack Leopard Print Panty,,,
300,9.59,0,Women Plus Size Full Printed Short Sleeve And Pants Pajama Set,,,
,8.66,0.21,"Women's Solid Color Round Neck Vest And Shorts Set, Casual Home Outfit",,,
,15.39,0,Women's Lace Trim Cami Top And Floral Print Shorts & Long Pants Pajama Set,3,in Women's romantic-style sleepwear,6
,4.65,0.1,"Women Seamless Plus Size High Waist Butt Lifter Tummy Control Shapewear, 1pc/Pack",3,in Black Plus Size Shapewear Bottoms,4
,8.59,0.08,Plus Floral Lace Ruffle Hem Plunging Neck Backless Crotchless Halter Teddy Bodysuit,4,in Plus Size Sexy Lingerie,6
